id,scientific,scientif_1,eventDate,lon,lat,institutio,collection,catalogNum,scientif_2,originalsc,absence,acceptedNa,accepted_1,accessRigh,aphiaID
0013c003-988d-47b0-a778-5c3e9683d11a,Cepphus grylle,"(Linnaeus, 1758)",01/01/1985 00:00,-58.19897,49.09993,Canadian Wildlife Service - Atlantic Region (CWS - Atlantic),,NF000505_BLGU_1202_1985-01-01,urn:lsid:marinespecies.org:taxname:137130,,FALSE,,,,137130
0071248d-d3f0-4c6c-b9df-be47edad9353,Cepphus grylle,"(Linnaeus, 1758)",01/01/1999 00:00,-56.53213,53.93329,Canadian Wildlife Service - Atlantic Region (CWS - Atlantic),,NF000706_BLGU_9640_1999-01-01,urn:lsid:marinespecies.org:taxname:137130,,FALSE,,,,137130
00746c65-f953-447a-80e7-26b9a9c52112,Cepphus grylle,"(Linnaeus, 1758)",8/31/90 12:00,-61.83729172,45.64994049,ACCD,EOR,31482,urn:lsid:marinespecies.org:taxname:137130,,FALSE,,,,137130
00a8146b-459b-4383-8efe-f32a85386ea4,Cepphus grylle,"(Linnaeus, 1758)",1980-04-28T08:30:00,-52.7667,47.2333,Canadian Wildlife Service,280,280_125486,urn:lsid:marinespecies.org:taxname:137130,,FALSE,,,,137130
00b6b59d-c92e-422e-a734-cb3145e18b55,Cepphus grylle,,,-66.69,49.91,"Canadian Wildlife Service-Atlantic, Environment Canada",,58439636_-1700888881_760719992,urn:lsid:marinespecies.org:taxname:137130,,FALSE,,,,137130
00c85030-bdf5-4472-a7ef-488684bdde18,Cepphus grylle,,,-65.47,47.96,"Canadian Wildlife Service-Atlantic, Environment Canada",,1421648014_-980266020_-533574144,urn:lsid:marinespecies.org:taxname:137130,,FALSE,,,,137130
00c8e739-74f5-4dd7-98c4-23f706de480e,Cepphus grylle,"(Linnaeus, 1758)",07/05/1988 12:00,-60.3768692,46.36740875,ACCD,EOR,31733,urn:lsid:marinespecies.org:taxname:137130,,FALSE,,,,137130
00f116a4-8f23-43c9-beb3-89d83a32a190,Cepphus grylle,"(Linnaeus, 1758)",6/21/01 00:00,-56.0042,50.03593,Canadian Wildlife Service - Atlantic Region (CWS - Atlantic),,NF000610_BLGU_5827_2001-06-21,urn:lsid:marinespecies.org:taxname:137130,,FALSE,,,,137130
01536bcf-0d59-4763-afca-e3a12b6e2ce6,Cepphus grylle,"(Linnaeus, 1758)",,-66.15000153,47.98332977,ACCD,EOR,31404,urn:lsid:marinespecies.org:taxname:137130,,FALSE,,,,137130
015a4fb1-1a92-4f19-9d9f-478fa2a2b664,Cepphus grylle,,,-69.25,43.86,"Canadian Wildlife Service-Atlantic, Environment Canada",,1272746530_1971340871_2021511629,urn:lsid:marinespecies.org:taxname:137130,,FALSE,,,,137130
0186df2f-2798-46da-9e4d-b9f6e6ac37b1,Cepphus grylle,,,-61.66,50.08,"Canadian Wildlife Service-Atlantic, Environment Canada",,-1636689528_1342834436_-1109118389,urn:lsid:marinespecies.org:taxname:137130,,FALSE,,,,137130
01c419c7-3aa5-4b94-8f10-adf460291aea,Cepphus grylle,"(Linnaeus, 1758)",01/01/1974 00:00,-54.25816,47.57554,Canadian Wildlife Service - Atlantic Region (CWS - Atlantic),,NF000372_BLGU_985_1974-01-01,urn:lsid:marinespecies.org:taxname:137130,,FALSE,,,,137130
01dba350-f01b-405d-b6e6-4624f5cbf367,Cepphus grylle,"(Linnaeus, 1758)",NA,-68.6212,44.1077,USFWS,,670234,137130,,FALSE,,,,137130
0215b1c1-e8d3-4f03-8fc1-583a6376f955,Cepphus grylle,"(Linnaeus, 1758)",07/04/1986 12:00,-64.04225159,47.00020981,ACCD,EOR,31698,urn:lsid:marinespecies.org:taxname:137130,,FALSE,,,,137130
0230da3c-be12-425b-938b-93b701dd6363,Cepphus grylle,"(Linnaeus, 1758)",NA,-68.0482,44.3562,USFWS,,670548,137130,,FALSE,,,,137130
023a2f76-1f19-4858-9e3c-1326aae38c63,Cepphus grylle,"(Linnaeus, 1758)",1978-06-29T09:00:00,-57.1333,54.0167,Canadian Wildlife Service,280,280_102172,urn:lsid:marinespecies.org:taxname:137130,,FALSE,,,,137130
024aeb91-389c-4f1e-84e0-f64b046abb7e,Cepphus grylle,"(Linnaeus, 1758)",1979-08-11T15:15:00,-61.9667,57.4333,Canadian Wildlife Service,280,280_118377,urn:lsid:marinespecies.org:taxname:137130,,FALSE,,,,137130
0257be68-0b49-4b07-b975-3d26e08d5cd3,Cepphus grylle,"(Linnaeus, 1758)",05/06/2000,-68.5,53,ICES,DOME-Biota,12135345,urn:lsid:marinespecies.org:taxname:137130,,FALSE,,,,137130
026ec1a0-ae0d-4f65-8ab9-3a44f6545c76,Cepphus grylle,"(Linnaeus, 1758)",1971-07-02T12:00:00Z,-59.77175903,46.18024826,ACCD,EOR,31749,urn:lsid:marinespecies.org:taxname:137130,,FALSE,,,,137130
027346ba-7dea-4324-950b-4b828f0786c6,Cepphus grylle,"(Linnaeus, 1758)",6/20/00,-68.5,53,ICES,DOME-Biota,12135378,urn:lsid:marinespecies.org:taxname:137130,,FALSE,,,,137130
0277fe21-cdb4-4fb4-aaee-8875790d4686,Cepphus grylle,"(Linnaeus, 1758)",01/01/1983 00:00,-56.53213,53.93329,Canadian Wildlife Service - Atlantic Region (CWS - Atlantic),,NF000706_BLGU_1756_1983-01-01,urn:lsid:marinespecies.org:taxname:137130,,FALSE,,,,137130
02789f53-dda9-48ee-bae5-12cd27a2e1bb,Cepphus grylle,"(Linnaeus, 1758)",01/01/2008 00:00,-61.5426,45.10182,Canadian Wildlife Service - Atlantic Region (CWS - Atlantic),,NS002232_BLGU_12224_2008-01-01,urn:lsid:marinespecies.org:taxname:137130,,FALSE,,,,137130
0283caf6-4cbe-401b-a511-7d443e19b8b0,Cepphus grylle,"(Linnaeus, 1758)",05/01/2007 00:00,-61.5426,45.10182,Canadian Wildlife Service - Atlantic Region (CWS - Atlantic),,NS002232_BLGU_9917_2007-05-01,urn:lsid:marinespecies.org:taxname:137130,,FALSE,,,,137130
02a086f9-fcc0-4372-b7af-50ce97055e7e,Cepphus grylle,"(Linnaeus, 1758)",1979-08-18T14:00:00,-63.7667,59.3833,Canadian Wildlife Service,280,280_119767,urn:lsid:marinespecies.org:taxname:137130,,FALSE,,,,137130
02e99486-c689-47e1-853c-36d5af5399db,Cepphus grylle,"(Linnaeus, 1758)",01/01/1984 00:00,-54.27883,49.7749,Canadian Wildlife Service - Atlantic Region (CWS - Atlantic),,NF000590_BLGU_1528_1984-01-01,urn:lsid:marinespecies.org:taxname:137130,,FALSE,,,,137130
03469ee9-33a2-4969-bfb4-0987b4745e1e,Cepphus grylle,,,-65.12,48.08,"Canadian Wildlife Service-Atlantic, Environment Canada",,-1636689528_-1194387646_1937692034,urn:lsid:marinespecies.org:taxname:137130,,FALSE,,,,137130
034a5815-ef02-486d-b0cb-88f5fe1fe03b,Cepphus grylle,,,-61.2,56.54,"Canadian Wildlife Service-Atlantic, Environment Canada",,1223666941_1223748917_-69023125,urn:lsid:marinespecies.org:taxname:137130,,FALSE,,,,137130
036116d2-0f74-401b-9c81-5db28588add2,Cepphus grylle,"(Linnaeus, 1758)",1990-07-02T12:00:00Z,-66.01338959,43.4263916,ACCD,EOR,31454,urn:lsid:marinespecies.org:taxname:137130,,FALSE,,,,137130
03723551-4cfc-4452-b650-72555adac266,Cepphus grylle,,,-63.55,44.62,"Canadian Wildlife Service-Atlantic, Environment Canada",,1295552759_-611383315_864244394,urn:lsid:marinespecies.org:taxname:137130,,FALSE,,,,137130
040c72a0-9d0d-4c50-8e0d-a5acb3cf1393,Cepphus grylle,"(Linnaeus, 1758)",1979-08-22T12:15:00,-62.5167,58.2833,Canadian Wildlife Service,280,280_120272,urn:lsid:marinespecies.org:taxname:137130,,FALSE,,,,137130
042cb7db-8319-420b-a7dd-bf6d418a4c7f,Cepphus grylle,"(Linnaeus, 1758)",7/26/05 13:34,-68.174,44.231,NA,,441245,137130,,FALSE,,,,137130
04487bad-235f-452e-8b2c-5dc7c48151d1,Cepphus grylle,"(Linnaeus, 1758)",05/06/2000,-68.5,53,ICES,DOME-Biota,12135341,urn:lsid:marinespecies.org:taxname:137130,,FALSE,,,,137130
044de6ef-c0e4-4915-8621-94c53c239d50,Cepphus grylle,,,-61.23,56.54,"Canadian Wildlife Service-Atlantic, Environment Canada",,1376494362_998215084_498364221,urn:lsid:marinespecies.org:taxname:137130,,FALSE,,,,137130
04745b52-840a-494e-8818-6aeb70548001,Cepphus grylle,,,-58.19,51.2,"Canadian Wildlife Service-Atlantic, Environment Canada",,-1636689528_-310499037_-1208054595,urn:lsid:marinespecies.org:taxname:137130,,FALSE,,,,137130
04b18b47-154e-4eb7-817e-420b30f0e78d,Cepphus grylle,"(Linnaeus, 1758)",08/03/2005 13:16,-68.136,44.359,NA,,441532,137130,,FALSE,,,,137130
04cd9fbc-d96f-4e57-9236-791b0b3deb27,Cepphus grylle,,,-65.3,43.67,"Canadian Wildlife Service-Atlantic, Environment Canada",,1361835644_-2080897728_391146561,urn:lsid:marinespecies.org:taxname:137130,,FALSE,,,,137130
054fe620-95b6-4c64-9100-38af41ec3557,Cepphus grylle,"(Linnaeus, 1758)",1979-08-17T15:45:00,-63.1333,59.15,Canadian Wildlife Service,280,280_119573,urn:lsid:marinespecies.org:taxname:137130,,FALSE,,,,137130
05589fc5-a59b-48f8-aa5f-12fe436753e2,Cepphus grylle,,,-65.53,47.97,"Canadian Wildlife Service-Atlantic, Environment Canada",,-635145613_-1740148077_-971862425,urn:lsid:marinespecies.org:taxname:137130,,FALSE,,,,137130
0563143c-7778-4123-a5cc-ba30ffa12823,Cepphus grylle,"(Linnaeus, 1758)",1973-02-16T12:40:00,-60.1833,46.9167,Canadian Wildlife Service,280,280_62363,urn:lsid:marinespecies.org:taxname:137130,,FALSE,,,,137130
056f2fc2-a209-4616-9e4f-37a6bafc21be,Cepphus grylle,"(Linnaeus, 1758)",07/02/2005 15:15,-68.2233,44.1671,NA,,439871,137130,,FALSE,,,,137130
057af038-a0de-4ff0-bee6-73400d0b32a1,Cepphus grylle,"(Linnaeus, 1758)",1971-07-02T12:00:00Z,-59.79064941,45.93856812,ACCD,EOR,31753,urn:lsid:marinespecies.org:taxname:137130,,FALSE,,,,137130
058da2a9-36ed-400b-bd88-57e51d312405,Cepphus grylle,"(Linnaeus, 1758)",08/02/1989 00:00,-67.10187,44.50182,Canadian Wildlife Service - Atlantic Region (CWS - Atlantic),,NB000085_BLGU_140_1989-08-02,urn:lsid:marinespecies.org:taxname:137130,,FALSE,,,,137130
0599ad31-693a-4723-8f9e-0e95d2bb8c7b,Cepphus grylle,"(Linnaeus, 1758)",1980-04-09T06:30:00,-53.3667,46.7167,Canadian Wildlife Service,280,280_124522,urn:lsid:marinespecies.org:taxname:137130,,FALSE,,,,137130
05d24c67-5ba4-498f-951f-159727f29c3b,Cepphus grylle,"(Linnaeus, 1758)",1979-08-29T08:10:00,-61.3167,56.3167,Canadian Wildlife Service,280,280_121050,urn:lsid:marinespecies.org:taxname:137130,,FALSE,,,,137130
05f43823-75f1-4fa3-b830-66cd5b9005b5,Cepphus grylle,"(Linnaeus, 1758)",01/01/1973 00:00,-55.90647,47.27996,Canadian Wildlife Service - Atlantic Region (CWS - Atlantic),,NF000284_BLGU_777_1973-01-01,urn:lsid:marinespecies.org:taxname:137130,,FALSE,,,,137130
05f76a47-70c5-4cc5-8fc7-db4122c1be93,Cepphus grylle,,,-63.31,59.25,"Canadian Wildlife Service-Atlantic, Environment Canada",,1409356886_-1552909123_152550202,urn:lsid:marinespecies.org:taxname:137130,,FALSE,,,,137130
06267dfe-0783-4df9-b6db-f2a6a0fce93b,Cepphus grylle,"(Linnaeus, 1758)",NA,-67.54,44.5167,"BOEM, USFWS, NOAA, NAVY",,728436,137130,,FALSE,,,,137130
062fcee9-09b2-4c92-8691-fb97ff85e675,Cepphus grylle,,,-64.01,44.48,"Canadian Wildlife Service-Atlantic, Environment Canada",,-1815568076_994443311_1409778194,urn:lsid:marinespecies.org:taxname:137130,,FALSE,,,,137130
064083ae-d41a-47b0-b186-a16647083278,Cepphus grylle,"(Linnaeus, 1758)",6/25/06 00:00,-60.14857,47.19983,Canadian Wildlife Service - Atlantic Region (CWS - Atlantic),,NS001142_BLGU_11825_2006-06-25,urn:lsid:marinespecies.org:taxname:137130,,FALSE,,,,137130
06591d46-6d4a-4bdd-a241-4adad67b9ca1,Cepphus grylle,"(Linnaeus, 1758)",1971-07-21T09:40:00,-56.1833,47.0833,Canadian Wildlife Service,280,280_41888,urn:lsid:marinespecies.org:taxname:137130,,FALSE,,,,137130
06d8ff72-bf55-48f9-8e84-960ded9017e8,Cepphus grylle,,,-52.58,47.54,"Canadian Wildlife Service-Atlantic, Environment Canada",,1218969274_1968395463_1228308106,urn:lsid:marinespecies.org:taxname:137130,,FALSE,,,,137130
06e36b84-f2ea-4be6-8006-e226776fbc69,Cepphus grylle,"(Linnaeus, 1758)",1978-08-02T10:45:00,-57.1167,54,Canadian Wildlife Service,280,280_105000,urn:lsid:marinespecies.org:taxname:137130,,FALSE,,,,137130
07421b43-abb0-4b21-ab59-a90659b487c9,Cepphus grylle,,,-61.6,50.09,"Canadian Wildlife Service-Atlantic, Environment Canada",,-1636689528_-1569287645_-157119286,urn:lsid:marinespecies.org:taxname:137130,,FALSE,,,,137130
07a66bf6-3b33-4bdb-8464-d85e289ba82d,Cepphus grylle,"(Linnaeus, 1758)",8/21/78 00:00,-57.1988,54.5833,Canadian Wildlife Service - Atlantic Region (CWS - Atlantic),,NF000756_BLGU_1839_1978-08-21,urn:lsid:marinespecies.org:taxname:137130,,FALSE,,,,137130
07b2e272-8be8-4ac3-b3ff-7c7ecfba5605,Cepphus grylle,,,-65.49,47.96,"Canadian Wildlife Service-Atlantic, Environment Canada",,1421648014_397506582_1503686679,urn:lsid:marinespecies.org:taxname:137130,,FALSE,,,,137130
07bf78f3-541b-4898-bdf0-2470db5002c7,Cepphus grylle,"(Linnaeus, 1758)",NA,-67.25,44.33333,NA,,105230,137130,,FALSE,,,,137130
07ecf00b-2d8f-4186-a869-707a045a9859,Cepphus grylle,"(Linnaeus, 1758)",1979-08-27T11:15:00,-61.6167,57.55,Canadian Wildlife Service,280,280_120896,urn:lsid:marinespecies.org:taxname:137130,,FALSE,,,,137130
07f8cf1b-fe6f-4f67-b76b-d3c74792627c,Cepphus grylle,"(Linnaeus, 1758)",1972-08-06T15:10:00,-59.8833,57.2,Canadian Wildlife Service,280,280_57474,urn:lsid:marinespecies.org:taxname:137130,,FALSE,,,,137130
080720e8-6f25-4ad4-a6f3-8bc48a67477d,Cepphus grylle,"(Linnaeus, 1758)",1981-02-17T06:00:00,-55.8333,47,Canadian Wildlife Service,280,280_138881,urn:lsid:marinespecies.org:taxname:137130,,FALSE,,,,137130
081279f0-8cb1-4d32-a26c-c0ecef4dff51,Cepphus grylle,"(Linnaeus, 1758)",1975-07-29T12:50:00,-81.5333,59.4333,Canadian Wildlife Service,280,280_69668,urn:lsid:marinespecies.org:taxname:137130,,FALSE,,,,137130
08210b86-cd76-4924-ad9a-706f411263c4,Cepphus grylle,"(Linnaeus, 1758)",,-66.75,44.58332825,ACCD,EOR,31398,urn:lsid:marinespecies.org:taxname:137130,,FALSE,,,,137130
08505b4e-5a5b-4cd6-bf7a-df8c1a586fec,Cepphus grylle,"(Linnaeus, 1758)",1984-12-09T19:00:00,-68.9833,44.0167,Canadian Wildlife Service,280,280_182390,urn:lsid:marinespecies.org:taxname:137130,,FALSE,,,,137130
085e9ec6-377d-4b86-b9bf-138e117a2c3e,Cepphus grylle,,,-69.31,48.3,"Canadian Wildlife Service-Atlantic, Environment Canada",,792082018_-1083062985_309654508,urn:lsid:marinespecies.org:taxname:137130,,FALSE,,,,137130
08a2b2e7-8cab-46f1-8609-1afe60693c75,Cepphus grylle,,,-58.39,47.28,"Canadian Wildlife Service-Atlantic, Environment Canada",,1409356886_-600436219_-1531829097,urn:lsid:marinespecies.org:taxname:137130,,FALSE,,,,137130
08c70f5c-2283-4d69-9274-d639e45d7c92,Cepphus grylle,"(Linnaeus, 1758)",06/12/1980 00:00,-64.69175,45.33006,Canadian Wildlife Service - Atlantic Region (CWS - Atlantic),,NS001131_BLGU_2911_1980-06-12,urn:lsid:marinespecies.org:taxname:137130,,FALSE,,,,137130
08d9c194-44ed-4a51-9dad-f14988434c50,Cepphus grylle,,,-56.89,53.74,"Canadian Wildlife Service-Atlantic, Environment Canada",,1351610123_1378414434_-1497096133,urn:lsid:marinespecies.org:taxname:137130,,FALSE,,,,137130
08de11de-cd25-4db3-9f63-f0191c246295,Cepphus grylle,,,-58.48,49.21,"Canadian Wildlife Service-Atlantic, Environment Canada",,896836590_-873657559_-1419610090,urn:lsid:marinespecies.org:taxname:137130,,FALSE,,,,137130
08fed541-e201-4b1a-bc69-39ccaa5fbe11,Cepphus grylle,"(Linnaeus, 1758)",1979-08-11T15:40:00,-61.9167,57.5833,Canadian Wildlife Service,280,280_118419,urn:lsid:marinespecies.org:taxname:137130,,FALSE,,,,137130
09147718-d4f1-4869-a928-8d05d40c7c0d,Cepphus grylle,"(Linnaeus, 1758)",07/02/1971 12:00,-60.11323166,45.76700974,ACCD,EOR,31760,urn:lsid:marinespecies.org:taxname:137130,,FALSE,,,,137130
094dc4cb-8ab5-4b92-b16e-e9073d6de2b9,Cepphus grylle,"(Linnaeus, 1758)",7/28/16 00:00,-66.02289,43.61047,Canadian Wildlife Service - Atlantic Region (CWS - Atlantic),,NS001166_BLGU_13369_2016-07-28,urn:lsid:marinespecies.org:taxname:137130,,FALSE,,,,137130
095ca5cb-47b1-40c9-9f60-295dc548dd97,Cepphus grylle,"(Linnaeus, 1758)",1979-08-11T14:05:00,-61.65,57.3833,Canadian Wildlife Service,280,280_118356,urn:lsid:marinespecies.org:taxname:137130,,FALSE,,,,137130
09afdcc1-b9a7-4807-8fae-4cea867e8cb8,Cepphus grylle,,,-58.2,49.5,"Canadian Wildlife Service-Atlantic, Environment Canada",,896836590_1669273326_1443355791,urn:lsid:marinespecies.org:taxname:137130,,FALSE,,,,137130
09ce2702-ad92-4f42-88e0-0f130066bbd2,Cepphus grylle,,,-52.75,46.92,"Canadian Wildlife Service-Atlantic, Environment Canada",,1384434657_1811361135_2114238084,urn:lsid:marinespecies.org:taxname:137130,,FALSE,,,,137130
09d3c6a6-85ec-4a21-88d0-8ca8c0b675c8,Cepphus grylle,,,-61.46,56.54,"Canadian Wildlife Service-Atlantic, Environment Canada",,1376494362_55566500_1566866187,urn:lsid:marinespecies.org:taxname:137130,,FALSE,,,,137130
0a0b6596-cca8-44d9-90cb-02c59ad35ad2,Cepphus grylle,"(Linnaeus, 1758)",1978-08-05T10:45:00,-59.1167,55.2833,Canadian Wildlife Service,280,280_105334,urn:lsid:marinespecies.org:taxname:137130,,FALSE,,,,137130
0aa38068-6377-4766-afb3-ccedbca8e358,Cepphus grylle,"(Linnaeus, 1758)",1979-08-18T11:50:00,-63.4667,59.3,Canadian Wildlife Service,280,280_119739,urn:lsid:marinespecies.org:taxname:137130,,FALSE,,,,137130
0b11ca6c-fc11-4c36-9e84-cf59672bc120,Cepphus grylle,"(Linnaeus, 1758)",08/10/1978 00:00,-60.46555,56.21669,Canadian Wildlife Service - Atlantic Region (CWS - Atlantic),,NF000930_BLGU_2046_1978-08-10,urn:lsid:marinespecies.org:taxname:137130,,FALSE,,,,137130
0b591e3f-34cd-4cdc-b85c-23ecafd44e95,Cepphus grylle,"(Linnaeus, 1758)",8/13/78 00:00,-61.41559,56.30003,Canadian Wildlife Service - Atlantic Region (CWS - Atlantic),,NF000953_BLGU_2091_1978-08-13,urn:lsid:marinespecies.org:taxname:137130,,FALSE,,,,137130
0b67a193-04de-4f01-b7df-8527e68b93d3,Cepphus grylle,,,-63.53,44.56,"Canadian Wildlife Service-Atlantic, Environment Canada",,1268399973_-754519580_1519082773,urn:lsid:marinespecies.org:taxname:137130,,FALSE,,,,137130
0bb2edf8-e7d6-4cc3-ab55-499646b56210,Cepphus grylle,"(Linnaeus, 1758)",2001-07-02T12:00:00Z,-66.80682373,44.60234833,ACCD,EOR,31787,urn:lsid:marinespecies.org:taxname:137130,,FALSE,,,,137130
0c2aa83d-84a2-4daa-95cc-d13dfbc87f86,Cepphus grylle,"(Linnaeus, 1758)",1979-08-16T18:30:00,-63.0333,59.0667,Canadian Wildlife Service,280,280_119345,urn:lsid:marinespecies.org:taxname:137130,,FALSE,,,,137130
0c4aeb68-16a9-40ba-8fda-fb409100d5d5,Cepphus grylle,,,-58.41,49.17,"Canadian Wildlife Service-Atlantic, Environment Canada",,896836590_1988819755_-1915351063,urn:lsid:marinespecies.org:taxname:137130,,FALSE,,,,137130
0c50fd35-6ab9-4cfe-b045-861066bdf1d3,Cepphus grylle,"(Linnaeus, 1758)",NA,-69.6295,41.4407,USFWS,,680394,137130,,FALSE,,,,137130
0c57a520-1083-488c-aba1-abffd8b7c20b,Cepphus grylle,"(Linnaeus, 1758)",08/07/1978 00:00,-61.2489,56.5667,Canadian Wildlife Service - Atlantic Region (CWS - Atlantic),,NF000994_BLGU_2140_1978-08-07,urn:lsid:marinespecies.org:taxname:137130,,FALSE,,,,137130
0c72e006-b05a-47df-a578-e39adbe29c7b,Cepphus grylle,"(Linnaeus, 1758)",01/01/1984 00:00,-53.86882,49.54823,Canadian Wildlife Service - Atlantic Region (CWS - Atlantic),,NF000558_BLGU_1325_1984-01-01,urn:lsid:marinespecies.org:taxname:137130,,FALSE,,,,137130
0c7ecec5-bd06-4f79-baa1-04ac63c86530,Cepphus grylle,"(Linnaeus, 1758)",1978-08-02T13:30:00,-57.8167,54.25,Canadian Wildlife Service,280,280_105043,urn:lsid:marinespecies.org:taxname:137130,,FALSE,,,,137130
0c802021-ce51-4291-ad2c-02abab071b2a,Cepphus grylle,"(Linnaeus, 1758)",1970-11-15T13:30:00,-59.35,47.9667,Canadian Wildlife Service,280,280_33198,urn:lsid:marinespecies.org:taxname:137130,,FALSE,,,,137130
0cd3d5c0-e5ff-49a1-b9b6-34a3b4015717,Cepphus grylle,,,-64.1,48.76,"Canadian Wildlife Service-Atlantic, Environment Canada",,689065724_1186131689_472954136,urn:lsid:marinespecies.org:taxname:137130,,FALSE,,,,137130
0ce5c3e7-f5b5-4d76-8fee-d0b10ec65918,Cepphus grylle,"(Linnaeus, 1758)",4/25/14 18:42,-69.351,41.507,"BOEM, NOAA, NAVY, USFWS",,802772,137130,,FALSE,,,,137130
0cf8d244-65c0-4218-99f1-124de063d6f2,Cepphus grylle,"(Linnaeus, 1758)",5/28/76 12:00,-65.03027344,43.68431091,ACCD,EOR,31805,urn:lsid:marinespecies.org:taxname:137130,,FALSE,,,,137130
0d411d63-90f0-4693-a86e-810fdc39f738,Cepphus grylle,,,-65.4,47.96,"Canadian Wildlife Service-Atlantic, Environment Canada",,-635145613_1840688132_1037210849,urn:lsid:marinespecies.org:taxname:137130,,FALSE,,,,137130
0db8dd9f-0a89-4cdc-b087-2924ed6b8c33,Cepphus grylle,"(Linnaeus, 1758)",8/20/05 17:19,-68.1036,44.3408,NA,,442295,137130,,FALSE,,,,137130
0dd42c60-99a3-4468-8276-6806c0aae10d,Cepphus grylle,"(Linnaeus, 1758)",2017-03-06T10:45:06,-73.7816,40.3743,NORMANDEAU,1817,1817_48110,urn:lsid:marinespecies.org:taxname:137130,,FALSE,,,,137130
0dfb2f90-e3d7-43e1-b6d7-354523295b2f,Cepphus grylle,,,-64.4,48.84,"Canadian Wildlife Service-Atlantic, Environment Canada",,58439636_-649322271_1406488163,urn:lsid:marinespecies.org:taxname:137130,,FALSE,,,,137130
0e001231-718e-4eb2-9e99-d0b33c33e7a3,Cepphus grylle,"(Linnaeus, 1758)",1979-09-01T09:20:00,-61.2333,56.05,Canadian Wildlife Service,280,280_121169,urn:lsid:marinespecies.org:taxname:137130,,FALSE,,,,137130
0e531afa-9a0f-4c40-991e-7c3d6b1fcca6,Cepphus grylle,"(Linnaeus, 1758)",1979-08-17T08:00:00,-63.2,59.1333,Canadian Wildlife Service,280,280_119456,urn:lsid:marinespecies.org:taxname:137130,,FALSE,,,,137130
0e8928fd-c7b6-4990-81b4-9ee2d176d0ea,Cepphus grylle,,,-63.49,44.51,"Canadian Wildlife Service-Atlantic, Environment Canada",,-1339166790_-389939252_-1386193162,urn:lsid:marinespecies.org:taxname:137130,,FALSE,,,,137130
0e8eb70f-b5c0-4fe3-827c-3f47d3285c50,Cepphus grylle,"(Linnaeus, 1758)",07/01/2009 00:00,-64.09384,44.43796,Canadian Wildlife Service - Atlantic Region (CWS - Atlantic),,NS003440_BLGU_11766_2009-07-01,urn:lsid:marinespecies.org:taxname:137130,,FALSE,,,,137130
0e965e22-19de-4f61-af89-bca98b6a7521,Cepphus grylle,"(Linnaeus, 1758)",1989-07-02T12:00:00Z,-66.75595856,44.58475113,ACCD,EOR,31437,urn:lsid:marinespecies.org:taxname:137130,,FALSE,,,,137130
0eb7902b-2cdd-4232-871d-72e5bed613e0,Cepphus grylle,"(Linnaeus, 1758)",07/05/2010 00:00,-62.45797,46.00309,Canadian Wildlife Service - Atlantic Region (CWS - Atlantic),,PE002621_BLGU_11913_2010-07-05,urn:lsid:marinespecies.org:taxname:137130,,FALSE,,,,137130
0eb9128e-21de-4403-9d23-3879cb7c1e33,Cepphus grylle,"(Linnaeus, 1758)",01/01/1985 00:00,-54.04883,49.48989,Canadian Wildlife Service - Atlantic Region (CWS - Atlantic),,NF000535_BLGU_1295_1985-01-01,urn:lsid:marinespecies.org:taxname:137130,,FALSE,,,,137130
0ec82026-ba5b-485a-b068-631a0e69ae4c,Cepphus grylle,"(Linnaeus, 1758)",8/13/78 00:00,-60.08222,55.71668,Canadian Wildlife Service - Atlantic Region (CWS - Atlantic),,NF000891_BLGU_1992_1978-08-13,urn:lsid:marinespecies.org:taxname:137130,,FALSE,,,,137130
0effe597-f73e-46a9-9927-6c8934e4df54,Cepphus grylle,"(Linnaeus, 1758)",1973-02-28T13:40:00,-67.4667,49.25,Canadian Wildlife Service,280,280_62762,urn:lsid:marinespecies.org:taxname:137130,,FALSE,,,,137130
0f00f388-2f63-45ea-ae3d-f0e01f74b7e2,Cepphus grylle,"(Linnaeus, 1758)",05/01/2009 00:00,-61.5426,45.10182,Canadian Wildlife Service - Atlantic Region (CWS - Atlantic),,NS002232_BLGU_9923_2009-05-01,urn:lsid:marinespecies.org:taxname:137130,,FALSE,,,,137130
0f01625f-f067-4450-ae4c-b21aef55fcdd,Cepphus grylle,,,-52.61,47.55,"Canadian Wildlife Service-Atlantic, Environment Canada",,1182351344_474287648_979979000,urn:lsid:marinespecies.org:taxname:137130,,FALSE,,,,137130
0f4f2107-99d3-4b7b-9bd6-c52b95e77cc5,Cepphus grylle,"(Linnaeus, 1758)",08/12/2005 15:41,-68.0262,44.2988,NA,,441727,137130,,FALSE,,,,137130
0fa9f807-dc1c-4aa6-aefa-9589b4cc0fb1,Cepphus grylle,"(Linnaeus, 1758)",NA,-69.9576,41.4428,USFWS,,680381,137130,,FALSE,,,,137130
0fce198b-1225-4759-88f3-011a02d52347,Cepphus grylle,,,-63.53,59.34,"Canadian Wildlife Service-Atlantic, Environment Canada",,1409356886_1952371713_1650731566,urn:lsid:marinespecies.org:taxname:137130,,FALSE,,,,137130
1038a896-edd6-4537-beb1-364a6ea9456e,Cepphus grylle,"(Linnaeus, 1758)",6/17/96 12:00,-66.81989288,44.60799026,ACCD,EOR,31406,urn:lsid:marinespecies.org:taxname:137130,,FALSE,,,,137130
104633d6-7800-4079-938b-c357adf670a6,Cepphus grylle,"(Linnaeus, 1758)",01/01/1987 00:00,-56.34896,46.78325,Canadian Wildlife Service - Atlantic Region (CWS - Atlantic),,NF000186_BLGU_362_1987-01-01,urn:lsid:marinespecies.org:taxname:137130,,FALSE,,,,137130
105442f0-7c20-462a-bb90-ab4e4e0e6a01,Cepphus grylle,"(Linnaeus, 1758)",NA,-66.36667,43.15,NA,,97201,137130,,FALSE,,,,137130
105c27fe-2276-4ac6-a3e7-d26bdb52c982,Cepphus grylle,"(Linnaeus, 1758)",01/01/2001 00:00,-64.04913,44.38377,Canadian Wildlife Service - Atlantic Region (CWS - Atlantic),,NS001336_BLGU_5342_2001-01-01,urn:lsid:marinespecies.org:taxname:137130,,FALSE,,,,137130
10740e3a-b1df-40f6-9ec6-5b57ded8c7f4,Cepphus grylle,,,-64.15,50.07,"Canadian Wildlife Service-Atlantic, Environment Canada",,-801551520_-153629455_596253171,urn:lsid:marinespecies.org:taxname:137130,,FALSE,,,,137130
10d5d19a-ad3b-4756-8629-1adfa86234db,Cepphus grylle,"(Linnaeus, 1758)",07/06/1990 12:00,-66.76948547,44.79608154,ACCD,EOR,31773,urn:lsid:marinespecies.org:taxname:137130,,FALSE,,,,137130
10e74f39-2a68-4f95-8fa0-24d032923935,Cepphus grylle,"(Linnaeus, 1758)",06/12/1988 12:00,-65.9883728,43.48546982,ACCD,EOR,31457,urn:lsid:marinespecies.org:taxname:137130,,FALSE,,,,137130
10e82d40-a011-41e2-97df-b5ad9e9cf6ce,Cepphus grylle,,,-65.02,48.06,"Canadian Wildlife Service-Atlantic, Environment Canada",,689065724_-1046257533_1540382646,urn:lsid:marinespecies.org:taxname:137130,,FALSE,,,,137130
1133f808-9ce9-438d-959a-beb525ed259a,Cepphus grylle,,,-58.65,49.06,"Canadian Wildlife Service-Atlantic, Environment Canada",,1310304990_-957520750_177592747,urn:lsid:marinespecies.org:taxname:137130,,FALSE,,,,137130
11b5a605-d67e-4c14-8b45-996b26b216b2,Cepphus grylle,,,-58.6,48.85,"Canadian Wildlife Service-Atlantic, Environment Canada",,896836590_-987181417_729783780,urn:lsid:marinespecies.org:taxname:137130,,FALSE,,,,137130
122f150c-5d20-4ff6-ab59-443e13ac6c82,Cepphus grylle,"(Linnaeus, 1758)",1980-08-27T14:00:00,-61.35,57.1167,Canadian Wildlife Service,280,280_134156,urn:lsid:marinespecies.org:taxname:137130,,FALSE,,,,137130
123fdc29-3a86-451f-8980-58bfa88e3cab,Cepphus grylle,"(Linnaeus, 1758)",06/06/2008 00:00,-64.0205,47.03191,Canadian Wildlife Service - Atlantic Region (CWS - Atlantic),,PE002149_BLGU_12294_2008-06-06,urn:lsid:marinespecies.org:taxname:137130,,FALSE,,,,137130
125e8e2d-6f2e-4639-8a13-133775e91f58,Cepphus grylle,"(Linnaeus, 1758)",07/02/1989 12:00,-66.75595856,44.58475113,ACCD,EOR,31437,urn:lsid:marinespecies.org:taxname:137130,,FALSE,,,,137130
1276c5ba-404d-40ef-8aa6-814c8810f623,Cepphus grylle,,,-58.44,49.19,"Canadian Wildlife Service-Atlantic, Environment Canada",,1421648014_1608748062_1001534554,urn:lsid:marinespecies.org:taxname:137130,,FALSE,,,,137130
12b001ee-5672-4627-b434-1233a628678c,Cepphus grylle,"(Linnaeus, 1758)",NA,-70.1491,43.6838,"BOEM, USFWS, NOAA, NAVY",,727685,137130,,FALSE,,,,137130
132126ba-5196-4006-866f-049225f15e45,Cepphus grylle,"(Linnaeus, 1758)",6/20/06 00:00,-65.35873,47.75579,Canadian Wildlife Service - Atlantic Region (CWS - Atlantic),,NB002477_BLGU_12017_2006-06-20,urn:lsid:marinespecies.org:taxname:137130,,FALSE,,,,137130
1337a6cc-9725-4202-858c-eb17b789d2c3,Cepphus grylle,"(Linnaeus, 1758)",8/18/78 00:00,-58.56551,54.98332,Canadian Wildlife Service - Atlantic Region (CWS - Atlantic),,NF000777_BLGU_1872_1978-08-18,urn:lsid:marinespecies.org:taxname:137130,,FALSE,,,,137130
1339a93c-83e3-4d34-98b7-bd55f37d77cd,Cepphus grylle,"(Linnaeus, 1758)",1977-07-29T12:35:00,-51.95,47.1,Canadian Wildlife Service,280,280_84305,urn:lsid:marinespecies.org:taxname:137130,,FALSE,,,,137130
13436271-1dc6-470a-a354-fe7b6c86a200,Cepphus grylle,"(Linnaeus, 1758)",1986-07-02T12:00:00Z,-61.89572906,45.72848892,ACCD,EOR,31481,urn:lsid:marinespecies.org:taxname:137130,,FALSE,,,,137130
134c959d-88dc-46df-a06a-7285e4ec4947,Cepphus grylle,"(Linnaeus, 1758)",8/21/78 00:00,-57.24709,54.58094,Canadian Wildlife Service - Atlantic Region (CWS - Atlantic),,NF000755_BLGU_1841_1978-08-21,urn:lsid:marinespecies.org:taxname:137130,,FALSE,,,,137130
139014ef-027d-4b61-8315-bb38b51335eb,Cepphus grylle,,,-55.3,51.44,"Canadian Wildlife Service-Atlantic, Environment Canada",,1258482491_-872617897_-23642204,urn:lsid:marinespecies.org:taxname:137130,,FALSE,,,,137130
1394c0f2-de21-4655-9eb4-9b0c0793edf3,Cepphus grylle,"(Linnaeus, 1758)",08/08/1990 12:00,-61.36120987,46.17232895,ACCD,EOR,31486,urn:lsid:marinespecies.org:taxname:137130,,FALSE,,,,137130
139741c8-41f2-4887-af13-941d6a733b1c,Cepphus grylle,"(Linnaeus, 1758)",08/06/2006 08:56,-68.0212,44.3408,NA,,6594,137130,,FALSE,,,,137130
13abcfd6-a8e3-4627-9293-33d26f14bfa5,Cepphus grylle,"(Linnaeus, 1758)",1981-02-18T05:50:00,-54.1667,47.1667,Canadian Wildlife Service,280,280_139076,urn:lsid:marinespecies.org:taxname:137130,,FALSE,,,,137130
13dd8378-18e7-451f-85a9-a79e6e4fa19b,Cepphus grylle,"(Linnaeus, 1758)",1987-07-22T10:00:00,-56.1,51.6333,Canadian Wildlife Service,280,280_201037,urn:lsid:marinespecies.org:taxname:137130,,FALSE,,,,137130
13e63a86-dd45-4860-aaa5-87772eafa04d,Cepphus grylle,"(Linnaeus, 1758)",6/15/79 00:00,-60.39474,46.36617,Canadian Wildlife Service - Atlantic Region (CWS - Atlantic),,NS001108_BLGU_3176_1979-06-15,urn:lsid:marinespecies.org:taxname:137130,,FALSE,,,,137130
13ef4235-c2fa-485c-b262-6f1a228a8cf3,Cepphus grylle,"(Linnaeus, 1758)",7/22/05 09:28,-68.2357,44.1569,NA,,440751,137130,,FALSE,,,,137130
1453efbd-a382-4301-b18a-33386f843138,Cepphus grylle,,,-65.32,43.68,"Canadian Wildlife Service-Atlantic, Environment Canada",,1280325370_1100320259_-1767855992,urn:lsid:marinespecies.org:taxname:137130,,FALSE,,,,137130
1459bf6d-3246-41f7-9f23-be1ab66a5c12,Cepphus grylle,,,-52.94,48.92,"Canadian Wildlife Service-Atlantic, Environment Canada",,1416220846_267761096_1212983935,urn:lsid:marinespecies.org:taxname:137130,,FALSE,,,,137130
14863b49-316c-4646-a1a8-67c04d4926c0,Cepphus grylle,"(Linnaeus, 1758)",01/01/1986 00:00,-56.34896,46.78325,Canadian Wildlife Service - Atlantic Region (CWS - Atlantic),,NF000186_BLGU_361_1986-01-01,urn:lsid:marinespecies.org:taxname:137130,,FALSE,,,,137130
148c44f6-7113-4ce1-888e-0f882579b5c3,Cepphus grylle,"(Linnaeus, 1758)",1979-08-27T13:30:00,-61.5,57.1833,Canadian Wildlife Service,280,280_120924,urn:lsid:marinespecies.org:taxname:137130,,FALSE,,,,137130
14986373-d658-4487-85cb-671c8a404985,Cepphus grylle,"(Linnaeus, 1758)",01/01/1943 00:00,-55.83218,51.24159,Canadian Wildlife Service - Atlantic Region (CWS - Atlantic),,NF000651_BLGU_1668_1943-01-01,urn:lsid:marinespecies.org:taxname:137130,,FALSE,,,,137130
14a775f9-8a4c-4c6e-8d12-d29786a6f307,Cepphus grylle,,,-65.32,43.72,"Canadian Wildlife Service-Atlantic, Environment Canada",,1361835644_-1022172184_-1256947767,urn:lsid:marinespecies.org:taxname:137130,,FALSE,,,,137130
14cb763e-2a95-4d6a-bc08-63faa484a02f,Cepphus grylle,"(Linnaeus, 1758)",1979-08-27T09:45:00,-61.9333,57.7833,Canadian Wildlife Service,280,280_120882,urn:lsid:marinespecies.org:taxname:137130,,FALSE,,,,137130
151cdbce-a946-4849-8c16-b4540274eee5,Cepphus grylle,"(Linnaeus, 1758)",NA,-68.91666,43.85,NA,,148146,137130,,FALSE,,,,137130
153d4ce2-c7a1-4396-84b0-95a369278c1c,Cepphus grylle,"(Linnaeus, 1758)",01/01/1999 00:00,-64.04913,44.38377,Canadian Wildlife Service - Atlantic Region (CWS - Atlantic),,NS001336_BLGU_5340_1999-01-01,urn:lsid:marinespecies.org:taxname:137130,,FALSE,,,,137130
154858f2-76e5-42cb-a83c-63548374ea7c,Cepphus grylle,,,-64.01,44.48,"Canadian Wildlife Service-Atlantic, Environment Canada",,-1815568076_994443311_-1338490300,urn:lsid:marinespecies.org:taxname:137130,,FALSE,,,,137130
15726d9e-598d-4ac0-b683-7bf76800de1c,Cepphus grylle,"(Linnaeus, 1758)",1975-07-29T15:15:00,-81.5,58.95,Canadian Wildlife Service,280,280_69674,urn:lsid:marinespecies.org:taxname:137130,,FALSE,,,,137130
15b02c2e-82e6-47f8-8e99-b7a2e1d281d5,Cepphus grylle,"(Linnaeus, 1758)",1973-02-28T15:25:00,-66.95,49.5167,Canadian Wildlife Service,280,280_62768,urn:lsid:marinespecies.org:taxname:137130,,FALSE,,,,137130
15fb2635-674b-45b5-89ce-efb65fdbc5ce,Cepphus grylle,,,-60.35,55.7,"Canadian Wildlife Service-Atlantic, Environment Canada",,1380544464_-650842432_-8511349,urn:lsid:marinespecies.org:taxname:137130,,FALSE,,,,137130
15fe24e2-4633-4f2e-a17c-cc0d2c1da848,Cepphus grylle,,,-58.46,49.21,"Canadian Wildlife Service-Atlantic, Environment Canada",,896836590_-1395030075_1476843427,urn:lsid:marinespecies.org:taxname:137130,,FALSE,,,,137130
163e1bb5-eb34-4735-aed8-b064877e838d,Cepphus grylle,"(Linnaeus, 1758)",01/01/1985 00:00,-54.06388,47.13323,Canadian Wildlife Service - Atlantic Region (CWS - Atlantic),,NF000270_BLGU_709_1985-01-01,urn:lsid:marinespecies.org:taxname:137130,,FALSE,,,,137130
16493862-33ed-419d-8447-929ab5ab891e,Cepphus grylle,,,-65.33,43.69,"Canadian Wildlife Service-Atlantic, Environment Canada",,1393959998_-1019207004_2088625392,urn:lsid:marinespecies.org:taxname:137130,,FALSE,,,,137130
166b8449-7d63-4e30-b5cc-9a959a315d2b,Cepphus grylle,,,-66.06,48.03,"Canadian Wildlife Service-Atlantic, Environment Canada",,-635145613_1945350841_-419040685,urn:lsid:marinespecies.org:taxname:137130,,FALSE,,,,137130
16a0e180-b2a6-45cb-b61f-5a1ea7640736,Cepphus grylle,"(Linnaeus, 1758)",05/06/2000,-68.5,53,ICES,DOME-Biota,12135340,urn:lsid:marinespecies.org:taxname:137130,,FALSE,,,,137130
16c29906-66d8-4912-9e05-922da328963d,Cepphus grylle,"(Linnaeus, 1758)",8/13/78 00:00,-60.83177,56.15396,Canadian Wildlife Service - Atlantic Region (CWS - Atlantic),,NF000923_BLGU_2039_1978-08-13,urn:lsid:marinespecies.org:taxname:137130,,FALSE,,,,137130
16ea6d17-8988-4bcb-a6d7-606cb8aa50bf,Cepphus grylle,,,-65.53,47.96,"Canadian Wildlife Service-Atlantic, Environment Canada",,1421648014_1540899388_-1081024520,urn:lsid:marinespecies.org:taxname:137130,,FALSE,,,,137130
177cdb0b-725d-45e6-a2d2-15546cb5f5e4,Cepphus grylle,"(Linnaeus, 1758)",08/04/2005 13:29,-68.0548,44.295,NA,,441646,137130,,FALSE,,,,137130
17e58508-9b02-495d-ae5c-bb3b575ef893,Cepphus grylle,"(Linnaeus, 1758)",1973-03-06T08:40:00,-58.55,50.2333,Canadian Wildlife Service,280,280_62810,urn:lsid:marinespecies.org:taxname:137130,,FALSE,,,,137130
17eac118-7000-44c1-aec7-729f131040ac,Cepphus grylle,,,-52.6,47.55,"Canadian Wildlife Service-Atlantic, Environment Canada",,1272717373_-899701308_515783541,urn:lsid:marinespecies.org:taxname:137130,,FALSE,,,,137130
17f2a3e4-a526-4c54-b7a8-4f9267fa927a,Cepphus grylle,,,-63.19,48.69,"Canadian Wildlife Service-Atlantic, Environment Canada",,1421648014_-351048294_1172332942,urn:lsid:marinespecies.org:taxname:137130,,FALSE,,,,137130
18101bba-f157-451e-a28b-ccfb54cf355a,Cepphus grylle,"(Linnaeus, 1758)",1973-03-02T12:35:00,-62.25,49.7333,Canadian Wildlife Service,280,280_62773,urn:lsid:marinespecies.org:taxname:137130,,FALSE,,,,137130
181ca310-d805-498e-80c3-2885352fcb20,Cepphus grylle,"(Linnaeus, 1758)",06/07/1987 12:00,-66.01470947,43.39942169,ACCD,EOR,31453,urn:lsid:marinespecies.org:taxname:137130,,FALSE,,,,137130
183577f3-a2c9-4966-b58b-694ec3cbe8c6,Cepphus grylle,"(Linnaeus, 1758)",NA,-70.9231,42.273,USFWS,,669473,137130,,FALSE,,,,137130
1842b37c-0f00-4d46-9fd5-dbd7275d5182,Cepphus grylle,"(Linnaeus, 1758)",1979-08-18T12:30:00,-63.6333,59.35,Canadian Wildlife Service,280,280_119759,urn:lsid:marinespecies.org:taxname:137130,,FALSE,,,,137130
18510172-3ebb-440f-be5a-5595e5f8a453,Cepphus grylle,,,-68.28,44.15,"Canadian Wildlife Service-Atlantic, Environment Canada",,1272746530_733385025_-1945341364,urn:lsid:marinespecies.org:taxname:137130,,FALSE,,,,137130
188d39af-28a3-4df6-95fe-0a0f88736ac6,Cepphus grylle,"(Linnaeus, 1758)",07/02/1971 12:00,-61.59714127,45.98118973,ACCD,EOR,31751,urn:lsid:marinespecies.org:taxname:137130,,FALSE,,,,137130
18990a79-0584-4064-891e-6fc8bc8ed188,Cepphus grylle,"(Linnaeus, 1758)",6/25/90 12:00,-60.3813591,46.37894821,ACCD,EOR,31502,urn:lsid:marinespecies.org:taxname:137130,,FALSE,,,,137130
189eefe1-5a24-442f-b489-d08e330c8604,Cepphus grylle,,,-64.38,48.82,"Canadian Wildlife Service-Atlantic, Environment Canada",,-487837150_-1248577607_-1280773029,urn:lsid:marinespecies.org:taxname:137130,,FALSE,,,,137130
18a0e420-2c8a-4ca5-8948-2f41375f2b33,Cepphus grylle,"(Linnaeus, 1758)",7/22/05 11:23,-68.1548,44.3406,NA,,440391,137130,,FALSE,,,,137130
18ab3a46-0792-4dd3-bbc6-7ec722079814,Cepphus grylle,"(Linnaeus, 1758)",05/06/2000,-68.5,53,ICES,DOME-Biota,12135353,urn:lsid:marinespecies.org:taxname:137130,,FALSE,,,,137130
18c5f437-eb83-4dab-afcd-ad10f40be31f,Cepphus grylle,,,-65.52,47.97,"Canadian Wildlife Service-Atlantic, Environment Canada",,-635145613_1119722010_162217406,urn:lsid:marinespecies.org:taxname:137130,,FALSE,,,,137130
18cddf79-443a-4bd7-9b62-5e4d995cfe91,Cepphus grylle,,,-61.72,47.31,"Canadian Wildlife Service-Atlantic, Environment Canada",,-1933920140_-710018418_-1566278361,urn:lsid:marinespecies.org:taxname:137130,,FALSE,,,,137130
18d5b930-2e30-4061-8541-c5c59b76b236,Cepphus grylle,"(Linnaeus, 1758)",2000-06-21T12:00:00Z,-61.25893021,46.36706162,ACCD,EOR,31744,urn:lsid:marinespecies.org:taxname:137130,,FALSE,,,,137130
18f68fad-05dc-41de-843a-0df7e807e7fd,Cepphus grylle,"(Linnaeus, 1758)",7/24/06 15:03,-68.1593,44.2938,NA,,5820,137130,,FALSE,,,,137130
1906dcf4-7989-4767-87cb-0179bc9bc10d,Cepphus grylle,"(Linnaeus, 1758)",08/08/2005 08:52,-68.1045,44.3416,NA,,441912,137130,,FALSE,,,,137130
19306e6c-8122-4fb5-8ace-d22ab423ee59,Cepphus grylle,"(Linnaeus, 1758)",7/22/05 09:30,-68.234,44.1459,NA,,440926,137130,,FALSE,,,,137130
193d3d4d-4164-4a3f-982a-89f4bbe9f0e2,Cepphus grylle,"(Linnaeus, 1758)",05/06/2000,-68.5,53,ICES,DOME-Biota,12135337,urn:lsid:marinespecies.org:taxname:137130,,FALSE,,,,137130
19655277-ba5e-4ad7-b260-c98c7b40bdf4,Cepphus grylle,,,-53.12,48.68,"Canadian Wildlife Service-Atlantic, Environment Canada",,1278617075_1472117032_1222671369,urn:lsid:marinespecies.org:taxname:137130,,FALSE,,,,137130
197bc9f9-3525-40c3-bcee-b64d93237ef5,Cepphus grylle,,,-59.78,50.02,"Canadian Wildlife Service-Atlantic, Environment Canada",,792082018_109639811_2049085283,urn:lsid:marinespecies.org:taxname:137130,,FALSE,,,,137130
197ddf64-3689-4be6-93a1-c20ca27b6eab,Cepphus grylle,"(Linnaeus, 1758)",7/15/89 12:00,-66.14932632,43.63722038,ACCD,EOR,31806,urn:lsid:marinespecies.org:taxname:137130,,FALSE,,,,137130
199ecbf4-c244-4b7c-9377-d17b57dbdc8d,Cepphus grylle,"(Linnaeus, 1758)",01/01/1986 00:00,-52.83439,47.19749,Canadian Wildlife Service - Atlantic Region (CWS - Atlantic),,NF003749_BLGU_772_1986-01-01,urn:lsid:marinespecies.org:taxname:137130,,FALSE,,,,137130
19aa0534-0ecf-47e1-9235-93d068fd5229,Cepphus grylle,"(Linnaeus, 1758)",1986-07-31T12:00:00Z,-64.95115662,44.98693848,ACCD,EOR,31461,urn:lsid:marinespecies.org:taxname:137130,,FALSE,,,,137130
19ad46ed-881b-43d9-b293-ba1bf10e72a8,Cepphus grylle,"(Linnaeus, 1758)",1979-08-14T15:30:00,-63.0667,58.4833,Canadian Wildlife Service,280,280_118884,urn:lsid:marinespecies.org:taxname:137130,,FALSE,,,,137130
19ec834a-00e4-464b-97a1-1c5f4a89341a,Cepphus grylle,"(Linnaeus, 1758)",1973-02-20T08:40:00,-61.0833,45.4167,Canadian Wildlife Service,280,280_62578,urn:lsid:marinespecies.org:taxname:137130,,FALSE,,,,137130
1a012e73-6a56-4e82-aa46-66c4cc72a4a6,Cepphus grylle,"(Linnaeus, 1758)",7/29/10 00:00,-57.16547,54.44997,Canadian Wildlife Service - Atlantic Region (CWS - Atlantic),,NF000747_BLGU_12554_2010-07-29,urn:lsid:marinespecies.org:taxname:137130,,FALSE,,,,137130
1a3a6f6a-2b82-4edf-941f-329fee6ae8e5,Cepphus grylle,"(Linnaeus, 1758)",7/26/05 09:43,-68.2142,44.207,NA,,441192,137130,,FALSE,,,,137130
1a5f3628-557d-44a6-b9a5-0ed92e2e8dea,Cepphus grylle,"(Linnaeus, 1758)",1981-02-17T12:30:00,-55,47,Canadian Wildlife Service,280,280_139006,urn:lsid:marinespecies.org:taxname:137130,,FALSE,,,,137130
1a69f925-d29b-4488-b8a5-462f54524d23,Cepphus grylle,"(Linnaeus, 1758)",1973-02-24T11:55:00,-64.6833,49.2667,Canadian Wildlife Service,280,280_62749,urn:lsid:marinespecies.org:taxname:137130,,FALSE,,,,137130
1a78eb0f-2a4f-40a7-a971-c8c62770ad69,Cepphus grylle,,,-65.09,48.09,"Canadian Wildlife Service-Atlantic, Environment Canada",,-1636689528_-1868097719_-705986688,urn:lsid:marinespecies.org:taxname:137130,,FALSE,,,,137130
1a905d6f-c912-444d-864c-a6a9c81f6775,Cepphus grylle,,,-65.48,47.96,"Canadian Wildlife Service-Atlantic, Environment Canada",,1421648014_713944272_2136857330,urn:lsid:marinespecies.org:taxname:137130,,FALSE,,,,137130
1add96b4-6c5d-4d81-837c-cbd1c8776f04,Cepphus grylle,"(Linnaeus, 1758)",06/06/2000 00:00,-65.16591,47.22218,Canadian Wildlife Service - Atlantic Region (CWS - Atlantic),,NB002460_BLGU_5604_2000-06-06,urn:lsid:marinespecies.org:taxname:137130,,FALSE,,,,137130
1ae74c04-290b-4f32-9459-b57751dbbf96,Cepphus grylle,"(Linnaeus, 1758)",7/19/06 12:38,-67.941,44.3466,NA,,5598,137130,,FALSE,,,,137130
1af2fabb-9b0e-4213-a34a-92580eb570c4,Cepphus grylle,"(Linnaeus, 1758)",1980-12-20T20:00:00,-66.3667,43.15,Canadian Wildlife Service,280,280_137070,urn:lsid:marinespecies.org:taxname:137130,,FALSE,,,,137130
1af3f5b6-43af-446a-b74f-b8f8add15203,Cepphus grylle,"(Linnaeus, 1758)",7/26/06 10:23,-68.2386,44.153,NA,,6008,137130,,FALSE,,,,137130
1b03f3f8-0c7f-4da9-b258-9c19d2803a1a,Cepphus grylle,"(Linnaeus, 1758)",1978-08-28T12:50:00,-59.5167,55.2833,Canadian Wildlife Service,280,280_108582,urn:lsid:marinespecies.org:taxname:137130,,FALSE,,,,137130
1b0fc073-c0e2-49a1-95e7-8dca9ac7d575,Cepphus grylle,,,-56.15,53.97,"Canadian Wildlife Service-Atlantic, Environment Canada",,1373407025_-2052147386_2059933259,urn:lsid:marinespecies.org:taxname:137130,,FALSE,,,,137130
1b18c0b4-d036-4d88-8c22-7b4135aaf58b,Cepphus grylle,"(Linnaeus, 1758)",1971-07-02T12:00:00Z,-62.37918854,44.82164001,ACCD,EOR,31770,urn:lsid:marinespecies.org:taxname:137130,,FALSE,,,,137130
1b44d579-14ec-45cf-a8ba-eaff8c817af9,Cepphus grylle,"(Linnaeus, 1758)",1973-03-05T16:10:00,-58.2167,50.5833,Canadian Wildlife Service,280,280_62805,urn:lsid:marinespecies.org:taxname:137130,,FALSE,,,,137130
1b6b4d9b-6165-4804-8e92-73de7a0b6186,Cepphus grylle,"(Linnaeus, 1758)",1990-07-30T12:00:00Z,-60.16275024,47.1866188,ACCD,EOR,31507,urn:lsid:marinespecies.org:taxname:137130,,FALSE,,,,137130
1c0cc52d-a37b-4fc1-94a6-176d04fe4bde,Cepphus grylle,"(Linnaeus, 1758)",8/15/78 00:00,-57.81549,54.83331,Canadian Wildlife Service - Atlantic Region (CWS - Atlantic),,NF000764_BLGU_1855_1978-08-15,urn:lsid:marinespecies.org:taxname:137130,,FALSE,,,,137130
1c2565ea-18d7-4d87-b33e-8776851e0576,Cepphus grylle,,,-67.19,49.49,"Canadian Wildlife Service-Atlantic, Environment Canada",,-1636689528_-1364130564_1272230575,urn:lsid:marinespecies.org:taxname:137130,,FALSE,,,,137130
1c5f366b-b9ec-4f71-8518-e1f51b3f620b,Cepphus grylle,,,-59.71,49.98,"Canadian Wildlife Service-Atlantic, Environment Canada",,792082018_2126004097_-2141488086,urn:lsid:marinespecies.org:taxname:137130,,FALSE,,,,137130
1ca51d4e-2981-4ed2-90c2-4f87ce5e7b21,Cepphus grylle,"(Linnaeus, 1758)",5/24/02 00:00,-62.55621,45.81521,Canadian Wildlife Service - Atlantic Region (CWS - Atlantic),,NS001389_BLGU_6675_2002-05-24,urn:lsid:marinespecies.org:taxname:137130,,FALSE,,,,137130
1cb3d680-145e-44e1-af14-314241a1e634,Cepphus grylle,"(Linnaeus, 1758)",01/01/1985 00:00,-53.2322,46.65822,Canadian Wildlife Service - Atlantic Region (CWS - Atlantic),,NF000180_BLGU_314_1985-01-01,urn:lsid:marinespecies.org:taxname:137130,,FALSE,,,,137130
1cc0f913-ee68-4bfd-bea6-e13fbf556bf2,Cepphus grylle,"(Linnaeus, 1758)",1988-04-09T20:00:00,-68.9167,43.85,Canadian Wildlife Service,280,280_206531,urn:lsid:marinespecies.org:taxname:137130,,FALSE,,,,137130
1cd2fb95-24db-4c59-8e3f-38229022507c,Cepphus grylle,,,-61.75,47.33,"Canadian Wildlife Service-Atlantic, Environment Canada",,-1325055108_-1348795469_-2098832279,urn:lsid:marinespecies.org:taxname:137130,,FALSE,,,,137130
1cd36dda-8064-45aa-ac92-9f21d9e64ef1,Cepphus grylle,,,-65.33,43.69,"Canadian Wildlife Service-Atlantic, Environment Canada",,1393959998_-1019207004_949425310,urn:lsid:marinespecies.org:taxname:137130,,FALSE,,,,137130
1d274107-538a-4b3c-871f-a68b7e14d9bb,Cepphus grylle,"(Linnaeus, 1758)",06/09/1976 12:00,-66.50797272,45.10573959,ACCD,EOR,31766,urn:lsid:marinespecies.org:taxname:137130,,FALSE,,,,137130
1d730bc9-d41a-42d3-8809-9436447c9038,Cepphus grylle,,,-61.85,47.37,"Canadian Wildlife Service-Atlantic, Environment Canada",,109413192_-776250012_649302541,urn:lsid:marinespecies.org:taxname:137130,,FALSE,,,,137130
1d84eed2-bd7a-423c-bca4-85b697ee3db5,Cepphus grylle,"(Linnaeus, 1758)",1987-08-03T13:55:00,-56.2333,55.8333,Canadian Wildlife Service,280,280_202590,urn:lsid:marinespecies.org:taxname:137130,,FALSE,,,,137130
1da6b761-ce90-4461-b0ad-2e62ea2530a2,Cepphus grylle,,,-66.55,49.23,"Canadian Wildlife Service-Atlantic, Environment Canada",,792082018_-1495184724_1271331211,urn:lsid:marinespecies.org:taxname:137130,,FALSE,,,,137130
1dcc5645-2c55-42b4-bddc-c4ac548b7a68,Cepphus grylle,"(Linnaeus, 1758)",1973-02-20T08:40:00,-61.0833,45.4167,Canadian Wildlife Service,280,280_62580,urn:lsid:marinespecies.org:taxname:137130,,FALSE,,,,137130
1dd4b76c-9216-4190-b013-6104c212cd25,Cepphus grylle,"(Linnaeus, 1758)",7/26/05 15:54,-68.159,44.2909,NA,,441279,137130,,FALSE,,,,137130
1de5cf8e-2c9f-402c-b705-3c0822cef680,Cepphus grylle,"(Linnaeus, 1758)",1986-08-01T12:00:00Z,-63.99726868,46.9745903,ACCD,EOR,31475,urn:lsid:marinespecies.org:taxname:137130,,FALSE,,,,137130
1e06a275-426d-41bc-bcaf-d2ed3ee3598b,Cepphus grylle,"(Linnaeus, 1758)",8/13/78 00:00,-60.68223,56.06669,Canadian Wildlife Service - Atlantic Region (CWS - Atlantic),,NF000912_BLGU_2029_1978-08-13,urn:lsid:marinespecies.org:taxname:137130,,FALSE,,,,137130
1e0a3933-ae5a-4b2d-ac03-b6d22eac1831,Cepphus grylle,,,-64.61,48.3,"Canadian Wildlife Service-Atlantic, Environment Canada",,689065724_1623609376_-839075085,urn:lsid:marinespecies.org:taxname:137130,,FALSE,,,,137130
1e16bed8-85d8-48aa-818c-441b7a66436a,Cepphus grylle,"(Linnaeus, 1758)",8/18/78 00:00,-58.2155,54.99998,Canadian Wildlife Service - Atlantic Region (CWS - Atlantic),,NF000783_BLGU_1874_1978-08-18,urn:lsid:marinespecies.org:taxname:137130,,FALSE,,,,137130
1e1ce49e-99c8-4017-993c-3341047d442e,Cepphus grylle,"(Linnaeus, 1758)",NA,-68.6045,44.108,USFWS,,670174,137130,,FALSE,,,,137130
1e5315a5-136b-4961-871b-d12a13445e7d,Cepphus grylle,"(Linnaeus, 1758)",07/09/1989 12:00,-66.28401184,45.17433167,ACCD,EOR,31449,urn:lsid:marinespecies.org:taxname:137130,,FALSE,,,,137130
1e571895-7359-40e1-a568-0e206a41be2b,Cepphus grylle,"(Linnaeus, 1758)",8/21/07 00:00,-66.68824,44.63043,Canadian Wildlife Service - Atlantic Region (CWS - Atlantic),,NB003372_BLGU_11958_2007-08-21,urn:lsid:marinespecies.org:taxname:137130,,FALSE,,,,137130
1e66f70d-3f8a-4ace-95a3-5cd548180133,Cepphus grylle,,,-58.73,48.9,"Canadian Wildlife Service-Atlantic, Environment Canada",,896836590_2085820365_1437859890,urn:lsid:marinespecies.org:taxname:137130,,FALSE,,,,137130
1e855d9a-8d17-44ae-83fb-61e67ea75ff5,Cepphus grylle,"(Linnaeus, 1758)",1983-07-25T07:50:00,-67.8,58.7167,Canadian Wildlife Service,280,280_165393,urn:lsid:marinespecies.org:taxname:137130,,FALSE,,,,137130
1ebbb8a4-92c5-4a15-aa3c-fd664981abec,Cepphus grylle,"(Linnaeus, 1758)",1979-08-25T14:15:00,-62.55,58.2,Canadian Wildlife Service,280,280_120718,urn:lsid:marinespecies.org:taxname:137130,,FALSE,,,,137130
1f199f03-d1ab-4bc4-886c-d14698d0cade,Cepphus grylle,"(Linnaeus, 1758)",7/19/06 12:37,-67.9251,44.3492,NA,,5597,137130,,FALSE,,,,137130
1f8dbf57-a633-4f57-b3c3-57a5ea8bd28a,Cepphus grylle,"(Linnaeus, 1758)",NA,-68.7507,44.0998,"BOEM, USFWS, NOAA, NAVY",,727975,137130,,FALSE,,,,137130
1f8e5c37-0958-496a-9f1d-0baa28940c90,Cepphus grylle,,,-63.27,49.91,"Canadian Wildlife Service-Atlantic, Environment Canada",,-635145613_2112068527_-1419550713,urn:lsid:marinespecies.org:taxname:137130,,FALSE,,,,137130
1f9e9415-0106-4a86-95ff-39f1e3aba25d,Cepphus grylle,"(Linnaeus, 1758)",NA,-68.8821,44.4333,"BOEM, USFWS, NOAA, NAVY",,732610,137130,,FALSE,,,,137130
1fc70039-f4be-422c-adad-ca2f5f5ea8bc,Cepphus grylle,"(Linnaeus, 1758)",07/03/2015 00:00,-52.7804,47.23832,Canadian Wildlife Service - Atlantic Region (CWS - Atlantic),,NF000298_BLGU_12560_2015-07-03,urn:lsid:marinespecies.org:taxname:137130,,FALSE,,,,137130
1fd41504-9d1d-451f-b1ba-fd891740c428,Cepphus grylle,"(Linnaeus, 1758)",1990-07-09T12:00:00Z,-62.50167847,46.02827072,ACCD,EOR,31479,urn:lsid:marinespecies.org:taxname:137130,,FALSE,,,,137130
1fd73bb4-79a8-42fc-a32a-b0c36d12f624,Cepphus grylle,"(Linnaeus, 1758)",1972-02-04T12:10:00,-53.15,46.6,Canadian Wildlife Service,280,280_55420,urn:lsid:marinespecies.org:taxname:137130,,FALSE,,,,137130
200de519-59ae-4161-ba1f-8a9e60665baa,Cepphus grylle,"(Linnaeus, 1758)",07/02/1986 12:00,-61.89572906,45.72848892,ACCD,EOR,31481,urn:lsid:marinespecies.org:taxname:137130,,FALSE,,,,137130
2080138a-7ddd-43ba-b4f3-1bf943d8c5ae,Cepphus grylle,,,-58.57,48.87,"Canadian Wildlife Service-Atlantic, Environment Canada",,896836590_1732922200_937340495,urn:lsid:marinespecies.org:taxname:137130,,FALSE,,,,137130
2093e116-8957-4284-b389-1b365ba74c0c,Cepphus grylle,"(Linnaeus, 1758)",NA,-69.7052,41.5227,USFWS,,680801,137130,,FALSE,,,,137130
20bb4491-262d-4c6a-bd19-6b3d144bf44a,Cepphus grylle,"(Linnaeus, 1758)",NA,-70.3626,43.4337,"BOEM, USFWS, NOAA, NAVY",,727649,137130,,FALSE,,,,137130
20d129ac-2bde-4b0e-9d41-839d71edea34,Cepphus grylle,"(Linnaeus, 1758)",7/26/78 00:00,-55.59878,53.43327,Canadian Wildlife Service - Atlantic Region (CWS - Atlantic),,NF000678_BLGU_1724_1978-07-26,urn:lsid:marinespecies.org:taxname:137130,,FALSE,,,,137130
2102bd91-3bce-48c8-a24f-9c6ba0aac361,Cepphus grylle,"(Linnaeus, 1758)",1989-08-06T12:00:00Z,-67.10142517,44.50217056,ACCD,EOR,31425,urn:lsid:marinespecies.org:taxname:137130,,FALSE,,,,137130
2119c2ba-d3b4-42da-b7cb-817489e544b2,Cepphus grylle,"(Linnaeus, 1758)",1979-09-01T10:30:00,-60.9333,55.95,Canadian Wildlife Service,280,280_121202,urn:lsid:marinespecies.org:taxname:137130,,FALSE,,,,137130
2151ce9f-55fe-4ffb-8bda-8007ed62b402,Cepphus grylle,,,-64.32,48.79,"Canadian Wildlife Service-Atlantic, Environment Canada",,58439636_1124206877_106968775,urn:lsid:marinespecies.org:taxname:137130,,FALSE,,,,137130
215b6244-174b-4859-a792-cc925fa389c1,Cepphus grylle,"(Linnaeus, 1758)",1978-08-28T13:20:00,-59.3,55.2667,Canadian Wildlife Service,280,280_108612,urn:lsid:marinespecies.org:taxname:137130,,FALSE,,,,137130
218e051e-3a35-4b7e-8d73-1dad035c187f,Cepphus grylle,,,-64.63,49.91,"Canadian Wildlife Service-Atlantic, Environment Canada",,-1636689528_1429780880_1141505026,urn:lsid:marinespecies.org:taxname:137130,,FALSE,,,,137130
21e6f76e-95fc-479e-91f3-dd326f75c840,Cepphus grylle,"(Linnaeus, 1758)",1978-06-23T21:00:00,-55.4333,49.5667,Canadian Wildlife Service,280,280_101687,urn:lsid:marinespecies.org:taxname:137130,,FALSE,,,,137130
2221cd8a-86ec-45e9-80a9-7b627e05e513,Cepphus grylle,"(Linnaeus, 1758)",7/13/16 00:00,-55.57673,46.88861,Canadian Wildlife Service - Atlantic Region (CWS - Atlantic),,NF002899_BLGU_13238_2016-07-13,urn:lsid:marinespecies.org:taxname:137130,,FALSE,,,,137130
2254c7fb-2029-4abc-80dc-24fbd4d44e80,Cepphus grylle,,,-59.7,45.92,"Canadian Wildlife Service-Atlantic, Environment Canada",,1207827508_-852444851_-1362308029,urn:lsid:marinespecies.org:taxname:137130,,FALSE,,,,137130
226ad634-f4f7-43ab-88c7-f763db898034,Cepphus grylle,"(Linnaeus, 1758)",01/01/1973 00:00,-66.69222,44.6325,Canadian Wildlife Service - Atlantic Region (CWS - Atlantic),,NB000098_BLGU_180_1973-01-01,urn:lsid:marinespecies.org:taxname:137130,,FALSE,,,,137130
22783ba8-871b-4dea-be55-e2d47e6cd677,Cepphus grylle,"(Linnaeus, 1758)",1971-07-19T14:30:00,-56.1667,46.8167,Canadian Wildlife Service,280,280_41434,urn:lsid:marinespecies.org:taxname:137130,,FALSE,,,,137130
227dafc2-e111-435f-a9cd-7e95ba05acd9,Cepphus grylle,,,-61.81,47.35,"Canadian Wildlife Service-Atlantic, Environment Canada",,-1325055108_-1623144943_-367630717,urn:lsid:marinespecies.org:taxname:137130,,FALSE,,,,137130
2283319b-aec7-4d73-9c12-48b3e407f175,Cepphus grylle,"(Linnaeus, 1758)",7/13/15 00:00,-61.26128,46.35939,Canadian Wildlife Service - Atlantic Region (CWS - Atlantic),,NS001348_BLGU_12624_2015-07-13,urn:lsid:marinespecies.org:taxname:137130,,FALSE,,,,137130
2286a730-5f3d-4f7b-b09e-f160a84f5449,Cepphus grylle,"(Linnaeus, 1758)",8/13/78 00:00,-59.93221,55.83334,Canadian Wildlife Service - Atlantic Region (CWS - Atlantic),,NF000896_BLGU_1999_1978-08-13,urn:lsid:marinespecies.org:taxname:137130,,FALSE,,,,137130
228ac17b-2ae8-4cec-8e5b-cf2e42734124,Cepphus grylle,"(Linnaeus, 1758)",1986-08-17T12:00:00Z,-66.79019928,44.72700882,ACCD,EOR,31443,urn:lsid:marinespecies.org:taxname:137130,,FALSE,,,,137130
22a10283-997b-420d-b8ca-ea654cd60c8f,Cepphus grylle,"(Linnaeus, 1758)",8/13/78 00:00,-60.66556,56.06669,Canadian Wildlife Service - Atlantic Region (CWS - Atlantic),,NF000913_BLGU_2028_1978-08-13,urn:lsid:marinespecies.org:taxname:137130,,FALSE,,,,137130
22bd4c4a-0f25-4d50-a382-b30b2d17f5db,Cepphus grylle,"(Linnaeus, 1758)",7/26/05 13:46,-68.2068,44.1713,NA,,441255,137130,,FALSE,,,,137130
22efe9a0-48eb-4a70-8619-00f3a8eef918,Cepphus grylle,"(Linnaeus, 1758)",8/15/78 00:00,-58.51551,54.88332,Canadian Wildlife Service - Atlantic Region (CWS - Atlantic),,NF000767_BLGU_1859_1978-08-15,urn:lsid:marinespecies.org:taxname:137130,,FALSE,,,,137130
231bf3da-813a-4c30-8f4c-3f7c7b2b0a9e,Cepphus grylle,,,-64.1,47.98,"Canadian Wildlife Service-Atlantic, Environment Canada",,-1636689528_465826877_-708285769,urn:lsid:marinespecies.org:taxname:137130,,FALSE,,,,137130
2328c793-8068-4670-a902-7316cdc8fac9,Cepphus grylle,,,-64.8,49.31,"Canadian Wildlife Service-Atlantic, Environment Canada",,-801551520_348412114_-1550884591,urn:lsid:marinespecies.org:taxname:137130,,FALSE,,,,137130
23353b3a-8784-4a18-9706-91c410cd067e,Cepphus grylle,"(Linnaeus, 1758)",1978-06-29T08:00:00,-57,53.8667,Canadian Wildlife Service,280,280_102167,urn:lsid:marinespecies.org:taxname:137130,,FALSE,,,,137130
233ea1bf-5754-4723-9737-a65de1de9504,Cepphus grylle,"(Linnaeus, 1758)",1977-06-18T19:45:00,-52.9667,47.75,Canadian Wildlife Service,280,280_82868,urn:lsid:marinespecies.org:taxname:137130,,FALSE,,,,137130
234c7214-178a-48e0-a226-1a0551ab43d1,Cepphus grylle,"(Linnaeus, 1758)",01/01/1984 00:00,-56.22562,46.77825,Canadian Wildlife Service - Atlantic Region (CWS - Atlantic),,NF000184_BLGU_331_1984-01-01,urn:lsid:marinespecies.org:taxname:137130,,FALSE,,,,137130
2381e884-1658-41d3-8277-40a2aa50b011,Cepphus grylle,"(Linnaeus, 1758)",01/01/1971 00:00,-59.95988,45.8947,Canadian Wildlife Service - Atlantic Region (CWS - Atlantic),,NS001325_BLGU_3089_1971-01-01,urn:lsid:marinespecies.org:taxname:137130,,FALSE,,,,137130
23946b4a-e6b5-432d-b918-4be9967a6cdb,Cepphus grylle,"(Linnaeus, 1758)",1968-06-14T12:00:00Z,-65.98500824,47.92221832,ACCD,EOR,31413,urn:lsid:marinespecies.org:taxname:137130,,FALSE,,,,137130
23cc83eb-11fa-4f08-815e-ee8e5392a2ca,Cepphus grylle,"(Linnaeus, 1758)",08/07/1978 00:00,-60.93785,56.67442,Canadian Wildlife Service - Atlantic Region (CWS - Atlantic),,NF001006_BLGU_2154_1978-08-07,urn:lsid:marinespecies.org:taxname:137130,,FALSE,,,,137130
23cd5ab5-86cc-496b-98e1-6f46af80d2f9,Cepphus grylle,"(Linnaeus, 1758)",1990-07-31T12:00:00Z,-61.04888916,46.61063004,ACCD,EOR,31491,urn:lsid:marinespecies.org:taxname:137130,,FALSE,,,,137130
24058547-7df5-4a01-a54c-450664387ad4,Cepphus grylle,"(Linnaeus, 1758)",1978-07-20T09:30:00,-55.4333,53.1333,Canadian Wildlife Service,280,280_103444,urn:lsid:marinespecies.org:taxname:137130,,FALSE,,,,137130
2411637e-4384-4aa0-961f-c2b349aeffe5,Cepphus grylle,,,-69.25,43.86,"Canadian Wildlife Service-Atlantic, Environment Canada",,1272746530_1971340871_1433412732,urn:lsid:marinespecies.org:taxname:137130,,FALSE,,,,137130
2476aef9-a5a4-428d-bcf6-d8767768cf59,Cepphus grylle,"(Linnaeus, 1758)",7/26/06 10:20,-68.2313,44.1699,NA,,6006,137130,,FALSE,,,,137130
248ad1ee-8ad2-4f5a-8cac-59daa7cba2da,Cepphus grylle,"(Linnaeus, 1758)",1979-08-14T17:50:00,-59.1667,55.2333,Canadian Wildlife Service,280,280_118900,urn:lsid:marinespecies.org:taxname:137130,,FALSE,,,,137130
248c395e-f74c-4258-888a-5542b029f775,Cepphus grylle,"(Linnaeus, 1758)",8/14/78 00:00,-58.76551,55.21666,Canadian Wildlife Service - Atlantic Region (CWS - Atlantic),,NF000815_BLGU_1904_1978-08-14,urn:lsid:marinespecies.org:taxname:137130,,FALSE,,,,137130
24c021f0-714d-47a9-ba0b-a91218f21d32,Cepphus grylle,"(Linnaeus, 1758)",1979-09-04T12:45:00,-59.7667,55.3667,Canadian Wildlife Service,280,280_121227,urn:lsid:marinespecies.org:taxname:137130,,FALSE,,,,137130
24dcb0ae-282b-41c3-8f85-6201de4447b6,Cepphus grylle,"(Linnaeus, 1758)",7/29/05 15:39,-68.1192,44.3546,NA,,441481,137130,,FALSE,,,,137130
25070bcc-0f88-4a63-bdc5-ba6829c27fea,Cepphus grylle,"(Linnaeus, 1758)",01/01/1985 00:00,-53.05302,48.66818,Canadian Wildlife Service - Atlantic Region (CWS - Atlantic),,NF002948_BLGU_1162_1985-01-01,urn:lsid:marinespecies.org:taxname:137130,,FALSE,,,,137130
250a4734-792d-4ccc-a7f7-3a94cb21edd3,Cepphus grylle,,,-61.14,56.54,"Canadian Wildlife Service-Atlantic, Environment Canada",,1223666941_157464958_397308892,urn:lsid:marinespecies.org:taxname:137130,,FALSE,,,,137130
2529ca22-887d-4555-a7b1-41534be0eda0,Cepphus grylle,,,-61.83,47.35,"Canadian Wildlife Service-Atlantic, Environment Canada",,-1614583778_-391041759_-460864633,urn:lsid:marinespecies.org:taxname:137130,,FALSE,,,,137130
25569c2b-0c83-4eb4-b5c1-8b2e3d50cb06,Cepphus grylle,,,-60.72,48.33,"Canadian Wildlife Service-Atlantic, Environment Canada",,792082018_-1218329127_837626830,urn:lsid:marinespecies.org:taxname:137130,,FALSE,,,,137130
25a3d189-8fe0-41a5-96df-019e65c22c8d,Cepphus grylle,,,-55.18,53.48,"Canadian Wildlife Service-Atlantic, Environment Canada",,1436357738_-1277520703_709987310,urn:lsid:marinespecies.org:taxname:137130,,FALSE,,,,137130
260ab3ee-4a72-4f40-9695-7440b1fc71bb,Cepphus grylle,"(Linnaeus, 1758)",6/27/86 12:00,-61.00395966,46.63269043,ACCD,EOR,31492,urn:lsid:marinespecies.org:taxname:137130,,FALSE,,,,137130
2625d587-1979-4842-be5f-edb768208ef4,Cepphus grylle,"(Linnaeus, 1758)",7/22/05 09:28,-68.2357,44.1569,NA,,440921,137130,,FALSE,,,,137130
2679096b-fb62-4b3e-a10b-8033341208dd,Cepphus grylle,"(Linnaeus, 1758)",7/26/05 15:51,-68.162,44.2683,NA,,441276,137130,,FALSE,,,,137130
26abd2e7-8c60-49ea-8936-04838499c820,Cepphus grylle,"(Linnaeus, 1758)",6/22/01 00:00,-54.49834,49.5806,Canadian Wildlife Service - Atlantic Region (CWS - Atlantic),,NF002766_BLGU_5936_2001-06-22,urn:lsid:marinespecies.org:taxname:137130,,FALSE,,,,137130
26dec666-b6bd-4832-8758-1e1d11c94bb9,Cepphus grylle,"(Linnaeus, 1758)",1970-04-23T08:50:00,-58.5333,49.1,Canadian Wildlife Service,280,280_19749,urn:lsid:marinespecies.org:taxname:137130,,FALSE,,,,137130
26df37cb-89e1-46f0-9f7b-ceb9eaf0cb5a,Cepphus grylle,"(Linnaeus, 1758)",07/02/1973 12:00,-66.76239777,44.61949158,ACCD,EOR,31419,urn:lsid:marinespecies.org:taxname:137130,,FALSE,,,,137130
26ef3c8f-30aa-43e7-8e85-1689d4dcbd62,Cepphus grylle,,,-63.54,59.35,"Canadian Wildlife Service-Atlantic, Environment Canada",,1409356886_-1589028261_1355981824,urn:lsid:marinespecies.org:taxname:137130,,FALSE,,,,137130
26f7beae-ab0e-4d9f-ad34-0407c5b084d2,Cepphus grylle,,,-65.32,43.73,"Canadian Wildlife Service-Atlantic, Environment Canada",,1361835644_-1428486039_-1282432030,urn:lsid:marinespecies.org:taxname:137130,,FALSE,,,,137130
26fdb935-2601-41b9-904d-b2ad52ac78fd,Cepphus grylle,"(Linnaeus, 1758)",8/13/78 00:00,-61.30024,56.26133,Canadian Wildlife Service - Atlantic Region (CWS - Atlantic),,NF000941_BLGU_2078_1978-08-13,urn:lsid:marinespecies.org:taxname:137130,,FALSE,,,,137130
271c34c0-c1f6-446c-89ad-c290a2e37a1c,Cepphus grylle,,,-53.4,48.25,"Canadian Wildlife Service-Atlantic, Environment Canada",,1427117146_1283377100_1355441885,urn:lsid:marinespecies.org:taxname:137130,,FALSE,,,,137130
2727439b-e85d-4255-959c-e90887db6b1f,Cepphus grylle,"(Linnaeus, 1758)",7/26/05 08:50,-68.1595,44.3297,NA,,441180,137130,,FALSE,,,,137130
27314b73-3150-410e-bd80-32f15b8147e6,Cepphus grylle,"(Linnaeus, 1758)",6/21/01 00:00,-55.50377,49.99191,Canadian Wildlife Service - Atlantic Region (CWS - Atlantic),,NF002710_BLGU_5832_2001-06-21,urn:lsid:marinespecies.org:taxname:137130,,FALSE,,,,137130
2732d462-db2a-4dbf-a16e-162296b310da,Cepphus grylle,"(Linnaeus, 1758)",07/06/1990 00:00,-66.76915,44.79494,Canadian Wildlife Service - Atlantic Region (CWS - Atlantic),,NB000110_BLGU_204_1990-07-06,urn:lsid:marinespecies.org:taxname:137130,,FALSE,,,,137130
27509ab0-95a8-41cb-90df-944cbd046285,Cepphus grylle,"(Linnaeus, 1758)",01/01/1944 00:00,-57.1989,50.79993,Canadian Wildlife Service - Atlantic Region (CWS - Atlantic),,NF000621_BLGU_1607_1944-01-01,urn:lsid:marinespecies.org:taxname:137130,,FALSE,,,,137130
27bb17c8-cd7a-434e-a359-5425e043a8e1,Cepphus grylle,"(Linnaeus, 1758)",1980-06-30T07:30:00,-52.5833,47.5,Canadian Wildlife Service,280,280_128543,urn:lsid:marinespecies.org:taxname:137130,,FALSE,,,,137130
27c4e2d2-e601-46b2-9bc4-10e362001c26,Cepphus grylle,"(Linnaeus, 1758)",08/12/1990 12:00,-60.39228821,47.02912903,ACCD,EOR,31499,urn:lsid:marinespecies.org:taxname:137130,,FALSE,,,,137130
27d16c33-2460-4b65-948c-1fe241517c97,Cepphus grylle,"(Linnaeus, 1758)",1979-08-11T15:30:00,-61.95,57.5833,Canadian Wildlife Service,280,280_118413,urn:lsid:marinespecies.org:taxname:137130,,FALSE,,,,137130
27e1ff41-65a2-415a-a546-876c5865e6ef,Cepphus grylle,,,-58.9,48.22,"Canadian Wildlife Service-Atlantic, Environment Canada",,896836590_1759638145_1314260838,urn:lsid:marinespecies.org:taxname:137130,,FALSE,,,,137130
281bd0fd-d200-4441-94bc-63cbeed3dc6d,Cepphus grylle,"(Linnaeus, 1758)",7/17/88 12:00,-66.95944214,45.00941086,ACCD,EOR,31432,urn:lsid:marinespecies.org:taxname:137130,,FALSE,,,,137130
283952e3-7d4e-4fc2-b6f2-be3904ac4e24,Cepphus grylle,"(Linnaeus, 1758)",08/11/1978 00:00,-60.09889,55.40001,Canadian Wildlife Service - Atlantic Region (CWS - Atlantic),,NF000855_BLGU_1954_1978-08-11,urn:lsid:marinespecies.org:taxname:137130,,FALSE,,,,137130
286ac2fe-eb32-4da7-b29c-d75412a81cf1,Cepphus grylle,"(Linnaeus, 1758)",1972-02-04T13:20:00,-52.9167,46.7167,Canadian Wildlife Service,280,280_55448,urn:lsid:marinespecies.org:taxname:137130,,FALSE,,,,137130
2876b0fe-9318-4e5c-82b1-2acce2ac1908,Cepphus grylle,"(Linnaeus, 1758)",1979-08-04T14:30:00,-57.1,54.5,Canadian Wildlife Service,280,280_117572,urn:lsid:marinespecies.org:taxname:137130,,FALSE,,,,137130
28993bd1-5444-4ef0-a5d0-b306cd540ba4,Cepphus grylle,"(Linnaeus, 1758)",6/17/08 00:00,-60.55993,47.02164,Canadian Wildlife Service - Atlantic Region (CWS - Atlantic),,NS003466_BLGU_11821_2008-06-17,urn:lsid:marinespecies.org:taxname:137130,,FALSE,,,,137130
289def7b-7cfa-470f-8f74-4480bd1a3da6,Cepphus grylle,"(Linnaeus, 1758)",NA,-66.23333,44,NA,,110591,137130,,FALSE,,,,137130
28a84b73-424a-4d26-9240-f58848cc029b,Cepphus grylle,,,-61.73,47.32,"Canadian Wildlife Service-Atlantic, Environment Canada",,-1933920140_-1261857440_639306204,urn:lsid:marinespecies.org:taxname:137130,,FALSE,,,,137130
28b2d48b-8019-4b22-98f4-513f1bcd5e9c,Cepphus grylle,"(Linnaeus, 1758)",1979-07-17T07:50:00,-55.2833,52.4667,Canadian Wildlife Service,280,280_116199,urn:lsid:marinespecies.org:taxname:137130,,FALSE,,,,137130
29190c47-5be5-472f-a1cc-807a18e433f6,Cepphus grylle,"(Linnaeus, 1758)",05/06/1999,-68.5,53,ICES,DOME-Biota,12135592,urn:lsid:marinespecies.org:taxname:137130,,FALSE,,,,137130
292c9569-6d0c-4c44-9554-397218c5955b,Cepphus grylle,"(Linnaeus, 1758)",1980-04-28T07:50:00,-52.7667,47.2,Canadian Wildlife Service,280,280_125466,urn:lsid:marinespecies.org:taxname:137130,,FALSE,,,,137130
296b02f7-a081-4194-9f05-f47461e6b4db,Cepphus grylle,,,-65.51,47.96,"Canadian Wildlife Service-Atlantic, Environment Canada",,1421648014_1440169776_-250239258,urn:lsid:marinespecies.org:taxname:137130,,FALSE,,,,137130
296bfa2d-59b1-448c-af94-b4ca11f01d15,Cepphus grylle,"(Linnaeus, 1758)",,-66.71666718,44.96667099,ACCD,EOR,31401,urn:lsid:marinespecies.org:taxname:137130,,FALSE,,,,137130
297224ae-1dec-4015-86c3-a6e3a0cb1afc,Cepphus grylle,,,-53.1,48.71,"Canadian Wildlife Service-Atlantic, Environment Canada",,1278617075_-1211790725_-225562266,urn:lsid:marinespecies.org:taxname:137130,,FALSE,,,,137130
297975ec-f133-4530-9427-33ce1ff79122,Cepphus grylle,"(Linnaeus, 1758)",01/01/1974 00:00,-53.94387,47.48656,Canadian Wildlife Service - Atlantic Region (CWS - Atlantic),,NF000342_BLGU_931_1974-01-01,urn:lsid:marinespecies.org:taxname:137130,,FALSE,,,,137130
2979dfa7-997d-4614-9370-c7c3b511f81d,Cepphus grylle,"(Linnaeus, 1758)",1981-07-02T12:00:00Z,-66.00653076,43.41556931,ACCD,EOR,31808,urn:lsid:marinespecies.org:taxname:137130,,FALSE,,,,137130
2992e5c0-2efa-49bb-b0b1-ee8e3e072d9b,Cepphus grylle,"(Linnaeus, 1758)",4/22/16 00:00,-65.86615,43.6772,Canadian Wildlife Service - Atlantic Region (CWS - Atlantic),,NS001423_BLGU_13350_2016-04-22_18:51,urn:lsid:marinespecies.org:taxname:137130,,FALSE,,,,137130
29d059ea-0238-4d98-832a-0a9f37e06c3f,Cepphus grylle,"(Linnaeus, 1758)",8/14/78 00:00,-60.2489,55.40001,Canadian Wildlife Service - Atlantic Region (CWS - Atlantic),,NF000853_BLGU_1956_1978-08-14,urn:lsid:marinespecies.org:taxname:137130,,FALSE,,,,137130
29d8a825-44f4-46b1-9736-f8a817da273e,Cepphus grylle,,,-59.27,48.46,"Canadian Wildlife Service-Atlantic, Environment Canada",,896836590_-1809521076_-1924625539,urn:lsid:marinespecies.org:taxname:137130,,FALSE,,,,137130
29e3232d-d56d-49bb-be9d-1c0bee14af13,Cepphus grylle,"(Linnaeus, 1758)",1979-08-27T10:00:00,-61.8667,57.7333,Canadian Wildlife Service,280,280_120887,urn:lsid:marinespecies.org:taxname:137130,,FALSE,,,,137130
2a3edfd0-85c3-4af5-a4ad-ca58010dd69a,Cepphus grylle,,,-61.34,56.53,"Canadian Wildlife Service-Atlantic, Environment Canada",,1380544464_1834448233_1750301878,urn:lsid:marinespecies.org:taxname:137130,,FALSE,,,,137130
2ac0e193-d254-4eb5-80da-1f87ce8718b0,Cepphus grylle,"(Linnaeus, 1758)",1980-04-28T07:50:00,-52.7667,47.2,Canadian Wildlife Service,280,280_125467,urn:lsid:marinespecies.org:taxname:137130,,FALSE,,,,137130
2ac7b590-c0af-46a3-b6a6-88fdafbd49cb,Cepphus grylle,"(Linnaeus, 1758)",1979-09-01T08:40:00,-61.2667,56.1667,Canadian Wildlife Service,280,280_121152,urn:lsid:marinespecies.org:taxname:137130,,FALSE,,,,137130
2adfaa51-cd62-424b-9525-e8797f8eef6d,Cepphus grylle,"(Linnaeus, 1758)",08/06/2006 08:58,-67.9993,44.3434,NA,,6595,137130,,FALSE,,,,137130
2aebe9d0-de78-4219-899c-f2ae4ecc1259,Cepphus grylle,,,-65.13,48.07,"Canadian Wildlife Service-Atlantic, Environment Canada",,-1636689528_558143296_-2022214363,urn:lsid:marinespecies.org:taxname:137130,,FALSE,,,,137130
2b13a0b2-4045-4742-a1ec-4d88533335bf,Cepphus grylle,"(Linnaeus, 1758)",01/01/1985 00:00,-53.50888,46.62989,Canadian Wildlife Service - Atlantic Region (CWS - Atlantic),,NF000177_BLGU_293_1985-01-01,urn:lsid:marinespecies.org:taxname:137130,,FALSE,,,,137130
2b82915d-698b-4b0e-87fb-cf091c9b2234,Cepphus grylle,"(Linnaeus, 1758)",6/15/02 00:00,-56.37525,46.79818,Canadian Wildlife Service - Atlantic Region (CWS - Atlantic),,NF002972_BLGU_6330_2002-06-15,urn:lsid:marinespecies.org:taxname:137130,,FALSE,,,,137130
2b9bcb9c-7ecd-439b-b976-7e4cabc0b148,Cepphus grylle,"(Linnaeus, 1758)",1987-07-30T10:00:00,-56.6,53.8333,Canadian Wildlife Service,280,280_202043,urn:lsid:marinespecies.org:taxname:137130,,FALSE,,,,137130
2baeb41a-19d1-47b9-98c1-9ee987855738,Cepphus grylle,"(Linnaeus, 1758)",1973-03-08T08:40:00,-59.7667,48.4,Canadian Wildlife Service,280,280_62825,urn:lsid:marinespecies.org:taxname:137130,,FALSE,,,,137130
2bbec37f-5328-4ccf-b254-75b4f176e688,Cepphus grylle,"(Linnaeus, 1758)",2001-07-02T12:00:00Z,-66.84181213,44.61022186,ACCD,EOR,31784,urn:lsid:marinespecies.org:taxname:137130,,FALSE,,,,137130
2bcf0a7a-4866-47f5-90cb-8b1f3aaa2ce5,Cepphus grylle,"(Linnaeus, 1758)",1987-07-31T07:49:00,-55,54.1667,Canadian Wildlife Service,280,280_202185,urn:lsid:marinespecies.org:taxname:137130,,FALSE,,,,137130
2bf056b5-5338-4bf4-bc2f-f5848844fa3b,Cepphus grylle,"(Linnaeus, 1758)",7/29/05 08:54,-68.0753,44.3329,NA,,441356,137130,,FALSE,,,,137130
2bf4d2b8-53e4-4394-b5af-e987fa27e659,Cepphus grylle,"(Linnaeus, 1758)",8/18/78 00:00,-58.74885,54.99999,Canadian Wildlife Service - Atlantic Region (CWS - Atlantic),,NF000782_BLGU_1875_1978-08-18,urn:lsid:marinespecies.org:taxname:137130,,FALSE,,,,137130
2bf8e272-e68e-4301-a730-4417299b93cb,Cepphus grylle,"(Linnaeus, 1758)",05/07/2014 00:00,-65.86615,43.6772,Canadian Wildlife Service - Atlantic Region (CWS - Atlantic),,NS001423_BLGU_12487_2014-05-07,urn:lsid:marinespecies.org:taxname:137130,,FALSE,,,,137130
2c6ffd74-7711-416d-8fea-4a76aa3253d4,Cepphus grylle,"(Linnaeus, 1758)",07/02/2005 17:06,-68.1362,44.3648,NA,,439884,137130,,FALSE,,,,137130
2c750251-e47b-473c-83f5-970f4a091b87,Cepphus grylle,,,-59.68,46.13,"Canadian Wildlife Service-Atlantic, Environment Canada",,-1666739583_982306580_768368261,urn:lsid:marinespecies.org:taxname:137130,,FALSE,,,,137130
2ca85fbf-79a2-475a-bc3d-33410c043751,Cepphus grylle,"(Linnaeus, 1758)",1990-07-23T12:00:00Z,-63.31396866,46.45769119,ACCD,EOR,31474,urn:lsid:marinespecies.org:taxname:137130,,FALSE,,,,137130
2cd2e725-c682-4864-9dfb-6a9fc6598be4,Cepphus grylle,"(Linnaeus, 1758)",1978-06-27T14:00:00,-55.8,52.8333,Canadian Wildlife Service,280,280_102036,urn:lsid:marinespecies.org:taxname:137130,,FALSE,,,,137130
2d2eb585-0d62-414d-89cd-83e4b0151146,Cepphus grylle,,,-59.42,46.05,"Canadian Wildlife Service-Atlantic, Environment Canada",,1404141821_-1454793848_-308696107,urn:lsid:marinespecies.org:taxname:137130,,FALSE,,,,137130
2d34e448-34fb-4f95-9ff1-990923287aa0,Cepphus grylle,,,-64.98,48.14,"Canadian Wildlife Service-Atlantic, Environment Canada",,-1636689528_-2019270676_209492861,urn:lsid:marinespecies.org:taxname:137130,,FALSE,,,,137130
2d378350-df89-44f2-b1c3-b240635e7db2,Cepphus grylle,"(Linnaeus, 1758)",08/06/2006 09:29,-67.8247,44.3611,NA,,6596,137130,,FALSE,,,,137130
2d3e1dde-9bf5-4b61-9b6e-8e21b0263983,Cepphus grylle,"(Linnaeus, 1758)",7/18/87 00:00,-66.76915,44.79494,Canadian Wildlife Service - Atlantic Region (CWS - Atlantic),,NB000110_BLGU_5025_1987-07-18,urn:lsid:marinespecies.org:taxname:137130,,FALSE,,,,137130
2d495ab1-59d0-41ea-af2f-8818ffc95c3e,Cepphus grylle,,,-66.25,49.23,"Canadian Wildlife Service-Atlantic, Environment Canada",,689065724_-1274126350_328031414,urn:lsid:marinespecies.org:taxname:137130,,FALSE,,,,137130
2d837c69-51cc-48ba-a428-5313d13a3726,Cepphus grylle,,,-52.91,47,"Canadian Wildlife Service-Atlantic, Environment Canada",,1201195787_1725118178_129971388,urn:lsid:marinespecies.org:taxname:137130,,FALSE,,,,137130
2d9b656c-ef21-47c6-b0fe-478abe44b6da,Cepphus grylle,"(Linnaeus, 1758)",1978-06-29T13:30:00,-57.6667,54.3667,Canadian Wildlife Service,280,280_102192,urn:lsid:marinespecies.org:taxname:137130,,FALSE,,,,137130
2dc1d17c-d18b-4ca5-98d8-398346f475cf,Cepphus grylle,"(Linnaeus, 1758)",1973-02-20T09:45:00,-61.05,45.4,Canadian Wildlife Service,280,280_62596,urn:lsid:marinespecies.org:taxname:137130,,FALSE,,,,137130
2e5854a2-52f4-4536-ae1f-720791316225,Cepphus grylle,,,-54.69,51.73,"Canadian Wildlife Service-Atlantic, Environment Canada",,1278617075_-2107398137_-1824861380,urn:lsid:marinespecies.org:taxname:137130,,FALSE,,,,137130
2e6fa476-084b-4502-9be9-a47fd6c82359,Cepphus grylle,"(Linnaeus, 1758)",1979-08-11T14:30:00,-62.0333,57.45,Canadian Wildlife Service,280,280_118390,urn:lsid:marinespecies.org:taxname:137130,,FALSE,,,,137130
2ea5c6ed-afe3-4f19-a078-fccc45628bbd,Cepphus grylle,"(Linnaeus, 1758)",1979-06-21T12:00:00Z,-65.24961853,47.7999897,ACCD,EOR,31651,urn:lsid:marinespecies.org:taxname:137130,,FALSE,,,,137130
2ebfc4ab-b928-4128-ac6a-361a611360be,Cepphus grylle,,,-59.71,46.09,"Canadian Wildlife Service-Atlantic, Environment Canada",,-1666739583_589740207_726616491,urn:lsid:marinespecies.org:taxname:137130,,FALSE,,,,137130
2ed6d082-3c87-409c-af46-ab5734a95d19,Cepphus grylle,,,-64.4,48.84,"Canadian Wildlife Service-Atlantic, Environment Canada",,58439636_-649322271_-151546070,urn:lsid:marinespecies.org:taxname:137130,,FALSE,,,,137130
2f0d6678-0537-4ecd-992b-2a36a6d83db8,Cepphus grylle,"(Linnaeus, 1758)",01/01/1983 00:00,-56.23729,46.84991,Canadian Wildlife Service - Atlantic Region (CWS - Atlantic),,NF000202_BLGU_474_1983-01-01,urn:lsid:marinespecies.org:taxname:137130,,FALSE,,,,137130
2f1080ee-c80d-4e64-bce2-3ddbc8b18d85,Cepphus grylle,"(Linnaeus, 1758)",2017-03-21T09:37:53,-71.0659,40.3447,NORMANDEAU,1817,1817_45622,urn:lsid:marinespecies.org:taxname:137130,,FALSE,,,,137130
2f1b2b40-8a16-45d4-bb87-7f9d9da16847,Cepphus grylle,,,-53.33,46.61,"Canadian Wildlife Service-Atlantic, Environment Canada",,1201195787_953810740_-2022480094,urn:lsid:marinespecies.org:taxname:137130,,FALSE,,,,137130
2f808aec-1bc3-4620-ac7d-76b0376bddc1,Cepphus grylle,"(Linnaeus, 1758)",1971-07-02T12:00:00Z,-59.81575012,46.18328094,ACCD,EOR,31748,urn:lsid:marinespecies.org:taxname:137130,,FALSE,,,,137130
2f8baac8-ca10-4595-8b52-ec561816fed8,Cepphus grylle,"(Linnaeus, 1758)",1979-08-11T14:30:00,-61.7833,57.4,Canadian Wildlife Service,280,280_118364,urn:lsid:marinespecies.org:taxname:137130,,FALSE,,,,137130
2fab4914-8aad-4c14-91b0-c88f2f0f88de,Cepphus grylle,"(Linnaeus, 1758)",8/29/87 12:00,-66.89441681,44.60754013,ACCD,EOR,31430,urn:lsid:marinespecies.org:taxname:137130,,FALSE,,,,137130
2fd2acf0-3fa9-46a7-8416-743dcd1361ba,Cepphus grylle,"(Linnaeus, 1758)",7/25/16 00:00,-65.03027,43.68431,Canadian Wildlife Service - Atlantic Region (CWS - Atlantic),,NS001323_BLGU_13398_2016-07-25,urn:lsid:marinespecies.org:taxname:137130,,FALSE,,,,137130
2fe5f275-39b7-4d04-833f-3887abff436e,Cepphus grylle,"(Linnaeus, 1758)",01/01/1975 00:00,-54.7496,47.32398,Canadian Wildlife Service - Atlantic Region (CWS - Atlantic),,NF000306_BLGU_878_1975-01-01,urn:lsid:marinespecies.org:taxname:137130,,FALSE,,,,137130
2fed7bad-9a81-4a7c-9d04-0cdf2dc2239c,Cepphus grylle,"(Linnaeus, 1758)",7/26/05 13:44,-68.2232,44.1787,NA,,441252,137130,,FALSE,,,,137130
3033c3e2-36df-44d2-830f-699c37e84efb,Cepphus grylle,,,-68.3,44.11,"Canadian Wildlife Service-Atlantic, Environment Canada",,1272746530_521366742_1907516831,urn:lsid:marinespecies.org:taxname:137130,,FALSE,,,,137130
303e7de3-6dfe-4b43-9f38-660aea89ee95,Cepphus grylle,"(Linnaeus, 1758)",7/23/05 12:12,-68.1813,44.1717,NA,,440985,137130,,FALSE,,,,137130
3041ea9a-a8bf-4a1c-bded-88240a05c592,Cepphus grylle,,,-60.67,55.91,"Canadian Wildlife Service-Atlantic, Environment Canada",,1380544464_100539866_-1026846086,urn:lsid:marinespecies.org:taxname:137130,,FALSE,,,,137130
3053047c-fb50-4245-b140-750afe3e9530,Cepphus grylle,"(Linnaeus, 1758)",1981-02-15T11:00:00,-57.5,47.5,Canadian Wildlife Service,280,280_138780,urn:lsid:marinespecies.org:taxname:137130,,FALSE,,,,137130
30633dfe-5793-4157-b2dd-183619ad1f3f,Cepphus grylle,"(Linnaeus, 1758)",7/28/16 00:00,-66.06152,43.641,Canadian Wildlife Service - Atlantic Region (CWS - Atlantic),,NS002269_BLGU_13367_2016-07-28,urn:lsid:marinespecies.org:taxname:137130,,FALSE,,,,137130
30dab340-c466-481f-af3a-53914d658f17,Cepphus grylle,"(Linnaeus, 1758)",7/22/08 00:00,-66.90691,44.60405,Canadian Wildlife Service - Atlantic Region (CWS - Atlantic),,NB003368_BLGU_11950_2008-07-22,urn:lsid:marinespecies.org:taxname:137130,,FALSE,,,,137130
30f2c54c-7968-4dc4-a8eb-3d15961879e7,Cepphus grylle,,,-65.32,43.72,"Canadian Wildlife Service-Atlantic, Environment Canada",,1361835644_-1475097759_1897116396,urn:lsid:marinespecies.org:taxname:137130,,FALSE,,,,137130
30fdf0ec-0e06-4b2e-81e0-399022a910bd,Cepphus grylle,"(Linnaeus, 1758)",7/31/90 12:00,-61.04888916,46.61063004,ACCD,EOR,31491,urn:lsid:marinespecies.org:taxname:137130,,FALSE,,,,137130
31180fd3-f60d-4177-82eb-7422a4cc1791,Cepphus grylle,"(Linnaeus, 1758)",6/17/08 00:00,-60.53936,47.02496,Canadian Wildlife Service - Atlantic Region (CWS - Atlantic),,NS003467_BLGU_11822_2008-06-17,urn:lsid:marinespecies.org:taxname:137130,,FALSE,,,,137130
31422875-d541-4e2c-b871-c2f9e3213beb,Cepphus grylle,"(Linnaeus, 1758)",NA,-69.5794,43.7745,USFWS,,670016,137130,,FALSE,,,,137130
31749737-ccee-42a0-af4d-69139485af19,Cepphus grylle,,,-69.24,48.22,"Canadian Wildlife Service-Atlantic, Environment Canada",,1331997355_496933082_1721599141,urn:lsid:marinespecies.org:taxname:137130,,FALSE,,,,137130
318d9028-352e-4bc3-a74d-ae6eca3a661a,Cepphus grylle,"(Linnaeus, 1758)",NA,-67.5644,44.517,"BOEM, USFWS, NOAA, NAVY",,728382,137130,,FALSE,,,,137130
31a912fc-9e41-4d1a-9093-6b98fe3248f1,Cepphus grylle,,,-65.33,43.69,"Canadian Wildlife Service-Atlantic, Environment Canada",,1393959998_-959012793_-639386675,urn:lsid:marinespecies.org:taxname:137130,,FALSE,,,,137130
31b0aeff-6363-4f89-9312-ee0887bb22c6,Cepphus grylle,,,-61.65,50.08,"Canadian Wildlife Service-Atlantic, Environment Canada",,-1636689528_-1940974357_-1462336802,urn:lsid:marinespecies.org:taxname:137130,,FALSE,,,,137130
32292012-8aa5-4c2a-9789-97f883ccad8e,Cepphus grylle,"(Linnaeus, 1758)",1975-07-31T10:30:00,-80.55,54.7833,Canadian Wildlife Service,280,280_69687,urn:lsid:marinespecies.org:taxname:137130,,FALSE,,,,137130
322db5e2-10de-4bc6-b071-69ea073d9d79,Cepphus grylle,,,-61.8,47.34,"Canadian Wildlife Service-Atlantic, Environment Canada",,109413192_968247404_-1323536182,urn:lsid:marinespecies.org:taxname:137130,,FALSE,,,,137130
32585d23-3a57-4688-bc5d-c52982bb4a2c,Cepphus grylle,"(Linnaeus, 1758)",NA,-69.8008,41.9332,USFWS,,698678,137130,,FALSE,,,,137130
328f78ce-d2d2-4a06-aa0b-bbc58315b002,Cepphus grylle,"(Linnaeus, 1758)",1986-06-27T12:00:00Z,-61.00395966,46.63269043,ACCD,EOR,31492,urn:lsid:marinespecies.org:taxname:137130,,FALSE,,,,137130
329d7d99-623e-4723-a6c0-426a3d7cbea8,Cepphus grylle,"(Linnaeus, 1758)",05/01/2005 00:00,-61.5426,45.10182,Canadian Wildlife Service - Atlantic Region (CWS - Atlantic),,NS002232_BLGU_9911_2005-05-01,urn:lsid:marinespecies.org:taxname:137130,,FALSE,,,,137130
32af31a7-85ea-4dc4-beff-8a7b2740d3dd,Cepphus grylle,"(Linnaeus, 1758)",7/24/78 00:00,-57.83217,54.29997,Canadian Wildlife Service - Atlantic Region (CWS - Atlantic),,NF000732_BLGU_1804_1978-07-24,urn:lsid:marinespecies.org:taxname:137130,,FALSE,,,,137130
32d8dade-a446-4c81-a2bb-0cc057c99464,Cepphus grylle,"(Linnaeus, 1758)",07/02/2005 13:31,-68.1872,44.3158,NA,,440055,137130,,FALSE,,,,137130
32e149e1-b045-417d-83b3-d05ae2d71d25,Cepphus grylle,"(Linnaeus, 1758)",8/18/90 12:00,-66.71109009,44.70877075,ACCD,EOR,31447,urn:lsid:marinespecies.org:taxname:137130,,FALSE,,,,137130
32ea3c27-1f8f-4ee5-8383-1dac2ac42b7b,Cepphus grylle,"(Linnaeus, 1758)",01/01/1985 00:00,-52.671,47.534,Canadian Wildlife Service - Atlantic Region (CWS - Atlantic),,NF000351_BLGU_953_1985-01-01,urn:lsid:marinespecies.org:taxname:137130,,FALSE,,,,137130
33005388-cc1a-421b-a7c0-7928311b4c1a,Cepphus grylle,"(Linnaeus, 1758)",07/12/2009 00:00,-60.39474,46.36617,Canadian Wildlife Service - Atlantic Region (CWS - Atlantic),,NS001108_BLGU_11817_2009-07-12,urn:lsid:marinespecies.org:taxname:137130,,FALSE,,,,137130
33aa2def-2628-4f50-af32-d2472ca15a4f,Cepphus grylle,"(Linnaeus, 1758)",05/06/1999,-68.5,53,ICES,DOME-Biota,12135605,urn:lsid:marinespecies.org:taxname:137130,,FALSE,,,,137130
341b7ef8-f7bc-4cc9-98e2-66b4cd139817,Cepphus grylle,"(Linnaeus, 1758)",1972-06-13T13:35:00,-63.6667,48.9167,Canadian Wildlife Service,280,280_56404,urn:lsid:marinespecies.org:taxname:137130,,FALSE,,,,137130
34b952d7-df0f-44b3-9588-4903794537b2,Cepphus grylle,"(Linnaeus, 1758)",1979-08-22T11:15:00,-62.5333,58.4333,Canadian Wildlife Service,280,280_120269,urn:lsid:marinespecies.org:taxname:137130,,FALSE,,,,137130
35145c2c-629c-4b76-9dcb-9dc8e1a5ef97,Cepphus grylle,"(Linnaeus, 1758)",05/06/2000,-68.5,53,ICES,DOME-Biota,12135344,urn:lsid:marinespecies.org:taxname:137130,,FALSE,,,,137130
352cb124-29b3-458d-ab08-66c740668ab9,Cepphus grylle,"(Linnaeus, 1758)",7/27/16 00:00,-65.98472,43.4647,Canadian Wildlife Service - Atlantic Region (CWS - Atlantic),,NS002604_BLGU_13357_2016-07-27_12:25,urn:lsid:marinespecies.org:taxname:137130,,FALSE,,,,137130
353ce36e-445a-47f8-abee-f0159dcddee5,Cepphus grylle,"(Linnaeus, 1758)",1990-08-16T12:00:00Z,-60.46910858,46.89649963,ACCD,EOR,31495,urn:lsid:marinespecies.org:taxname:137130,,FALSE,,,,137130
3545174c-5cea-4346-9a73-f759b1415d0c,Cepphus grylle,"(Linnaeus, 1758)",1979-09-01T09:10:00,-61.25,56.0667,Canadian Wildlife Service,280,280_121163,urn:lsid:marinespecies.org:taxname:137130,,FALSE,,,,137130
35649b9a-200d-4dbb-9573-e65d670d60d0,Cepphus grylle,"(Linnaeus, 1758)",1992-07-08T12:00:00Z,-66.75013733,44.6669693,ACCD,EOR,31397,urn:lsid:marinespecies.org:taxname:137130,,FALSE,,,,137130
35b39feb-42a2-4d89-8f30-bd55101b60a3,Cepphus grylle,,,-64.85,49.23,"Canadian Wildlife Service-Atlantic, Environment Canada",,-801551520_1442294784_-470399035,urn:lsid:marinespecies.org:taxname:137130,,FALSE,,,,137130
35beee72-38a4-4774-8a21-dafbd8bc9a5f,Cepphus grylle,"(Linnaeus, 1758)",7/18/89 12:00,-66.13629913,47.98468018,ACCD,EOR,31450,urn:lsid:marinespecies.org:taxname:137130,,FALSE,,,,137130
35da945f-2b40-455e-a258-f7efaefb5831,Cepphus grylle,"(Linnaeus, 1758)",07/06/1990 12:00,-65.18267822,47.81335068,ACCD,EOR,31464,urn:lsid:marinespecies.org:taxname:137130,,FALSE,,,,137130
3658d47d-4e90-4f7c-ac13-91da05a6211d,Cepphus grylle,,,-58.77,49.42,"Canadian Wildlife Service-Atlantic, Environment Canada",,1421648014_1079726864_-1625719926,urn:lsid:marinespecies.org:taxname:137130,,FALSE,,,,137130
367b329b-f6d6-45f2-ab8d-56a1d131b669,Cepphus grylle,,,-54.39,49.5,"Canadian Wildlife Service-Atlantic, Environment Canada",,1436357738_130181201_1176837182,urn:lsid:marinespecies.org:taxname:137130,,FALSE,,,,137130
369f460d-3b97-4d3b-9e91-969faad75cff,Cepphus grylle,,,-65.47,47.96,"Canadian Wildlife Service-Atlantic, Environment Canada",,58439636_733274139_-1145220483,urn:lsid:marinespecies.org:taxname:137130,,FALSE,,,,137130
36c405f5-65a9-41d8-b3ca-c5348bde10fa,Cepphus grylle,,,-61.55,45.09,"Canadian Wildlife Service-Atlantic, Environment Canada",,626889947_-1869966047_1301798094,urn:lsid:marinespecies.org:taxname:137130,,FALSE,,,,137130
36c9e4ac-f2e4-4962-a3e7-36fc39256a21,Cepphus grylle,"(Linnaeus, 1758)",1970-05-09T08:20:00,-52.4333,52.5167,Canadian Wildlife Service,280,280_20875,urn:lsid:marinespecies.org:taxname:137130,,FALSE,,,,137130
36e7fcc5-5cb7-430c-9e1b-1920f8238270,Cepphus grylle,"(Linnaeus, 1758)",1988-07-05T12:00:00Z,-66.02554321,43.65013886,ACCD,EOR,31456,urn:lsid:marinespecies.org:taxname:137130,,FALSE,,,,137130
370d5839-8eca-4b29-acac-0b10e601c9a3,Cepphus grylle,"(Linnaeus, 1758)",8/16/07 00:00,-66.77646,44.79926,Canadian Wildlife Service - Atlantic Region (CWS - Atlantic),,NB002613_BLGU_11964_2007-08-16,urn:lsid:marinespecies.org:taxname:137130,,FALSE,,,,137130
3730f775-3f11-468d-afe0-a038cb18d63e,Cepphus grylle,"(Linnaeus, 1758)",07/02/1971 12:00,-62.37918854,44.82164001,ACCD,EOR,31770,urn:lsid:marinespecies.org:taxname:137130,,FALSE,,,,137130
37d2263a-d52a-4df7-a9eb-db809894130f,Cepphus grylle,,,-64.42,48.84,"Canadian Wildlife Service-Atlantic, Environment Canada",,58439636_2016398041_-1312006319,urn:lsid:marinespecies.org:taxname:137130,,FALSE,,,,137130
37f25ae2-c6b9-4ad7-921a-bc8f16d51653,Cepphus grylle,"(Linnaeus, 1758)",1973-07-02T12:00:00Z,-66.76629639,44.58356094,ACCD,EOR,31418,urn:lsid:marinespecies.org:taxname:137130,,FALSE,,,,137130
37f74dbd-fd20-42f4-a624-6821346ee2d1,Cepphus grylle,"(Linnaeus, 1758)",01/01/1985 00:00,-56.23729,46.84991,Canadian Wildlife Service - Atlantic Region (CWS - Atlantic),,NF000202_BLGU_476_1985-01-01,urn:lsid:marinespecies.org:taxname:137130,,FALSE,,,,137130
3807830f-e341-4a4c-8fb7-e7588fa51756,Cepphus grylle,"(Linnaeus, 1758)",1978-06-29T15:10:00,-58.1667,54.25,Canadian Wildlife Service,280,280_102215,urn:lsid:marinespecies.org:taxname:137130,,FALSE,,,,137130
3812b4f1-f84e-4553-b2ba-505cf12cbee5,Cepphus grylle,"(Linnaeus, 1758)",1973-03-02T15:20:00,-61.7,49.8833,Canadian Wildlife Service,280,280_62777,urn:lsid:marinespecies.org:taxname:137130,,FALSE,,,,137130
3818a418-8639-4343-82ab-155f8ca80857,Cepphus grylle,"(Linnaeus, 1758)",1969-06-17T10:00:00,-53.1833,49.7333,Canadian Wildlife Service,280,280_9485,urn:lsid:marinespecies.org:taxname:137130,,FALSE,,,,137130
381a3544-38db-46ca-8d56-e11c16740c2b,Cepphus grylle,"(Linnaeus, 1758)",01/01/1971 00:00,-59.96385,45.89968,Canadian Wildlife Service - Atlantic Region (CWS - Atlantic),,NS001326_BLGU_3097_1971-01-01,urn:lsid:marinespecies.org:taxname:137130,,FALSE,,,,137130
387a2641-e522-426b-ba5e-5e74a9be7db1,Cepphus grylle,"(Linnaeus, 1758)",05/06/1999,-68.5,53,ICES,DOME-Biota,12135603,urn:lsid:marinespecies.org:taxname:137130,,FALSE,,,,137130
389c50d2-a64a-4ff1-a41e-f98baa675675,Cepphus grylle,"(Linnaeus, 1758)",1973-02-28T11:55:00,-68,49,Canadian Wildlife Service,280,280_62754,urn:lsid:marinespecies.org:taxname:137130,,FALSE,,,,137130
391eb637-2f7d-4a95-82f6-59d0fc86236a,Cepphus grylle,,,-61.84,47.36,"Canadian Wildlife Service-Atlantic, Environment Canada",,-1933920140_-77378327_-1121885494,urn:lsid:marinespecies.org:taxname:137130,,FALSE,,,,137130
392f94f0-9618-4c61-9889-0d6f812a5420,Cepphus grylle,"(Linnaeus, 1758)",08/06/2006 08:52,-68.0571,44.3279,NA,,6590,137130,,FALSE,,,,137130
39698eb9-e918-4b0b-bf42-ba75f4fd84b3,Cepphus grylle,"(Linnaeus, 1758)",06/01/2006 00:00,-66.3503,48.06065,Canadian Wildlife Service - Atlantic Region (CWS - Atlantic),,NB003365_BLGU_11943_2006-06-01,urn:lsid:marinespecies.org:taxname:137130,,FALSE,,,,137130
398f2d46-abbb-4ad9-9be2-31628497c96d,Cepphus grylle,"(Linnaeus, 1758)",08/07/1978 00:00,-61.04889,56.7667,Canadian Wildlife Service - Atlantic Region (CWS - Atlantic),,NF001017_BLGU_2169_1978-08-07,urn:lsid:marinespecies.org:taxname:137130,,FALSE,,,,137130
399f9669-3a56-49c6-acdb-8b400adc9736,Cepphus grylle,,,-53.63,48.17,"Canadian Wildlife Service-Atlantic, Environment Canada",,1218969274_1639730711_-869513837,urn:lsid:marinespecies.org:taxname:137130,,FALSE,,,,137130
3a3e03ca-dafa-4a1a-b289-c774e53c904e,Cepphus grylle,"(Linnaeus, 1758)",01/01/1975 00:00,-54.77182,47.2424,Canadian Wildlife Service - Atlantic Region (CWS - Atlantic),,NF000292_BLGU_810_1975-01-01,urn:lsid:marinespecies.org:taxname:137130,,FALSE,,,,137130
3aa7aa71-8186-4fc6-92a3-f509bf281401,Cepphus grylle,"(Linnaeus, 1758)",6/21/01 00:00,-55.6949,49.6833,Canadian Wildlife Service - Atlantic Region (CWS - Atlantic),,NF000587_BLGU_5846_2001-06-21,urn:lsid:marinespecies.org:taxname:137130,,FALSE,,,,137130
3aae5620-1160-42ff-90e6-f2b8f674c181,Cepphus grylle,,,-52.86,46.37,"Canadian Wildlife Service-Atlantic, Environment Canada",,1181145870_642576669_-644789070,urn:lsid:marinespecies.org:taxname:137130,,FALSE,,,,137130
3abe6ab6-e285-40c7-a1ab-e1d5ffbeacb5,Cepphus grylle,"(Linnaeus, 1758)",1971-11-05T16:35:00,-55.7333,52.75,Canadian Wildlife Service,280,280_53957,urn:lsid:marinespecies.org:taxname:137130,,FALSE,,,,137130
3aeea14b-7798-439a-85e6-fafa5350ef49,Cepphus grylle,"(Linnaeus, 1758)",NA,-68.5479,44.108,USFWS,,670225,137130,,FALSE,,,,137130
3b696fca-e849-4ae6-a0a2-f251c6763301,Cepphus grylle,,,-64.41,48.84,"Canadian Wildlife Service-Atlantic, Environment Canada",,58439636_751511805_1680275356,urn:lsid:marinespecies.org:taxname:137130,,FALSE,,,,137130
3b737bd5-dae7-43b8-83cd-76e58c883336,Cepphus grylle,"(Linnaeus, 1758)",07/05/2005 00:00,-52.6776,47.5408,Canadian Wildlife Service - Atlantic Region (CWS - Atlantic),,NF000355_BLGU_12520_2005-07-05,urn:lsid:marinespecies.org:taxname:137130,,FALSE,,,,137130
3b900d5f-7472-4a61-8cd7-b686b116ef95,Cepphus grylle,"(Linnaeus, 1758)",1979-08-27T09:00:00,-61.8667,57.85,Canadian Wildlife Service,280,280_120870,urn:lsid:marinespecies.org:taxname:137130,,FALSE,,,,137130
3bb3138e-b86c-4e65-b491-ae2ecb6a37c9,Cepphus grylle,"(Linnaeus, 1758)",NA,-67.43333,44.51667,NA,,134443,137130,,FALSE,,,,137130
3bf0f93b-08e2-42e1-acb1-206c28fb8d4e,Cepphus grylle,"(Linnaeus, 1758)",1978-08-02T08:30:00,-56.8167,53.7833,Canadian Wildlife Service,280,280_104957,urn:lsid:marinespecies.org:taxname:137130,,FALSE,,,,137130
3bf144e6-255a-41eb-b180-3fa18a3e338e,Cepphus grylle,"(Linnaeus, 1758)",07/12/2016 00:00,-66.00485,43.50834,Canadian Wildlife Service - Atlantic Region (CWS - Atlantic),,NS001164_BLGU_13355_2016-07-12_15:06,urn:lsid:marinespecies.org:taxname:137130,,FALSE,,,,137130
3c25352e-c171-4aa1-a448-cb752df694ee,Cepphus grylle,"(Linnaeus, 1758)",8/14/78 00:00,-60.03222,55.50001,Canadian Wildlife Service - Atlantic Region (CWS - Atlantic),,NF000871_BLGU_1973_1978-08-14,urn:lsid:marinespecies.org:taxname:137130,,FALSE,,,,137130
3cc4719b-cedc-45f0-902d-97398d97529b,Cepphus grylle,"(Linnaeus, 1758)",1990-07-21T12:00:00Z,-60.58391953,46.95695114,ACCD,EOR,31496,urn:lsid:marinespecies.org:taxname:137130,,FALSE,,,,137130
3cc47c32-d07c-4033-b932-6a1380e783af,Cepphus grylle,"(Linnaeus, 1758)",8/14/78 00:00,-58.92141,55.16293,Canadian Wildlife Service - Atlantic Region (CWS - Atlantic),,NF000800_BLGU_1893_1978-08-14,urn:lsid:marinespecies.org:taxname:137130,,FALSE,,,,137130
3cf0b57b-ea37-4b87-ad29-476890219a50,Cepphus grylle,"(Linnaeus, 1758)",2017-03-21T09:37:53,-71.0659,40.3447,NORMANDEAU,1817,1817_45621,urn:lsid:marinespecies.org:taxname:137130,,FALSE,,,,137130
3d32ae51-59cc-42f7-a28e-1748f5d24831,Cepphus grylle,"(Linnaeus, 1758)",7/26/05 13:39,-68.2037,44.2036,NA,,441250,137130,,FALSE,,,,137130
3d41038f-0d91-40b1-a9dd-c15604c57ab6,Cepphus grylle,"(Linnaeus, 1758)",1979-08-16T18:45:00,-63.0333,59.0667,Canadian Wildlife Service,280,280_119351,urn:lsid:marinespecies.org:taxname:137130,,FALSE,,,,137130
3d41e790-ec4d-414e-ad19-7faf94a34dfa,Cepphus grylle,"(Linnaeus, 1758)",07/08/1992 12:00,-66.90527344,44.59878922,ACCD,EOR,31407,urn:lsid:marinespecies.org:taxname:137130,,FALSE,,,,137130
3d4f8a93-6c93-4fe7-856f-10f45ace2ce9,Cepphus grylle,"(Linnaeus, 1758)",1979-08-25T12:25:00,-58.7667,55.3,Canadian Wildlife Service,280,280_120681,urn:lsid:marinespecies.org:taxname:137130,,FALSE,,,,137130
3d594930-23cc-47ad-b41b-321f1753a7fb,Cepphus grylle,"(Linnaeus, 1758)",06/08/1994 00:00,-61.26128,46.35939,Canadian Wildlife Service - Atlantic Region (CWS - Atlantic),,NS001348_BLGU_4933_1994-06-08,urn:lsid:marinespecies.org:taxname:137130,,FALSE,,,,137130
3d801aa7-4545-48e3-a404-4b60b2075005,Cepphus grylle,"(Linnaeus, 1758)",10/06/2006 15:05,-68.3759,44.1293,NA,,8052,137130,,FALSE,,,,137130
3d846223-a22f-4c07-b6c1-ae8476a83b85,Cepphus grylle,"(Linnaeus, 1758)",2001-07-02T12:00:00Z,-66.68263245,44.68330002,ACCD,EOR,31774,urn:lsid:marinespecies.org:taxname:137130,,FALSE,,,,137130
3d9715a6-a3e6-4876-a5bb-c45e55283bad,Cepphus grylle,"(Linnaeus, 1758)",1975-07-31T14:56:00,-80.0833,54.7667,Canadian Wildlife Service,280,280_69696,urn:lsid:marinespecies.org:taxname:137130,,FALSE,,,,137130
3daaca91-bef4-49cd-a778-a81b11f635b2,Cepphus grylle,"(Linnaeus, 1758)",07/08/2006 00:00,-61.05502,46.60304,Canadian Wildlife Service - Atlantic Region (CWS - Atlantic),,NS003497_BLGU_12090_2006-07-08,urn:lsid:marinespecies.org:taxname:137130,,FALSE,,,,137130
3dbb7883-69ce-44fc-9e0b-338cf271fcc4,Cepphus grylle,"(Linnaeus, 1758)",6/24/05 10:05,-67.8552,44.3623,NA,,439753,137130,,FALSE,,,,137130
3dd802d0-defd-4950-ae7d-7379e3001d81,Cepphus grylle,"(Linnaeus, 1758)",1971-05-16T08:25:00,-61.5167,48.4,Canadian Wildlife Service,280,280_36986,urn:lsid:marinespecies.org:taxname:137130,,FALSE,,,,137130
3e9a5dee-e274-4c70-93cf-59e0d6b9fbf7,Cepphus grylle,"(Linnaeus, 1758)",05/01/2004 00:00,-61.5426,45.10182,Canadian Wildlife Service - Atlantic Region (CWS - Atlantic),,NS002232_BLGU_9908_2004-05-01,urn:lsid:marinespecies.org:taxname:137130,,FALSE,,,,137130
3ec071b1-f2f2-4080-9704-6567aa4f773a,Cepphus grylle,"(Linnaeus, 1758)",01/01/1985 00:00,-56.38896,47.12491,Canadian Wildlife Service - Atlantic Region (CWS - Atlantic),,NF000266_BLGU_688_1985-01-01,urn:lsid:marinespecies.org:taxname:137130,,FALSE,,,,137130
3f3e59e6-14b3-4db1-abba-39f52ae8111b,Cepphus grylle,"(Linnaeus, 1758)",05/06/1999,-68.5,53,ICES,DOME-Biota,12135598,urn:lsid:marinespecies.org:taxname:137130,,FALSE,,,,137130
3f5d6a64-0a04-450b-a679-aea517524834,Cepphus grylle,"(Linnaeus, 1758)",1975-07-31T13:50:00,-80.15,54.7667,Canadian Wildlife Service,280,280_69694,urn:lsid:marinespecies.org:taxname:137130,,FALSE,,,,137130
3f88ceae-b417-4231-a26e-d3338a2aefb7,Cepphus grylle,"(Linnaeus, 1758)",05/06/2000,-68.5,53,ICES,DOME-Biota,12135348,urn:lsid:marinespecies.org:taxname:137130,,FALSE,,,,137130
3f8f57c0-cdb5-48b0-b229-0bdadfe88922,Cepphus grylle,"(Linnaeus, 1758)",08/07/1978 00:00,-60.93343,56.63723,Canadian Wildlife Service - Atlantic Region (CWS - Atlantic),,NF001000_BLGU_2150_1978-08-07,urn:lsid:marinespecies.org:taxname:137130,,FALSE,,,,137130
3f901b69-6e76-42ae-ad77-e454a2fa169c,Cepphus grylle,"(Linnaeus, 1758)",1979-08-27T13:20:00,-61.55,57.2,Canadian Wildlife Service,280,280_120923,urn:lsid:marinespecies.org:taxname:137130,,FALSE,,,,137130
3fae00d2-c69f-46ca-b8ac-4a19f043811f,Cepphus grylle,"(Linnaeus, 1758)",1970-04-23T09:10:00,-58.4833,49.1333,Canadian Wildlife Service,280,280_19753,urn:lsid:marinespecies.org:taxname:137130,,FALSE,,,,137130
3fb0b295-4633-494d-9f7f-14bf35481e97,Cepphus grylle,"(Linnaeus, 1758)",1978-08-02T14:30:00,-58.1667,54.2667,Canadian Wildlife Service,280,280_105053,urn:lsid:marinespecies.org:taxname:137130,,FALSE,,,,137130
3fb32dd9-a0df-4fa4-bdfb-8b85af9ce2a3,Cepphus grylle,"(Linnaeus, 1758)",5/24/80 00:00,-60.06073,45.86601,Canadian Wildlife Service - Atlantic Region (CWS - Atlantic),,NS001359_BLGU_3077_1980-05-24,urn:lsid:marinespecies.org:taxname:137130,,FALSE,,,,137130
3fb6906c-b4d2-4c4d-8117-449f39134986,Cepphus grylle,,,-64.14,48.69,"Canadian Wildlife Service-Atlantic, Environment Canada",,58439636_1232590403_1602032669,urn:lsid:marinespecies.org:taxname:137130,,FALSE,,,,137130
3fbeea7d-4a27-481f-9945-e6fb9c935e3a,Cepphus grylle,"(Linnaeus, 1758)",01/01/2001 00:00,-66.75834,44.58521,Canadian Wildlife Service - Atlantic Region (CWS - Atlantic),,NB000089_BLGU_5403_2001-01-01,urn:lsid:marinespecies.org:taxname:137130,,FALSE,,,,137130
3fd2fc3a-d975-4778-bca7-d1066b9436a4,Cepphus grylle,,2016,-66.362226,44.259135,Nova Scotian Institute of Science,,Cepphus grylle,urn:lsid:marinespecies.org:taxname:137130,,FALSE,,,,137130
4009273a-d0ca-4033-8279-e3728fe22321,Cepphus grylle,"(Linnaeus, 1758)",6/20/73 00:00,-61.26128,46.35939,Canadian Wildlife Service - Atlantic Region (CWS - Atlantic),,NS001348_BLGU_3139_1973-06-20,urn:lsid:marinespecies.org:taxname:137130,,FALSE,,,,137130
40181d2e-0607-4777-b20d-610ee2d2f98d,Cepphus grylle,"(Linnaeus, 1758)",1978-07-15T16:15:00,-55.3667,54.4833,Canadian Wildlife Service,280,280_102760,urn:lsid:marinespecies.org:taxname:137130,,FALSE,,,,137130
4023ecc4-2639-4669-8604-ed014d960145,Cepphus grylle,,,-65.42,47.95,"Canadian Wildlife Service-Atlantic, Environment Canada",,58439636_238513768_-352680001,urn:lsid:marinespecies.org:taxname:137130,,FALSE,,,,137130
4029ff12-d0df-499e-8b62-3d226fb3c960,Cepphus grylle,,,-65.1,49.3,"Canadian Wildlife Service-Atlantic, Environment Canada",,689065724_-936967394_574444101,urn:lsid:marinespecies.org:taxname:137130,,FALSE,,,,137130
402e775c-3217-4acf-8f58-c4840ba819ad,Cepphus grylle,"(Linnaeus, 1758)",1977-08-05T07:50:00,-61.5167,58.5333,Canadian Wildlife Service,280,280_85180,urn:lsid:marinespecies.org:taxname:137130,,FALSE,,,,137130
4030ac06-0f43-4295-a535-48a5e72fef63,Cepphus grylle,"(Linnaeus, 1758)",8/18/05 13:28,-68.0291,44.294,NA,,442432,137130,,FALSE,,,,137130
403773a5-7598-49b2-afdd-f78eba327e09,Cepphus grylle,,,-64.38,48.83,"Canadian Wildlife Service-Atlantic, Environment Canada",,58439636_-35970323_-621500422,urn:lsid:marinespecies.org:taxname:137130,,FALSE,,,,137130
404ffc7f-1996-4824-96c2-34ff6d42757e,Cepphus grylle,,,-56.54,51.46,"Canadian Wildlife Service-Atlantic, Environment Canada",,1404141821_939834342_1254434553,urn:lsid:marinespecies.org:taxname:137130,,FALSE,,,,137130
407b7948-58e4-4a6b-9047-7d8f461a29bd,Cepphus grylle,"(Linnaeus, 1758)",01/01/1987 00:00,-53.01548,48.63368,Canadian Wildlife Service - Atlantic Region (CWS - Atlantic),,NF000484_BLGU_1154_1987-01-01,urn:lsid:marinespecies.org:taxname:137130,,FALSE,,,,137130
40a9f8eb-be0c-4d31-9ec3-68a214f49405,Cepphus grylle,,,-58.4,49.3,"Canadian Wildlife Service-Atlantic, Environment Canada",,896836590_1846921228_-667072607,urn:lsid:marinespecies.org:taxname:137130,,FALSE,,,,137130
40c7bc46-4659-499a-a295-880e591e1c64,Cepphus grylle,"(Linnaeus, 1758)",1979-08-27T08:15:00,-61.8833,57.8167,Canadian Wildlife Service,280,280_120875,urn:lsid:marinespecies.org:taxname:137130,,FALSE,,,,137130
40fe9d4e-b3f4-423c-887f-582c18f2ec1d,Cepphus grylle,,,-65.52,47.97,"Canadian Wildlife Service-Atlantic, Environment Canada",,-635145613_135594781_-1411678255,urn:lsid:marinespecies.org:taxname:137130,,FALSE,,,,137130
41003aac-c7e9-4dc5-9437-d37d504ecbed,Cepphus grylle,"(Linnaeus, 1758)",8/19/06 13:42,-68.2334,44.1428,NA,,7150,137130,,FALSE,,,,137130
412722e8-7cb6-47be-a6bb-da297cd413fc,Cepphus grylle,"(Linnaeus, 1758)",1975-06-04T12:00:00Z,-66.16333008,48.00999832,ACCD,EOR,31416,urn:lsid:marinespecies.org:taxname:137130,,FALSE,,,,137130
417c1c4b-7640-4457-86d5-8c4f8c9a761c,Cepphus grylle,"(Linnaeus, 1758)",1979-08-13T11:45:00,-62.3333,58.2667,Canadian Wildlife Service,280,280_118706,urn:lsid:marinespecies.org:taxname:137130,,FALSE,,,,137130
41a6c7ad-5d7b-408e-86cb-c9f12466616c,Cepphus grylle,"(Linnaeus, 1758)",7/22/05 09:33,-68.2063,44.1341,NA,,440931,137130,,FALSE,,,,137130
41aec9bc-fc9f-489b-a609-ffbbfb87e8ce,Cepphus grylle,"(Linnaeus, 1758)",6/28/86 12:00,-65.16404724,47.81690979,ACCD,EOR,31409,urn:lsid:marinespecies.org:taxname:137130,,FALSE,,,,137130
41c69ade-b7dc-4c2c-b875-eef7b5ad6375,Cepphus grylle,"(Linnaeus, 1758)",1980-08-18T08:15:00,-53.9,46.7667,Canadian Wildlife Service,280,280_133024,urn:lsid:marinespecies.org:taxname:137130,,FALSE,,,,137130
41da23fc-5639-40e2-916c-a61ce54a84e8,Cepphus grylle,"(Linnaeus, 1758)",07/02/2005 14:34,-68.2805,44.2354,NA,,439861,137130,,FALSE,,,,137130
41e1839c-e3de-4bdf-8788-754a6b3b2324,Cepphus grylle,"(Linnaeus, 1758)",1976-06-09T12:00:00Z,-66.50797272,45.10573959,ACCD,EOR,31766,urn:lsid:marinespecies.org:taxname:137130,,FALSE,,,,137130
41e939aa-264a-4117-b9cf-ef38917e2727,Cepphus grylle,,,-65.24,43.64,"Canadian Wildlife Service-Atlantic, Environment Canada",,1248786725_-1447517269_1660009575,urn:lsid:marinespecies.org:taxname:137130,,FALSE,,,,137130
41edde26-b30d-44db-9bdb-8ef8a4ea8354,Cepphus grylle,,,-64.09,47.95,"Canadian Wildlife Service-Atlantic, Environment Canada",,-1636689528_1942522751_-1845859970,urn:lsid:marinespecies.org:taxname:137130,,FALSE,,,,137130
421f983d-fd06-433c-aa25-f4138876529a,Cepphus grylle,"(Linnaeus, 1758)",05/06/1999,-68.5,53,ICES,DOME-Biota,12135610,urn:lsid:marinespecies.org:taxname:137130,,FALSE,,,,137130
4252aad0-f6e6-4888-90ea-ef8f53df68e6,Cepphus grylle,"(Linnaeus, 1758)",1975-07-29T13:10:00,-81.5333,59.3667,Canadian Wildlife Service,280,280_69669,urn:lsid:marinespecies.org:taxname:137130,,FALSE,,,,137130
42546d7e-6409-4446-a00c-bef7e85f591b,Cepphus grylle,"(Linnaeus, 1758)",5/31/76 00:00,-64.69175,45.33006,Canadian Wildlife Service - Atlantic Region (CWS - Atlantic),,NS001131_BLGU_2910_1976-05-31,urn:lsid:marinespecies.org:taxname:137130,,FALSE,,,,137130
42acc22b-7730-4e0c-9d5f-16a984d2a4b9,Cepphus grylle,"(Linnaeus, 1758)",07/07/2015 00:00,-52.83718,47.19155,Canadian Wildlife Service - Atlantic Region (CWS - Atlantic),,NF000282_BLGU_12515_2015-07-07,urn:lsid:marinespecies.org:taxname:137130,,FALSE,,,,137130
42c68c83-99e7-40fe-9a74-232287161f46,Cepphus grylle,"(Linnaeus, 1758)",NA,-68.5712,44.0168,USFWS,,699290,137130,,FALSE,,,,137130
42d6c293-3198-4c3f-a1ab-692dab8d6da5,Cepphus grylle,,,-53.57,48.2,"Canadian Wildlife Service-Atlantic, Environment Canada",,1218969274_67279765_366049456,urn:lsid:marinespecies.org:taxname:137130,,FALSE,,,,137130
42f2dce6-e6b1-42fc-9e65-1e2c7e91ee96,Cepphus grylle,,,-61.14,45.45,"Canadian Wildlife Service-Atlantic, Environment Canada",,1395402048_-635944483_1401951222,urn:lsid:marinespecies.org:taxname:137130,,FALSE,,,,137130
4306cc87-05ad-426b-ba20-accdf7eeb7c6,Cepphus grylle,"(Linnaeus, 1758)",01/01/1987 00:00,-56.16562,46.81991,Canadian Wildlife Service - Atlantic Region (CWS - Atlantic),,NF000195_BLGU_412_1987-01-01,urn:lsid:marinespecies.org:taxname:137130,,FALSE,,,,137130
43074a67-12ed-442d-8c01-dbe0a64b3327,Cepphus grylle,"(Linnaeus, 1758)",6/29/10 00:00,-62.3803,44.82106,Canadian Wildlife Service - Atlantic Region (CWS - Atlantic),,NS001181_BLGU_12062_2010-06-29,urn:lsid:marinespecies.org:taxname:137130,,FALSE,,,,137130
4308f380-60b7-4f29-865d-9065a96026f2,Cepphus grylle,"(Linnaeus, 1758)",07/02/2001 12:00,-66.74932861,44.61669922,ACCD,EOR,31781,urn:lsid:marinespecies.org:taxname:137130,,FALSE,,,,137130
435ef9b1-74bb-4684-8460-368027c9cbb9,Cepphus grylle,"(Linnaeus, 1758)",01/01/1943 00:00,-55.34882,51.58325,Canadian Wildlife Service - Atlantic Region (CWS - Atlantic),,NF000659_BLGU_1694_1943-01-01,urn:lsid:marinespecies.org:taxname:137130,,FALSE,,,,137130
43666ac4-15a6-4cc1-b2db-721be5770a23,Cepphus grylle,"(Linnaeus, 1758)",07/10/2010 00:00,-64.25715,46.83955,Canadian Wildlife Service - Atlantic Region (CWS - Atlantic),,PE002624_BLGU_11919_2010-07-10,urn:lsid:marinespecies.org:taxname:137130,,FALSE,,,,137130
4367beee-876e-44a6-b182-726c698c6211,Cepphus grylle,"(Linnaeus, 1758)",8/13/78 00:00,-61.38225,56.15003,Canadian Wildlife Service - Atlantic Region (CWS - Atlantic),,NF000922_BLGU_2041_1978-08-13,urn:lsid:marinespecies.org:taxname:137130,,FALSE,,,,137130
43759cef-31ab-416a-a097-b7b75ca22477,Cepphus grylle,"(Linnaeus, 1758)",01/01/1974 00:00,-53.90054,47.57322,Canadian Wildlife Service - Atlantic Region (CWS - Atlantic),,NF000371_BLGU_984_1974-01-01,urn:lsid:marinespecies.org:taxname:137130,,FALSE,,,,137130
438470dc-c8aa-4e29-b295-ad2147412077,Cepphus grylle,"(Linnaeus, 1758)",08/07/1978 00:00,-61.03223,56.55003,Canadian Wildlife Service - Atlantic Region (CWS - Atlantic),,NF000990_BLGU_2137_1978-08-07,urn:lsid:marinespecies.org:taxname:137130,,FALSE,,,,137130
43cf6b51-974b-4203-b601-d9f96cf21976,Cepphus grylle,"(Linnaeus, 1758)",8/13/78 00:00,-61.16558,56.17894,Canadian Wildlife Service - Atlantic Region (CWS - Atlantic),,NF000925_BLGU_2043_1978-08-13,urn:lsid:marinespecies.org:taxname:137130,,FALSE,,,,137130
43fc313d-3772-474d-a1c4-33782d3aec8f,Cepphus grylle,,,-61.63,50.09,"Canadian Wildlife Service-Atlantic, Environment Canada",,-1636689528_401245694_899980941,urn:lsid:marinespecies.org:taxname:137130,,FALSE,,,,137130
43ff8c44-c823-4238-8c86-835bee0b1574,Cepphus grylle,"(Linnaeus, 1758)",01/01/1971 00:00,-59.77003,46.18043,Canadian Wildlife Service - Atlantic Region (CWS - Atlantic),,NS001256_BLGU_3133_1971-01-01,urn:lsid:marinespecies.org:taxname:137130,,FALSE,,,,137130
446f0de0-5a62-4bc4-8024-934a00e706b3,Cepphus grylle,,,-61.14,56.54,"Canadian Wildlife Service-Atlantic, Environment Canada",,1380544464_83450777_1316614725,urn:lsid:marinespecies.org:taxname:137130,,FALSE,,,,137130
447afa5e-d6e0-42c8-bb1c-78c97e36e8f0,Cepphus grylle,"(Linnaeus, 1758)",1975-08-02T13:55:00,-82,57.0167,Canadian Wildlife Service,280,280_69701,urn:lsid:marinespecies.org:taxname:137130,,FALSE,,,,137130
4480bc75-4fe9-4e86-b9dd-22977961f8d2,Cepphus grylle,"(Linnaeus, 1758)",1981-02-15T10:30:00,-57.5,47.5,Canadian Wildlife Service,280,280_138777,urn:lsid:marinespecies.org:taxname:137130,,FALSE,,,,137130
448d674f-df1e-4289-8b1c-efabd908dd06,Cepphus grylle,"(Linnaeus, 1758)",1966-06-27T12:00:00Z,-65.81474304,47.8927803,ACCD,EOR,31410,urn:lsid:marinespecies.org:taxname:137130,,FALSE,,,,137130
44aaf89b-e2da-4d4d-b323-102d3e55422e,Cepphus grylle,,,-62.2,44.71,"Canadian Wildlife Service-Atlantic, Environment Canada",,1404141821_-1455910807_-1549855831,urn:lsid:marinespecies.org:taxname:137130,,FALSE,,,,137130
44da9c28-62d7-41f0-8bb4-e1823f5fefe7,Cepphus grylle,,,-59.28,48.47,"Canadian Wildlife Service-Atlantic, Environment Canada",,896836590_-1252643629_-1092372978,urn:lsid:marinespecies.org:taxname:137130,,FALSE,,,,137130
44f9225f-22ce-4a60-87b0-8172aa3f7ff2,Cepphus grylle,"(Linnaeus, 1758)",6/21/79 00:00,-65.38258,47.73332,Canadian Wildlife Service - Atlantic Region (CWS - Atlantic),,NB000066_BLGU_82_1979-06-21,urn:lsid:marinespecies.org:taxname:137130,,FALSE,,,,137130
44ff29a5-4ba4-4716-854e-11fa8f91de06,Cepphus grylle,"(Linnaeus, 1758)",1987-07-13T12:00:00Z,-61.44916916,46.0777092,ACCD,EOR,31485,urn:lsid:marinespecies.org:taxname:137130,,FALSE,,,,137130
459d8bd9-2545-487e-8aa7-42c71ab38ff7,Cepphus grylle,,,-65.33,43.7,"Canadian Wildlife Service-Atlantic, Environment Canada",,1361835644_1884259954_360419742,urn:lsid:marinespecies.org:taxname:137130,,FALSE,,,,137130
45a4a44f-3377-4f26-b415-094f78bb8c20,Cepphus grylle,"(Linnaeus, 1758)",6/25/05 09:56,-67.859,44.3644,NA,,440011,137130,,FALSE,,,,137130
45fce605-2802-449a-a6f8-db9339372ac8,Cepphus grylle,"(Linnaeus, 1758)",1977-08-06T08:05:00,-62.6,58.5167,Canadian Wildlife Service,280,280_85327,urn:lsid:marinespecies.org:taxname:137130,,FALSE,,,,137130
460a710b-ef47-4867-b578-98e6711c3b0b,Cepphus grylle,"(Linnaeus, 1758)",1975-07-31T13:40:00,-80.2,54.7667,Canadian Wildlife Service,280,280_69693,urn:lsid:marinespecies.org:taxname:137130,,FALSE,,,,137130
4633fe62-9c40-45c2-a9a0-04f970e560a5,Cepphus grylle,"(Linnaeus, 1758)",6/16/08 00:00,-66.77646,44.79926,Canadian Wildlife Service - Atlantic Region (CWS - Atlantic),,NB002613_BLGU_11702_2008-06-16,urn:lsid:marinespecies.org:taxname:137130,,FALSE,,,,137130
46499d37-285c-4016-b359-5fd7146a817c,Cepphus grylle,"(Linnaeus, 1758)",,-64.5,48.01667023,ACCD,EOR,31402,urn:lsid:marinespecies.org:taxname:137130,,FALSE,,,,137130
464e029e-1007-4bcb-b9c5-444c4d87c73e,Cepphus grylle,,,-55.97,50.26,"Canadian Wildlife Service-Atlantic, Environment Canada",,1278617075_-2061141953_-1115212667,urn:lsid:marinespecies.org:taxname:137130,,FALSE,,,,137130
46553411-d5a7-414a-ba91-0ef2f9153eeb,Cepphus grylle,,,-64.38,48.83,"Canadian Wildlife Service-Atlantic, Environment Canada",,58439636_1202339464_1850491551,urn:lsid:marinespecies.org:taxname:137130,,FALSE,,,,137130
466e0e32-c925-44c8-8fe3-dc711cbdc858,Cepphus grylle,,,-58.08,55.02,"Canadian Wildlife Service-Atlantic, Environment Canada",,1436357738_-1409304333_-1176644424,urn:lsid:marinespecies.org:taxname:137130,,FALSE,,,,137130
468aaba5-3fda-4c25-b72f-2ddd625b821c,Cepphus grylle,"(Linnaeus, 1758)",6/19/05 12:12,-67.8885,44.1097,NA,,439518,137130,,FALSE,,,,137130
4690f5b5-03b3-4be5-81e1-a4fbb34987c8,Cepphus grylle,"(Linnaeus, 1758)",1971-05-16T08:35:00,-61.55,48.4,Canadian Wildlife Service,280,280_36987,urn:lsid:marinespecies.org:taxname:137130,,FALSE,,,,137130
469bfdb0-a144-400f-833b-b467651f352a,Cepphus grylle,"(Linnaeus, 1758)",NA,-68.9184,43.8499,USFWS,,699140,137130,,FALSE,,,,137130
46b39418-2d00-4982-9911-14357a548995,Cepphus grylle,"(Linnaeus, 1758)",1979-09-01T09:40:00,-61.15,56.0167,Canadian Wildlife Service,280,280_121181,urn:lsid:marinespecies.org:taxname:137130,,FALSE,,,,137130
46f5ffc7-872f-4b5f-b384-1eee24012244,Cepphus grylle,"(Linnaeus, 1758)",01/01/1973 00:00,-66.76206,44.61949,Canadian Wildlife Service - Atlantic Region (CWS - Atlantic),,NB000097_BLGU_177_1973-01-01,urn:lsid:marinespecies.org:taxname:137130,,FALSE,,,,137130
479af093-fbb5-4139-8637-f979114d9854,Cepphus grylle,"(Linnaeus, 1758)",1971-01-26T09:20:00,-58.8333,49.1,Canadian Wildlife Service,280,280_33965,urn:lsid:marinespecies.org:taxname:137130,,FALSE,,,,137130
47b11890-ca6d-43f9-8a8e-95c781fb0d2b,Cepphus grylle,"(Linnaeus, 1758)",6/21/01 00:00,-55.36297,49.9966,Canadian Wildlife Service - Atlantic Region (CWS - Atlantic),,NF000608_BLGU_5830_2001-06-21,urn:lsid:marinespecies.org:taxname:137130,,FALSE,,,,137130
47c62efe-c214-49a6-8cda-72a3c14b8fac,Cepphus grylle,"(Linnaeus, 1758)",1979-08-13T09:30:00,-62.5167,58.4,Canadian Wildlife Service,280,280_118697,urn:lsid:marinespecies.org:taxname:137130,,FALSE,,,,137130
47cae055-73b0-4e55-b0da-e03da6a6a259,Cepphus grylle,"(Linnaeus, 1758)",6/22/01 00:00,-54.47394,49.5909,Canadian Wildlife Service - Atlantic Region (CWS - Atlantic),,NF002767_BLGU_5938_2001-06-22,urn:lsid:marinespecies.org:taxname:137130,,FALSE,,,,137130
4807f305-0e5f-40e6-879f-7afbc2f2bf7d,Cepphus grylle,"(Linnaeus, 1758)",07/02/2001 12:00,-66.76983643,44.5809288,ACCD,EOR,31791,urn:lsid:marinespecies.org:taxname:137130,,FALSE,,,,137130
4831aa08-e9f7-47f4-a4c9-7d96c9f59d80,Cepphus grylle,"(Linnaeus, 1758)",05/11/2015 00:00,-61.5426,45.10182,Canadian Wildlife Service - Atlantic Region (CWS - Atlantic),,NS002232_BLGU_13091_2015-05-11,urn:lsid:marinespecies.org:taxname:137130,,FALSE,,,,137130
48328838-fea0-471e-8844-0e75d5367451,Cepphus grylle,,,-58.41,49.17,"Canadian Wildlife Service-Atlantic, Environment Canada",,1421648014_-1708348929_-2114523071,urn:lsid:marinespecies.org:taxname:137130,,FALSE,,,,137130
48911cc8-c56c-4ec6-a111-24f6c8cb3c73,Cepphus grylle,"(Linnaeus, 1758)",1979-09-01T11:00:00,-60.7833,55.95,Canadian Wildlife Service,280,280_121214,urn:lsid:marinespecies.org:taxname:137130,,FALSE,,,,137130
48a965cb-a405-4fee-a35d-b2b5a5e63293,Cepphus grylle,"(Linnaeus, 1758)",NA,-68.757,44.2752,USFWS,,670474,137130,,FALSE,,,,137130
48e01950-312d-466a-b40a-cc6625dfbd18,Cepphus grylle,"(Linnaeus, 1758)",09/07/2005 09:18,-68.1569,44.331,NA,,443098,137130,,FALSE,,,,137130
490c66bb-485f-46fb-afa1-e5f84f2bec06,Cepphus grylle,,,-64.18,50.01,"Canadian Wildlife Service-Atlantic, Environment Canada",,1421648014_1651926192_1981044343,urn:lsid:marinespecies.org:taxname:137130,,FALSE,,,,137130
4931b118-f6d7-4ab0-ae2d-5d9cde8f1ac7,Cepphus grylle,"(Linnaeus, 1758)",08/12/2005 13:18,-68.1128,44.3402,NA,,442075,137130,,FALSE,,,,137130
494ee893-dff6-4c70-9ce0-88b912b94421,Cepphus grylle,"(Linnaeus, 1758)",01/01/2009 00:00,-53.2322,46.65822,Canadian Wildlife Service - Atlantic Region (CWS - Atlantic),,NF000180_BLGU_13509_2009-01-01,urn:lsid:marinespecies.org:taxname:137130,,FALSE,,,,137130
49725e9e-1977-4bae-9fed-c55aaa7653da,Cepphus grylle,"(Linnaeus, 1758)",1969-07-08T07:05:00,-63.8333,44.4833,Canadian Wildlife Service,280,280_12516,urn:lsid:marinespecies.org:taxname:137130,,FALSE,,,,137130
4977f4d8-5ad9-4a38-bc97-35ed9b18490f,Cepphus grylle,"(Linnaeus, 1758)",1978-07-15T17:55:00,-55.3667,54.7833,Canadian Wildlife Service,280,280_102764,urn:lsid:marinespecies.org:taxname:137130,,FALSE,,,,137130
49ac5d7e-dcbe-4f1d-8797-5df668935ece,Cepphus grylle,"(Linnaeus, 1758)",08/06/2006 09:30,-67.8105,44.3608,NA,,6597,137130,,FALSE,,,,137130
49aec59f-6ed2-4007-ba25-a84ee759601d,Cepphus grylle,,,-58.6,48.96,"Canadian Wildlife Service-Atlantic, Environment Canada",,896836590_-224164210_1532032203,urn:lsid:marinespecies.org:taxname:137130,,FALSE,,,,137130
49da31b6-de43-4113-ae78-ff17e82b7643,Cepphus grylle,"(Linnaeus, 1758)",8/13/78 00:00,-61.36558,56.33337,Canadian Wildlife Service - Atlantic Region (CWS - Atlantic),,NF000965_BLGU_2103_1978-08-13,urn:lsid:marinespecies.org:taxname:137130,,FALSE,,,,137130
4a1abe13-f396-4de3-b6b8-fa1ef0e07463,Cepphus grylle,"(Linnaeus, 1758)",1980-06-04T12:00:00Z,-60.34700012,46.36671829,ACCD,EOR,31746,urn:lsid:marinespecies.org:taxname:137130,,FALSE,,,,137130
4a2729b3-96a7-4080-a7ee-101519d635d8,Cepphus grylle,"(Linnaeus, 1758)",1973-03-05T16:20:00,-58.2333,50.5667,Canadian Wildlife Service,280,280_62807,urn:lsid:marinespecies.org:taxname:137130,,FALSE,,,,137130
4a51dc39-ae4b-4cab-a070-423edde5bb2e,Cepphus grylle,,,-61.35,50.14,"Canadian Wildlife Service-Atlantic, Environment Canada",,-1636689528_-550238473_1777439872,urn:lsid:marinespecies.org:taxname:137130,,FALSE,,,,137130
4a98a111-4500-483e-ab43-373605eff195,Cepphus grylle,"(Linnaeus, 1758)",7/19/06 12:49,-68.0489,44.3284,NA,,5600,137130,,FALSE,,,,137130
4a9fb4ea-68d3-4c69-bb55-9422531f16a3,Cepphus grylle,"(Linnaeus, 1758)",1989-07-18T12:00:00Z,-66.16799927,48.00320816,ACCD,EOR,31451,urn:lsid:marinespecies.org:taxname:137130,,FALSE,,,,137130
4adbe366-6596-46e0-b263-c19591910de9,Cepphus grylle,"(Linnaeus, 1758)",07/10/2012 00:00,-54.1953,49.7981,Canadian Wildlife Service - Atlantic Region (CWS - Atlantic),,NF003525_BLGU_10104_2012-07-10,urn:lsid:marinespecies.org:taxname:137130,,FALSE,,,,137130
4ae5a142-3b72-4d21-a113-57ba93d55426,Cepphus grylle,"(Linnaeus, 1758)",8/14/78 00:00,-60.04889,55.21667,Canadian Wildlife Service - Atlantic Region (CWS - Atlantic),,NF000813_BLGU_1905_1978-08-14,urn:lsid:marinespecies.org:taxname:137130,,FALSE,,,,137130
4ae7126d-5186-413d-85f7-ff050ee60723,Cepphus grylle,,,-65.24,43.62,"Canadian Wildlife Service-Atlantic, Environment Canada",,1361835644_1600639801_-1579175921,urn:lsid:marinespecies.org:taxname:137130,,FALSE,,,,137130
4b23e308-f5ef-418d-909f-41e26554e995,Cepphus grylle,"(Linnaeus, 1758)",,-67.06667328,44.5,ACCD,EOR,31399,urn:lsid:marinespecies.org:taxname:137130,,FALSE,,,,137130
4b3a4ad6-5e57-4786-8bcb-091c2578fb4c,Cepphus grylle,"(Linnaeus, 1758)",07/02/2007 00:00,-61.25795,46.29228,Canadian Wildlife Service - Atlantic Region (CWS - Atlantic),,NS003463_BLGU_11812_2007-07-02,urn:lsid:marinespecies.org:taxname:137130,,FALSE,,,,137130
4b46043a-dda0-402a-ac8b-0ccc510d673c,Cepphus grylle,"(Linnaeus, 1758)",01/01/1975 00:00,-54.16217,49.54656,Canadian Wildlife Service - Atlantic Region (CWS - Atlantic),,NF000556_BLGU_1323_1975-01-01,urn:lsid:marinespecies.org:taxname:137130,,FALSE,,,,137130
4b498b0f-3170-4cc8-a361-33e070261301,Cepphus grylle,"(Linnaeus, 1758)",8/13/78 00:00,-60.63223,56.05002,Canadian Wildlife Service - Atlantic Region (CWS - Atlantic),,NF000910_BLGU_2025_1978-08-13,urn:lsid:marinespecies.org:taxname:137130,,FALSE,,,,137130
4b4c62b5-078e-44e2-a459-eee3742b9a2d,Cepphus grylle,"(Linnaeus, 1758)",08/12/2006 19:54,-68.116,44.3099,NA,,6871,137130,,FALSE,,,,137130
4b75ccec-d3d9-4367-b227-64d3fb972b03,Cepphus grylle,"(Linnaeus, 1758)",1969-07-28T14:20:00,-52.6667,47.5833,Canadian Wildlife Service,280,280_16040,urn:lsid:marinespecies.org:taxname:137130,,FALSE,,,,137130
4bc5ed6a-5e7d-4675-9465-6778da4e9145,Cepphus grylle,"(Linnaeus, 1758)",6/20/06 00:00,-65.20077,47.81198,Canadian Wildlife Service - Atlantic Region (CWS - Atlantic),,NB003385_BLGU_12022_2006-06-20,urn:lsid:marinespecies.org:taxname:137130,,FALSE,,,,137130
4c2f0d81-a4fd-4fbb-ad35-167ebd5c81bf,Cepphus grylle,"(Linnaeus, 1758)",NA,-70.1691,43.7672,"BOEM, USFWS, NOAA, NAVY",,727744,137130,,FALSE,,,,137130
4c587fbb-8aff-40a3-a77b-b3efd72243cd,Cepphus grylle,"(Linnaeus, 1758)",8/19/06 13:38,-68.2165,44.1698,NA,,7149,137130,,FALSE,,,,137130
4c828e01-6c55-4956-bae0-1e51a026bc82,Cepphus grylle,,,-52.91,47,"Canadian Wildlife Service-Atlantic, Environment Canada",,1201195787_1725118178_-1357343541,urn:lsid:marinespecies.org:taxname:137130,,FALSE,,,,137130
4c861078-396b-43af-aff9-3361fbb3e948,Cepphus grylle,"(Linnaeus, 1758)",1979-08-27T10:30:00,-61.8167,57.6333,Canadian Wildlife Service,280,280_120890,urn:lsid:marinespecies.org:taxname:137130,,FALSE,,,,137130
4c9ab64e-50f8-432f-842b-edb4073c81af,Cepphus grylle,"(Linnaeus, 1758)",1976-08-04T05:21:00,-50.4667,47.9,Canadian Wildlife Service,280,280_75209,urn:lsid:marinespecies.org:taxname:137130,,FALSE,,,,137130
4c9b3807-5a0c-49cf-8c18-629cf41c2770,Cepphus grylle,"(Linnaeus, 1758)",01/01/1977 00:00,-55.94894,47.24991,Canadian Wildlife Service - Atlantic Region (CWS - Atlantic),,NF000295_BLGU_820_1977-01-01,urn:lsid:marinespecies.org:taxname:137130,,FALSE,,,,137130
4c9f9318-a087-4f98-8818-ce7d14d9ae81,Cepphus grylle,"(Linnaeus, 1758)",7/26/05 13:46,-68.208,44.172,NA,,441254,137130,,FALSE,,,,137130
4cbd5e82-b511-439d-8ce8-560ae94666c8,Cepphus grylle,"(Linnaeus, 1758)",1969-05-09T11:25:00,-53.2,49.6833,Canadian Wildlife Service,280,280_3169,urn:lsid:marinespecies.org:taxname:137130,,FALSE,,,,137130
4d3566a5-783a-4cf2-9ff9-b5f6448ff5fa,Cepphus grylle,"(Linnaeus, 1758)",01/01/1973 00:00,-66.76596,44.58356,Canadian Wildlife Service - Atlantic Region (CWS - Atlantic),,NB000088_BLGU_155_1973-01-01,urn:lsid:marinespecies.org:taxname:137130,,FALSE,,,,137130
4d3fd1e2-4b49-4e7b-b733-806f5a6f7581,Cepphus grylle,"(Linnaeus, 1758)",1978-06-24T18:00:00,-56.4333,50.3,Canadian Wildlife Service,280,280_101784,urn:lsid:marinespecies.org:taxname:137130,,FALSE,,,,137130
4d5e7382-61d6-4a7d-8829-a66c5bfc762b,Cepphus grylle,,,-64.82,49.28,"Canadian Wildlife Service-Atlantic, Environment Canada",,-801551520_-581601188_1625890799,urn:lsid:marinespecies.org:taxname:137130,,FALSE,,,,137130
4d638dc8-1a09-4692-bc2a-46a00c3fe7d8,Cepphus grylle,,,-53.36,46.62,"Canadian Wildlife Service-Atlantic, Environment Canada",,1201195787_243036316_-1538680060,urn:lsid:marinespecies.org:taxname:137130,,FALSE,,,,137130
4d6b5786-4bf9-4f42-be1c-f1a9d7bc4e20,Cepphus grylle,"(Linnaeus, 1758)",7/13/06 00:00,-59.77003,46.18043,Canadian Wildlife Service - Atlantic Region (CWS - Atlantic),,NS001256_BLGU_12088_2006-07-13,urn:lsid:marinespecies.org:taxname:137130,,FALSE,,,,137130
4da046c6-4c3b-4f43-9dbc-00e0263e3098,Cepphus grylle,,,-65.42,47.96,"Canadian Wildlife Service-Atlantic, Environment Canada",,-635145613_1817469457_-835574150,urn:lsid:marinespecies.org:taxname:137130,,FALSE,,,,137130
4dfa6581-157e-46ef-bed8-87cf3c757a35,Cepphus grylle,"(Linnaeus, 1758)",1975-07-29T14:10:00,-81.5167,59.1667,Canadian Wildlife Service,280,280_69671,urn:lsid:marinespecies.org:taxname:137130,,FALSE,,,,137130
4e27c772-2785-4889-bd46-8a69b88bf17f,Cepphus grylle,"(Linnaeus, 1758)",01/01/2000 00:00,-61.5426,45.10182,Canadian Wildlife Service - Atlantic Region (CWS - Atlantic),,NS002232_BLGU_4883_2000-01-01,urn:lsid:marinespecies.org:taxname:137130,,FALSE,,,,137130
4e34e96e-a325-4fbd-bbad-e03452be63f5,Cepphus grylle,"(Linnaeus, 1758)",1969-06-17T06:10:00,-53.4167,49.2667,Canadian Wildlife Service,280,280_9297,urn:lsid:marinespecies.org:taxname:137130,,FALSE,,,,137130
4e5e855c-131f-4ae4-859d-d4324bfa47ac,Cepphus grylle,,,-61.28,57.06,"Canadian Wildlife Service-Atlantic, Environment Canada",,1409356886_-1414896536_1428756041,urn:lsid:marinespecies.org:taxname:137130,,FALSE,,,,137130
4e6659b6-ee82-4837-8fa3-ee38398fa6f9,Cepphus grylle,"(Linnaeus, 1758)",07/04/2005 09:38,-67.8422,44.3531,NA,,440263,137130,,FALSE,,,,137130
4e8f2867-b8df-459a-b818-04522639d771,Cepphus grylle,,,-69.72,47.8,"Canadian Wildlife Service-Atlantic, Environment Canada",,1286797999_1397874171_-43327849,urn:lsid:marinespecies.org:taxname:137130,,FALSE,,,,137130
4e996392-a4a8-48f9-a1f1-6612cea97e70,Cepphus grylle,"(Linnaeus, 1758)",01/01/1975 00:00,-55.01306,47.18386,Canadian Wildlife Service - Atlantic Region (CWS - Atlantic),,NF000280_BLGU_757_1975-01-01,urn:lsid:marinespecies.org:taxname:137130,,FALSE,,,,137130
4ec31538-5ddd-47d6-ada9-7070391f684b,Cepphus grylle,"(Linnaeus, 1758)",7/26/05 13:34,-68.1759,44.2287,NA,,441246,137130,,FALSE,,,,137130
4eda64e6-2243-4a5c-91e6-7c735d678a13,Cepphus grylle,,,-58.2,49.5,"Canadian Wildlife Service-Atlantic, Environment Canada",,896836590_-846713919_-934658268,urn:lsid:marinespecies.org:taxname:137130,,FALSE,,,,137130
4ef01dde-2b67-4c67-ab53-422b3b8d8d6f,Cepphus grylle,"(Linnaeus, 1758)",1987-08-29T12:00:00Z,-66.89441681,44.60754013,ACCD,EOR,31430,urn:lsid:marinespecies.org:taxname:137130,,FALSE,,,,137130
4f06fc48-5094-4aef-8499-63ec4d9c7136,Cepphus grylle,"(Linnaeus, 1758)",05/01/2008 00:00,-61.5426,45.10182,Canadian Wildlife Service - Atlantic Region (CWS - Atlantic),,NS002232_BLGU_9920_2008-05-01,urn:lsid:marinespecies.org:taxname:137130,,FALSE,,,,137130
4f29a283-d246-4d6e-a2bc-c29486615650,Cepphus grylle,"(Linnaeus, 1758)",7/26/05 13:36,-68.1859,44.2202,NA,,441248,137130,,FALSE,,,,137130
4f58f3fa-14f9-43d0-99d3-3d3bce75958e,Cepphus grylle,"(Linnaeus, 1758)",1969-05-14T13:25:00,-54,51.45,Canadian Wildlife Service,280,280_4267,urn:lsid:marinespecies.org:taxname:137130,,FALSE,,,,137130
4f627fd1-6402-4109-9e6c-cda2ab79caa6,Cepphus grylle,"(Linnaeus, 1758)",06/05/2006 00:00,-52.6776,47.5408,Canadian Wildlife Service - Atlantic Region (CWS - Atlantic),,NF000355_BLGU_12526_2006-06-05,urn:lsid:marinespecies.org:taxname:137130,,FALSE,,,,137130
4fd13c15-0c93-47bf-962c-2afda7d10426,Cepphus grylle,"(Linnaeus, 1758)",7/19/06 12:49,-68.0489,44.3284,NA,,5602,137130,,FALSE,,,,137130
4fe5ff24-3c01-43f1-b6b3-aad5db771bbd,Cepphus grylle,"(Linnaeus, 1758)",1973-03-02T14:10:00,-61.9333,49.8167,Canadian Wildlife Service,280,280_62775,urn:lsid:marinespecies.org:taxname:137130,,FALSE,,,,137130
4fed1a22-b397-40af-ba3c-9d5680726c15,Cepphus grylle,"(Linnaeus, 1758)",1971-07-02T12:00:00Z,-61.59714127,45.98118973,ACCD,EOR,31751,urn:lsid:marinespecies.org:taxname:137130,,FALSE,,,,137130
5009d45a-64f5-4806-a5cd-5490409008b7,Cepphus grylle,"(Linnaeus, 1758)",6/21/06 14:10,-68.052,44.2352,NA,,4401,137130,,FALSE,,,,137130
50426e80-d7eb-43d0-b6d9-3271926f2c39,Cepphus grylle,"(Linnaeus, 1758)",06/11/1992 00:00,-61.26128,46.35939,Canadian Wildlife Service - Atlantic Region (CWS - Atlantic),,NS001348_BLGU_3144_1992-06-11,urn:lsid:marinespecies.org:taxname:137130,,FALSE,,,,137130
5089ce97-5e12-4315-9c87-5fd74b79cbe2,Cepphus grylle,"(Linnaeus, 1758)",1979-07-24T08:00:00,-57.5833,54.95,Canadian Wildlife Service,280,280_116973,urn:lsid:marinespecies.org:taxname:137130,,FALSE,,,,137130
50a81f1f-a3da-4dd1-acf7-dffc1a877eb7,Cepphus grylle,"(Linnaeus, 1758)",,-70.69000244,41.50999832,WoodsHoleBioSurvey,A Biological Survey of the Waters of Woods Hole and Vacinity,580,urn:lsid:marinespecies.org:taxname:137130,,FALSE,,,,137130
50b85a61-3100-4b0b-9922-918da366d276,Cepphus grylle,"(Linnaeus, 1758)",NA,-69.0042,43.9408,USFWS,,670122,137130,,FALSE,,,,137130
50bcdb0e-8e75-41ce-acfc-927b5a872cf0,Cepphus grylle,"(Linnaeus, 1758)",01/01/1974 00:00,-53.90462,47.58561,Canadian Wildlife Service - Atlantic Region (CWS - Atlantic),,NF000377_BLGU_992_1974-01-01,urn:lsid:marinespecies.org:taxname:137130,,FALSE,,,,137130
50dc8fb9-1402-4a88-bc1c-ec7ad0a82ed9,Cepphus grylle,"(Linnaeus, 1758)",1979-08-27T10:15:00,-61.8333,57.6667,Canadian Wildlife Service,280,280_120889,urn:lsid:marinespecies.org:taxname:137130,,FALSE,,,,137130
51633ee9-44f5-4aa2-a894-f7d37f77a73d,Cepphus grylle,"(Linnaeus, 1758)",1989-07-18T12:00:00Z,-66.13629913,47.98468018,ACCD,EOR,31450,urn:lsid:marinespecies.org:taxname:137130,,FALSE,,,,137130
518d9f99-3e14-420e-b2b7-3b78145e19cc,Cepphus grylle,,,-64.56,48.33,"Canadian Wildlife Service-Atlantic, Environment Canada",,689065724_2012113659_1355222391,urn:lsid:marinespecies.org:taxname:137130,,FALSE,,,,137130
51907e88-4483-4544-88fe-6576d012d59f,Cepphus grylle,"(Linnaeus, 1758)",1979-08-11T15:40:00,-62.05,57.4833,Canadian Wildlife Service,280,280_118399,urn:lsid:marinespecies.org:taxname:137130,,FALSE,,,,137130
5195b46e-0390-45c3-8122-1ebbc6a61a65,Cepphus grylle,"(Linnaeus, 1758)",1979-08-13T09:46:00,-62.4833,58.3333,Canadian Wildlife Service,280,280_118701,urn:lsid:marinespecies.org:taxname:137130,,FALSE,,,,137130
519b4706-7934-442a-b66c-296680d913ee,Cepphus grylle,"(Linnaeus, 1758)",9/22/05 11:50,-68.1029,44.3437,NA,,443335,137130,,FALSE,,,,137130
522818e3-4c04-466e-ab2f-50913ce75066,Cepphus grylle,"(Linnaeus, 1758)",01/01/1941 00:00,-52.79882,48.11655,Canadian Wildlife Service - Atlantic Region (CWS - Atlantic),,NF000456_BLGU_1078_1941-01-01,urn:lsid:marinespecies.org:taxname:137130,,FALSE,,,,137130
526ee39c-4856-4832-9546-004a1433af47,Cepphus grylle,"(Linnaeus, 1758)",6/21/00 00:00,-61.26128,46.35939,Canadian Wildlife Service - Atlantic Region (CWS - Atlantic),,NS001348_BLGU_4935_2000-06-21,urn:lsid:marinespecies.org:taxname:137130,,FALSE,,,,137130
52934e50-1152-4d3a-adca-00443cfa4306,Cepphus grylle,,,-58.43,49.23,"Canadian Wildlife Service-Atlantic, Environment Canada",,896836590_103446553_-480015975,urn:lsid:marinespecies.org:taxname:137130,,FALSE,,,,137130
529c2b45-3f8a-4e7e-b2e1-f719a8dc05e7,Cepphus grylle,"(Linnaeus, 1758)",7/28/05 09:43,-67.8434,44.3483,NA,,441299,137130,,FALSE,,,,137130
52b5e129-5061-43e9-89bf-cc7eda9849dc,Cepphus grylle,"(Linnaeus, 1758)",05/06/1999,-68.5,53,ICES,DOME-Biota,12135609,urn:lsid:marinespecies.org:taxname:137130,,FALSE,,,,137130
52c24787-71ff-4713-bf2d-8671d66b0420,Cepphus grylle,"(Linnaeus, 1758)",1970-07-20T17:25:00,-69.8833,47.75,Canadian Wildlife Service,280,280_25620,urn:lsid:marinespecies.org:taxname:137130,,FALSE,,,,137130
52d48b92-0f1f-4146-a9a6-1c8cc341ab74,Cepphus grylle,"(Linnaeus, 1758)",1986-07-03T12:00:00Z,-63.98480988,46.90428162,ACCD,EOR,31468,urn:lsid:marinespecies.org:taxname:137130,,FALSE,,,,137130
53055c39-d1c3-4962-8dae-0c40e52b9949,Cepphus grylle,"(Linnaeus, 1758)",6/20/00,-68.5,53,ICES,DOME-Biota,12135380,urn:lsid:marinespecies.org:taxname:137130,,FALSE,,,,137130
5309483e-74e5-4710-b0bc-015896bd5fd2,Cepphus grylle,"(Linnaeus, 1758)",07/03/2005 11:41,-67.944,44.227,NA,,440203,137130,,FALSE,,,,137130
531cd955-89b3-4317-8af7-4904a18a06ca,Cepphus grylle,"(Linnaeus, 1758)",7/13/16 00:00,-65.21092,43.66998,Canadian Wildlife Service - Atlantic Region (CWS - Atlantic),,NS001322_BLGU_13388_2016-07-13,urn:lsid:marinespecies.org:taxname:137130,,FALSE,,,,137130
5340153e-5653-4aa8-b119-e68ee485b845,Cepphus grylle,"(Linnaeus, 1758)",07/02/2005 17:19,-68.032,44.3398,NA,,439903,137130,,FALSE,,,,137130
53835f42-1a49-4fd9-8b15-4cf8b7180f36,Cepphus grylle,"(Linnaeus, 1758)",05/06/2000,-68.5,53,ICES,DOME-Biota,12135339,urn:lsid:marinespecies.org:taxname:137130,,FALSE,,,,137130
5423abb9-b8e0-4001-9e0a-60cfbda967b2,Cepphus grylle,"(Linnaeus, 1758)",1978-06-25T13:30:00,-55.6833,51.2167,Canadian Wildlife Service,280,280_101836,urn:lsid:marinespecies.org:taxname:137130,,FALSE,,,,137130
547c92a3-3abb-47fe-8d19-8efc6809282f,Cepphus grylle,,,-60.68,55.89,"Canadian Wildlife Service-Atlantic, Environment Canada",,1380544464_-419975715_1899009644,urn:lsid:marinespecies.org:taxname:137130,,FALSE,,,,137130
54dbced5-5754-4239-bc75-8b07ee5812ce,Cepphus grylle,"(Linnaeus, 1758)",6/20/01 00:00,-55.66551,51.21659,Canadian Wildlife Service - Atlantic Region (CWS - Atlantic),,NF000641_BLGU_5773_2001-06-20,urn:lsid:marinespecies.org:taxname:137130,,FALSE,,,,137130
557e0246-bcf8-4f21-a5d5-3efadbdce1be,Cepphus grylle,,,-69.24,48.23,"Canadian Wildlife Service-Atlantic, Environment Canada",,1331997355_1659589272_1058836226,urn:lsid:marinespecies.org:taxname:137130,,FALSE,,,,137130
55de2e80-0af8-4ad3-9d91-caaf1bde4e9d,Cepphus grylle,"(Linnaeus, 1758)",1979-08-27T12:50:00,-61.5333,57.3,Canadian Wildlife Service,280,280_120913,urn:lsid:marinespecies.org:taxname:137130,,FALSE,,,,137130
55e6150b-746a-448d-9ce9-5b08865dbd4f,Cepphus grylle,,,-53.47,48.24,"Canadian Wildlife Service-Atlantic, Environment Canada",,1201195787_389260882_-1564086401,urn:lsid:marinespecies.org:taxname:137130,,FALSE,,,,137130
5654e291-606f-4c29-a72f-e469c8a64af0,Cepphus grylle,"(Linnaeus, 1758)",8/14/78 00:00,-60.11556,55.28334,Canadian Wildlife Service - Atlantic Region (CWS - Atlantic),,NF000833_BLGU_1933_1978-08-14,urn:lsid:marinespecies.org:taxname:137130,,FALSE,,,,137130
56b10d67-3df7-4a3b-aa2e-f58396a71138,Cepphus grylle,"(Linnaeus, 1758)",1978-08-28T12:50:00,-59.5167,55.2833,Canadian Wildlife Service,280,280_108583,urn:lsid:marinespecies.org:taxname:137130,,FALSE,,,,137130
56c0ec37-dd72-4f09-8b7e-c7998dc014b6,Cepphus grylle,"(Linnaeus, 1758)",1979-09-01T10:00:00,-61.05,55.9833,Canadian Wildlife Service,280,280_121188,urn:lsid:marinespecies.org:taxname:137130,,FALSE,,,,137130
56debdb0-e8be-4a3d-9857-dd267603fc5a,Cepphus grylle,"(Linnaeus, 1758)",1978-06-25T17:30:00,-55.3833,51.6167,Canadian Wildlife Service,280,280_101874,urn:lsid:marinespecies.org:taxname:137130,,FALSE,,,,137130
572252b9-b4a4-4d7f-9882-c235136e6a60,Cepphus grylle,,,-58.62,48.81,"Canadian Wildlife Service-Atlantic, Environment Canada",,896836590_-219990308_850970290,urn:lsid:marinespecies.org:taxname:137130,,FALSE,,,,137130
5765bd42-8e73-45de-8a8a-223ebb7bd3fc,Cepphus grylle,"(Linnaeus, 1758)",NA,-68.6053,44.108,USFWS,,670231,137130,,FALSE,,,,137130
57725092-f9f2-4cc3-8208-1a82514432bc,Cepphus grylle,,,-61.46,56.54,"Canadian Wildlife Service-Atlantic, Environment Canada",,1376494362_55566500_2096464624,urn:lsid:marinespecies.org:taxname:137130,,FALSE,,,,137130
5786ad89-b334-46a7-a087-00ac38807629,Cepphus grylle,,,-65.48,47.96,"Canadian Wildlife Service-Atlantic, Environment Canada",,58439636_1618661138_-1095168286,urn:lsid:marinespecies.org:taxname:137130,,FALSE,,,,137130
57c0e868-013d-4efd-953c-b1ca4bd41cb9,Cepphus grylle,"(Linnaeus, 1758)",08/07/1978 00:00,-61.01556,56.75004,Canadian Wildlife Service - Atlantic Region (CWS - Atlantic),,NF001014_BLGU_2167_1978-08-07,urn:lsid:marinespecies.org:taxname:137130,,FALSE,,,,137130
57c194ed-20d0-4969-b4b0-45b1ace3bbbe,Cepphus grylle,"(Linnaeus, 1758)",06/12/1986 00:00,-65.24892,47.78916,Canadian Wildlife Service - Atlantic Region (CWS - Atlantic),,NB000068_BLGU_83_1986-06-12,urn:lsid:marinespecies.org:taxname:137130,,FALSE,,,,137130
57e0ec24-023b-4dba-996c-c4a9be17fded,Cepphus grylle,"(Linnaeus, 1758)",7/17/10 00:00,-65.30579,43.60258,Canadian Wildlife Service - Atlantic Region (CWS - Atlantic),,NS002259_BLGU_12096_2010-07-17,urn:lsid:marinespecies.org:taxname:137130,,FALSE,,,,137130
57f27dee-a7ab-4290-8a9f-663a91518656,Cepphus grylle,"(Linnaeus, 1758)",1987-06-07T12:00:00Z,-66.01470947,43.39942169,ACCD,EOR,31453,urn:lsid:marinespecies.org:taxname:137130,,FALSE,,,,137130
584742a3-b335-44d7-aa3d-de188d1e5bd0,Cepphus grylle,,,-64.33,48.8,"Canadian Wildlife Service-Atlantic, Environment Canada",,58439636_-2132648506_1033847055,urn:lsid:marinespecies.org:taxname:137130,,FALSE,,,,137130
58581bde-52a8-42b0-896e-c3a45eab6ef8,Cepphus grylle,"(Linnaeus, 1758)",01/01/1942 00:00,-53.01548,48.63368,Canadian Wildlife Service - Atlantic Region (CWS - Atlantic),,NF000484_BLGU_1150_1942-01-01,urn:lsid:marinespecies.org:taxname:137130,,FALSE,,,,137130
58590506-d631-4b66-8040-98424deaf885,Cepphus grylle,"(Linnaeus, 1758)",1984-12-09T19:00:00,-68.9667,43.9833,Canadian Wildlife Service,280,280_182383,urn:lsid:marinespecies.org:taxname:137130,,FALSE,,,,137130
587fc949-daf8-44eb-bbc2-756111608a6e,Cepphus grylle,"(Linnaeus, 1758)",07/02/2001 12:00,-66.84238052,44.60393143,ACCD,EOR,31785,urn:lsid:marinespecies.org:taxname:137130,,FALSE,,,,137130
58878be9-f56e-4a36-826e-ac62a2f69220,Cepphus grylle,"(Linnaeus, 1758)",1973-06-20T09:05:00,-66.7333,45.0167,Canadian Wildlife Service,280,280_63102,urn:lsid:marinespecies.org:taxname:137130,,FALSE,,,,137130
5887bcbd-b728-4a89-a6f6-2b2d7fd0782f,Cepphus grylle,,,-58.44,49.22,"Canadian Wildlife Service-Atlantic, Environment Canada",,896836590_-1247343444_1705810302,urn:lsid:marinespecies.org:taxname:137130,,FALSE,,,,137130
58b0830a-5311-4f9e-b877-bd7772498c80,Cepphus grylle,"(Linnaeus, 1758)",06/04/1980 00:00,-60.39474,46.36617,Canadian Wildlife Service - Atlantic Region (CWS - Atlantic),,NS001108_BLGU_3177_1980-06-04,urn:lsid:marinespecies.org:taxname:137130,,FALSE,,,,137130
58d4e72d-bb13-469c-b04a-d3e3eeb674b2,Cepphus grylle,"(Linnaeus, 1758)",NA,-68.3555,44.1838,USFWS,,699441,137130,,FALSE,,,,137130
58f85e25-3dd6-4935-a40b-eea9604d59da,Cepphus grylle,"(Linnaeus, 1758)",8/13/78 00:00,-60.71556,56.08336,Canadian Wildlife Service - Atlantic Region (CWS - Atlantic),,NF000915_BLGU_2031_1978-08-13,urn:lsid:marinespecies.org:taxname:137130,,FALSE,,,,137130
593330a7-5688-429e-a2eb-ca328132ad70,Cepphus grylle,"(Linnaeus, 1758)",01/01/1974 00:00,-53.97346,47.69383,Canadian Wildlife Service - Atlantic Region (CWS - Atlantic),,NF000419_BLGU_1035_1974-01-01,urn:lsid:marinespecies.org:taxname:137130,,FALSE,,,,137130
593aae9e-3e03-4b93-baf0-fda3989c95c9,Cepphus grylle,"(Linnaeus, 1758)",1973-03-06T14:20:00,-59.1,50.0167,Canadian Wildlife Service,280,280_62816,urn:lsid:marinespecies.org:taxname:137130,,FALSE,,,,137130
59437bd3-13a7-49e7-a79b-9b7ac2587995,Cepphus grylle,"(Linnaeus, 1758)",1973-03-03T14:45:00,-60.8667,49.95,Canadian Wildlife Service,280,280_62793,urn:lsid:marinespecies.org:taxname:137130,,FALSE,,,,137130
59602db1-f1c5-4837-9879-501c0d84fd6c,Cepphus grylle,"(Linnaeus, 1758)",07/12/2012 00:00,-52.79882,48.11655,Canadian Wildlife Service - Atlantic Region (CWS - Atlantic),,NF000456_BLGU_10934_2012-07-12,urn:lsid:marinespecies.org:taxname:137130,,FALSE,,,,137130
596427c3-09cc-42fa-b55d-6152ff784249,Cepphus grylle,"(Linnaeus, 1758)",NA,-56.46667,54.5,NOAA,,68679,137130,,FALSE,,,,137130
59778fe7-f720-4328-b927-acb248f4f292,Cepphus grylle,"(Linnaeus, 1758)",01/01/1984 00:00,-52.97384,47.56655,Canadian Wildlife Service - Atlantic Region (CWS - Atlantic),,NF000365_BLGU_976_1984-01-01,urn:lsid:marinespecies.org:taxname:137130,,FALSE,,,,137130
5985570d-3a8e-417f-8c39-516e8410ce80,Cepphus grylle,,,-60.64,50.18,"Canadian Wildlife Service-Atlantic, Environment Canada",,-1636689528_-200338184_2012563070,urn:lsid:marinespecies.org:taxname:137130,,FALSE,,,,137130
599aa549-f909-4f49-ae1d-5ecb03659674,Cepphus grylle,"(Linnaeus, 1758)",8/15/78 00:00,-58.36551,54.88332,Canadian Wildlife Service - Atlantic Region (CWS - Atlantic),,NF000768_BLGU_1858_1978-08-15,urn:lsid:marinespecies.org:taxname:137130,,FALSE,,,,137130
59a0db81-f5ca-445b-82df-0c3ba5736ced,Cepphus grylle,,,-54.71,51.76,"Canadian Wildlife Service-Atlantic, Environment Canada",,1278617075_-302558103_-678417290,urn:lsid:marinespecies.org:taxname:137130,,FALSE,,,,137130
59b071e6-9e5f-4375-be96-54ec5e6a6b5a,Cepphus grylle,"(Linnaeus, 1758)",01/01/1971 00:00,-59.79065,45.93857,Canadian Wildlife Service - Atlantic Region (CWS - Atlantic),,NS001328_BLGU_3103_1971-01-01,urn:lsid:marinespecies.org:taxname:137130,,FALSE,,,,137130
59b372eb-9e50-4147-9501-8a52ce486077,Cepphus grylle,,,-60.62,50.18,"Canadian Wildlife Service-Atlantic, Environment Canada",,-1636689528_-1527585818_-1927421039,urn:lsid:marinespecies.org:taxname:137130,,FALSE,,,,137130
59f7f738-f3c7-4de8-abc5-457c102c0466,Cepphus grylle,,,-63.51,44.5,"Canadian Wildlife Service-Atlantic, Environment Canada",,1375807454_91559737_983635995,urn:lsid:marinespecies.org:taxname:137130,,FALSE,,,,137130
5a2e0c62-e15c-4b94-91e3-d2a3757604dd,Cepphus grylle,"(Linnaeus, 1758)",1990-06-23T12:00:00Z,-59.79985809,46.12871933,ACCD,EOR,31511,urn:lsid:marinespecies.org:taxname:137130,,FALSE,,,,137130
5a74d08b-b14f-43a3-9e5f-a6c7662c4444,Cepphus grylle,"(Linnaeus, 1758)",07/02/2005 15:15,-68.2225,44.1682,NA,,439872,137130,,FALSE,,,,137130
5aac6d33-f063-4e64-91f8-a071b8bf9c22,Cepphus grylle,"(Linnaeus, 1758)",7/18/86 00:00,-52.85385,47.14655,Canadian Wildlife Service - Atlantic Region (CWS - Atlantic),,NF000274_BLGU_724_1986-07-18_1130,urn:lsid:marinespecies.org:taxname:137130,,FALSE,,,,137130
5abd31d0-8df3-41fd-b7b5-9b6e844cff61,Cepphus grylle,"(Linnaeus, 1758)",1981-02-15T10:10:00,-57.8333,47.5,Canadian Wildlife Service,280,280_138766,urn:lsid:marinespecies.org:taxname:137130,,FALSE,,,,137130
5ad828f4-c930-4a6e-91f6-4865658b68c3,Cepphus grylle,"(Linnaeus, 1758)",NA,-69.4239,41.0167,"BOEM, USFWS, NOAA, NAVY",,731787,137130,,FALSE,,,,137130
5b38d4bf-5b89-46dc-80b4-77ff5c54561d,Cepphus grylle,"(Linnaeus, 1758)",1996-06-17T12:00:00Z,-66.81989288,44.60799026,ACCD,EOR,31406,urn:lsid:marinespecies.org:taxname:137130,,FALSE,,,,137130
5b614536-8b68-4733-89b4-c3f72513136a,Cepphus grylle,"(Linnaeus, 1758)",1979-08-04T15:15:00,-57.1667,54.6,Canadian Wildlife Service,280,280_117596,urn:lsid:marinespecies.org:taxname:137130,,FALSE,,,,137130
5b748ab5-85ef-4027-b2af-beef09f9736c,Cepphus grylle,,,-57.88,51.3,"Canadian Wildlife Service-Atlantic, Environment Canada",,-1636689528_984924356_2131526213,urn:lsid:marinespecies.org:taxname:137130,,FALSE,,,,137130
5baf2217-5b99-4980-83b6-3df6e2122562,Cepphus grylle,"(Linnaeus, 1758)",1990-07-06T12:00:00Z,-66.76948547,44.79608154,ACCD,EOR,31773,urn:lsid:marinespecies.org:taxname:137130,,FALSE,,,,137130
5bba613a-29c6-477e-b7c5-3e6f7fcc1f47,Cepphus grylle,"(Linnaeus, 1758)",05/06/2000,-68.5,53,ICES,DOME-Biota,12135346,urn:lsid:marinespecies.org:taxname:137130,,FALSE,,,,137130
5bdd553d-e0da-4596-bbec-a070ec1cba69,Cepphus grylle,,,-61.45,56.54,"Canadian Wildlife Service-Atlantic, Environment Canada",,1223666941_123557897_1641938267,urn:lsid:marinespecies.org:taxname:137130,,FALSE,,,,137130
5bf9058a-db0c-477a-aa02-d693d4738247,Cepphus grylle,"(Linnaeus, 1758)",7/26/06 10:19,-68.2268,44.1793,NA,,6004,137130,,FALSE,,,,137130
5c013727-ffb1-4221-9cfc-e8d9e3ac0a3e,Cepphus grylle,"(Linnaeus, 1758)",7/22/05 09:29,-68.2352,44.1539,NA,,440924,137130,,FALSE,,,,137130
5c022da4-387d-4c71-9699-b6c01e14be7a,Cepphus grylle,"(Linnaeus, 1758)",01/01/2001 00:00,-66.80682,44.60235,Canadian Wildlife Service - Atlantic Region (CWS - Atlantic),,NB000091_BLGU_5401_2001-01-01,urn:lsid:marinespecies.org:taxname:137130,,FALSE,,,,137130
5c4fd7c2-66d0-454d-acbd-d4e307e35ff6,Cepphus grylle,"(Linnaeus, 1758)",01/01/1943 00:00,-55.66551,51.21659,Canadian Wildlife Service - Atlantic Region (CWS - Atlantic),,NF000641_BLGU_1642_1943-01-01,urn:lsid:marinespecies.org:taxname:137130,,FALSE,,,,137130
5c86e619-c6a6-4cb3-a339-53771e1da35a,Cepphus grylle,,,-52.22,53.61,"Canadian Wildlife Service-Atlantic, Environment Canada",,1258482491_1258806681_-1657654190,urn:lsid:marinespecies.org:taxname:137130,,FALSE,,,,137130
5c985be3-c500-4eab-9dbc-687da359a19c,Cepphus grylle,"(Linnaeus, 1758)",1978-06-25T18:20:00,-55.4667,51.6667,Canadian Wildlife Service,280,280_101883,urn:lsid:marinespecies.org:taxname:137130,,FALSE,,,,137130
5cb0b2fd-f868-4981-90cd-b2535ae3a1fb,Cepphus grylle,"(Linnaeus, 1758)",06/06/2014 00:00,-66.76369,44.59527,Canadian Wildlife Service - Atlantic Region (CWS - Atlantic),,NB002440_BLGU_13723_2014-06-06,urn:lsid:marinespecies.org:taxname:137130,,FALSE,,,,137130
5cbb4b48-bf6f-43f1-8578-906fa1b162bb,Cepphus grylle,"(Linnaeus, 1758)",1987-07-25T12:00:00Z,-60.94079971,46.71197891,ACCD,EOR,31493,urn:lsid:marinespecies.org:taxname:137130,,FALSE,,,,137130
5cec2671-6681-4d56-b35c-5264233d05c4,Cepphus grylle,"(Linnaeus, 1758)",8/15/78 00:00,-57.88215,54.89998,Canadian Wildlife Service - Atlantic Region (CWS - Atlantic),,NF000771_BLGU_1861_1978-08-15,urn:lsid:marinespecies.org:taxname:137130,,FALSE,,,,137130
5cf078db-3e0d-435d-a442-7abe9bca1e66,Cepphus grylle,"(Linnaeus, 1758)",08/10/1978 00:00,-60.60973,56.20328,Canadian Wildlife Service - Atlantic Region (CWS - Atlantic),,NF000936_BLGU_2060_1978-08-10,urn:lsid:marinespecies.org:taxname:137130,,FALSE,,,,137130
5d0df447-86b9-4629-99b7-1a67ec2395d7,Cepphus grylle,"(Linnaeus, 1758)",NA,-68.5605,44.1075,USFWS,,670227,137130,,FALSE,,,,137130
5d464964-c015-43f6-bfef-42823035dfbe,Cepphus grylle,,,-69.72,47.8,"Canadian Wildlife Service-Atlantic, Environment Canada",,1286797999_1397874171_-1860723538,urn:lsid:marinespecies.org:taxname:137130,,FALSE,,,,137130
5d524200-07c4-42ed-bae9-980f1e8da0e0,Cepphus grylle,"(Linnaeus, 1758)",01/01/1979 00:00,-52.78007,47.23825,Canadian Wildlife Service - Atlantic Region (CWS - Atlantic),,NF000290_BLGU_793_1979-01-01,urn:lsid:marinespecies.org:taxname:137130,,FALSE,,,,137130
5d856e6d-6131-4e24-94f4-a473589996b0,Cepphus grylle,"(Linnaeus, 1758)",7/17/05 00:00,-64.04913,44.38377,Canadian Wildlife Service - Atlantic Region (CWS - Atlantic),,NS001336_BLGU_8099_2005-07-17,urn:lsid:marinespecies.org:taxname:137130,,FALSE,,,,137130
5d8a48a1-0817-48d1-aec8-8ba6094179d0,Cepphus grylle,"(Linnaeus, 1758)",1979-08-29T08:20:00,-61.35,56.2833,Canadian Wildlife Service,280,280_121054,urn:lsid:marinespecies.org:taxname:137130,,FALSE,,,,137130
5de00d92-bd25-47e9-9bdb-2f3ca1258454,Cepphus grylle,"(Linnaeus, 1758)",01/01/1979 00:00,-52.7804,47.23832,Canadian Wildlife Service - Atlantic Region (CWS - Atlantic),,NF000298_BLGU_831_1979-01-01,urn:lsid:marinespecies.org:taxname:137130,,FALSE,,,,137130
5de293c6-1261-4e04-93db-79b0308fb893,Cepphus grylle,"(Linnaeus, 1758)",7/26/05 10:15,-68.2371,44.1415,NA,,441199,137130,,FALSE,,,,137130
5e28114d-e5bc-4749-99a3-81bbfbd75cc2,Cepphus grylle,"(Linnaeus, 1758)",01/01/1971 00:00,-59.81782,46.18078,Canadian Wildlife Service - Atlantic Region (CWS - Atlantic),,NS001255_BLGU_3134_1971-01-01,urn:lsid:marinespecies.org:taxname:137130,,FALSE,,,,137130
5e6aa3ea-6382-49f6-a56d-ca8ef978dfa8,Cepphus grylle,"(Linnaeus, 1758)",6/26/16 00:00,-65.67671,43.4204,Canadian Wildlife Service - Atlantic Region (CWS - Atlantic),,NS003106_BLGU_13323_2016-06-26,urn:lsid:marinespecies.org:taxname:137130,,FALSE,,,,137130
5e8db229-eecb-4400-ab1d-b10b0925c17f,Cepphus grylle,,,-65.72,49.31,"Canadian Wildlife Service-Atlantic, Environment Canada",,689065724_-25160015_-996693548,urn:lsid:marinespecies.org:taxname:137130,,FALSE,,,,137130
5e9cd9d5-221c-4c09-9ce1-83c47f7da943,Cepphus grylle,"(Linnaeus, 1758)",NA,-68.6328,44.0167,"BOEM, USFWS, NOAA, NAVY",,727926,137130,,FALSE,,,,137130
5eb71657-15af-4661-8ae6-b51d8c57e7ef,Cepphus grylle,"(Linnaeus, 1758)",1979-08-27T13:10:00,-61.55,57.2333,Canadian Wildlife Service,280,280_120921,urn:lsid:marinespecies.org:taxname:137130,,FALSE,,,,137130
5ed5df06-e9b7-4c95-8c06-cfd91457087b,Cepphus grylle,"(Linnaeus, 1758)",1969-07-30T09:50:00,-52.6,47.55,Canadian Wildlife Service,280,280_16049,urn:lsid:marinespecies.org:taxname:137130,,FALSE,,,,137130
5ee17f56-7874-4d46-8ef0-95bea23c3fa0,Cepphus grylle,"(Linnaeus, 1758)",NA,-68.96667,43.98333,NA,,129306,137130,,FALSE,,,,137130
5ee5b46c-080c-4e3e-845a-e2c4fc524db3,Cepphus grylle,"(Linnaeus, 1758)",7/19/06 12:48,-68.0411,44.3343,NA,,5601,137130,,FALSE,,,,137130
5f617328-0891-463f-b053-145d2a22066e,Cepphus grylle,,,-61.9,46.49,"Canadian Wildlife Service-Atlantic, Environment Canada",,-1933920140_745585476_1708063604,urn:lsid:marinespecies.org:taxname:137130,,FALSE,,,,137130
5f845a8e-8c4d-4a8d-b15b-1d9e5924b12d,Cepphus grylle,"(Linnaeus, 1758)",5/23/02 00:00,-63.78475,44.45143,Canadian Wildlife Service - Atlantic Region (CWS - Atlantic),,NS001448_BLGU_6559_2002-05-23,urn:lsid:marinespecies.org:taxname:137130,,FALSE,,,,137130
5fc20e6f-c00f-4674-a881-36be651d1986,Cepphus grylle,"(Linnaeus, 1758)",01/01/1989 00:00,-53.73217,48.71656,Canadian Wildlife Service - Atlantic Region (CWS - Atlantic),,NF000494_BLGU_1184_1989-01-01,urn:lsid:marinespecies.org:taxname:137130,,FALSE,,,,137130
5fcfd2ec-fc70-455c-8283-6bbf5278d8ab,Cepphus grylle,"(Linnaeus, 1758)",1981-02-15T06:20:00,-58.8333,47.5,Canadian Wildlife Service,280,280_138669,urn:lsid:marinespecies.org:taxname:137130,,FALSE,,,,137130
5ff5b7b2-6397-4cab-97cb-716057c56cf1,Cepphus grylle,,,-65.48,47.96,"Canadian Wildlife Service-Atlantic, Environment Canada",,1421648014_713944272_951380107,urn:lsid:marinespecies.org:taxname:137130,,FALSE,,,,137130
602bc11d-64d4-4a0c-ba0b-ed7e6514f25d,Cepphus grylle,"(Linnaeus, 1758)",1969-06-27T09:30:00,-65.7667,43.1833,Canadian Wildlife Service,280,280_11076,urn:lsid:marinespecies.org:taxname:137130,,FALSE,,,,137130
603ddd38-bb3c-4780-99e2-820825d316d6,Cepphus grylle,"(Linnaeus, 1758)",7/26/06 10:22,-68.2371,44.1578,NA,,6007,137130,,FALSE,,,,137130
60702a86-16ab-45fb-9f32-2b1ae85efe6b,Cepphus grylle,"(Linnaeus, 1758)",NA,-70.6855,42.2765,USFWS,,669496,137130,,FALSE,,,,137130
6111c5f2-81b9-42be-a130-914ba16200a1,Cepphus grylle,"(Linnaeus, 1758)",06/10/1971 00:00,-65.03027,43.68431,Canadian Wildlife Service - Atlantic Region (CWS - Atlantic),,NS001323_BLGU_2319_1971-06-10,urn:lsid:marinespecies.org:taxname:137130,,FALSE,,,,137130
6170eccf-b001-4fc5-ba73-ea6d115386ad,Cepphus grylle,,,-64.12,48.04,"Canadian Wildlife Service-Atlantic, Environment Canada",,-1636689528_-523760600_-449426499,urn:lsid:marinespecies.org:taxname:137130,,FALSE,,,,137130
617f0b0c-358d-4600-a42c-a1f219a049eb,Cepphus grylle,"(Linnaeus, 1758)",1979-08-18T12:00:00,-63.5167,59.3167,Canadian Wildlife Service,280,280_119741,urn:lsid:marinespecies.org:taxname:137130,,FALSE,,,,137130
619081b7-b6e0-446a-a911-9902d3852c7f,Cepphus grylle,"(Linnaeus, 1758)",1990-08-08T12:00:00Z,-61.36120987,46.17232895,ACCD,EOR,31486,urn:lsid:marinespecies.org:taxname:137130,,FALSE,,,,137130
61c37e47-5168-4026-b026-a88acf6111fe,Cepphus grylle,"(Linnaeus, 1758)",NA,-69.5813,41.1831,USFWS,,679259,137130,,FALSE,,,,137130
61ff0616-c0be-4115-ac83-bcc44bb56f60,Cepphus grylle,"(Linnaeus, 1758)",1973-03-02T15:50:00,-61.5833,49.9,Canadian Wildlife Service,280,280_62780,urn:lsid:marinespecies.org:taxname:137130,,FALSE,,,,137130
62067845-73bb-441c-879c-9d8933f4cfe1,Cepphus grylle,"(Linnaeus, 1758)",7/29/05 08:56,-68.0566,44.3251,NA,,441359,137130,,FALSE,,,,137130
62792628-ce21-4fad-a6da-b38b1a0d556a,Cepphus grylle,"(Linnaeus, 1758)",05/06/1999,-68.5,53,ICES,DOME-Biota,12135596,urn:lsid:marinespecies.org:taxname:137130,,FALSE,,,,137130
62b7c9e0-befc-4632-b52d-736ea8d38195,Cepphus grylle,"(Linnaeus, 1758)",NA,-68.5366,44.1083,USFWS,,670223,137130,,FALSE,,,,137130
62e99281-1c76-4d35-a8c0-f39d8141c3ac,Cepphus grylle,"(Linnaeus, 1758)",5/22/14 00:00,-61.5426,45.10182,Canadian Wildlife Service - Atlantic Region (CWS - Atlantic),,NS002232_BLGU_12451_2014-05-22,urn:lsid:marinespecies.org:taxname:137130,,FALSE,,,,137130
6355c049-eea3-4057-92cf-8f33e8a50b56,Cepphus grylle,"(Linnaeus, 1758)",07/03/1986 12:00,-63.9756012,46.87931824,ACCD,EOR,31702,urn:lsid:marinespecies.org:taxname:137130,,FALSE,,,,137130
637381fc-e0e2-4869-89ed-b2fb3596a686,Cepphus grylle,"(Linnaeus, 1758)",8/13/09 00:00,-64.04913,44.38377,Canadian Wildlife Service - Atlantic Region (CWS - Atlantic),,NS001336_BLGU_12097_2009-08-13,urn:lsid:marinespecies.org:taxname:137130,,FALSE,,,,137130
63755783-ec0f-41d9-a060-d0c744c22012,Cepphus grylle,"(Linnaeus, 1758)",07/02/2005 14:31,-68.2882,44.262,NA,,439856,137130,,FALSE,,,,137130
63c09e49-7daf-447a-8a0a-77a2661adbbf,Cepphus grylle,"(Linnaeus, 1758)",6/18/02 00:00,-57.68257,47.58152,Canadian Wildlife Service - Atlantic Region (CWS - Atlantic),,NF000374_BLGU_6407_2002-06-18,urn:lsid:marinespecies.org:taxname:137130,,FALSE,,,,137130
6432ed5a-f780-44d0-b018-760386b2bbac,Cepphus grylle,"(Linnaeus, 1758)",1973-02-28T12:05:00,-67.95,49.0333,Canadian Wildlife Service,280,280_62755,urn:lsid:marinespecies.org:taxname:137130,,FALSE,,,,137130
64652db0-55a4-4448-8986-aec8ceb5c306,Cepphus grylle,"(Linnaeus, 1758)",1979-12-03T07:40:00,-65.25,43.6333,Canadian Wildlife Service,280,280_122155,urn:lsid:marinespecies.org:taxname:137130,,FALSE,,,,137130
64a5ef92-2aa9-4575-b911-755a88d318fd,Cepphus grylle,"(Linnaeus, 1758)",1969-05-14T12:30:00,-54.1333,51.4167,Canadian Wildlife Service,280,280_4245,urn:lsid:marinespecies.org:taxname:137130,,FALSE,,,,137130
64e5d30f-46c1-445c-b7f6-3137a2fec97a,Cepphus grylle,"(Linnaeus, 1758)",6/15/02 00:00,-56.34584,47.14654,Canadian Wildlife Service - Atlantic Region (CWS - Atlantic),,NF002973_BLGU_6332_2002-06-15,urn:lsid:marinespecies.org:taxname:137130,,FALSE,,,,137130
64ef2150-cf09-4a6f-8cfb-2682926c3d98,Cepphus grylle,,,-64.33,48.8,"Canadian Wildlife Service-Atlantic, Environment Canada",,58439636_1031009240_263154133,urn:lsid:marinespecies.org:taxname:137130,,FALSE,,,,137130
65105ecf-2025-4000-8448-50b78d594428,Cepphus grylle,,,-64,44.49,"Canadian Wildlife Service-Atlantic, Environment Canada",,-1815568076_-484171021_-1568639304,urn:lsid:marinespecies.org:taxname:137130,,FALSE,,,,137130
65229ff9-fa8a-4185-8c11-173eaa5e60df,Cepphus grylle,"(Linnaeus, 1758)",01/01/1975 00:00,-54.54389,47.3599,Canadian Wildlife Service - Atlantic Region (CWS - Atlantic),,NF000310_BLGU_883_1975-01-01,urn:lsid:marinespecies.org:taxname:137130,,FALSE,,,,137130
6533bcdc-fd5d-4597-9988-37c2cec6e5f5,Cepphus grylle,"(Linnaeus, 1758)",05/06/2000,-68.5,53,ICES,DOME-Biota,12135334,urn:lsid:marinespecies.org:taxname:137130,,FALSE,,,,137130
655b82ad-91cd-4233-b6d6-4a986468663d,Cepphus grylle,"(Linnaeus, 1758)",1979-08-29T08:00:00,-61.2667,56.3333,Canadian Wildlife Service,280,280_121043,urn:lsid:marinespecies.org:taxname:137130,,FALSE,,,,137130
6572b7b8-b9e7-4f11-a9c8-6f6f61170c5f,Cepphus grylle,"(Linnaeus, 1758)",8/28/08 00:00,-66.90648,44.99921,Canadian Wildlife Service - Atlantic Region (CWS - Atlantic),,NB003338_BLGU_11970_2008-08-28,urn:lsid:marinespecies.org:taxname:137130,,FALSE,,,,137130
65b195d1-21d6-4657-8db1-5107622ad1e8,Cepphus grylle,"(Linnaeus, 1758)",07/02/1990 12:00,-66.01338959,43.4263916,ACCD,EOR,31454,urn:lsid:marinespecies.org:taxname:137130,,FALSE,,,,137130
65b4ccaa-936f-45fc-a326-178a0a54de85,Cepphus grylle,,,-65.33,43.69,"Canadian Wildlife Service-Atlantic, Environment Canada",,1280325370_1138062321_-88131254,urn:lsid:marinespecies.org:taxname:137130,,FALSE,,,,137130
65c0907f-6937-4f5f-af38-c58d54200e15,Cepphus grylle,"(Linnaeus, 1758)",01/01/1986 00:00,-54.06388,47.13323,Canadian Wildlife Service - Atlantic Region (CWS - Atlantic),,NF000270_BLGU_710_1986-01-01,urn:lsid:marinespecies.org:taxname:137130,,FALSE,,,,137130
65d9a005-16e7-43ad-8812-26e414e66668,Cepphus grylle,"(Linnaeus, 1758)",6/21/01 00:00,-55.88397,50.19502,Canadian Wildlife Service - Atlantic Region (CWS - Atlantic),,NF002704_BLGU_5816_2001-06-21,urn:lsid:marinespecies.org:taxname:137130,,FALSE,,,,137130
65dc6559-eb00-462a-b117-bdbab86e618f,Cepphus grylle,"(Linnaeus, 1758)",1973-03-03T14:45:00,-60.8667,49.95,Canadian Wildlife Service,280,280_62792,urn:lsid:marinespecies.org:taxname:137130,,FALSE,,,,137130
65f913d6-05fe-4a10-8c54-70123d9ae145,Cepphus grylle,,,-64.48,49.79,"Canadian Wildlife Service-Atlantic, Environment Canada",,843543794_663784915_-1854945790,urn:lsid:marinespecies.org:taxname:137130,,FALSE,,,,137130
663ae004-c0fe-419b-8e69-75c777c02d13,Cepphus grylle,"(Linnaeus, 1758)",01/01/1971 00:00,-59.79406,45.96225,Canadian Wildlife Service - Atlantic Region (CWS - Atlantic),,NS001330_BLGU_3110_1971-01-01,urn:lsid:marinespecies.org:taxname:137130,,FALSE,,,,137130
663f799c-de93-44b7-8b3e-107469545c69,Cepphus grylle,,,-58.42,49.23,"Canadian Wildlife Service-Atlantic, Environment Canada",,896836590_1455054831_986547960,urn:lsid:marinespecies.org:taxname:137130,,FALSE,,,,137130
669787f1-ae88-490b-82cb-176b0afb6199,Cepphus grylle,,,-59.04,48.68,"Canadian Wildlife Service-Atlantic, Environment Canada",,896836590_43671710_1658272150,urn:lsid:marinespecies.org:taxname:137130,,FALSE,,,,137130
66ae0171-3d88-40c0-ab9e-9fd2e65593f1,Cepphus grylle,"(Linnaeus, 1758)",06/04/1975 12:00,-66.16333008,48.00999832,ACCD,EOR,31416,urn:lsid:marinespecies.org:taxname:137130,,FALSE,,,,137130
66fd6e72-0b6e-4c96-8f77-e742e6184f8d,Cepphus grylle,"(Linnaeus, 1758)",1979-07-15T13:10:00,-55.7,49.6833,Canadian Wildlife Service,280,280_116051,urn:lsid:marinespecies.org:taxname:137130,,FALSE,,,,137130
670fa57c-084a-466e-b68b-9c1e89ecd5dd,Cepphus grylle,"(Linnaeus, 1758)",8/13/78 00:00,-59.81555,55.43334,Canadian Wildlife Service - Atlantic Region (CWS - Atlantic),,NF000862_BLGU_1962_1978-08-13,urn:lsid:marinespecies.org:taxname:137130,,FALSE,,,,137130
6749c0c6-0ead-4a4c-b9d3-d6a6457bf7a4,Cepphus grylle,"(Linnaeus, 1758)",1980-12-21T19:00:00,-70.2833,42.0667,Canadian Wildlife Service,280,280_137101,urn:lsid:marinespecies.org:taxname:137130,,FALSE,,,,137130
676dc7f6-400e-4363-ba22-fcda9feefbac,Cepphus grylle,,,-64.56,48.33,"Canadian Wildlife Service-Atlantic, Environment Canada",,689065724_2012113659_1406552044,urn:lsid:marinespecies.org:taxname:137130,,FALSE,,,,137130
676e46ce-f484-48f1-99f7-9a7006ff5bd9,Cepphus grylle,,,-65.43,47.96,"Canadian Wildlife Service-Atlantic, Environment Canada",,-635145613_1773615783_-301416743,urn:lsid:marinespecies.org:taxname:137130,,FALSE,,,,137130
6783ac73-f821-4852-9ad8-f8051cfd971d,Cepphus grylle,,,-60.79,55.95,"Canadian Wildlife Service-Atlantic, Environment Canada",,1380544464_-1842477452_1692621413,urn:lsid:marinespecies.org:taxname:137130,,FALSE,,,,137130
67883c4e-b9d3-4473-b69a-043423c4fbfd,Cepphus grylle,"(Linnaeus, 1758)",1980-08-29T17:40:00,-61.1833,56.4167,Canadian Wildlife Service,280,280_134459,urn:lsid:marinespecies.org:taxname:137130,,FALSE,,,,137130
67a25bb4-d737-4dca-b6a6-ee0f9b531e98,Cepphus grylle,"(Linnaeus, 1758)",7/26/05 13:35,-68.1811,44.2238,NA,,441247,137130,,FALSE,,,,137130
67da3ac7-5720-4759-b955-af46d01c5633,Cepphus grylle,,,-58.44,49.22,"Canadian Wildlife Service-Atlantic, Environment Canada",,896836590_-759184835_1168676560,urn:lsid:marinespecies.org:taxname:137130,,FALSE,,,,137130
67dd574e-b6c2-4013-aa0a-53de3cd398ca,Cepphus grylle,"(Linnaeus, 1758)",07/12/2012 00:00,-52.81221,48.12609,Canadian Wildlife Service - Atlantic Region (CWS - Atlantic),,NF000457_BLGU_10940_2012-07-12,urn:lsid:marinespecies.org:taxname:137130,,FALSE,,,,137130
68254152-f5aa-426e-86bc-e296cd751b18,Cepphus grylle,"(Linnaeus, 1758)",01/01/1973 00:00,-67.10187,44.50182,Canadian Wildlife Service - Atlantic Region (CWS - Atlantic),,NB000085_BLGU_141_1973-01-01,urn:lsid:marinespecies.org:taxname:137130,,FALSE,,,,137130
68269249-1b1a-4eb5-a642-8a636257f073,Cepphus grylle,,,-65.5,47.97,"Canadian Wildlife Service-Atlantic, Environment Canada",,58439636_-1501511847_-1469972210,urn:lsid:marinespecies.org:taxname:137130,,FALSE,,,,137130
6831d21c-b333-493c-a0d8-4bc063bd8c81,Cepphus grylle,"(Linnaeus, 1758)",1972-02-04T12:20:00,-53.1167,46.6,Canadian Wildlife Service,280,280_55430,urn:lsid:marinespecies.org:taxname:137130,,FALSE,,,,137130
685144d3-1841-488f-8663-a934078b57b0,Cepphus grylle,"(Linnaeus, 1758)",8/13/78 00:00,-60.46555,56.05002,Canadian Wildlife Service - Atlantic Region (CWS - Atlantic),,NF000911_BLGU_2019_1978-08-13,urn:lsid:marinespecies.org:taxname:137130,,FALSE,,,,137130
686adcca-9aaa-43f4-8bf4-c733a1212c6d,Cepphus grylle,"(Linnaeus, 1758)",7/18/89 12:00,-66.16799927,48.00320816,ACCD,EOR,31451,urn:lsid:marinespecies.org:taxname:137130,,FALSE,,,,137130
6884954b-8ac4-4fa4-9c89-f64863af7ff9,Cepphus grylle,"(Linnaeus, 1758)",05/06/2000,-68.5,53,ICES,DOME-Biota,12135349,urn:lsid:marinespecies.org:taxname:137130,,FALSE,,,,137130
689600c2-c374-485d-9503-5e447e7cf884,Cepphus grylle,"(Linnaeus, 1758)",NA,-68.8951,43.9419,USFWS,,670126,137130,,FALSE,,,,137130
68a0408d-aebb-4b40-9e85-9830861845e5,Cepphus grylle,"(Linnaeus, 1758)",7/25/89 12:00,-66.70659637,44.62926865,ACCD,EOR,31446,urn:lsid:marinespecies.org:taxname:137130,,FALSE,,,,137130
68ca7aed-fd67-4e4f-8ddd-4010b64ca93a,Cepphus grylle,"(Linnaeus, 1758)",NA,-69.5762,41.607,USFWS,,681043,137130,,FALSE,,,,137130
68edd1db-ed99-42b3-9e15-764f131fca8d,Cepphus grylle,,,-53.3,50.59,"Canadian Wildlife Service-Atlantic, Environment Canada",,1380828098_117898386_82476657,urn:lsid:marinespecies.org:taxname:137130,,FALSE,,,,137130
68f45728-d8e3-46bb-a6da-22c09011c0d5,Cepphus grylle,,,-61.79,47.34,"Canadian Wildlife Service-Atlantic, Environment Canada",,-1614583778_1243567850_-775098602,urn:lsid:marinespecies.org:taxname:137130,,FALSE,,,,137130
6921ab63-dcbe-46fb-9539-f0d04630c67e,Cepphus grylle,"(Linnaeus, 1758)",6/29/11 00:00,-52.7804,47.23832,Canadian Wildlife Service - Atlantic Region (CWS - Atlantic),,NF000298_BLGU_10007_2011-06-29,urn:lsid:marinespecies.org:taxname:137130,,FALSE,,,,137130
69292561-f3c5-41aa-ad05-7e9a52068e0e,Cepphus grylle,,,-59.76,45.88,"Canadian Wildlife Service-Atlantic, Environment Canada",,1207827508_162753551_-62328053,urn:lsid:marinespecies.org:taxname:137130,,FALSE,,,,137130
69299098-9647-43a7-ac62-fccef3af1327,Cepphus grylle,"(Linnaeus, 1758)",1976-08-02T07:45:00,-62.5833,58.5333,Canadian Wildlife Service,280,280_75018,urn:lsid:marinespecies.org:taxname:137130,,FALSE,,,,137130
69480553-4f45-4ec1-b6a0-b14a48154de1,Cepphus grylle,"(Linnaeus, 1758)",05/06/1999,-68.5,53,ICES,DOME-Biota,12135599,urn:lsid:marinespecies.org:taxname:137130,,FALSE,,,,137130
6970b3ec-9928-45c4-8299-86049ff62644,Cepphus grylle,"(Linnaeus, 1758)",5/24/80 00:00,-60.06687,45.81714,Canadian Wildlife Service - Atlantic Region (CWS - Atlantic),,NS001357_BLGU_3052_1980-05-24,urn:lsid:marinespecies.org:taxname:137130,,FALSE,,,,137130
6997a51a-0b8c-4cfb-95f7-5041dc4aa070,Cepphus grylle,,,-59.1,55.14,"Canadian Wildlife Service-Atlantic, Environment Canada",,1406113415_-628641531_1406321775,urn:lsid:marinespecies.org:taxname:137130,,FALSE,,,,137130
6997c387-4ac7-464c-a312-0da17eb92327,Cepphus grylle,"(Linnaeus, 1758)",6/21/05 13:45,-68.2034,44.1939,NA,,439639,137130,,FALSE,,,,137130
69d94f85-9b30-43d9-aaa1-005e53e8899e,Cepphus grylle,"(Linnaeus, 1758)",5/31/92 00:00,-66.80682,44.60235,Canadian Wildlife Service - Atlantic Region (CWS - Atlantic),,NB000091_BLGU_5030_1992-05-31,urn:lsid:marinespecies.org:taxname:137130,,FALSE,,,,137130
69f2acfe-5637-4c3b-afa2-379b40153d89,Cepphus grylle,"(Linnaeus, 1758)",1989-07-15T12:00:00Z,-66.14932632,43.63722038,ACCD,EOR,31806,urn:lsid:marinespecies.org:taxname:137130,,FALSE,,,,137130
6a05c368-1db9-4014-b80f-38fc6acb279c,Cepphus grylle,,,-69.75,47.79,"Canadian Wildlife Service-Atlantic, Environment Canada",,1286797999_888985001_824664986,urn:lsid:marinespecies.org:taxname:137130,,FALSE,,,,137130
6a0c0afb-1f07-4331-b69a-c41216c362fe,Cepphus grylle,"(Linnaeus, 1758)",6/20/00,-68.5,53,ICES,DOME-Biota,12135375,urn:lsid:marinespecies.org:taxname:137130,,FALSE,,,,137130
6a5a44da-ac7d-4df2-bef3-c5384ae00f8d,Cepphus grylle,,,-59.27,48.46,"Canadian Wildlife Service-Atlantic, Environment Canada",,896836590_125560154_-518548361,urn:lsid:marinespecies.org:taxname:137130,,FALSE,,,,137130
6b144352-ff00-43f7-aa01-5a7f95ef6811,Cepphus grylle,"(Linnaeus, 1758)",06/04/1980 00:00,-60.37579,46.38324,Canadian Wildlife Service - Atlantic Region (CWS - Atlantic),,NS001109_BLGU_3192_1980-06-04,urn:lsid:marinespecies.org:taxname:137130,,FALSE,,,,137130
6b1d7670-9b33-4fb2-b01c-7a6eded463ad,Cepphus grylle,"(Linnaeus, 1758)",,-66.71666718,44.96667099,ACCD,EOR,31401,urn:lsid:marinespecies.org:taxname:137130,,FALSE,,,,137130
6b633a78-edf8-4ada-bba7-ad5724d43d53,Cepphus grylle,,,-65.04,48.01,"Canadian Wildlife Service-Atlantic, Environment Canada",,545832393_-1563779192_13766914,urn:lsid:marinespecies.org:taxname:137130,,FALSE,,,,137130
6ba1f53f-b234-4858-85d3-aa671d70c85f,Cepphus grylle,"(Linnaeus, 1758)",8/29/02 00:00,-66.87169,44.99206,Canadian Wildlife Service - Atlantic Region (CWS - Atlantic),,NB002496_BLGU_5595_2002-08-29_9:32,urn:lsid:marinespecies.org:taxname:137130,,FALSE,,,,137130
6baa1fbc-1d71-46e9-8c77-47c72ffb5249,Cepphus grylle,,,-65.39,47.96,"Canadian Wildlife Service-Atlantic, Environment Canada",,-635145613_486795503_884724832,urn:lsid:marinespecies.org:taxname:137130,,FALSE,,,,137130
6bf67b3b-12fd-4aa3-97e8-f626134212ec,Cepphus grylle,"(Linnaeus, 1758)",6/25/05 09:43,-67.9702,44.329,NA,,439988,137130,,FALSE,,,,137130
6bfb92eb-04b3-4955-accb-e13481d59b3a,Cepphus grylle,"(Linnaeus, 1758)",7/13/87 12:00,-61.44916916,46.0777092,ACCD,EOR,31485,urn:lsid:marinespecies.org:taxname:137130,,FALSE,,,,137130
6c141d39-530b-4c89-b67f-11afd6f09c7f,Cepphus grylle,"(Linnaeus, 1758)",1979-08-11T14:15:00,-61.7,57.3833,Canadian Wildlife Service,280,280_118360,urn:lsid:marinespecies.org:taxname:137130,,FALSE,,,,137130
6c5f0ec5-b755-484e-9a1a-3ed66ed1a214,Cepphus grylle,"(Linnaeus, 1758)",1978-06-23T20:00:00,-55.1667,49.5667,Canadian Wildlife Service,280,280_101673,urn:lsid:marinespecies.org:taxname:137130,,FALSE,,,,137130
6c6cd4a0-86df-4d17-b689-962f93637c16,Cepphus grylle,"(Linnaeus, 1758)",8/21/78 00:00,-57.18232,54.41785,Canadian Wildlife Service - Atlantic Region (CWS - Atlantic),,NF000743_BLGU_1819_1978-08-21,urn:lsid:marinespecies.org:taxname:137130,,FALSE,,,,137130
6c8939d3-2e7a-408b-9378-432e52f3c6ee,Cepphus grylle,"(Linnaeus, 1758)",07/02/2005 14:37,-68.2743,44.223,NA,,439864,137130,,FALSE,,,,137130
6ccca42f-f317-48e3-a174-3797df33408e,Cepphus grylle,"(Linnaeus, 1758)",7/23/90 12:00,-63.31396866,46.45769119,ACCD,EOR,31474,urn:lsid:marinespecies.org:taxname:137130,,FALSE,,,,137130
6d5a98aa-3aae-4a4e-a054-8b75f3df85ab,Cepphus grylle,"(Linnaeus, 1758)",1979-08-27T16:20:00,-61.55,56.9333,Canadian Wildlife Service,280,280_120984,urn:lsid:marinespecies.org:taxname:137130,,FALSE,,,,137130
6d627ef6-7d4a-4177-bf5b-a71962a786d9,Cepphus grylle,"(Linnaeus, 1758)",NA,-69.0674,44.1078,USFWS,,682382,137130,,FALSE,,,,137130
6daf8377-01f8-403c-b6df-fc890b6872a4,Cepphus grylle,"(Linnaeus, 1758)",1986-06-12T12:00:00Z,-65.2492981,47.7891655,ACCD,EOR,31652,urn:lsid:marinespecies.org:taxname:137130,,FALSE,,,,137130
6e0fbb7a-e25e-4f80-abfe-612356702462,Cepphus grylle,"(Linnaeus, 1758)",01/01/1984 00:00,-52.96551,47.63321,Canadian Wildlife Service - Atlantic Region (CWS - Atlantic),,NF000396_BLGU_1007_1984-01-01,urn:lsid:marinespecies.org:taxname:137130,,FALSE,,,,137130
6e33cf1a-3b94-455e-8330-6d3480741be9,Cepphus grylle,"(Linnaeus, 1758)",08/09/2006 13:29,-68.0934,44.2512,NA,,6687,137130,,FALSE,,,,137130
6e5fa6e6-9c48-4b59-9d7a-4fdd6a4cbcc1,Cepphus grylle,"(Linnaeus, 1758)",1980-08-27T14:10:00,-61.3333,57.0833,Canadian Wildlife Service,280,280_134158,urn:lsid:marinespecies.org:taxname:137130,,FALSE,,,,137130
6eb7c1ec-7ac9-44bd-a91e-95fa009d7e68,Cepphus grylle,"(Linnaeus, 1758)",7/26/05 13:44,-68.2271,44.1818,NA,,441251,137130,,FALSE,,,,137130
6edc6b1b-6c48-44bb-8e81-cce698d5df26,Cepphus grylle,"(Linnaeus, 1758)",1971-05-02T14:10:00,-68.3,48.7,Canadian Wildlife Service,280,280_35651,urn:lsid:marinespecies.org:taxname:137130,,FALSE,,,,137130
6f1a12a2-1086-4c7b-ae07-ad6d6d7a5d57,Cepphus grylle,"(Linnaeus, 1758)",05/06/2000,-68.5,53,ICES,DOME-Biota,12135336,urn:lsid:marinespecies.org:taxname:137130,,FALSE,,,,137130
6f5d1566-6214-4828-b42a-3ff2fcd729fd,Cepphus grylle,,,-64.98,49.3,"Canadian Wildlife Service-Atlantic, Environment Canada",,-801551520_1968506900_-1720066774,urn:lsid:marinespecies.org:taxname:137130,,FALSE,,,,137130
6f9046b1-3737-4ed1-aff8-286102009b86,Cepphus grylle,"(Linnaeus, 1758)",06/05/1987 12:00,-66.73302841,44.95199394,ACCD,EOR,31769,urn:lsid:marinespecies.org:taxname:137130,,FALSE,,,,137130
6fe51e7b-9e65-4747-8283-7e2228999f51,Cepphus grylle,"(Linnaeus, 1758)",01/01/2001 00:00,-66.76206,44.61949,Canadian Wildlife Service - Atlantic Region (CWS - Atlantic),,NB000097_BLGU_5395_2001-01-01,urn:lsid:marinespecies.org:taxname:137130,,FALSE,,,,137130
6ff3c048-f69f-4043-8431-4b335f432f3b,Cepphus grylle,"(Linnaeus, 1758)",6/15/08 00:00,-60.35271,46.8869,Canadian Wildlife Service - Atlantic Region (CWS - Atlantic),,NS003465_BLGU_11819_2008-06-15,urn:lsid:marinespecies.org:taxname:137130,,FALSE,,,,137130
7001c647-a187-4e38-8074-f031808ae8d7,Cepphus grylle,"(Linnaeus, 1758)",NA,-68.2465,44.1843,USFWS,,699531,137130,,FALSE,,,,137130
702d5e8c-fb2e-46ad-a5e5-5e81207981ff,Cepphus grylle,"(Linnaeus, 1758)",07/10/2012 00:00,-54.1038,49.8158,Canadian Wildlife Service - Atlantic Region (CWS - Atlantic),,NF003528_BLGU_10040_2012-07-10,urn:lsid:marinespecies.org:taxname:137130,,FALSE,,,,137130
70632aac-1a27-4b9e-a351-33b69b1a2426,Cepphus grylle,"(Linnaeus, 1758)",2001-07-02T12:00:00Z,-66.83262634,44.61669922,ACCD,EOR,31782,urn:lsid:marinespecies.org:taxname:137130,,FALSE,,,,137130
7084e585-7d39-4e8b-bbd8-0c1a4924d09f,Cepphus grylle,"(Linnaeus, 1758)",1977-07-31T09:40:00,-59.75,56.1833,Canadian Wildlife Service,280,280_84737,urn:lsid:marinespecies.org:taxname:137130,,FALSE,,,,137130
708728d5-f099-4f2e-bd33-59323f78c98e,Cepphus grylle,,,-60.32,55.74,"Canadian Wildlife Service-Atlantic, Environment Canada",,1380544464_-1395755071_-1659910329,urn:lsid:marinespecies.org:taxname:137130,,FALSE,,,,137130
70b2487f-5f13-415c-b0fa-34f0ea3c0175,Cepphus grylle,,,-63.23,49.91,"Canadian Wildlife Service-Atlantic, Environment Canada",,1421648014_369787011_1310401667,urn:lsid:marinespecies.org:taxname:137130,,FALSE,,,,137130
70bc9c12-1418-4c41-84ea-8a956df450d0,Cepphus grylle,"(Linnaeus, 1758)",1974-07-19T17:40:00,-55.2667,53.1667,Canadian Wildlife Service,280,280_64834,urn:lsid:marinespecies.org:taxname:137130,,FALSE,,,,137130
70da9bf9-d8dd-4e87-b94b-9001b3c9184d,Cepphus grylle,"(Linnaeus, 1758)",1980-05-24T12:00:00Z,-60.06687164,45.81713867,ACCD,EOR,31759,urn:lsid:marinespecies.org:taxname:137130,,FALSE,,,,137130
70df0a3a-7a0c-495f-98c6-4cfbccccf3fa,Cepphus grylle,"(Linnaeus, 1758)",06/09/2010 00:00,-64.14572,44.34449,Canadian Wildlife Service - Atlantic Region (CWS - Atlantic),,NS002453_BLGU_11882_2010-06-09,urn:lsid:marinespecies.org:taxname:137130,,FALSE,,,,137130
70e69681-57d6-412f-b001-b1d1661c5733,Cepphus grylle,"(Linnaeus, 1758)",08/07/1978 00:00,-61.61556,57.60006,Canadian Wildlife Service - Atlantic Region (CWS - Atlantic),,NF001040_BLGU_2195_1978-08-07,urn:lsid:marinespecies.org:taxname:137130,,FALSE,,,,137130
70e9e06c-0e68-418c-9663-5078279c445f,Cepphus grylle,"(Linnaeus, 1758)",07/03/1986 12:00,-63.98480988,46.90428162,ACCD,EOR,31468,urn:lsid:marinespecies.org:taxname:137130,,FALSE,,,,137130
7130859d-063b-4c52-ad26-2305fe74cbe9,Cepphus grylle,,,-68.3,44.11,"Canadian Wildlife Service-Atlantic, Environment Canada",,1272746530_521366742_-798443788,urn:lsid:marinespecies.org:taxname:137130,,FALSE,,,,137130
71325615-fd1e-478b-b7ca-744e4d8f0e94,Cepphus grylle,"(Linnaeus, 1758)",01/01/1986 00:00,-56.23729,46.84991,Canadian Wildlife Service - Atlantic Region (CWS - Atlantic),,NF000202_BLGU_477_1986-01-01,urn:lsid:marinespecies.org:taxname:137130,,FALSE,,,,137130
714e6e1b-decd-44eb-bf3f-7d6a29df4d63,Cepphus grylle,,,-64.59,48.22,"Canadian Wildlife Service-Atlantic, Environment Canada",,689065724_-1435385300_-1820220596,urn:lsid:marinespecies.org:taxname:137130,,FALSE,,,,137130
71532d45-2ea7-4b63-bf59-4ea01262b00a,Cepphus grylle,"(Linnaeus, 1758)",1973-03-01T14:10:00,-66.05,50.05,Canadian Wildlife Service,280,280_62771,urn:lsid:marinespecies.org:taxname:137130,,FALSE,,,,137130
7157c3c9-457d-4c49-ac15-afae5954dc0c,Cepphus grylle,"(Linnaeus, 1758)",07/03/2005 08:58,-68.0506,44.3233,NA,,440119,137130,,FALSE,,,,137130
715a9bd7-f948-4cc2-9279-2ea948610a2e,Cepphus grylle,"(Linnaeus, 1758)",1990-07-31T12:00:00Z,-60.14374924,47.21529007,ACCD,EOR,31508,urn:lsid:marinespecies.org:taxname:137130,,FALSE,,,,137130
7175f887-114f-47ac-a6f5-395ff5b9a78d,Cepphus grylle,"(Linnaeus, 1758)",6/23/05 09:52,-67.8576,44.3622,NA,,439715,137130,,FALSE,,,,137130
717b6366-585b-4321-b8e2-c3cc4f038924,Cepphus grylle,,,-69.76,47.78,"Canadian Wildlife Service-Atlantic, Environment Canada",,1286797999_502078792_1810423315,urn:lsid:marinespecies.org:taxname:137130,,FALSE,,,,137130
71815e32-0132-4754-8f9b-5c1ba434e20e,Cepphus grylle,"(Linnaeus, 1758)",1979-08-04T16:00:00,-57.3,54.6833,Canadian Wildlife Service,280,280_117625,urn:lsid:marinespecies.org:taxname:137130,,FALSE,,,,137130
71962d7d-4a77-4217-a4ae-f37d064dc54d,Cepphus grylle,"(Linnaeus, 1758)",01/01/1976 00:00,-55.83218,51.24159,Canadian Wildlife Service - Atlantic Region (CWS - Atlantic),,NF000651_BLGU_1669_1976-01-01,urn:lsid:marinespecies.org:taxname:137130,,FALSE,,,,137130
71a9c3e6-b4f5-43b5-8d41-763b36e75eac,Cepphus grylle,,,-63.49,44.47,"Canadian Wildlife Service-Atlantic, Environment Canada",,1545053651_267528156_140552621,urn:lsid:marinespecies.org:taxname:137130,,FALSE,,,,137130
71bfbb63-8111-4c18-8148-fb038981ab69,Cepphus grylle,"(Linnaeus, 1758)",NA,-68.9568,43.8504,USFWS,,699143,137130,,FALSE,,,,137130
71dfeb06-c4e0-49e4-90e9-3fe477d2b104,Cepphus grylle,,,-60.04,49.88,"Canadian Wildlife Service-Atlantic, Environment Canada",,1191353334_1530531747_500345481,urn:lsid:marinespecies.org:taxname:137130,,FALSE,,,,137130
71e750fe-277c-428d-92f4-734a8fee080f,Cepphus grylle,"(Linnaeus, 1758)",8/14/78 00:00,-58.81552,55.14999,Canadian Wildlife Service - Atlantic Region (CWS - Atlantic),,NF000798_BLGU_1891_1978-08-14,urn:lsid:marinespecies.org:taxname:137130,,FALSE,,,,137130
7220823d-1220-4351-b7c6-0fe7d518bac4,Cepphus grylle,"(Linnaeus, 1758)",08/10/1986 12:00,-62.4238205,46.26119995,ACCD,EOR,31483,urn:lsid:marinespecies.org:taxname:137130,,FALSE,,,,137130
7220ba8b-f7bc-463f-93d5-37df3b3350ff,Cepphus grylle,"(Linnaeus, 1758)",1974-07-19T17:05:00,-55.3,53.0667,Canadian Wildlife Service,280,280_64833,urn:lsid:marinespecies.org:taxname:137130,,FALSE,,,,137130
725e4966-baf9-4880-9d91-5d95c9bfe0e1,Cepphus grylle,"(Linnaeus, 1758)",6/15/79 00:00,-60.37579,46.38324,Canadian Wildlife Service - Atlantic Region (CWS - Atlantic),,NS001109_BLGU_3191_1979-06-15,urn:lsid:marinespecies.org:taxname:137130,,FALSE,,,,137130
72775f2a-914e-4ab7-9764-4b63e29511da,Cepphus grylle,"(Linnaeus, 1758)",8/13/89 12:00,-60.31864929,46.6970787,ACCD,EOR,31504,urn:lsid:marinespecies.org:taxname:137130,,FALSE,,,,137130
72ec7de9-7f87-4c81-bbf3-ba1c522e83ae,Cepphus grylle,"(Linnaeus, 1758)",1973-03-05T16:20:00,-58.2333,50.5667,Canadian Wildlife Service,280,280_62808,urn:lsid:marinespecies.org:taxname:137130,,FALSE,,,,137130
72f7673e-16db-4a8b-99f2-3ece2513862e,Cepphus grylle,"(Linnaeus, 1758)",5/26/88 00:00,-61.26128,46.35939,Canadian Wildlife Service - Atlantic Region (CWS - Atlantic),,NS001348_BLGU_12596_1988-05-26,urn:lsid:marinespecies.org:taxname:137130,,FALSE,,,,137130
72fb5af7-b1f5-4307-a0a4-20b0915ed8b1,Cepphus grylle,,,-64.42,48.84,"Canadian Wildlife Service-Atlantic, Environment Canada",,-487837150_460397640_1348171811,urn:lsid:marinespecies.org:taxname:137130,,FALSE,,,,137130
735021b0-b810-4a9f-8443-7948ac201d91,Cepphus grylle,"(Linnaeus, 1758)",01/01/1987 00:00,-56.22562,46.77825,Canadian Wildlife Service - Atlantic Region (CWS - Atlantic),,NF000184_BLGU_333_1987-01-01,urn:lsid:marinespecies.org:taxname:137130,,FALSE,,,,137130
7357ea37-6dd9-4bab-8d66-02c5ed57ffb8,Cepphus grylle,"(Linnaeus, 1758)",6/22/06 11:55,-68.0687,44.3302,NA,,4450,137130,,FALSE,,,,137130
735d6d91-565c-405e-bc86-d4f201d1afa0,Cepphus grylle,"(Linnaeus, 1758)",1978-08-05T14:15:00,-59.9,55.45,Canadian Wildlife Service,280,280_105380,urn:lsid:marinespecies.org:taxname:137130,,FALSE,,,,137130
7363930c-fb23-42bc-8d54-f18474a9fc51,Cepphus grylle,"(Linnaeus, 1758)",1990-08-02T12:00:00Z,-65.00090027,45.24969101,ACCD,EOR,31462,urn:lsid:marinespecies.org:taxname:137130,,FALSE,,,,137130
73cd8c49-1c6f-4d27-b2f3-f2dd0e700f90,Cepphus grylle,"(Linnaeus, 1758)",01/01/1945 00:00,-56.9823,47.38325,Canadian Wildlife Service - Atlantic Region (CWS - Atlantic),,NF000314_BLGU_896_1945-01-01,urn:lsid:marinespecies.org:taxname:137130,,FALSE,,,,137130
73f36cbd-eda7-4fa5-871f-97dcda0e8bed,Cepphus grylle,"(Linnaeus, 1758)",NA,-67.5604,44.5168,"BOEM, USFWS, NOAA, NAVY",,728422,137130,,FALSE,,,,137130
7400234b-3404-442d-84bd-9e8ba8f753c8,Cepphus grylle,,,-58.39,49.16,"Canadian Wildlife Service-Atlantic, Environment Canada",,1421648014_835809275_1520845300,urn:lsid:marinespecies.org:taxname:137130,,FALSE,,,,137130
743a0d6e-b7a0-4260-95f6-4d8abdc2282b,Cepphus grylle,,,-64.61,48.3,"Canadian Wildlife Service-Atlantic, Environment Canada",,689065724_1623609376_-2094846280,urn:lsid:marinespecies.org:taxname:137130,,FALSE,,,,137130
74683a57-3e88-464e-a344-f1aae778f3b6,Cepphus grylle,,,-65.22,43.61,"Canadian Wildlife Service-Atlantic, Environment Canada",,1298217701_-1857802734_1960854827,urn:lsid:marinespecies.org:taxname:137130,,FALSE,,,,137130
74805093-a1c2-4cef-b01a-a0a2a209c07f,Cepphus grylle,,,-57.02,51.39,"Canadian Wildlife Service-Atlantic, Environment Canada",,-635145613_892592044_158670614,urn:lsid:marinespecies.org:taxname:137130,,FALSE,,,,137130
74b093af-352b-4d2c-a7eb-34c744e25780,Cepphus grylle,,,-53.29,48.24,"Canadian Wildlife Service-Atlantic, Environment Canada",,1218969274_-1690648731_607365147,urn:lsid:marinespecies.org:taxname:137130,,FALSE,,,,137130
74f5d96f-5043-45eb-9441-80d97c3dd676,Cepphus grylle,"(Linnaeus, 1758)",07/02/2001 12:00,-66.68476868,44.62965012,ACCD,EOR,31778,urn:lsid:marinespecies.org:taxname:137130,,FALSE,,,,137130
74fdbdfa-430b-4b8b-bd51-f3d710958c46,Cepphus grylle,,,-63.49,44.51,"Canadian Wildlife Service-Atlantic, Environment Canada",,-1339166790_-389939252_-1722495475,urn:lsid:marinespecies.org:taxname:137130,,FALSE,,,,137130
7527e1d3-0274-49d0-8081-112cd481026a,Cepphus grylle,,,-52.93,48.43,"Canadian Wildlife Service-Atlantic, Environment Canada",,1215446144_703710848_-1118695250,urn:lsid:marinespecies.org:taxname:137130,,FALSE,,,,137130
753cecb2-3e28-4c25-bd3c-d90023a43a1b,Cepphus grylle,,,-64.36,48.82,"Canadian Wildlife Service-Atlantic, Environment Canada",,58439636_-1125053851_-73149315,urn:lsid:marinespecies.org:taxname:137130,,FALSE,,,,137130
7546b429-3f72-4982-b5ca-263145c55584,Cepphus grylle,,,-61.81,47.35,"Canadian Wildlife Service-Atlantic, Environment Canada",,-1614583778_-1303010649_-682374433,urn:lsid:marinespecies.org:taxname:137130,,FALSE,,,,137130
754b0840-8c84-4e3c-aad3-62de27c6bb31,Cepphus grylle,,,-65.32,43.72,"Canadian Wildlife Service-Atlantic, Environment Canada",,1361835644_-1475097759_-906288653,urn:lsid:marinespecies.org:taxname:137130,,FALSE,,,,137130
755b1314-b034-45e5-8ffc-66905c9889b9,Cepphus grylle,,,-69.21,48.44,"Canadian Wildlife Service-Atlantic, Environment Canada",,1331997355_1705272447_-64540118,urn:lsid:marinespecies.org:taxname:137130,,FALSE,,,,137130
75820964-6a16-4698-9afc-f3d95a54c9a4,Cepphus grylle,"(Linnaeus, 1758)",NA,-67.16666,44.58333,NA,,121448,137130,,FALSE,,,,137130
758ffea4-bedd-4a95-97b6-8e049eccc2b6,Cepphus grylle,"(Linnaeus, 1758)",1990-08-16T12:00:00Z,-60.35197067,46.87794876,ACCD,EOR,31506,urn:lsid:marinespecies.org:taxname:137130,,FALSE,,,,137130
7604143a-02d4-4804-8f47-7dfafcd34546,Cepphus grylle,"(Linnaeus, 1758)",8/24/86 12:00,-64.10945892,44.49214172,ACCD,EOR,31467,urn:lsid:marinespecies.org:taxname:137130,,FALSE,,,,137130
7649366d-9beb-47d7-9f6f-0b7b99426946,Cepphus grylle,"(Linnaeus, 1758)",01/01/1945 00:00,-53.5383,48.9401,Canadian Wildlife Service - Atlantic Region (CWS - Atlantic),,NF000500_BLGU_1194_1945-01-01,urn:lsid:marinespecies.org:taxname:137130,,FALSE,,,,137130
76609b6d-3f53-4e96-b5aa-9d7647784715,Cepphus grylle,,,-65.48,47.96,"Canadian Wildlife Service-Atlantic, Environment Canada",,1421648014_-1494522247_1256138603,urn:lsid:marinespecies.org:taxname:137130,,FALSE,,,,137130
76750a5c-49c0-4b31-892c-03d37a6ec4c8,Cepphus grylle,"(Linnaeus, 1758)",7/24/89 12:00,-66.78942871,44.78469086,ACCD,EOR,31444,urn:lsid:marinespecies.org:taxname:137130,,FALSE,,,,137130
76b675ae-47ef-4530-ace0-ac01ee61c8e8,Cepphus grylle,,,-66.39,50.01,"Canadian Wildlife Service-Atlantic, Environment Canada",,58439636_1290952587_401841358,urn:lsid:marinespecies.org:taxname:137130,,FALSE,,,,137130
76c78a39-2fec-4900-8f5d-8742ee44abb6,Cepphus grylle,,,-65.48,47.96,"Canadian Wildlife Service-Atlantic, Environment Canada",,58439636_1618661138_-550449147,urn:lsid:marinespecies.org:taxname:137130,,FALSE,,,,137130
76d54aaf-0289-4e63-b104-a26d5601695e,Cepphus grylle,"(Linnaeus, 1758)",7/31/76 00:00,-64.04913,44.38377,Canadian Wildlife Service - Atlantic Region (CWS - Atlantic),,NS001336_BLGU_2409_1976-07-31,urn:lsid:marinespecies.org:taxname:137130,,FALSE,,,,137130
76d7085c-c3bc-4632-b47a-56d1408132e3,Cepphus grylle,,,-58.53,48.92,"Canadian Wildlife Service-Atlantic, Environment Canada",,896836590_-397311613_590174092,urn:lsid:marinespecies.org:taxname:137130,,FALSE,,,,137130
76d99417-8072-4092-b401-d4e70e92e29f,Cepphus grylle,,,-58.48,49.2,"Canadian Wildlife Service-Atlantic, Environment Canada",,896836590_-1101457208_-1347231777,urn:lsid:marinespecies.org:taxname:137130,,FALSE,,,,137130
76f53e4e-df76-4020-89e9-6d571e885d8b,Cepphus grylle,"(Linnaeus, 1758)",7/16/09 00:00,-61.26128,46.35939,Canadian Wildlife Service - Atlantic Region (CWS - Atlantic),,NS001348_BLGU_12618_2009-07-16,urn:lsid:marinespecies.org:taxname:137130,,FALSE,,,,137130
76fea0b9-dcc2-4d38-a671-e8921cb64b98,Cepphus grylle,,,-61.52,48.17,"Canadian Wildlife Service-Atlantic, Environment Canada",,58439636_1642908679_2082858148,urn:lsid:marinespecies.org:taxname:137130,,FALSE,,,,137130
771b4b1f-2ae3-4d90-a03b-27756d9c3d25,Cepphus grylle,"(Linnaeus, 1758)",1973-03-03T14:25:00,-60.8667,49.9,Canadian Wildlife Service,280,280_62790,urn:lsid:marinespecies.org:taxname:137130,,FALSE,,,,137130
774c296b-32d8-457b-8a68-09c4a27b0cde,Cepphus grylle,"(Linnaeus, 1758)",1972-02-04T11:45:00,-53.3,46.5833,Canadian Wildlife Service,280,280_55410,urn:lsid:marinespecies.org:taxname:137130,,FALSE,,,,137130
7759e0ad-97c8-48a6-9933-f191245535c6,Cepphus grylle,,,-57.24,54.71,"Canadian Wildlife Service-Atlantic, Environment Canada",,1373407025_56199861_-308543534,urn:lsid:marinespecies.org:taxname:137130,,FALSE,,,,137130
776c2f6e-96db-4d1b-8caf-ccd234ef04cd,Cepphus grylle,"(Linnaeus, 1758)",1976-12-15T09:30:00,-57.3167,54.6167,Canadian Wildlife Service,280,280_80593,urn:lsid:marinespecies.org:taxname:137130,,FALSE,,,,137130
77a030e9-8ecb-4684-825e-f54874b2b21c,Cepphus grylle,,,-58.59,49.1,"Canadian Wildlife Service-Atlantic, Environment Canada",,896836590_1692829286_1645895559,urn:lsid:marinespecies.org:taxname:137130,,FALSE,,,,137130
77a1a9d0-7e0e-4e37-bd63-71c59ebc3db0,Cepphus grylle,"(Linnaeus, 1758)",1978-06-25T18:30:00,-55.5167,51.6833,Canadian Wildlife Service,280,280_101890,urn:lsid:marinespecies.org:taxname:137130,,FALSE,,,,137130
77d11d18-6685-4437-8e92-1b6b830cbf54,Cepphus grylle,,,-63.25,46.91,"Canadian Wildlife Service-Atlantic, Environment Canada",,545832393_984810434_-1344261428,urn:lsid:marinespecies.org:taxname:137130,,FALSE,,,,137130
77d68f9e-34ac-4ddf-aa8f-0b1aaafd0e5f,Cepphus grylle,"(Linnaeus, 1758)",1979-08-27T12:30:00,-61.5333,57.3667,Canadian Wildlife Service,280,280_120904,urn:lsid:marinespecies.org:taxname:137130,,FALSE,,,,137130
78059760-b594-44ab-bedc-d7c34dc1f5d4,Cepphus grylle,"(Linnaeus, 1758)",01/01/1988 00:00,-56.08993,46.87761,Canadian Wildlife Service - Atlantic Region (CWS - Atlantic),,NF000213_BLGU_546_1988-01-01,urn:lsid:marinespecies.org:taxname:137130,,FALSE,,,,137130
781a38cc-7bec-4723-8bde-41675d7739f2,Cepphus grylle,"(Linnaeus, 1758)",NA,-68.6817,44.1083,USFWS,,670237,137130,,FALSE,,,,137130
7841a771-4e03-4846-a083-f37ee9d0cb38,Cepphus grylle,"(Linnaeus, 1758)",08/05/2006 17:05,-67.9163,44.3306,NA,,6528,137130,,FALSE,,,,137130
785b6c1a-29f5-4d46-92ba-5164d55df260,Cepphus grylle,"(Linnaeus, 1758)",07/02/2001 12:00,-66.89897156,44.59778976,ACCD,EOR,31788,urn:lsid:marinespecies.org:taxname:137130,,FALSE,,,,137130
785da835-b6a5-4882-b57e-0f2c6d9bcc64,Cepphus grylle,"(Linnaeus, 1758)",05/06/1999,-68.5,53,ICES,DOME-Biota,12135607,urn:lsid:marinespecies.org:taxname:137130,,FALSE,,,,137130
7882d0a5-27ad-4cc9-8fe2-c05b9f1e4c3d,Cepphus grylle,"(Linnaeus, 1758)",08/09/1978 00:00,-61.04891,56.23336,Canadian Wildlife Service - Atlantic Region (CWS - Atlantic),,NF000933_BLGU_2065_1978-08-09,urn:lsid:marinespecies.org:taxname:137130,,FALSE,,,,137130
78976939-edd0-4c10-b4b2-55ec77186c68,Cepphus grylle,"(Linnaeus, 1758)",1978-06-25T16:20:00,-55.3833,51.5667,Canadian Wildlife Service,280,280_101871,urn:lsid:marinespecies.org:taxname:137130,,FALSE,,,,137130
78dc3f6c-387b-4e74-8123-2957b2b37af2,Cepphus grylle,,,-62.8,49.8,"Canadian Wildlife Service-Atlantic, Environment Canada",,-635145613_-1969977678_1451214224,urn:lsid:marinespecies.org:taxname:137130,,FALSE,,,,137130
78e14fb9-d195-45fb-8758-cb1642eca173,Cepphus grylle,"(Linnaeus, 1758)",1973-03-06T10:50:00,-58.8333,50.1333,Canadian Wildlife Service,280,280_62813,urn:lsid:marinespecies.org:taxname:137130,,FALSE,,,,137130
78ecf129-1c80-44f4-b1e7-a03b5314c79a,Cepphus grylle,,,-55.19,50.6,"Canadian Wildlife Service-Atlantic, Environment Canada",,1404943950_-257323956_953807197,urn:lsid:marinespecies.org:taxname:137130,,FALSE,,,,137130
78f77684-276d-4873-8379-1f481401a5bb,Cepphus grylle,"(Linnaeus, 1758)",1970-11-10T08:10:00,-63.75,47.4333,Canadian Wildlife Service,280,280_32764,urn:lsid:marinespecies.org:taxname:137130,,FALSE,,,,137130
78fc29a4-4375-4187-8a6d-e9ea6442defc,Cepphus grylle,"(Linnaeus, 1758)",8/19/06 13:31,-68.1854,44.225,NA,,7148,137130,,FALSE,,,,137130
7903b80e-71fe-4317-8c2f-dd0db9d0f2c2,Cepphus grylle,"(Linnaeus, 1758)",07/07/2015 00:00,-52.83439,47.19749,Canadian Wildlife Service - Atlantic Region (CWS - Atlantic),,NF003749_BLGU_12511_2015-07-07,urn:lsid:marinespecies.org:taxname:137130,,FALSE,,,,137130
793a7eb4-9249-4d40-8431-838363f08bb1,Cepphus grylle,"(Linnaeus, 1758)",01/01/1984 00:00,-56.23729,46.84991,Canadian Wildlife Service - Atlantic Region (CWS - Atlantic),,NF000202_BLGU_475_1984-01-01,urn:lsid:marinespecies.org:taxname:137130,,FALSE,,,,137130
795918d3-b276-400f-b28c-d88d42673c2c,Cepphus grylle,"(Linnaeus, 1758)",08/06/1978 00:00,-62.28224,57.96674,Canadian Wildlife Service - Atlantic Region (CWS - Atlantic),,NF001050_BLGU_2208_1978-08-06,urn:lsid:marinespecies.org:taxname:137130,,FALSE,,,,137130
7959f67d-834f-40c0-9bc6-090edbbaa8a1,Cepphus grylle,"(Linnaeus, 1758)",08/07/1978 00:00,-61.79889,57.70006,Canadian Wildlife Service - Atlantic Region (CWS - Atlantic),,NF001045_BLGU_2202_1978-08-07,urn:lsid:marinespecies.org:taxname:137130,,FALSE,,,,137130
796d5b7e-8b0d-4abb-92b7-dd2016a9673d,Cepphus grylle,"(Linnaeus, 1758)",6/16/08 00:00,-64.04913,44.38377,Canadian Wildlife Service - Atlantic Region (CWS - Atlantic),,NS001336_BLGU_11901_2008-06-16,urn:lsid:marinespecies.org:taxname:137130,,FALSE,,,,137130
79bd0ab1-3a72-43a5-9760-4d9196d658fb,Cepphus grylle,"(Linnaeus, 1758)",1981-02-18T04:50:00,-54.3333,47.1667,Canadian Wildlife Service,280,280_139052,urn:lsid:marinespecies.org:taxname:137130,,FALSE,,,,137130
79e9ef4e-c5af-4afe-9da0-bef1dc6cceb8,Cepphus grylle,"(Linnaeus, 1758)",1976-08-04T05:41:00,-50.45,47.9,Canadian Wildlife Service,280,280_75210,urn:lsid:marinespecies.org:taxname:137130,,FALSE,,,,137130
7a46bb3d-7393-4e50-8bfb-e80c022a8766,Cepphus grylle,"(Linnaeus, 1758)",07/02/2005 14:39,-68.2691,44.2145,NA,,439866,137130,,FALSE,,,,137130
7ac89918-a0e3-4498-a63a-301d7646d0dc,Cepphus grylle,,,-65.24,43.64,"Canadian Wildlife Service-Atlantic, Environment Canada",,1393959998_1343301985_-1364940564,urn:lsid:marinespecies.org:taxname:137130,,FALSE,,,,137130
7acd02fa-0957-4ac7-adee-5f514a53bf6d,Cepphus grylle,"(Linnaeus, 1758)",01/01/2000 00:00,-64.04913,44.38377,Canadian Wildlife Service - Atlantic Region (CWS - Atlantic),,NS001336_BLGU_5341_2000-01-01,urn:lsid:marinespecies.org:taxname:137130,,FALSE,,,,137130
7adf26d9-b172-4dc9-941a-f468fc823a24,Cepphus grylle,"(Linnaeus, 1758)",8/13/78 00:00,-60.08222,55.70001,Canadian Wildlife Service - Atlantic Region (CWS - Atlantic),,NF000890_BLGU_1991_1978-08-13,urn:lsid:marinespecies.org:taxname:137130,,FALSE,,,,137130
7b7eec4c-9b88-4f32-a7fd-a4d2f4632af7,Cepphus grylle,"(Linnaeus, 1758)",01/01/1984 00:00,-52.83718,47.19155,Canadian Wildlife Service - Atlantic Region (CWS - Atlantic),,NF000282_BLGU_764_1984-01-01,urn:lsid:marinespecies.org:taxname:137130,,FALSE,,,,137130
7b8088c1-0a01-4b0a-b85a-84687d061e84,Cepphus grylle,,,-63.6,44.67,"Canadian Wildlife Service-Atlantic, Environment Canada",,1177689284_1177765532_719064642,urn:lsid:marinespecies.org:taxname:137130,,FALSE,,,,137130
7b8887df-ec91-4b37-a843-3d7a001f771d,Cepphus grylle,,,-65.33,43.7,"Canadian Wildlife Service-Atlantic, Environment Canada",,1361835644_1884259954_-108963344,urn:lsid:marinespecies.org:taxname:137130,,FALSE,,,,137130
7bbbed82-1b73-4b4b-b7df-665836628b52,Cepphus grylle,"(Linnaeus, 1758)",7/22/65 00:00,-61.26128,46.35939,Canadian Wildlife Service - Atlantic Region (CWS - Atlantic),,NS001348_BLGU_3145_1965-07-22,urn:lsid:marinespecies.org:taxname:137130,,FALSE,,,,137130
7bc4f877-709e-4577-84aa-3bbc3abc6f88,Cepphus grylle,"(Linnaeus, 1758)",8/21/78 00:00,-56.96294,54.48566,Canadian Wildlife Service - Atlantic Region (CWS - Atlantic),,NF000752_BLGU_1834_1978-08-21,urn:lsid:marinespecies.org:taxname:137130,,FALSE,,,,137130
7bcfdce3-1bfd-4c36-8e0d-b97e03f2a765,Cepphus grylle,"(Linnaeus, 1758)",01/01/1974 00:00,-53.94387,47.45656,Canadian Wildlife Service - Atlantic Region (CWS - Atlantic),,NF000337_BLGU_922_1974-01-01,urn:lsid:marinespecies.org:taxname:137130,,FALSE,,,,137130
7bffca97-24cb-4204-8a2f-0268b0e00c86,Cepphus grylle,"(Linnaeus, 1758)",1970-06-13T13:15:00,-60.2,46.3,Canadian Wildlife Service,280,280_22685,urn:lsid:marinespecies.org:taxname:137130,,FALSE,,,,137130
7c02f2e9-3f39-4f18-ba89-e81443df3f1d,Cepphus grylle,,,-61.13,48.7,"Canadian Wildlife Service-Atlantic, Environment Canada",,-801551520_642192192_-1406170277,urn:lsid:marinespecies.org:taxname:137130,,FALSE,,,,137130
7c07dd0b-e815-49b1-bece-424a696e3de9,Cepphus grylle,"(Linnaeus, 1758)",1978-06-26T09:50:00,-55.5833,52.1167,Canadian Wildlife Service,280,280_101925,urn:lsid:marinespecies.org:taxname:137130,,FALSE,,,,137130
7c094208-d426-4597-9bf1-5af387d95a23,Cepphus grylle,"(Linnaeus, 1758)",1983-11-05T19:00:00,-68.0667,44.3,Canadian Wildlife Service,280,280_168221,urn:lsid:marinespecies.org:taxname:137130,,FALSE,,,,137130
7c2331fb-d5cf-430d-8e0b-419217c1fcfd,Cepphus grylle,"(Linnaeus, 1758)",7/27/07 00:00,-59.8132,46.17216,Canadian Wildlife Service - Atlantic Region (CWS - Atlantic),,NS003222_BLGU_12181_2007-07-27,urn:lsid:marinespecies.org:taxname:137130,,FALSE,,,,137130
7c4c8057-d914-474c-a60f-932f42795336,Cepphus grylle,"(Linnaeus, 1758)",01/01/2001 00:00,-66.75236,44.61175,Canadian Wildlife Service - Atlantic Region (CWS - Atlantic),,NB002439_BLGU_5396_2001-01-01,urn:lsid:marinespecies.org:taxname:137130,,FALSE,,,,137130
7cb08b0b-10e1-47c9-bd17-d5fec5dfd405,Cepphus grylle,"(Linnaeus, 1758)",2017-03-21T09:37:53,-71.0659,40.3446,NORMANDEAU,1817,1817_45619,urn:lsid:marinespecies.org:taxname:137130,,FALSE,,,,137130
7d1da88c-9259-4170-b1d2-3d4fe1848efa,Cepphus grylle,"(Linnaeus, 1758)",7/30/90 12:00,-60.16275024,47.1866188,ACCD,EOR,31507,urn:lsid:marinespecies.org:taxname:137130,,FALSE,,,,137130
7d5a3d10-be76-4204-aa47-21c1dab967ab,Cepphus grylle,"(Linnaeus, 1758)",07/12/2006 18:17,-68.0587,44.3285,NA,,5253,137130,,FALSE,,,,137130
7d64c448-7972-4e83-8ba7-a9262803d062,Cepphus grylle,"(Linnaeus, 1758)",1979-08-18T12:10:00,-63.55,59.3333,Canadian Wildlife Service,280,280_119745,urn:lsid:marinespecies.org:taxname:137130,,FALSE,,,,137130
7da5bf21-a7d6-4af3-b681-d3ecc8e92281,Cepphus grylle,,,-52.22,53.61,"Canadian Wildlife Service-Atlantic, Environment Canada",,1258482491_1258806681_-1256113532,urn:lsid:marinespecies.org:taxname:137130,,FALSE,,,,137130
7e0e3b1b-0ea5-4a6a-bf52-c3986d1aa0e8,Cepphus grylle,,,-58.48,49.2,"Canadian Wildlife Service-Atlantic, Environment Canada",,896836590_2046568259_-1348639451,urn:lsid:marinespecies.org:taxname:137130,,FALSE,,,,137130
7e19f572-a734-4fe7-b724-60ef402dcd39,Cepphus grylle,"(Linnaeus, 1758)",6/16/07 00:00,-61.51744,46.05675,Canadian Wildlife Service - Atlantic Region (CWS - Atlantic),,NS003460_BLGU_11806_2007-06-16,urn:lsid:marinespecies.org:taxname:137130,,FALSE,,,,137130
7e1d4b2e-f733-4bdc-a5b5-1ab6a81975d8,Cepphus grylle,"(Linnaeus, 1758)",7/24/06 10:10,-68.1779,44.2517,NA,,5819,137130,,FALSE,,,,137130
7e23ce98-3f9e-458a-996d-7570de8992d1,Cepphus grylle,"(Linnaeus, 1758)",1962-07-02T12:00:00Z,-61.04016876,46.61471176,ACCD,EOR,31730,urn:lsid:marinespecies.org:taxname:137130,,FALSE,,,,137130
7e24f9cb-e07c-4650-ba71-a9b1bb4de2a0,Cepphus grylle,"(Linnaeus, 1758)",07/10/2012 00:00,-54.1194,49.812,Canadian Wildlife Service - Atlantic Region (CWS - Atlantic),,NF003536_BLGU_10071_2012-07-10,urn:lsid:marinespecies.org:taxname:137130,,FALSE,,,,137130
7e3712b9-8e5a-4206-838c-c553db7740c6,Cepphus grylle,"(Linnaeus, 1758)",1989-07-24T12:00:00Z,-66.78942871,44.78469086,ACCD,EOR,31444,urn:lsid:marinespecies.org:taxname:137130,,FALSE,,,,137130
7e68d18e-77a5-45fd-ae7b-cd5e784d8e72,Cepphus grylle,"(Linnaeus, 1758)",6/21/86 12:00,-63.81055641,46.31604958,ACCD,EOR,31469,urn:lsid:marinespecies.org:taxname:137130,,FALSE,,,,137130
7e6b8595-1770-4580-aa8e-7aacb8f74b6e,Cepphus grylle,"(Linnaeus, 1758)",08/07/1978 00:00,-60.5989,55.90002,Canadian Wildlife Service - Atlantic Region (CWS - Atlantic),,NF000904_BLGU_2011_1978-08-07,urn:lsid:marinespecies.org:taxname:137130,,FALSE,,,,137130
7eb05cc6-93b1-4eb7-aa84-36be91c2c906,Cepphus grylle,"(Linnaeus, 1758)",8/27/05 13:22,-68.1068,44.3468,NA,,442781,137130,,FALSE,,,,137130
7ece8f74-96c6-401b-abb6-1fb9d3889857,Cepphus grylle,,,-56.79,51.44,"Canadian Wildlife Service-Atlantic, Environment Canada",,1367583303_395742570_1530619074,urn:lsid:marinespecies.org:taxname:137130,,FALSE,,,,137130
7edeff8c-cf4b-4fa2-842d-8e4a730a495b,Cepphus grylle,,,-61.56,50.1,"Canadian Wildlife Service-Atlantic, Environment Canada",,-1636689528_1456033371_-1100583562,urn:lsid:marinespecies.org:taxname:137130,,FALSE,,,,137130
7f04a666-8345-45ff-bbfb-41769f91735b,Cepphus grylle,"(Linnaeus, 1758)",1978-06-25T13:00:00,-55.7167,51.1333,Canadian Wildlife Service,280,280_101832,urn:lsid:marinespecies.org:taxname:137130,,FALSE,,,,137130
7f402650-2c06-4f02-b1f0-1d383ec7a238,Cepphus grylle,"(Linnaeus, 1758)",1983-01-22T20:00:00,-66.2333,44,Canadian Wildlife Service,280,280_159988,urn:lsid:marinespecies.org:taxname:137130,,FALSE,,,,137130
7ffe95ee-75d5-4615-af52-3f51aaf93f78,Cepphus grylle,"(Linnaeus, 1758)",7/15/89 00:00,-66.14861,43.63744,Canadian Wildlife Service - Atlantic Region (CWS - Atlantic),,NS001170_BLGU_2303_1989-07-15,urn:lsid:marinespecies.org:taxname:137130,,FALSE,,,,137130
80141df5-48d9-4f29-aca1-022d41515abc,Cepphus grylle,"(Linnaeus, 1758)",6/23/16 00:00,-65.9948,43.6772,Canadian Wildlife Service - Atlantic Region (CWS - Atlantic),,NS001424_BLGU_13286_2016-06-23,urn:lsid:marinespecies.org:taxname:137130,,FALSE,,,,137130
803b5e2b-38dd-44d0-8166-63633aaf7203,Cepphus grylle,,,-65.52,47.96,"Canadian Wildlife Service-Atlantic, Environment Canada",,1421648014_663909958_698779539,urn:lsid:marinespecies.org:taxname:137130,,FALSE,,,,137130
804b44db-8642-4caa-9102-aee5bf257aeb,Cepphus grylle,,,-59.65,46.2,"Canadian Wildlife Service-Atlantic, Environment Canada",,1270728399_-1800352280_-300768823,urn:lsid:marinespecies.org:taxname:137130,,FALSE,,,,137130
80575b29-78c4-4b38-b392-cd5905182167,Cepphus grylle,"(Linnaeus, 1758)",NA,-69.8003,41.7728,USFWS,,681199,137130,,FALSE,,,,137130
805be392-b7ed-4462-8c0d-666ea955d8ac,Cepphus grylle,"(Linnaeus, 1758)",8/15/78 00:00,-58.84083,54.93908,Canadian Wildlife Service - Atlantic Region (CWS - Atlantic),,NF000772_BLGU_1864_1978-08-15,urn:lsid:marinespecies.org:taxname:137130,,FALSE,,,,137130
80670ec3-37c1-4d19-ac6e-5b7c6aacc85e,Cepphus grylle,"(Linnaeus, 1758)",08/10/1978 00:00,-60.86556,56.35003,Canadian Wildlife Service - Atlantic Region (CWS - Atlantic),,NF000968_BLGU_2112_1978-08-10,urn:lsid:marinespecies.org:taxname:137130,,FALSE,,,,137130
80868776-6e1a-401d-a526-71a7267328ef,Cepphus grylle,"(Linnaeus, 1758)",1979-08-27T09:50:00,-61.9167,57.75,Canadian Wildlife Service,280,280_120885,urn:lsid:marinespecies.org:taxname:137130,,FALSE,,,,137130
80acf8d3-7197-41c7-91f5-47811192b6b2,Cepphus grylle,"(Linnaeus, 1758)",NA,-67.5586,44.5167,"BOEM, USFWS, NOAA, NAVY",,728399,137130,,FALSE,,,,137130
811d9cf3-c043-4acf-bb29-a8a9319b945a,Cepphus grylle,"(Linnaeus, 1758)",7/31/16 00:00,-66.04508,43.6623,Canadian Wildlife Service - Atlantic Region (CWS - Atlantic),,NS003527_BLGU_13403_2016-07-31,urn:lsid:marinespecies.org:taxname:137130,,FALSE,,,,137130
815733a9-b540-4fac-8dc1-215a431dff9f,Cepphus grylle,"(Linnaeus, 1758)",7/30/06 13:42,-68.0229,44.3393,NA,,5305,137130,,FALSE,,,,137130
81647e1b-96a8-4785-8f32-3cdc5f1033b1,Cepphus grylle,"(Linnaeus, 1758)",NA,-68.6214,44.1,"BOEM, USFWS, NOAA, NAVY",,728004,137130,,FALSE,,,,137130
81801789-db50-4f33-ac16-a53382c744ff,Cepphus grylle,"(Linnaeus, 1758)",1/30/09 11:26,-73.72693,39.78892,NA,,418881,137130,,FALSE,,,,137130
818422e7-8818-4e6d-b6be-a03d98e5fe8e,Cepphus grylle,"(Linnaeus, 1758)",1978-07-20T12:10:00,-55.55,53.5333,Canadian Wildlife Service,280,280_103506,urn:lsid:marinespecies.org:taxname:137130,,FALSE,,,,137130
81973261-c2e7-4a75-9e46-c96ef80b12c2,Cepphus grylle,"(Linnaeus, 1758)",1978-06-29T15:20:00,-58.2333,54.2333,Canadian Wildlife Service,280,280_102228,urn:lsid:marinespecies.org:taxname:137130,,FALSE,,,,137130
8217e8c9-2985-4e3c-9b03-33aec3c74d9a,Cepphus grylle,"(Linnaeus, 1758)",1975-07-22T09:50:00,-59.7667,47.7333,Canadian Wildlife Service,280,280_68704,urn:lsid:marinespecies.org:taxname:137130,,FALSE,,,,137130
82456898-1c37-45eb-8150-f189ec58b7d9,Cepphus grylle,,,-52.63,47.59,"Canadian Wildlife Service-Atlantic, Environment Canada",,1273771188_-2049035190_1784945544,urn:lsid:marinespecies.org:taxname:137130,,FALSE,,,,137130
82a04ab5-9003-4b5b-ae3c-1f14f9f5fdde,Cepphus grylle,"(Linnaeus, 1758)",1986-06-28T12:00:00Z,-65.16404724,47.81690979,ACCD,EOR,31409,urn:lsid:marinespecies.org:taxname:137130,,FALSE,,,,137130
82a9f9af-4c2f-464a-9461-9f31a886ca63,Cepphus grylle,"(Linnaeus, 1758)",7/26/05 10:19,-68.2028,44.1384,NA,,441202,137130,,FALSE,,,,137130
82aedecd-2db9-49cd-a14d-ac9f22f75e40,Cepphus grylle,"(Linnaeus, 1758)",1974-07-20T19:49:00,-55.8333,54.9833,Canadian Wildlife Service,280,280_64951,urn:lsid:marinespecies.org:taxname:137130,,FALSE,,,,137130
82d61b40-8228-433d-8095-5f5d5a2c3e6a,Cepphus grylle,"(Linnaeus, 1758)",2017-03-21T09:37:53,-71.0658,40.3446,NORMANDEAU,1817,1817_45617,urn:lsid:marinespecies.org:taxname:137130,,FALSE,,,,137130
830117b7-9ac1-4aef-b454-5afc49a645da,Cepphus grylle,"(Linnaeus, 1758)",7/25/87 12:00,-60.94079971,46.71197891,ACCD,EOR,31493,urn:lsid:marinespecies.org:taxname:137130,,FALSE,,,,137130
83196dbf-7bd8-4198-89fd-ea9cd6ea0ba3,Cepphus grylle,"(Linnaeus, 1758)",1971-11-01T13:50:00,-66.7833,44.9833,Canadian Wildlife Service,280,280_53708,urn:lsid:marinespecies.org:taxname:137130,,FALSE,,,,137130
8344f01b-4465-42ae-9687-8841d20e17f0,Cepphus grylle,"(Linnaeus, 1758)",1978-06-26T10:40:00,-55.6167,52.2,Canadian Wildlife Service,280,280_101942,urn:lsid:marinespecies.org:taxname:137130,,FALSE,,,,137130
835a086f-17f1-40dd-b3c2-997d7f1ccd76,Cepphus grylle,"(Linnaeus, 1758)",1979-08-25T11:05:00,-59.1167,55.1333,Canadian Wildlife Service,280,280_120660,urn:lsid:marinespecies.org:taxname:137130,,FALSE,,,,137130
837e1377-1d7c-43c0-875b-29ce19f090e6,Cepphus grylle,"(Linnaeus, 1758)",1976-07-30T19:41:00,-59.2167,56.5833,Canadian Wildlife Service,280,280_74852,urn:lsid:marinespecies.org:taxname:137130,,FALSE,,,,137130
83b28727-4509-48ee-8564-acbaab28592b,Cepphus grylle,,,-64.01,44.48,"Canadian Wildlife Service-Atlantic, Environment Canada",,-1815568076_994443311_-1033060875,urn:lsid:marinespecies.org:taxname:137130,,FALSE,,,,137130
83cb0a97-b1ea-4eae-92fa-c434ddc05851,Cepphus grylle,,,-65.1,49.31,"Canadian Wildlife Service-Atlantic, Environment Canada",,-801551520_-697217252_-1272042634,urn:lsid:marinespecies.org:taxname:137130,,FALSE,,,,137130
83fdf3ec-f618-4e21-bb40-52b9f23e62ce,Cepphus grylle,,,-65.4,47.95,"Canadian Wildlife Service-Atlantic, Environment Canada",,58439636_-1020152149_362019829,urn:lsid:marinespecies.org:taxname:137130,,FALSE,,,,137130
842ab7d4-6291-4b9d-8eb1-166344578fcf,Cepphus grylle,"(Linnaeus, 1758)",7/17/91 00:00,-66.75014,44.66697,Canadian Wildlife Service - Atlantic Region (CWS - Atlantic),,NB000101_BLGU_186_1991-07-17,urn:lsid:marinespecies.org:taxname:137130,,FALSE,,,,137130
84371a1d-9e65-442e-8419-6eda3c291920,Cepphus grylle,"(Linnaeus, 1758)",08/10/1975 12:00,-61.98831177,45.62620163,ACCD,EOR,31761,urn:lsid:marinespecies.org:taxname:137130,,FALSE,,,,137130
843c3900-37fe-4cf6-9099-2c1b22848458,Cepphus grylle,"(Linnaeus, 1758)",1977-08-05T11:50:00,-67.5333,59.2833,Canadian Wildlife Service,280,280_85241,urn:lsid:marinespecies.org:taxname:137130,,FALSE,,,,137130
8440fa64-3ad1-415a-8286-5b271375b2b8,Cepphus grylle,"(Linnaeus, 1758)",6/26/10 00:00,-63.99656,47.06065,Canadian Wildlife Service - Atlantic Region (CWS - Atlantic),,PE002615_BLGU_12295_2010-06-26,urn:lsid:marinespecies.org:taxname:137130,,FALSE,,,,137130
84582b04-59ff-4f73-9772-20d1baa989e3,Cepphus grylle,"(Linnaeus, 1758)",NA,-68.687,44.1082,USFWS,,670238,137130,,FALSE,,,,137130
846c9eb1-e1b3-4625-a2dc-919055d11ed0,Cepphus grylle,"(Linnaeus, 1758)",1973-02-20T09:25:00,-61.0333,45.4333,Canadian Wildlife Service,280,280_62593,urn:lsid:marinespecies.org:taxname:137130,,FALSE,,,,137130
84a0eb58-86be-4c3b-ae82-388a0a5e0ad1,Cepphus grylle,"(Linnaeus, 1758)",7/31/08 00:00,-66.90388,44.6184,Canadian Wildlife Service - Atlantic Region (CWS - Atlantic),,NB003369_BLGU_11951_2008-07-31,urn:lsid:marinespecies.org:taxname:137130,,FALSE,,,,137130
84c00db5-adc8-4ce6-a739-4f4bed840b8f,Cepphus grylle,"(Linnaeus, 1758)",01/01/1971 00:00,-62.3803,44.82106,Canadian Wildlife Service - Atlantic Region (CWS - Atlantic),,NS001181_BLGU_2498_1971-01-01,urn:lsid:marinespecies.org:taxname:137130,,FALSE,,,,137130
84f49543-a867-4408-9e8b-2028d122784b,Cepphus grylle,"(Linnaeus, 1758)",07/02/1971 12:00,-59.66574097,46.03327942,ACCD,EOR,31750,urn:lsid:marinespecies.org:taxname:137130,,FALSE,,,,137130
851f7ae6-a869-4029-acfa-8254fe2fdf3f,Cepphus grylle,"(Linnaeus, 1758)",01/01/1984 00:00,-53.81549,49.54989,Canadian Wildlife Service - Atlantic Region (CWS - Atlantic),,NF000563_BLGU_1332_1984-01-01,urn:lsid:marinespecies.org:taxname:137130,,FALSE,,,,137130
8550df59-1a9a-4157-b187-ccdebd8bb3e7,Cepphus grylle,"(Linnaeus, 1758)",1981-02-15T12:20:00,-57.3333,47.5,Canadian Wildlife Service,280,280_138806,urn:lsid:marinespecies.org:taxname:137130,,FALSE,,,,137130
85520b2a-e642-41af-86e1-214703997fca,Cepphus grylle,"(Linnaeus, 1758)",1979-08-13T09:45:00,-62.5,58.35,Canadian Wildlife Service,280,280_118700,urn:lsid:marinespecies.org:taxname:137130,,FALSE,,,,137130
85892b59-4d57-460d-af59-8c03c8a9d957,Cepphus grylle,"(Linnaeus, 1758)",06/09/1997 00:00,-61.26128,46.35939,Canadian Wildlife Service - Atlantic Region (CWS - Atlantic),,NS001348_BLGU_4934_1997-06-09,urn:lsid:marinespecies.org:taxname:137130,,FALSE,,,,137130
85ac45e3-9114-4870-a812-cb56a0969015,Cepphus grylle,"(Linnaeus, 1758)",1973-02-20T08:40:00,-61.0833,45.4167,Canadian Wildlife Service,280,280_62574,urn:lsid:marinespecies.org:taxname:137130,,FALSE,,,,137130
85ae051e-1831-4c14-ad67-fe0693f89e14,Cepphus grylle,"(Linnaeus, 1758)",05/06/1999,-68.5,53,ICES,DOME-Biota,12135611,urn:lsid:marinespecies.org:taxname:137130,,FALSE,,,,137130
8638a2ae-c210-47dd-affd-1a69ffe25cb5,Cepphus grylle,"(Linnaeus, 1758)",6/22/06 07:36,-68.2641,44.085,NA,,4449,137130,,FALSE,,,,137130
86441bca-444f-41ab-9895-19da699d519c,Cepphus grylle,,,-58.43,49.23,"Canadian Wildlife Service-Atlantic, Environment Canada",,896836590_103446553_-1889622554,urn:lsid:marinespecies.org:taxname:137130,,FALSE,,,,137130
865408ae-1323-4e1c-90bc-4dd47c71f19b,Cepphus grylle,,,-53.5,48.23,"Canadian Wildlife Service-Atlantic, Environment Canada",,1270557349_1621758297_1839222334,urn:lsid:marinespecies.org:taxname:137130,,FALSE,,,,137130
86bedd37-f539-4c05-8808-f83bd10a6b8a,Cepphus grylle,"(Linnaeus, 1758)",NA,-55.55,53.53333,NOAA,,68616,137130,,FALSE,,,,137130
870c6f31-cd2a-449e-8d8f-c5ff06f47882,Cepphus grylle,"(Linnaeus, 1758)",1979-08-14T06:25:00,-59.1,55.3,Canadian Wildlife Service,280,280_118821,urn:lsid:marinespecies.org:taxname:137130,,FALSE,,,,137130
875cfb65-da0d-4f30-86d0-3f3ca9ba6acc,Cepphus grylle,"(Linnaeus, 1758)",5/22/13 00:00,-61.5426,45.10182,Canadian Wildlife Service - Atlantic Region (CWS - Atlantic),,NS002232_BLGU_12450_2013-05-22,urn:lsid:marinespecies.org:taxname:137130,,FALSE,,,,137130
87afaee5-8ba4-4b7e-b627-2de0c0867c18,Cepphus grylle,"(Linnaeus, 1758)",1987-07-30T09:40:00,-56.5667,53.8667,Canadian Wildlife Service,280,280_202028,urn:lsid:marinespecies.org:taxname:137130,,FALSE,,,,137130
87dc3ae3-72e0-4f2a-9abb-adb2e31069ca,Cepphus grylle,"(Linnaeus, 1758)",8/17/86 12:00,-66.79019928,44.72700882,ACCD,EOR,31443,urn:lsid:marinespecies.org:taxname:137130,,FALSE,,,,137130
87e1b23f-6930-40c9-922c-1df7b981a89c,Cepphus grylle,,,-61.59,47.66,"Canadian Wildlife Service-Atlantic, Environment Canada",,545832393_-461766515_-755397094,urn:lsid:marinespecies.org:taxname:137130,,FALSE,,,,137130
88531051-29b8-4793-bdc9-c1f3c5f74667,Cepphus grylle,,,-64.36,49.76,"Canadian Wildlife Service-Atlantic, Environment Canada",,843543794_-285541870_-391691543,urn:lsid:marinespecies.org:taxname:137130,,FALSE,,,,137130
888e02e9-1dcc-4438-8e18-46bf1c451875,Cepphus grylle,"(Linnaeus, 1758)",2001-07-02T12:00:00Z,-66.68476868,44.62965012,ACCD,EOR,31778,urn:lsid:marinespecies.org:taxname:137130,,FALSE,,,,137130
88cefecc-9a00-42f2-8b8b-95a06b00bbfc,Cepphus grylle,"(Linnaeus, 1758)",12/16/13 08:39,-75.5252,36.79312,"BRI, DOE, BOEM",,756900,137130,,FALSE,,,,137130
88e61f7a-8ea5-4815-92c7-623928b1c2a4,Cepphus grylle,"(Linnaeus, 1758)",7/26/06 10:15,-68.2105,44.1995,NA,,6002,137130,,FALSE,,,,137130
892e625f-a018-494f-97f3-6020d793e37a,Cepphus grylle,,,-60.37,55.78,"Canadian Wildlife Service-Atlantic, Environment Canada",,1380544464_1037043671_1145484878,urn:lsid:marinespecies.org:taxname:137130,,FALSE,,,,137130
8934d8a8-b7f3-492e-a6e1-d6d58295973a,Cepphus grylle,,,-64.42,48.84,"Canadian Wildlife Service-Atlantic, Environment Canada",,58439636_1239784998_1597783696,urn:lsid:marinespecies.org:taxname:137130,,FALSE,,,,137130
89809763-d273-4dca-b625-a474ccdda328,Cepphus grylle,"(Linnaeus, 1758)",01/01/1971 00:00,-64.69175,45.33006,Canadian Wildlife Service - Atlantic Region (CWS - Atlantic),,NS001131_BLGU_2913_1971-01-01,urn:lsid:marinespecies.org:taxname:137130,,FALSE,,,,137130
89acb4c4-1cd9-4c89-88b6-2b0f34119b86,Cepphus grylle,"(Linnaeus, 1758)",05/01/2011 00:00,-61.5426,45.10182,Canadian Wildlife Service - Atlantic Region (CWS - Atlantic),,NS002232_BLGU_9929_2011-05-01,urn:lsid:marinespecies.org:taxname:137130,,FALSE,,,,137130
89c424f8-5c8d-4813-87c2-59c09147628b,Cepphus grylle,"(Linnaeus, 1758)",06/04/1980 12:00,-60.34700012,46.36671829,ACCD,EOR,31746,urn:lsid:marinespecies.org:taxname:137130,,FALSE,,,,137130
8a431542-f9a8-4abc-aca1-55b90215845b,Cepphus grylle,"(Linnaeus, 1758)",8/15/78 00:00,-57.93216,54.86665,Canadian Wildlife Service - Atlantic Region (CWS - Atlantic),,NF000766_BLGU_1856_1978-08-15,urn:lsid:marinespecies.org:taxname:137130,,FALSE,,,,137130
8a5625f5-7db9-4f0f-8649-550ee95288f3,Cepphus grylle,"(Linnaeus, 1758)",3/13/08 11:33,-74.06019,39.58188,NA,,562783,137130,,FALSE,,,,137130
8a5a94c8-7a2a-4284-aa4e-d88677629bd7,Cepphus grylle,"(Linnaeus, 1758)",6/24/14 00:00,-52.7804,47.23832,Canadian Wildlife Service - Atlantic Region (CWS - Atlantic),,NF000298_BLGU_12374_2014-06-24,urn:lsid:marinespecies.org:taxname:137130,,FALSE,,,,137130
8a875897-6d98-4807-b4fa-c18bcb3fbdd9,Cepphus grylle,"(Linnaeus, 1758)",7/24/05 08:57,-68.0267,44.3402,NA,,441032,137130,,FALSE,,,,137130
8a8fde92-deb2-4187-b75b-84c615203522,Cepphus grylle,,,-65.69,49.33,"Canadian Wildlife Service-Atlantic, Environment Canada",,-801551520_685797834_801014306,urn:lsid:marinespecies.org:taxname:137130,,FALSE,,,,137130
8a95b243-9933-4938-b02e-51bfaff47204,Cepphus grylle,,,-63.2,48.69,"Canadian Wildlife Service-Atlantic, Environment Canada",,1421648014_613103941_-1482946993,urn:lsid:marinespecies.org:taxname:137130,,FALSE,,,,137130
8aa0ef92-70d7-4b94-913c-81270c2b6990,Cepphus grylle,,,-58.31,55.1,"Canadian Wildlife Service-Atlantic, Environment Canada",,1373407025_1374398817_1782069629,urn:lsid:marinespecies.org:taxname:137130,,FALSE,,,,137130
8b0785c0-2991-49a9-90cf-e73dba00fd25,Cepphus grylle,"(Linnaeus, 1758)",1977-08-08T12:26:00,-60.1333,58.8333,Canadian Wildlife Service,280,280_85410,urn:lsid:marinespecies.org:taxname:137130,,FALSE,,,,137130
8b2c57a7-40e3-49f8-8856-861cb72cf363,Cepphus grylle,,,-57.79,51.33,"Canadian Wildlife Service-Atlantic, Environment Canada",,-1636689528_-1693340044_1802151419,urn:lsid:marinespecies.org:taxname:137130,,FALSE,,,,137130
8b2c7876-8af8-4083-bd3e-a474ac95ae89,Cepphus grylle,"(Linnaeus, 1758)",6/18/16 00:00,-65.30579,43.60258,Canadian Wildlife Service - Atlantic Region (CWS - Atlantic),,NS002259_BLGU_13274_2016-06-18,urn:lsid:marinespecies.org:taxname:137130,,FALSE,,,,137130
8b4aed11-3dc8-4ca8-b76b-a0688f376538,Cepphus grylle,"(Linnaeus, 1758)",1979-09-01T09:50:00,-60.8333,55.95,Canadian Wildlife Service,280,280_121208,urn:lsid:marinespecies.org:taxname:137130,,FALSE,,,,137130
8b5abe74-0768-4295-a9e6-88079c5312b0,Cepphus grylle,"(Linnaeus, 1758)",8/13/78 00:00,-59.73221,55.28333,Canadian Wildlife Service - Atlantic Region (CWS - Atlantic),,NF000835_BLGU_1931_1978-08-13,urn:lsid:marinespecies.org:taxname:137130,,FALSE,,,,137130
8b69cc60-b8d6-43af-bfe4-10eb999bc343,Cepphus grylle,"(Linnaeus, 1758)",1979-08-18T14:10:00,-63.75,59.4,Canadian Wildlife Service,280,280_119769,urn:lsid:marinespecies.org:taxname:137130,,FALSE,,,,137130
8b6a07a9-0153-4958-83a8-70a3ac7773be,Cepphus grylle,,,-58.46,49.2,"Canadian Wildlife Service-Atlantic, Environment Canada",,1421648014_434198770_463886872,urn:lsid:marinespecies.org:taxname:137130,,FALSE,,,,137130
8bba4f63-8ddf-43fe-8dcf-d875aacc82d5,Cepphus grylle,"(Linnaeus, 1758)",1956-07-02T00:00:00Z,-66.02851105,43.62232971,ACCD,EOR,31807,urn:lsid:marinespecies.org:taxname:137130,,FALSE,,,,137130
8bcea449-0837-4e17-a978-37099bfd794c,Cepphus grylle,"(Linnaeus, 1758)",06/09/1981 00:00,-61.26128,46.35939,Canadian Wildlife Service - Atlantic Region (CWS - Atlantic),,NS001348_BLGU_3146_1981-06-09,urn:lsid:marinespecies.org:taxname:137130,,FALSE,,,,137130
8bdc8e11-4396-4764-852a-875d139a8d29,Cepphus grylle,,,-59.71,46.28,"Canadian Wildlife Service-Atlantic, Environment Canada",,1270728399_-87654737_595739408,urn:lsid:marinespecies.org:taxname:137130,,FALSE,,,,137130
8bedd360-e284-48c6-b4cb-0c5a60cedf9d,Cepphus grylle,"(Linnaeus, 1758)",1969-06-17T05:50:00,-53.4333,49.2333,Canadian Wildlife Service,280,280_9279,urn:lsid:marinespecies.org:taxname:137130,,FALSE,,,,137130
8bf759ce-5e26-4fe7-bd1e-acc1b8fd8127,Cepphus grylle,"(Linnaeus, 1758)",6/21/79 12:00,-65.24961853,47.7999897,ACCD,EOR,31651,urn:lsid:marinespecies.org:taxname:137130,,FALSE,,,,137130
8ca61c83-67f9-4665-9f0f-9ec3e2dd49bc,Cepphus grylle,"(Linnaeus, 1758)",08/12/2000 12:00,-65.25669861,47.78926086,ACCD,EOR,31408,urn:lsid:marinespecies.org:taxname:137130,,FALSE,,,,137130
8cd82c29-8784-4708-90bf-860640530798,Cepphus grylle,"(Linnaeus, 1758)",7/26/05 09:42,-68.2073,44.2129,NA,,441191,137130,,FALSE,,,,137130
8d1d2a41-d394-4a87-9672-ef635478645b,Cepphus grylle,"(Linnaeus, 1758)",6/21/01 00:00,-55.4085,49.5402,Canadian Wildlife Service - Atlantic Region (CWS - Atlantic),,NF000546_BLGU_5877_2001-06-21,urn:lsid:marinespecies.org:taxname:137130,,FALSE,,,,137130
8d4f36ed-ae3d-4292-9368-090db4aa6ba8,Cepphus grylle,"(Linnaeus, 1758)",08/04/2005 09:33,-67.8553,44.3627,NA,,441583,137130,,FALSE,,,,137130
8d585601-1142-4e7f-938b-0eecc8482f5f,Cepphus grylle,"(Linnaeus, 1758)",1979-06-21T12:00:00Z,-65.34829712,47.75526047,ACCD,EOR,31415,urn:lsid:marinespecies.org:taxname:137130,,FALSE,,,,137130
8d5eb6aa-ae54-4342-a1f9-1ade96ee9d88,Cepphus grylle,"(Linnaeus, 1758)",1990-08-31T12:00:00Z,-61.83729172,45.64994049,ACCD,EOR,31482,urn:lsid:marinespecies.org:taxname:137130,,FALSE,,,,137130
8d640819-d04e-4e2c-a421-4c7c82fd1f82,Cepphus grylle,"(Linnaeus, 1758)",01/01/1986 00:00,-53.68221,46.98322,Canadian Wildlife Service - Atlantic Region (CWS - Atlantic),,NF000224_BLGU_602_1986-01-01,urn:lsid:marinespecies.org:taxname:137130,,FALSE,,,,137130
8d65188a-6c0e-406d-8288-88a40b660842,Cepphus grylle,"(Linnaeus, 1758)",01/01/1983 00:00,-56.38896,47.12491,Canadian Wildlife Service - Atlantic Region (CWS - Atlantic),,NF000266_BLGU_686_1983-01-01,urn:lsid:marinespecies.org:taxname:137130,,FALSE,,,,137130
8d799eaf-ec51-43b8-84ce-f806f689d699,Cepphus grylle,"(Linnaeus, 1758)",6/19/89 12:00,-65.80091095,43.63235855,ACCD,EOR,31458,urn:lsid:marinespecies.org:taxname:137130,,FALSE,,,,137130
8d7eed5c-393a-4b4d-8eab-4ea553bdbd9d,Cepphus grylle,"(Linnaeus, 1758)",5/21/86 00:00,-61.26128,46.35939,Canadian Wildlife Service - Atlantic Region (CWS - Atlantic),,NS001348_BLGU_3142_1986-05-21,urn:lsid:marinespecies.org:taxname:137130,,FALSE,,,,137130
8dac0074-7115-42f5-9005-b74e540fa6b3,Cepphus grylle,"(Linnaeus, 1758)",01/01/1998 00:00,-67.10187,44.50182,Canadian Wildlife Service - Atlantic Region (CWS - Atlantic),,NB000085_BLGU_4683_1998-01-01,urn:lsid:marinespecies.org:taxname:137130,,FALSE,,,,137130
8dbad2df-67c6-4f98-a659-e98e0aaf1827,Cepphus grylle,"(Linnaeus, 1758)",1980-05-24T12:00:00Z,-59.95988083,45.8946991,ACCD,EOR,31756,urn:lsid:marinespecies.org:taxname:137130,,FALSE,,,,137130
8dd6a122-6939-483d-b6d2-b02c95a117ee,Cepphus grylle,"(Linnaeus, 1758)",07/06/2016 00:00,-52.7804,47.23832,Canadian Wildlife Service - Atlantic Region (CWS - Atlantic),,NF000298_BLGU_12701_2016-07-06,urn:lsid:marinespecies.org:taxname:137130,,FALSE,,,,137130
8dd73902-7888-4c30-89d6-fef7361524df,Cepphus grylle,"(Linnaeus, 1758)",05/06/1999,-68.5,53,ICES,DOME-Biota,12135601,urn:lsid:marinespecies.org:taxname:137130,,FALSE,,,,137130
8dd976d1-a02f-4318-8784-3ff492b19c40,Cepphus grylle,,,-61.14,56.54,"Canadian Wildlife Service-Atlantic, Environment Canada",,1223666941_157464958_-1031680217,urn:lsid:marinespecies.org:taxname:137130,,FALSE,,,,137130
8e200603-adc7-4177-b3f4-63f1bb330b21,Cepphus grylle,"(Linnaeus, 1758)",1970-08-19T14:40:00,-66.8,45,Canadian Wildlife Service,280,280_26438,urn:lsid:marinespecies.org:taxname:137130,,FALSE,,,,137130
8e51ec2c-e1f1-4cc0-943d-9bd1128a5b9a,Cepphus grylle,"(Linnaeus, 1758)",2016-11-06T13:06:33,-71.8182,40.7431,NORMANDEAU,1817,1817_27257,urn:lsid:marinespecies.org:taxname:137130,,FALSE,,,,137130
8e605640-2603-4932-bbf4-72f9031e112e,Cepphus grylle,"(Linnaeus, 1758)",1978-06-29T15:30:00,-58.2667,54.2333,Canadian Wildlife Service,280,280_102232,urn:lsid:marinespecies.org:taxname:137130,,FALSE,,,,137130
8eb0ef48-f7e9-465c-a1d3-b84eb9fdb5b4,Cepphus grylle,"(Linnaeus, 1758)",09/02/1987 12:00,-60.40792847,46.67055893,ACCD,EOR,31494,urn:lsid:marinespecies.org:taxname:137130,,FALSE,,,,137130
8ee26a3f-11ba-4b10-9da6-788d79f75236,Cepphus grylle,,,-57.82,51.32,"Canadian Wildlife Service-Atlantic, Environment Canada",,-1636689528_-783847709_-1971526622,urn:lsid:marinespecies.org:taxname:137130,,FALSE,,,,137130
8efc83bb-f21e-45fd-b30e-282bd1009977,Cepphus grylle,"(Linnaeus, 1758)",05/06/1999,-68.5,53,ICES,DOME-Biota,12135597,urn:lsid:marinespecies.org:taxname:137130,,FALSE,,,,137130
8f44332e-3257-42dd-a777-61ae5691d061,Cepphus grylle,"(Linnaeus, 1758)",NA,-69.8908,41.9335,"BOEM, USFWS, NOAA, NAVY",,727401,137130,,FALSE,,,,137130
8f554d82-da56-45dd-b23d-f86bb795936b,Cepphus grylle,"(Linnaeus, 1758)",8/29/86 12:00,-66.70130157,44.97756958,ACCD,EOR,31448,urn:lsid:marinespecies.org:taxname:137130,,FALSE,,,,137130
8f63e962-6355-46b6-85ed-e6f1b3eb77aa,Cepphus grylle,"(Linnaeus, 1758)",01/01/1975 00:00,-54.14882,49.8299,Canadian Wildlife Service - Atlantic Region (CWS - Atlantic),,NF000601_BLGU_1548_1975-01-01,urn:lsid:marinespecies.org:taxname:137130,,FALSE,,,,137130
8fceaf0b-e86c-42b8-a12f-af6bdeeab241,Cepphus grylle,"(Linnaeus, 1758)",7/27/16 00:00,-65.98843,43.48639,Canadian Wildlife Service - Atlantic Region (CWS - Atlantic),,NS001146_BLGU_13354_2016-07-27_7:30,urn:lsid:marinespecies.org:taxname:137130,,FALSE,,,,137130
90072c52-d07d-4bab-a61d-8b571bf70392,Cepphus grylle,"(Linnaeus, 1758)",8/18/78 00:00,-58.29883,55.01665,Canadian Wildlife Service - Atlantic Region (CWS - Atlantic),,NF000784_BLGU_1879_1978-08-18,urn:lsid:marinespecies.org:taxname:137130,,FALSE,,,,137130
900b9d56-c4af-4d28-bc92-00be8506188e,Cepphus grylle,,,-64.12,48.77,"Canadian Wildlife Service-Atlantic, Environment Canada",,689065724_1096273907_1085606556,urn:lsid:marinespecies.org:taxname:137130,,FALSE,,,,137130
9029dfb4-e24d-4f6e-a3a5-01d7cee90e38,Cepphus grylle,,,-64.98,49.3,"Canadian Wildlife Service-Atlantic, Environment Canada",,-801551520_1968506900_1872731235,urn:lsid:marinespecies.org:taxname:137130,,FALSE,,,,137130
902a07ec-f7ef-47fe-92f5-41de2bf1f412,Cepphus grylle,,,-58.43,49.23,"Canadian Wildlife Service-Atlantic, Environment Canada",,896836590_103446553_-1204826769,urn:lsid:marinespecies.org:taxname:137130,,FALSE,,,,137130
903610db-6d1b-4818-8c6d-78a360430eeb,Cepphus grylle,,,-64.38,48.83,"Canadian Wildlife Service-Atlantic, Environment Canada",,58439636_-179877313_840162774,urn:lsid:marinespecies.org:taxname:137130,,FALSE,,,,137130
9095625e-2373-4286-8a33-c972a5afc746,Cepphus grylle,"(Linnaeus, 1758)",08/06/2006 11:46,-68.0718,44.3119,NA,,6598,137130,,FALSE,,,,137130
90b4d5f5-0dea-461b-9813-dc676579cc4e,Cepphus grylle,"(Linnaeus, 1758)",01/01/2001 00:00,-66.81908,44.61159,Canadian Wildlife Service - Atlantic Region (CWS - Atlantic),,NB000095_BLGU_5398_2001-01-01,urn:lsid:marinespecies.org:taxname:137130,,FALSE,,,,137130
90bfd4e7-4970-49a9-9f3e-c12f63340dba,Cepphus grylle,"(Linnaeus, 1758)",1979-08-04T16:45:00,-57.35,54.7667,Canadian Wildlife Service,280,280_117644,urn:lsid:marinespecies.org:taxname:137130,,FALSE,,,,137130
911739b8-5405-40b0-a327-9915ef847ac8,Cepphus grylle,"(Linnaeus, 1758)",1979-08-17T15:30:00,-63.0667,59.1667,Canadian Wildlife Service,280,280_119571,urn:lsid:marinespecies.org:taxname:137130,,FALSE,,,,137130
911fe5b7-7d42-4223-8b34-53108e5a981f,Cepphus grylle,,,-61.81,47.35,"Canadian Wildlife Service-Atlantic, Environment Canada",,-1933920140_1475696060_1798218614,urn:lsid:marinespecies.org:taxname:137130,,FALSE,,,,137130
9142419c-8354-4ba6-93f3-34d696e63e20,Cepphus grylle,,,-61.84,47.36,"Canadian Wildlife Service-Atlantic, Environment Canada",,109413192_-1044734261_1245669617,urn:lsid:marinespecies.org:taxname:137130,,FALSE,,,,137130
9149e13b-4d72-4dcf-aa38-77a536bdba82,Cepphus grylle,"(Linnaeus, 1758)",NA,-68.6942,44.1078,USFWS,,670239,137130,,FALSE,,,,137130
9161e61a-56ee-47db-8c0c-137947877ae6,Cepphus grylle,"(Linnaeus, 1758)",1986-08-10T12:00:00Z,-62.4238205,46.26119995,ACCD,EOR,31483,urn:lsid:marinespecies.org:taxname:137130,,FALSE,,,,137130
92365727-f9fb-412f-aaf0-91919a299bb6,Cepphus grylle,,,-61.37,56.53,"Canadian Wildlife Service-Atlantic, Environment Canada",,1380544464_1382011912_-1626263859,urn:lsid:marinespecies.org:taxname:137130,,FALSE,,,,137130
9243435f-f2f7-45b1-8a5b-16c08db89b75,Cepphus grylle,,,-64.21,48.06,"Canadian Wildlife Service-Atlantic, Environment Canada",,689065724_1028668017_-991238796,urn:lsid:marinespecies.org:taxname:137130,,FALSE,,,,137130
9284c950-4a7e-4ad4-aa99-ba6213bab4a9,Cepphus grylle,"(Linnaeus, 1758)",2017-03-21T09:37:53,-71.0659,40.3446,NORMANDEAU,1817,1817_45618,urn:lsid:marinespecies.org:taxname:137130,,FALSE,,,,137130
92d87b9d-dcf0-415a-8de6-0de7a02e90eb,Cepphus grylle,"(Linnaeus, 1758)",5/24/80 12:00,-60.06045151,45.86557007,ACCD,EOR,31757,urn:lsid:marinespecies.org:taxname:137130,,FALSE,,,,137130
92ee05d4-b18d-4dd8-bc75-c7b7e9e2c8da,Cepphus grylle,"(Linnaeus, 1758)",08/10/1978 00:00,-60.71556,56.25003,Canadian Wildlife Service - Atlantic Region (CWS - Atlantic),,NF000939_BLGU_2069_1978-08-10,urn:lsid:marinespecies.org:taxname:137130,,FALSE,,,,137130
931368ef-e56e-4ef0-802f-63f52e4b6064,Cepphus grylle,"(Linnaeus, 1758)",1982-06-10T12:00:00Z,-64.69264221,45.33010101,ACCD,EOR,31765,urn:lsid:marinespecies.org:taxname:137130,,FALSE,,,,137130
9341bc6b-e154-43b1-ab15-2a97135a93e0,Cepphus grylle,"(Linnaeus, 1758)",,-64.5,48.01667023,ACCD,EOR,31402,urn:lsid:marinespecies.org:taxname:137130,,FALSE,,,,137130
9347fa24-83d2-4f21-b9e9-56d7b3cfbb79,Cepphus grylle,"(Linnaeus, 1758)",1979-08-18T14:20:00,-63.7333,59.4167,Canadian Wildlife Service,280,280_119771,urn:lsid:marinespecies.org:taxname:137130,,FALSE,,,,137130
9367abb7-ca51-4bf9-99bd-da153c5f6fde,Cepphus grylle,"(Linnaeus, 1758)",1975-07-29T17:45:00,-81.4833,58.4667,Canadian Wildlife Service,280,280_69680,urn:lsid:marinespecies.org:taxname:137130,,FALSE,,,,137130
94349220-4e8f-4d51-90b4-a07121872b33,Cepphus grylle,"(Linnaeus, 1758)",1978-08-28T11:00:00,-59.9,55.4333,Canadian Wildlife Service,280,280_108520,urn:lsid:marinespecies.org:taxname:137130,,FALSE,,,,137130
945a9499-d7cc-4f61-a668-d9a481701111,Cepphus grylle,"(Linnaeus, 1758)",7/22/87 12:00,-62.33975983,44.82471085,ACCD,EOR,31478,urn:lsid:marinespecies.org:taxname:137130,,FALSE,,,,137130
9461b5eb-f55e-4400-beac-bed16f397a43,Cepphus grylle,"(Linnaeus, 1758)",1973-03-03T13:05:00,-60.8667,49.6167,Canadian Wildlife Service,280,280_62782,urn:lsid:marinespecies.org:taxname:137130,,FALSE,,,,137130
94a3cd5c-df83-4438-a254-ffbcc8d5aa1f,Cepphus grylle,,,-64.83,49.27,"Canadian Wildlife Service-Atlantic, Environment Canada",,-801551520_359990762_594229273,urn:lsid:marinespecies.org:taxname:137130,,FALSE,,,,137130
94df57e2-c1b3-4cf3-b858-8211351442df,Cepphus grylle,"(Linnaeus, 1758)",1980-04-09T05:20:00,-53.5167,46.6,Canadian Wildlife Service,280,280_124513,urn:lsid:marinespecies.org:taxname:137130,,FALSE,,,,137130
94f3339a-bad1-4d01-b950-80b9fe060fff,Cepphus grylle,"(Linnaeus, 1758)",08/10/1975 00:00,-61.98831,45.6262,Canadian Wildlife Service - Atlantic Region (CWS - Atlantic),,NS001094_BLGU_3019_1975-08-10,urn:lsid:marinespecies.org:taxname:137130,,FALSE,,,,137130
94fe462c-3617-4e0d-b7c8-0a0cbcfa7a34,Cepphus grylle,"(Linnaeus, 1758)",7/22/05 13:22,-68.1552,44.2868,NA,,440497,137130,,FALSE,,,,137130
951bfba6-5c13-4970-9af5-bfab17e87882,Cepphus grylle,,,-65.5,47.97,"Canadian Wildlife Service-Atlantic, Environment Canada",,58439636_-909403994_1928213089,urn:lsid:marinespecies.org:taxname:137130,,FALSE,,,,137130
951d7b8f-5344-4815-b06f-b7d5d0ccc873,Cepphus grylle,,,-61.56,50.1,"Canadian Wildlife Service-Atlantic, Environment Canada",,-1636689528_1456033371_816331113,urn:lsid:marinespecies.org:taxname:137130,,FALSE,,,,137130
95248cd9-1d13-42d3-a320-7c388f4cbd71,Cepphus grylle,"(Linnaeus, 1758)",8/13/78 00:00,-59.74888,55.18333,Canadian Wildlife Service - Atlantic Region (CWS - Atlantic),,NF000804_BLGU_1896_1978-08-13,urn:lsid:marinespecies.org:taxname:137130,,FALSE,,,,137130
953874fb-4066-475e-b75b-16ba9976f7b7,Cepphus grylle,,,-52.81,47.01,"Canadian Wildlife Service-Atlantic, Environment Canada",,1353408495_-1182649571_-1945171430,urn:lsid:marinespecies.org:taxname:137130,,FALSE,,,,137130
9545d80e-0785-4a0b-9af7-f89c0d838b72,Cepphus grylle,,,-60.64,49.01,"Canadian Wildlife Service-Atlantic, Environment Canada",,-801551520_911758554_1503126915,urn:lsid:marinespecies.org:taxname:137130,,FALSE,,,,137130
957a5c5b-7d83-4871-8761-166180253b53,Cepphus grylle,,,-64.2,44.29,"Canadian Wildlife Service-Atlantic, Environment Canada",,2114767753_-1447173879_-354641856,urn:lsid:marinespecies.org:taxname:137130,,FALSE,,,,137130
95bc2fe8-014b-4424-924a-ce3367091609,Cepphus grylle,"(Linnaeus, 1758)",1970-08-19T14:30:00,-66.7833,44.9667,Canadian Wildlife Service,280,280_26427,urn:lsid:marinespecies.org:taxname:137130,,FALSE,,,,137130
95bcfa4b-8f63-4f7a-88b1-de17cb489558,Cepphus grylle,"(Linnaeus, 1758)",1969-08-13T10:00:00,-55.3667,52.0167,Canadian Wildlife Service,280,280_18267,urn:lsid:marinespecies.org:taxname:137130,,FALSE,,,,137130
95fbeb07-c157-4369-8709-aec624b4948d,Cepphus grylle,,,-60.84,45.56,"Canadian Wildlife Service-Atlantic, Environment Canada",,-722473856_-629760728_1823500182,urn:lsid:marinespecies.org:taxname:137130,,FALSE,,,,137130
96104c32-61bb-465f-87e9-97e9928c7d30,Cepphus grylle,"(Linnaeus, 1758)",6/27/09 00:00,-63.81098,46.31633,Canadian Wildlife Service - Atlantic Region (CWS - Atlantic),,PE002171_BLGU_11916_2009-06-27,urn:lsid:marinespecies.org:taxname:137130,,FALSE,,,,137130
96240c62-5c70-43de-bdc2-9c9df0fcd603,Cepphus grylle,"(Linnaeus, 1758)",07/12/2006 18:12,-68.0146,44.3411,NA,,5251,137130,,FALSE,,,,137130
965a940d-7782-4f3a-9ecb-9814c11a8f14,Cepphus grylle,"(Linnaeus, 1758)",8/14/78 00:00,-60.06556,55.40001,Canadian Wildlife Service - Atlantic Region (CWS - Atlantic),,NF000856_BLGU_1952_1978-08-14,urn:lsid:marinespecies.org:taxname:137130,,FALSE,,,,137130
966bf26e-d90a-40a2-ab74-1afd0e55747a,Cepphus grylle,"(Linnaeus, 1758)",07/02/1956 00:00,-66.02851105,43.62232971,ACCD,EOR,31807,urn:lsid:marinespecies.org:taxname:137130,,FALSE,,,,137130
969b7a05-4f51-4ea7-936d-62c3d9f58eb1,Cepphus grylle,"(Linnaeus, 1758)",1978-06-24T08:35:00,-55.4333,49.9333,Canadian Wildlife Service,280,280_101701,urn:lsid:marinespecies.org:taxname:137130,,FALSE,,,,137130
9724876e-6a35-450b-b90b-fdd1a6a33c07,Cepphus grylle,"(Linnaeus, 1758)",6/24/05 10:04,-67.8584,44.3647,NA,,439751,137130,,FALSE,,,,137130
976a4ee7-c565-4366-99de-8ea46568f101,Cepphus grylle,"(Linnaeus, 1758)",08/12/1990 12:00,-60.45996094,46.99935913,ACCD,EOR,31498,urn:lsid:marinespecies.org:taxname:137130,,FALSE,,,,137130
976fc6c6-ba25-49b1-914e-eef13bcb1ce9,Cepphus grylle,"(Linnaeus, 1758)",05/06/1999,-68.5,53,ICES,DOME-Biota,12135600,urn:lsid:marinespecies.org:taxname:137130,,FALSE,,,,137130
97798283-e7fb-4ae1-87c9-071774074469,Cepphus grylle,"(Linnaeus, 1758)",1978-06-29T10:00:00,-57.2667,54.15,Canadian Wildlife Service,280,280_102181,urn:lsid:marinespecies.org:taxname:137130,,FALSE,,,,137130
97cb043e-0210-47b5-aab4-04afa5b07c4b,Cepphus grylle,"(Linnaeus, 1758)",6/27/66 12:00,-65.81474304,47.8927803,ACCD,EOR,31410,urn:lsid:marinespecies.org:taxname:137130,,FALSE,,,,137130
9832986e-1773-42bc-9ca7-413843a537af,Cepphus grylle,"(Linnaeus, 1758)",07/02/2001 12:00,-66.81907654,44.61159134,ACCD,EOR,31783,urn:lsid:marinespecies.org:taxname:137130,,FALSE,,,,137130
984b4359-8024-4e3c-85bf-f108ac9a5595,Cepphus grylle,"(Linnaeus, 1758)",1973-03-08T08:20:00,-59.7833,48.45,Canadian Wildlife Service,280,280_62820,urn:lsid:marinespecies.org:taxname:137130,,FALSE,,,,137130
984ff879-c49d-49dd-8821-f1a0940a191c,Cepphus grylle,"(Linnaeus, 1758)",06/06/2014 00:00,-66.75834,44.58521,Canadian Wildlife Service - Atlantic Region (CWS - Atlantic),,NB000089_BLGU_13721_2014-06-06,urn:lsid:marinespecies.org:taxname:137130,,FALSE,,,,137130
985df133-4871-4391-99f9-66e0cb0181fd,Cepphus grylle,"(Linnaeus, 1758)",1978-07-15T18:05:00,-55.3667,54.8333,Canadian Wildlife Service,280,280_102765,urn:lsid:marinespecies.org:taxname:137130,,FALSE,,,,137130
986dec8f-80af-4d0e-a0e6-cc0643468064,Cepphus grylle,"(Linnaeus, 1758)",1977-08-05T11:50:00,-67.5333,59.2833,Canadian Wildlife Service,280,280_85240,urn:lsid:marinespecies.org:taxname:137130,,FALSE,,,,137130
9896cecc-4dfa-4e56-b291-7ade7328065c,Cepphus grylle,"(Linnaeus, 1758)",1978-07-20T18:40:00,-56.4667,54.5,Canadian Wildlife Service,280,280_103622,urn:lsid:marinespecies.org:taxname:137130,,FALSE,,,,137130
98b8200d-66c8-4493-b214-3efc717989a5,Cepphus grylle,"(Linnaeus, 1758)",1981-02-17T08:10:00,-56,46.6667,Canadian Wildlife Service,280,280_138911,urn:lsid:marinespecies.org:taxname:137130,,FALSE,,,,137130
98cd9528-ea53-4eea-b217-c13bab4e4a79,Cepphus grylle,"(Linnaeus, 1758)",01/01/1977 00:00,-55.6158,46.86926,Canadian Wildlife Service - Atlantic Region (CWS - Atlantic),,NF000212_BLGU_526_1977-01-01,urn:lsid:marinespecies.org:taxname:137130,,FALSE,,,,137130
9901d29d-181e-42ef-bebd-3c3c2b9a9fc5,Cepphus grylle,"(Linnaeus, 1758)",05/01/2001 00:00,-61.5426,45.10182,Canadian Wildlife Service - Atlantic Region (CWS - Atlantic),,NS002232_BLGU_9899_2001-05-01,urn:lsid:marinespecies.org:taxname:137130,,FALSE,,,,137130
991a8258-5cb1-4477-8201-9495a2ce3e49,Cepphus grylle,"(Linnaeus, 1758)",8/13/78 00:00,-60.18223,55.45001,Canadian Wildlife Service - Atlantic Region (CWS - Atlantic),,NF000865_BLGU_1967_1978-08-13,urn:lsid:marinespecies.org:taxname:137130,,FALSE,,,,137130
9924741f-3a0d-4c33-8a3d-cdabe7ad9d4d,Cepphus grylle,"(Linnaeus, 1758)",1988-06-12T12:00:00Z,-65.9883728,43.48546982,ACCD,EOR,31457,urn:lsid:marinespecies.org:taxname:137130,,FALSE,,,,137130
996de473-74d3-4b63-83de-2f0d23db24da,Cepphus grylle,,,-65.52,47.96,"Canadian Wildlife Service-Atlantic, Environment Canada",,1421648014_-575293286_1498620698,urn:lsid:marinespecies.org:taxname:137130,,FALSE,,,,137130
997e264f-b1f0-4b25-ba74-710439417484,Cepphus grylle,"(Linnaeus, 1758)",01/01/1976 00:00,-53.2322,46.65822,Canadian Wildlife Service - Atlantic Region (CWS - Atlantic),,NF000180_BLGU_313_1976-01-01,urn:lsid:marinespecies.org:taxname:137130,,FALSE,,,,137130
9980bc7d-c2ac-439d-b533-799364653869,Cepphus grylle,"(Linnaeus, 1758)",7/15/06 12:13,-67.8563,44.3645,NA,,5436,137130,,FALSE,,,,137130
998ec47a-48a5-4f46-b03a-f255833f0170,Cepphus grylle,,,-65.43,47.96,"Canadian Wildlife Service-Atlantic, Environment Canada",,-635145613_-902790402_-62121672,urn:lsid:marinespecies.org:taxname:137130,,FALSE,,,,137130
99c4368b-fbad-4a15-bd7a-8a2d12a9bf2b,Cepphus grylle,,,-68.68,48.86,"Canadian Wildlife Service-Atlantic, Environment Canada",,-801551520_-1381078135_636693159,urn:lsid:marinespecies.org:taxname:137130,,FALSE,,,,137130
99f96d8a-a360-4a1f-a001-9a460c112f9d,Cepphus grylle,"(Linnaeus, 1758)",07/02/1987 12:00,-66.75833511,44.58510399,ACCD,EOR,31424,urn:lsid:marinespecies.org:taxname:137130,,FALSE,,,,137130
9a154469-2254-4510-b9f7-28376ef533a1,Cepphus grylle,"(Linnaeus, 1758)",1969-06-03T15:10:00,-61.7833,45.95,Canadian Wildlife Service,280,280_7449,urn:lsid:marinespecies.org:taxname:137130,,FALSE,,,,137130
9a31b88b-a970-47dc-8a62-5bfa337ef08a,Cepphus grylle,"(Linnaeus, 1758)",08/06/2006 08:53,-68.0487,44.3283,NA,,6591,137130,,FALSE,,,,137130
9a3dfe3e-9307-4d58-8bff-4341d0c5001d,Cepphus grylle,,,-61.51,50.11,"Canadian Wildlife Service-Atlantic, Environment Canada",,-1636689528_1026777304_232341951,urn:lsid:marinespecies.org:taxname:137130,,FALSE,,,,137130
9a4921b7-2f2a-458d-996e-ffc30044114c,Cepphus grylle,"(Linnaeus, 1758)",1978-04-11T06:10:00,-51.6,48.4667,Canadian Wildlife Service,280,280_98441,urn:lsid:marinespecies.org:taxname:137130,,FALSE,,,,137130
9a72c780-3215-425d-ba11-e84458f4014d,Cepphus grylle,"(Linnaeus, 1758)",07/02/2001 12:00,-64.04988861,44.3838501,ACCD,EOR,31803,urn:lsid:marinespecies.org:taxname:137130,,FALSE,,,,137130
9ade58e1-c76d-410d-bb50-650a772c3e5d,Cepphus grylle,,,-65.96,48.02,"Canadian Wildlife Service-Atlantic, Environment Canada",,1421648014_-1459902758_2055776497,urn:lsid:marinespecies.org:taxname:137130,,FALSE,,,,137130
9ae534e3-14bc-4bb6-bf83-ae6d999907ec,Cepphus grylle,"(Linnaeus, 1758)",NA,-69.3948,43.7677,"BOEM, USFWS, NOAA, NAVY",,732390,137130,,FALSE,,,,137130
9b05f9a2-2515-4d7a-a5b3-ecbfbbc1542f,Cepphus grylle,,,-58.5,49.12,"Canadian Wildlife Service-Atlantic, Environment Canada",,896836590_783080547_-2047491109,urn:lsid:marinespecies.org:taxname:137130,,FALSE,,,,137130
9b1e631e-4d0f-40dd-b507-258d052aa7fd,Cepphus grylle,"(Linnaeus, 1758)",1976-08-02T10:25:00,-62.4333,58.6167,Canadian Wildlife Service,280,280_75034,urn:lsid:marinespecies.org:taxname:137130,,FALSE,,,,137130
9b307967-f19c-4130-953c-e5851ff9e0e0,Cepphus grylle,"(Linnaeus, 1758)",7/26/78 00:00,-55.76545,53.54994,Canadian Wildlife Service - Atlantic Region (CWS - Atlantic),,NF000682_BLGU_1728_1978-07-26,urn:lsid:marinespecies.org:taxname:137130,,FALSE,,,,137130
9b9a5b16-90b7-42f3-8ed8-16e3008f7b8f,Cepphus grylle,,,-61.2,56.54,"Canadian Wildlife Service-Atlantic, Environment Canada",,1223666941_1223748917_1270304850,urn:lsid:marinespecies.org:taxname:137130,,FALSE,,,,137130
9bd98090-6be1-42c6-a445-552f761a5007,Cepphus grylle,"(Linnaeus, 1758)",08/06/2006 08:54,-68.0406,44.3335,NA,,6592,137130,,FALSE,,,,137130
9bf3c266-3e2e-4959-8c38-e80f44096798,Cepphus grylle,"(Linnaeus, 1758)",6/25/97 00:00,-64.04913,44.38377,Canadian Wildlife Service - Atlantic Region (CWS - Atlantic),,NS001336_BLGU_4898_1997-06-25_1000,urn:lsid:marinespecies.org:taxname:137130,,FALSE,,,,137130
9cb1fe96-9219-4f69-a734-420908998e82,Cepphus grylle,"(Linnaeus, 1758)",08/02/1990 12:00,-65.00090027,45.24969101,ACCD,EOR,31462,urn:lsid:marinespecies.org:taxname:137130,,FALSE,,,,137130
9cbb25c2-4b44-4e2d-baa8-07158658693a,Cepphus grylle,"(Linnaeus, 1758)",NA,-68.5017,44.1078,USFWS,,670341,137130,,FALSE,,,,137130
9cbd5b84-26c4-4be0-b9fb-967be8e9fde4,Cepphus grylle,"(Linnaeus, 1758)",8/13/78 00:00,-60.14889,55.55001,Canadian Wildlife Service - Atlantic Region (CWS - Atlantic),,NF000880_BLGU_1981_1978-08-13,urn:lsid:marinespecies.org:taxname:137130,,FALSE,,,,137130
9cc0b471-1e99-4592-b7b8-57428845477d,Cepphus grylle,"(Linnaeus, 1758)",NA,-67.6444,44.5168,"BOEM, USFWS, NOAA, NAVY",,732640,137130,,FALSE,,,,137130
9cc0ceb8-deae-40c9-8ebb-99e59ac31880,Cepphus grylle,"(Linnaeus, 1758)",NA,-68.6036,44.1082,USFWS,,670230,137130,,FALSE,,,,137130
9cc5673f-7e08-4e79-996a-c5357ce5a4a7,Cepphus grylle,,,-53.11,48.12,"Canadian Wildlife Service-Atlantic, Environment Canada",,1201195787_-1996839147_929690258,urn:lsid:marinespecies.org:taxname:137130,,FALSE,,,,137130
9cca4846-fca4-4abf-8b81-9823997aff83,Cepphus grylle,,,-64.81,49.76,"Canadian Wildlife Service-Atlantic, Environment Canada",,689065724_-1339955327_-1119572969,urn:lsid:marinespecies.org:taxname:137130,,FALSE,,,,137130
9cce65ab-669d-4bf4-8889-f7618c2e1d5c,Cepphus grylle,"(Linnaeus, 1758)",01/01/2001 00:00,-66.68477,44.62965,Canadian Wildlife Service - Atlantic Region (CWS - Atlantic),,NB000086_BLGU_5394_2001-01-01,urn:lsid:marinespecies.org:taxname:137130,,FALSE,,,,137130
9cd3e1b9-b791-4b92-8c70-ff453d690125,Cepphus grylle,"(Linnaeus, 1758)",05/06/2000,-68.5,53,ICES,DOME-Biota,12135352,urn:lsid:marinespecies.org:taxname:137130,,FALSE,,,,137130
9cf76c3b-b5eb-41d1-8828-b5bbaf8dbf9c,Cepphus grylle,"(Linnaeus, 1758)",8/13/78 00:00,-61.04891,56.25003,Canadian Wildlife Service - Atlantic Region (CWS - Atlantic),,NF000938_BLGU_2071_1978-08-13,urn:lsid:marinespecies.org:taxname:137130,,FALSE,,,,137130
9d28361f-103b-4c20-aa44-d98281aa2806,Cepphus grylle,"(Linnaeus, 1758)",1990-06-25T12:00:00Z,-60.3813591,46.37894821,ACCD,EOR,31502,urn:lsid:marinespecies.org:taxname:137130,,FALSE,,,,137130
9d3cf470-a1dc-41ab-bfcf-9612f6ce4b5e,Cepphus grylle,"(Linnaeus, 1758)",07/10/2012 00:00,-54.0924,49.8218,Canadian Wildlife Service - Atlantic Region (CWS - Atlantic),,NF003531_BLGU_10057_2012-07-10,urn:lsid:marinespecies.org:taxname:137130,,FALSE,,,,137130
9d6e94ca-d15a-4e9b-b079-fde641823a07,Cepphus grylle,"(Linnaeus, 1758)",1979-08-27T13:00:00,-61.55,57.2667,Canadian Wildlife Service,280,280_120916,urn:lsid:marinespecies.org:taxname:137130,,FALSE,,,,137130
9d7d90ab-8274-452d-814a-3243a73fadc5,Cepphus grylle,"(Linnaeus, 1758)",1973-03-03T14:25:00,-60.8667,49.9,Canadian Wildlife Service,280,280_62788,urn:lsid:marinespecies.org:taxname:137130,,FALSE,,,,137130
9dabd2c2-3c57-4e00-a7d5-12d227cb703f,Cepphus grylle,"(Linnaeus, 1758)",8/22/08 00:00,-66.89897,44.59779,Canadian Wildlife Service - Atlantic Region (CWS - Atlantic),,NB000090_BLGU_11949_2008-08-22,urn:lsid:marinespecies.org:taxname:137130,,FALSE,,,,137130
9dd5e536-5037-4ecc-bbca-c2359b571ab7,Cepphus grylle,"(Linnaeus, 1758)",,-70.69000244,41.50999832,Smithsonian Environmental Research Center,A Biological Survey of the Waters of Woods Hole and Vacinity,580,urn:lsid:marinespecies.org:taxname:137130,,FALSE,,,,137130
9e09e747-c62e-425d-b393-6865a8e5b8d0,Cepphus grylle,"(Linnaeus, 1758)",1979-08-14T16:00:00,-62.9,58.4833,Canadian Wildlife Service,280,280_118890,urn:lsid:marinespecies.org:taxname:137130,,FALSE,,,,137130
9ec04d0c-e635-472b-9519-7c1ef5a98fa2,Cepphus grylle,"(Linnaeus, 1758)",1981-02-15T13:30:00,-57.3333,47.5,Canadian Wildlife Service,280,280_138814,urn:lsid:marinespecies.org:taxname:137130,,FALSE,,,,137130
9ec0f2fd-860c-4946-8805-516ac783b3f1,Cepphus grylle,"(Linnaeus, 1758)",8/18/78 00:00,-58.83219,55.04999,Canadian Wildlife Service - Atlantic Region (CWS - Atlantic),,NF000787_BLGU_1881_1978-08-18,urn:lsid:marinespecies.org:taxname:137130,,FALSE,,,,137130
9edd4f59-0ba2-4dfe-ac10-d056dd0c0b64,Cepphus grylle,"(Linnaeus, 1758)",,-66.15000153,47.98332977,ACCD,EOR,31404,urn:lsid:marinespecies.org:taxname:137130,,FALSE,,,,137130
9eebf776-d83c-41ec-ba37-f86439fc07ff,Cepphus grylle,,,-52.81,46.2,"Canadian Wildlife Service-Atlantic, Environment Canada",,-1273965972_1537059744_-859926350,urn:lsid:marinespecies.org:taxname:137130,,FALSE,,,,137130
9ef388aa-a882-4259-8773-d1b36a84f79d,Cepphus grylle,,,-64.61,48.3,"Canadian Wildlife Service-Atlantic, Environment Canada",,689065724_1623609376_-1637050891,urn:lsid:marinespecies.org:taxname:137130,,FALSE,,,,137130
9f0132f6-6706-4ec2-8250-236a9493af7e,Cepphus grylle,"(Linnaeus, 1758)",7/22/05 11:09,-68.127,44.2549,NA,,440380,137130,,FALSE,,,,137130
9f090465-0e03-4d97-8f4b-8de836652649,Cepphus grylle,"(Linnaeus, 1758)",1969-06-24T15:20:00,-59.4333,47.7167,Canadian Wildlife Service,280,280_10478,urn:lsid:marinespecies.org:taxname:137130,,FALSE,,,,137130
9f0cbb2c-9d7c-4494-b2b5-8be29d61609a,Cepphus grylle,"(Linnaeus, 1758)",5/26/76 00:00,-61.26128,46.35939,Canadian Wildlife Service - Atlantic Region (CWS - Atlantic),,NS001348_BLGU_3140_1976-05-26,urn:lsid:marinespecies.org:taxname:137130,,FALSE,,,,137130
9f2cc34e-76dd-497f-816d-41c202961f77,Cepphus grylle,"(Linnaeus, 1758)",06/11/1987 12:00,-59.82984924,45.95544815,ACCD,EOR,31509,urn:lsid:marinespecies.org:taxname:137130,,FALSE,,,,137130
9f37e7c6-6e2f-4899-b062-c9c40a10204e,Cepphus grylle,"(Linnaeus, 1758)",1987-07-22T06:20:00,-56.55,51.2833,Canadian Wildlife Service,280,280_200960,urn:lsid:marinespecies.org:taxname:137130,,FALSE,,,,137130
9f40b7e9-3201-47ff-b40a-76aa224508d6,Cepphus grylle,"(Linnaeus, 1758)",01/01/1975 00:00,-63.81098,46.31633,Canadian Wildlife Service - Atlantic Region (CWS - Atlantic),,PE002171_BLGU_3316_1975-01-01,urn:lsid:marinespecies.org:taxname:137130,,FALSE,,,,137130
9f682c9c-1ca9-4a11-a10e-e81dc7cebc01,Cepphus grylle,,,-69.33,43.8,"Canadian Wildlife Service-Atlantic, Environment Canada",,1272746530_601530371_1273273683,urn:lsid:marinespecies.org:taxname:137130,,FALSE,,,,137130
9f6a236e-6b54-4207-995a-b6287bb15f09,Cepphus grylle,,,-65.54,47.97,"Canadian Wildlife Service-Atlantic, Environment Canada",,-635145613_1650945990_657438122,urn:lsid:marinespecies.org:taxname:137130,,FALSE,,,,137130
9f8298d6-74fa-4944-9658-a20b64b5669f,Cepphus grylle,"(Linnaeus, 1758)",1979-09-01T08:30:00,-61.1833,56.0333,Canadian Wildlife Service,280,280_121175,urn:lsid:marinespecies.org:taxname:137130,,FALSE,,,,137130
9f858088-6f32-4b08-9477-c33fc8779ed5,Cepphus grylle,"(Linnaeus, 1758)",01/01/1973 00:00,-52.7804,47.23832,Canadian Wildlife Service - Atlantic Region (CWS - Atlantic),,NF000298_BLGU_830_1973-01-01,urn:lsid:marinespecies.org:taxname:137130,,FALSE,,,,137130
9f8d29c3-f0e4-4521-a55c-d53b6d9a7d8e,Cepphus grylle,"(Linnaeus, 1758)",6/21/05 13:40,-68.1874,44.2229,NA,,439636,137130,,FALSE,,,,137130
9fa39788-56a3-4f70-a925-a0a6b1343301,Cepphus grylle,,,-63.51,44.56,"Canadian Wildlife Service-Atlantic, Environment Canada",,1192120914_-862842619_-1330085747,urn:lsid:marinespecies.org:taxname:137130,,FALSE,,,,137130
9facc947-2e70-4bbc-8b37-008f52333b28,Cepphus grylle,,,-69.76,47.78,"Canadian Wildlife Service-Atlantic, Environment Canada",,1286797999_1089703363_-1791747240,urn:lsid:marinespecies.org:taxname:137130,,FALSE,,,,137130
9fc78bed-ae82-4ca3-a3df-8a55feb7a416,Cepphus grylle,"(Linnaeus, 1758)",07/10/2012 00:00,-54.1883,49.8144,Canadian Wildlife Service - Atlantic Region (CWS - Atlantic),,NF003524_BLGU_10103_2012-07-10,urn:lsid:marinespecies.org:taxname:137130,,FALSE,,,,137130
9fd814a2-d427-4c9c-84e0-01370c76dbe8,Cepphus grylle,,,-61.13,56,"Canadian Wildlife Service-Atlantic, Environment Canada",,1380544464_-1223844157_-1788477404,urn:lsid:marinespecies.org:taxname:137130,,FALSE,,,,137130
a0034c11-6c09-4a30-8ec4-4f79e384404a,Cepphus grylle,"(Linnaeus, 1758)",01/01/1984 00:00,-56.38896,47.12491,Canadian Wildlife Service - Atlantic Region (CWS - Atlantic),,NF000266_BLGU_687_1984-01-01,urn:lsid:marinespecies.org:taxname:137130,,FALSE,,,,137130
a029d798-f84e-479c-b83f-58cf7f2c02a9,Cepphus grylle,"(Linnaeus, 1758)",07/06/2006 17:26,-67.8619,44.3587,NA,,4896,137130,,FALSE,,,,137130
a03e233f-4e6c-47ca-8178-dd10cc2c4341,Cepphus grylle,"(Linnaeus, 1758)",1978-08-28T12:00:00,-59.7167,55.35,Canadian Wildlife Service,280,280_108531,urn:lsid:marinespecies.org:taxname:137130,,FALSE,,,,137130
a053c4a4-9e21-4c3a-9945-4f6c18f4848a,Cepphus grylle,"(Linnaeus, 1758)",1979-08-25T15:15:00,-62.3333,58.1,Canadian Wildlife Service,280,280_120748,urn:lsid:marinespecies.org:taxname:137130,,FALSE,,,,137130
a076fb4b-6b80-4605-98c3-f781f29c58f3,Cepphus grylle,"(Linnaeus, 1758)",7/15/87 12:00,-65.75216675,44.67573929,ACCD,EOR,31459,urn:lsid:marinespecies.org:taxname:137130,,FALSE,,,,137130
a0779709-203f-4b6c-9292-27783ca9586d,Cepphus grylle,"(Linnaeus, 1758)",01/01/1957 00:00,-53.01551,47.54488,Canadian Wildlife Service - Atlantic Region (CWS - Atlantic),,NF000357_BLGU_959_1957-01-01,urn:lsid:marinespecies.org:taxname:137130,,FALSE,,,,137130
a09b9812-2790-4209-9f73-d405bd10804d,Cepphus grylle,"(Linnaeus, 1758)",1971-07-02T12:00:00Z,-59.79444885,45.96278,ACCD,EOR,31752,urn:lsid:marinespecies.org:taxname:137130,,FALSE,,,,137130
a0b37ea6-1c16-464e-aab7-9f478d2767df,Cepphus grylle,,,-65.4,47.96,"Canadian Wildlife Service-Atlantic, Environment Canada",,-635145613_1420285109_1927408119,urn:lsid:marinespecies.org:taxname:137130,,FALSE,,,,137130
a0b63054-b8de-42ad-a503-2a26a6f408fe,Cepphus grylle,"(Linnaeus, 1758)",1987-07-30T09:50:00,-56.5833,53.85,Canadian Wildlife Service,280,280_202033,urn:lsid:marinespecies.org:taxname:137130,,FALSE,,,,137130
a0fd272b-197b-4cb8-8942-129f0b44cfc6,Cepphus grylle,"(Linnaeus, 1758)",8/16/90 12:00,-60.35197067,46.87794876,ACCD,EOR,31506,urn:lsid:marinespecies.org:taxname:137130,,FALSE,,,,137130
a173bc7a-5a35-41d7-8a81-097a704ca3fc,Cepphus grylle,,,-53.55,48.21,"Canadian Wildlife Service-Atlantic, Environment Canada",,1270557349_-390095457_595024101,urn:lsid:marinespecies.org:taxname:137130,,FALSE,,,,137130
a1a17cb4-4e1d-4cae-8bd9-c937c19de62d,Cepphus grylle,"(Linnaeus, 1758)",1987-07-22T12:00:00Z,-62.33975983,44.82471085,ACCD,EOR,31478,urn:lsid:marinespecies.org:taxname:137130,,FALSE,,,,137130
a1baf215-7d4b-498b-ab41-c2b301c05262,Cepphus grylle,,,-64.44,49.93,"Canadian Wildlife Service-Atlantic, Environment Canada",,-635145613_1821671086_1844945357,urn:lsid:marinespecies.org:taxname:137130,,FALSE,,,,137130
a217ae67-5086-45e6-b8f1-a6d762428b5a,Cepphus grylle,"(Linnaeus, 1758)",07/10/2012 00:00,-54.1127,49.8155,Canadian Wildlife Service - Atlantic Region (CWS - Atlantic),,NF003527_BLGU_10033_2012-07-10,urn:lsid:marinespecies.org:taxname:137130,,FALSE,,,,137130
a22ea9ba-2c85-4014-83d4-29c1e97fa285,Cepphus grylle,"(Linnaeus, 1758)",06/05/1987 00:00,-66.73269,44.95199,Canadian Wildlife Service - Atlantic Region (CWS - Atlantic),,NB000023_BLGU_208_1987-06-05,urn:lsid:marinespecies.org:taxname:137130,,FALSE,,,,137130
a2351580-c761-490d-b365-bd1f91e1430f,Cepphus grylle,,,-63.87,48.88,"Canadian Wildlife Service-Atlantic, Environment Canada",,1421648014_-678519173_-780619597,urn:lsid:marinespecies.org:taxname:137130,,FALSE,,,,137130
a2746292-c918-42f4-aa9e-f9a77cb03ed5,Cepphus grylle,"(Linnaeus, 1758)",05/06/2000,-68.5,53,ICES,DOME-Biota,12135338,urn:lsid:marinespecies.org:taxname:137130,,FALSE,,,,137130
a27bdc79-73f4-4dd7-8cff-5a1267a574a7,Cepphus grylle,"(Linnaeus, 1758)",01/01/1985 00:00,-53.62555,46.64322,Canadian Wildlife Service - Atlantic Region (CWS - Atlantic),,NF000178_BLGU_299_1985-01-01,urn:lsid:marinespecies.org:taxname:137130,,FALSE,,,,137130
a29def0d-b25c-49f3-89d8-867efc3a8cb6,Cepphus grylle,"(Linnaeus, 1758)",08/09/2006 11:42,-68.1119,44.3341,NA,,6686,137130,,FALSE,,,,137130
a2f9bbda-9aee-46f6-9d79-44af8bbeb04b,Cepphus grylle,"(Linnaeus, 1758)",1986-08-24T12:00:00Z,-64.10945892,44.49214172,ACCD,EOR,31467,urn:lsid:marinespecies.org:taxname:137130,,FALSE,,,,137130
a329244c-0741-4db9-a2e6-8468730ffc76,Cepphus grylle,,,-52.91,47,"Canadian Wildlife Service-Atlantic, Environment Canada",,1201195787_1725118178_2080251954,urn:lsid:marinespecies.org:taxname:137130,,FALSE,,,,137130
a32b5cf2-2a84-4ce8-87ea-17d076bd5e92,Cepphus grylle,,,-65.41,47.96,"Canadian Wildlife Service-Atlantic, Environment Canada",,-635145613_249233874_346688108,urn:lsid:marinespecies.org:taxname:137130,,FALSE,,,,137130
a337f683-96c4-40b9-9e21-1d71a252c70c,Cepphus grylle,"(Linnaeus, 1758)",1973-02-24T12:05:00,-64.7167,49.2833,Canadian Wildlife Service,280,280_62750,urn:lsid:marinespecies.org:taxname:137130,,FALSE,,,,137130
a368dc53-142d-4cf9-86dc-9e142b562569,Cepphus grylle,"(Linnaeus, 1758)",7/31/86 12:00,-64.95115662,44.98693848,ACCD,EOR,31461,urn:lsid:marinespecies.org:taxname:137130,,FALSE,,,,137130
a3698a79-b65c-4d21-8dba-5e64f8b854cb,Cepphus grylle,"(Linnaeus, 1758)",6/21/79 12:00,-65.38295746,47.73332405,ACCD,EOR,31654,urn:lsid:marinespecies.org:taxname:137130,,FALSE,,,,137130
a38116e1-cd17-43e0-8e8d-114afc0de94a,Cepphus grylle,"(Linnaeus, 1758)",6/28/05 00:00,-53.50888,46.62989,Canadian Wildlife Service - Atlantic Region (CWS - Atlantic),,NF000177_BLGU_9972_2005-06-28,urn:lsid:marinespecies.org:taxname:137130,,FALSE,,,,137130
a49e31f9-230f-45af-aec4-d91c66c4eb20,Cepphus grylle,"(Linnaeus, 1758)",01/01/1945 00:00,-57.43491,47.50607,Canadian Wildlife Service - Atlantic Region (CWS - Atlantic),,NF000345_BLGU_938_1945-01-01,urn:lsid:marinespecies.org:taxname:137130,,FALSE,,,,137130
a4aa9ac1-13e6-441d-b29f-1412c4a7183e,Cepphus grylle,"(Linnaeus, 1758)",06/06/2014 00:00,-66.76968,44.58236,Canadian Wildlife Service - Atlantic Region (CWS - Atlantic),,NB000087_BLGU_13722_2014-06-06,urn:lsid:marinespecies.org:taxname:137130,,FALSE,,,,137130
a4b2691b-b704-4e06-9072-a354673197ce,Cepphus grylle,"(Linnaeus, 1758)",6/27/11 00:00,-52.81397,47.18734,Canadian Wildlife Service - Atlantic Region (CWS - Atlantic),,NF000279_BLGU_10030_2011-06-27,urn:lsid:marinespecies.org:taxname:137130,,FALSE,,,,137130
a4c4abd0-f6ff-43f2-a820-7a36a861b21d,Cepphus grylle,,,-60.64,50.18,"Canadian Wildlife Service-Atlantic, Environment Canada",,-1636689528_-200338184_485660711,urn:lsid:marinespecies.org:taxname:137130,,FALSE,,,,137130
a5aaefe2-2dea-40da-b8ce-ae038e47a19b,Cepphus grylle,"(Linnaeus, 1758)",1973-03-08T10:00:00,-59.7,48.1667,Canadian Wildlife Service,280,280_62834,urn:lsid:marinespecies.org:taxname:137130,,FALSE,,,,137130
a5b784cf-198d-46e7-bf96-1ce2d1b133a8,Cepphus grylle,"(Linnaeus, 1758)",1979-08-27T12:40:00,-61.5333,57.3333,Canadian Wildlife Service,280,280_120908,urn:lsid:marinespecies.org:taxname:137130,,FALSE,,,,137130
a5d857ba-26e8-43d9-80e1-c6ae381c39ca,Cepphus grylle,"(Linnaeus, 1758)",7/18/86 00:00,-52.86885,47.12655,Canadian Wildlife Service - Atlantic Region (CWS - Atlantic),,NF000267_BLGU_703_1986-07-18_1130,urn:lsid:marinespecies.org:taxname:137130,,FALSE,,,,137130
a5e96c00-fea2-4b5b-a3f0-22c4aed150b0,Cepphus grylle,,,-53.4,46.66,"Canadian Wildlife Service-Atlantic, Environment Canada",,1201195787_-990335684_177674222,urn:lsid:marinespecies.org:taxname:137130,,FALSE,,,,137130
a5f70920-7348-4809-aa0c-455118b040b0,Cepphus grylle,,,-58.96,55.14,"Canadian Wildlife Service-Atlantic, Environment Canada",,1406113415_1102419679_-396692443,urn:lsid:marinespecies.org:taxname:137130,,FALSE,,,,137130
a6088e4a-d702-4500-b8c3-53e1ef71cae5,Cepphus grylle,"(Linnaeus, 1758)",1978-04-11T06:10:00,-51.6,48.4667,Canadian Wildlife Service,280,280_98442,urn:lsid:marinespecies.org:taxname:137130,,FALSE,,,,137130
a60ac316-c6f7-4234-afbc-0811fb7c874e,Cepphus grylle,"(Linnaeus, 1758)",1978-08-28T07:00:00,-60.2833,55.7833,Canadian Wildlife Service,280,280_108461,urn:lsid:marinespecies.org:taxname:137130,,FALSE,,,,137130
a60def4c-b7d2-45c4-86c4-ea0e20021965,Cepphus grylle,,,-60.85,55.96,"Canadian Wildlife Service-Atlantic, Environment Canada",,1380544464_-1776326020_-933154356,urn:lsid:marinespecies.org:taxname:137130,,FALSE,,,,137130
a6119ce9-8c8f-458d-931e-834bc1123cba,Cepphus grylle,,,-64.33,48.8,"Canadian Wildlife Service-Atlantic, Environment Canada",,58439636_1031009240_1730869362,urn:lsid:marinespecies.org:taxname:137130,,FALSE,,,,137130
a624f1cb-af47-4ff0-b9bd-5781c526bedd,Cepphus grylle,"(Linnaeus, 1758)",8/20/06 00:00,-66.36808,44.24378,Canadian Wildlife Service - Atlantic Region (CWS - Atlantic),,NS001353_BLGU_12101_2006-08-20,urn:lsid:marinespecies.org:taxname:137130,,FALSE,,,,137130
a65d27e7-8eda-4909-99c3-f2a9263bd000,Cepphus grylle,"(Linnaeus, 1758)",1990-08-16T12:00:00Z,-60.31938934,46.81330872,ACCD,EOR,31505,urn:lsid:marinespecies.org:taxname:137130,,FALSE,,,,137130
a6752d8b-e04e-4b64-b52e-c770e82a9127,Cepphus grylle,"(Linnaeus, 1758)",,-66.75,44.58332825,ACCD,EOR,31398,urn:lsid:marinespecies.org:taxname:137130,,FALSE,,,,137130
a68cb94c-87e0-4693-af8a-5671dcf87b0d,Cepphus grylle,"(Linnaeus, 1758)",06/04/2016 00:00,-66.05649,43.67264,Canadian Wildlife Service - Atlantic Region (CWS - Atlantic),,NS003138_BLGU_13297_2016-06-04_7:44,urn:lsid:marinespecies.org:taxname:137130,,FALSE,,,,137130
a69c5c8b-cf23-47b9-83f2-77a47428469b,Cepphus grylle,"(Linnaeus, 1758)",2001-07-02T12:00:00Z,-66.84238052,44.60393143,ACCD,EOR,31785,urn:lsid:marinespecies.org:taxname:137130,,FALSE,,,,137130
a6ae7502-4fa9-472b-b8ca-e90e6de3a825,Cepphus grylle,,,-61.65,50.08,"Canadian Wildlife Service-Atlantic, Environment Canada",,-1636689528_-1940974357_1938238833,urn:lsid:marinespecies.org:taxname:137130,,FALSE,,,,137130
a6aed234-7ae6-4bbb-80af-fe8b85ebe197,Cepphus grylle,,,-64.66,50.31,"Canadian Wildlife Service-Atlantic, Environment Canada",,-1636689528_1105094932_-1928514003,urn:lsid:marinespecies.org:taxname:137130,,FALSE,,,,137130
a6dbfbb7-0ff8-4464-a180-47126109373f,Cepphus grylle,,,-61.8,47.34,"Canadian Wildlife Service-Atlantic, Environment Canada",,-1614583778_-843620667_-667865782,urn:lsid:marinespecies.org:taxname:137130,,FALSE,,,,137130
a6e848c0-ab9f-48d0-875a-9f89747219ca,Cepphus grylle,"(Linnaeus, 1758)",01/01/1962 00:00,-61.04017,46.61471,Canadian Wildlife Service - Atlantic Region (CWS - Atlantic),,NS001161_BLGU_3209_1962-01-01,urn:lsid:marinespecies.org:taxname:137130,,FALSE,,,,137130
a6eaadfc-f0f1-41bd-9cd4-0baf055000ae,Cepphus grylle,,,-58.47,49.21,"Canadian Wildlife Service-Atlantic, Environment Canada",,896836590_-1334220417_-1733273176,urn:lsid:marinespecies.org:taxname:137130,,FALSE,,,,137130
a6eebc10-bce8-43a0-a321-1367fa9d9b24,Cepphus grylle,"(Linnaeus, 1758)",7/31/90 12:00,-60.14374924,47.21529007,ACCD,EOR,31508,urn:lsid:marinespecies.org:taxname:137130,,FALSE,,,,137130
a6f2c39c-450b-4538-a4e6-8ec617b4ff8f,Cepphus grylle,"(Linnaeus, 1758)",6/21/01 00:00,-55.84577,50.19041,Canadian Wildlife Service - Atlantic Region (CWS - Atlantic),,NF002703_BLGU_5815_2001-06-21,urn:lsid:marinespecies.org:taxname:137130,,FALSE,,,,137130
a76e1d41-e947-49a5-9120-1f24b57b5e65,Cepphus grylle,"(Linnaeus, 1758)",1979-08-11T15:50:00,-62.0667,57.5167,Canadian Wildlife Service,280,280_118402,urn:lsid:marinespecies.org:taxname:137130,,FALSE,,,,137130
a78ce38b-5591-41f8-8c1c-51ac2f6cd10d,Cepphus grylle,"(Linnaeus, 1758)",1973-03-02T15:50:00,-61.5833,49.9,Canadian Wildlife Service,280,280_62779,urn:lsid:marinespecies.org:taxname:137130,,FALSE,,,,137130
a79f7594-75a9-42e6-a77a-53b214d35791,Cepphus grylle,"(Linnaeus, 1758)",05/12/2016 00:00,-65.86613,43.66345,Canadian Wildlife Service - Atlantic Region (CWS - Atlantic),,NS003172_BLGU_13347_2016-05-12_7:45,urn:lsid:marinespecies.org:taxname:137130,,FALSE,,,,137130
a7a77d7f-ff6e-4984-a803-b6c597feec0b,Cepphus grylle,"(Linnaeus, 1758)",07/02/2001 12:00,-66.68263245,44.68330002,ACCD,EOR,31774,urn:lsid:marinespecies.org:taxname:137130,,FALSE,,,,137130
a7bcc55d-1d0b-4673-849e-9047ff5b9548,Cepphus grylle,,,-58.56,48.87,"Canadian Wildlife Service-Atlantic, Environment Canada",,896836590_-896630458_897807942,urn:lsid:marinespecies.org:taxname:137130,,FALSE,,,,137130
a803fe9f-7dc9-4ec5-b6d7-71c1a7889c8e,Cepphus grylle,"(Linnaeus, 1758)",8/13/78 00:00,-61.43225,56.23336,Canadian Wildlife Service - Atlantic Region (CWS - Atlantic),,NF000932_BLGU_2066_1978-08-13,urn:lsid:marinespecies.org:taxname:137130,,FALSE,,,,137130
a814b87c-587a-46f4-bca9-679d61c2f4e2,Cepphus grylle,"(Linnaeus, 1758)",2001-07-02T12:00:00Z,-66.74932861,44.61669922,ACCD,EOR,31781,urn:lsid:marinespecies.org:taxname:137130,,FALSE,,,,137130
a840bb8e-e63f-4490-89c3-270c0e360bab,Cepphus grylle,"(Linnaeus, 1758)",05/01/2010 00:00,-61.5426,45.10182,Canadian Wildlife Service - Atlantic Region (CWS - Atlantic),,NS002232_BLGU_9926_2010-05-01,urn:lsid:marinespecies.org:taxname:137130,,FALSE,,,,137130
a898a242-1b4d-4faa-9ddd-0f244b4f8fc2,Cepphus grylle,"(Linnaeus, 1758)",6/13/06 00:00,-59.95988,45.8947,Canadian Wildlife Service - Atlantic Region (CWS - Atlantic),,NS001325_BLGU_12080_2006-06-13,urn:lsid:marinespecies.org:taxname:137130,,FALSE,,,,137130
a8a06434-8030-4068-93a5-d76408e1c877,Cepphus grylle,"(Linnaeus, 1758)",07/02/2005 14:35,-68.279,44.232,NA,,439863,137130,,FALSE,,,,137130
a8ad0fe0-6a7a-4e99-bc4e-2bc1108f3a4a,Cepphus grylle,"(Linnaeus, 1758)",1986-07-03T12:00:00Z,-63.9756012,46.87931824,ACCD,EOR,31702,urn:lsid:marinespecies.org:taxname:137130,,FALSE,,,,137130
a8e2901e-2ea1-4bbe-97fe-a805bbe32a71,Cepphus grylle,"(Linnaeus, 1758)",1975-08-14T19:00:00,-52.6,47.75,Canadian Wildlife Service,280,280_69908,urn:lsid:marinespecies.org:taxname:137130,,FALSE,,,,137130
a8e3368c-540f-4d0e-99e0-a36398b00adc,Cepphus grylle,,,-65.32,43.72,"Canadian Wildlife Service-Atlantic, Environment Canada",,1361835644_-1022172184_78187606,urn:lsid:marinespecies.org:taxname:137130,,FALSE,,,,137130
a90b44a3-243f-45b0-935d-e7eeec8c5d4b,Cepphus grylle,"(Linnaeus, 1758)",1990-08-18T12:00:00Z,-66.71109009,44.70877075,ACCD,EOR,31447,urn:lsid:marinespecies.org:taxname:137130,,FALSE,,,,137130
a90c8303-c39c-42b7-8454-a565a0768136,Cepphus grylle,"(Linnaeus, 1758)",7/26/05 13:45,-68.2142,44.1751,NA,,441253,137130,,FALSE,,,,137130
a90e6cdb-c230-4800-a931-0dc058a3ee64,Cepphus grylle,,,-58.44,49.22,"Canadian Wildlife Service-Atlantic, Environment Canada",,896836590_-759184835_-1560728981,urn:lsid:marinespecies.org:taxname:137130,,FALSE,,,,137130
a962e715-b510-4b6e-b458-0d62a7f0bd24,Cepphus grylle,,,-60.01,49.22,"Canadian Wildlife Service-Atlantic, Environment Canada",,792082018_589428736_225063259,urn:lsid:marinespecies.org:taxname:137130,,FALSE,,,,137130
a9839355-1ef0-4854-b38d-8c81ed018853,Cepphus grylle,"(Linnaeus, 1758)",07/08/1992 00:00,-66.75014,44.66697,Canadian Wildlife Service - Atlantic Region (CWS - Atlantic),,NB000101_BLGU_187_1992-07-08,urn:lsid:marinespecies.org:taxname:137130,,FALSE,,,,137130
a999b642-0510-4aa8-a4a9-8a5d55f43772,Cepphus grylle,"(Linnaeus, 1758)",6/13/03 00:00,-61.26128,46.35939,Canadian Wildlife Service - Atlantic Region (CWS - Atlantic),,NS001348_BLGU_12606_2003-06-13,urn:lsid:marinespecies.org:taxname:137130,,FALSE,,,,137130
a9a171e9-5b95-48a3-8fe7-7c96ff7897c3,Cepphus grylle,"(Linnaeus, 1758)",1975-07-31T11:00:00,-80.3667,54.7667,Canadian Wildlife Service,280,280_69690,urn:lsid:marinespecies.org:taxname:137130,,FALSE,,,,137130
a9a42621-7c86-4890-a520-c206fe258b4a,Cepphus grylle,"(Linnaeus, 1758)",1973-02-20T09:10:00,-61.0667,45.45,Canadian Wildlife Service,280,280_62587,urn:lsid:marinespecies.org:taxname:137130,,FALSE,,,,137130
a9bf4452-a919-4378-b786-79b06aca6c1a,Cepphus grylle,,,-65.23,43.55,"Canadian Wildlife Service-Atlantic, Environment Canada",,1361835644_1528901942_-913206700,urn:lsid:marinespecies.org:taxname:137130,,FALSE,,,,137130
a9e56a7c-8f7c-4211-aba9-5317b044da98,Cepphus grylle,"(Linnaeus, 1758)",1969-07-19T08:50:00,-53.1667,51.1333,Canadian Wildlife Service,280,280_14288,urn:lsid:marinespecies.org:taxname:137130,,FALSE,,,,137130
a9f519ec-abfc-4467-9465-75218864a45a,Cepphus grylle,"(Linnaeus, 1758)",05/01/2003 00:00,-61.5426,45.10182,Canadian Wildlife Service - Atlantic Region (CWS - Atlantic),,NS002232_BLGU_9905_2003-05-01,urn:lsid:marinespecies.org:taxname:137130,,FALSE,,,,137130
a9f6fb32-034c-4983-8c03-8a4e2cd1765b,Cepphus grylle,"(Linnaeus, 1758)",7/27/07 00:00,-59.81782,46.18078,Canadian Wildlife Service - Atlantic Region (CWS - Atlantic),,NS001255_BLGU_12182_2007-07-27,urn:lsid:marinespecies.org:taxname:137130,,FALSE,,,,137130
aa1213b4-1be3-4b91-af44-afcf238aa1b4,Cepphus grylle,"(Linnaeus, 1758)",7/22/05 13:37,-68.1814,44.178,NA,,440502,137130,,FALSE,,,,137130
aa92e33e-f872-4b8b-9a26-fc3601f94643,Cepphus grylle,,,-60.67,55.91,"Canadian Wildlife Service-Atlantic, Environment Canada",,1380544464_100539866_-1766628040,urn:lsid:marinespecies.org:taxname:137130,,FALSE,,,,137130
aa9bb5df-7694-43de-bb6e-eb98fabb7a44,Cepphus grylle,"(Linnaeus, 1758)",1969-07-23T10:20:00,-55.2333,50.9167,Canadian Wildlife Service,280,280_15002,urn:lsid:marinespecies.org:taxname:137130,,FALSE,,,,137130
aab213c8-615f-45bb-b39f-8922217b93d1,Cepphus grylle,"(Linnaeus, 1758)",1973-02-16T12:30:00,-60.1667,46.9333,Canadian Wildlife Service,280,280_62357,urn:lsid:marinespecies.org:taxname:137130,,FALSE,,,,137130
aacb4ae8-c8c5-4bf6-853d-702358cf3dba,Cepphus grylle,"(Linnaeus, 1758)",8/13/78 00:00,-61.28225,56.13336,Canadian Wildlife Service - Atlantic Region (CWS - Atlantic),,NF000920_BLGU_2038_1978-08-13,urn:lsid:marinespecies.org:taxname:137130,,FALSE,,,,137130
aae35ef3-665a-4a0d-b88b-90dc8cd8200f,Cepphus grylle,"(Linnaeus, 1758)",06/10/1982 12:00,-64.69264221,45.33010101,ACCD,EOR,31765,urn:lsid:marinespecies.org:taxname:137130,,FALSE,,,,137130
aaf481a3-333c-4653-9bd2-20aaf17d5e81,Cepphus grylle,,,-58.3,49.24,"Canadian Wildlife Service-Atlantic, Environment Canada",,896836590_-792828849_1531105763,urn:lsid:marinespecies.org:taxname:137130,,FALSE,,,,137130
ab3540b7-91d5-433e-a703-898d4a09fe62,Cepphus grylle,"(Linnaeus, 1758)",05/06/2000,-68.5,53,ICES,DOME-Biota,12135342,urn:lsid:marinespecies.org:taxname:137130,,FALSE,,,,137130
abc73d2a-654c-47ec-bfb6-a90e380212f0,Cepphus grylle,,,-62.43,48.72,"Canadian Wildlife Service-Atlantic, Environment Canada",,792082018_-2092427675_-1420105950,urn:lsid:marinespecies.org:taxname:137130,,FALSE,,,,137130
abe7186d-dafa-4ce9-9668-431a344f5406,Cepphus grylle,"(Linnaeus, 1758)",05/01/1974 00:00,-64.04913,44.38377,Canadian Wildlife Service - Atlantic Region (CWS - Atlantic),,NS001336_BLGU_4894_1974-05-01,urn:lsid:marinespecies.org:taxname:137130,,FALSE,,,,137130
ac1c0307-7310-41e6-bf5a-6ba4c669990c,Cepphus grylle,,,-67.94,49.21,"Canadian Wildlife Service-Atlantic, Environment Canada",,792082018_875165843_-1311521019,urn:lsid:marinespecies.org:taxname:137130,,FALSE,,,,137130
ac250512-ace5-4199-a6b7-152e643112f5,Cepphus grylle,"(Linnaeus, 1758)",07/02/1981 12:00,-66.00653076,43.41556931,ACCD,EOR,31808,urn:lsid:marinespecies.org:taxname:137130,,FALSE,,,,137130
ac335da3-5fc2-43fa-8256-7a8d6bfdff85,Cepphus grylle,"(Linnaeus, 1758)",6/25/05 13:48,-68.0456,44.3124,NA,,440038,137130,,FALSE,,,,137130
ac64926e-1b8f-40dd-add4-5761648fcef7,Cepphus grylle,"(Linnaeus, 1758)",12/12/1990 06:30,-70.81056,42.50167,NOAA,,362619,137130,,FALSE,,,,137130
ac7324ce-7661-4272-a939-084457b22d5d,Cepphus grylle,,,-65.51,47.96,"Canadian Wildlife Service-Atlantic, Environment Canada",,1421648014_1436236657_-72339815,urn:lsid:marinespecies.org:taxname:137130,,FALSE,,,,137130
ac8baf1d-93a1-4817-aa8f-1b9d10ad87ec,Cepphus grylle,"(Linnaeus, 1758)",07/02/1971 12:00,-59.79064941,45.93856812,ACCD,EOR,31753,urn:lsid:marinespecies.org:taxname:137130,,FALSE,,,,137130
ac95b6ed-c86e-4e70-b43f-bcd05f8dd3d3,Cepphus grylle,"(Linnaeus, 1758)",2001-07-02T12:00:00Z,-66.89897156,44.59778976,ACCD,EOR,31788,urn:lsid:marinespecies.org:taxname:137130,,FALSE,,,,137130
acb05c34-eae4-4db4-92fe-3006f6849679,Cepphus grylle,,,-51.85,49.08,"Canadian Wildlife Service-Atlantic, Environment Canada",,1373407025_991312923_-1850372269,urn:lsid:marinespecies.org:taxname:137130,,FALSE,,,,137130
acd78e70-3749-471d-ac8d-83a277dd5e54,Cepphus grylle,"(Linnaeus, 1758)",1970-08-19T14:20:00,-66.7833,44.9333,Canadian Wildlife Service,280,280_26409,urn:lsid:marinespecies.org:taxname:137130,,FALSE,,,,137130
acec8f29-2ea9-4322-82e4-6534b4073fc8,Cepphus grylle,"(Linnaeus, 1758)",1971-07-02T12:00:00Z,-60.11323166,45.76700974,ACCD,EOR,31760,urn:lsid:marinespecies.org:taxname:137130,,FALSE,,,,137130
ad096207-7d54-4700-b7a7-67e0af308edb,Cepphus grylle,"(Linnaeus, 1758)",05/06/1999,-68.5,53,ICES,DOME-Biota,12135593,urn:lsid:marinespecies.org:taxname:137130,,FALSE,,,,137130
ad0d0324-3e6e-4a68-957f-8fd737782d84,Cepphus grylle,,,-65.32,43.69,"Canadian Wildlife Service-Atlantic, Environment Canada",,1425516209_481733299_-1311843189,urn:lsid:marinespecies.org:taxname:137130,,FALSE,,,,137130
ad1d24f0-0247-4e7f-84bf-2837fac05af6,Cepphus grylle,"(Linnaeus, 1758)",1979-08-17T16:15:00,-63.2667,59.1,Canadian Wildlife Service,280,280_119579,urn:lsid:marinespecies.org:taxname:137130,,FALSE,,,,137130
ad4f351f-250b-4f0d-bbab-ebbbacfbec00,Cepphus grylle,"(Linnaeus, 1758)",6/23/05 09:51,-67.8602,44.3598,NA,,439712,137130,,FALSE,,,,137130
ada08627-26bf-489a-8544-727a9cef3e2d,Cepphus grylle,"(Linnaeus, 1758)",2017-03-21T09:37:53,-71.0659,40.3446,NORMANDEAU,1817,1817_45623,urn:lsid:marinespecies.org:taxname:137130,,FALSE,,,,137130
ae2e49e0-f689-4653-b120-8dee1bd1252e,Cepphus grylle,"(Linnaeus, 1758)",1979-08-17T07:45:00,-63.2667,59.1,Canadian Wildlife Service,280,280_119445,urn:lsid:marinespecies.org:taxname:137130,,FALSE,,,,137130
ae433164-ad92-4ca6-98e1-a49c0966dedc,Cepphus grylle,"(Linnaeus, 1758)",01/01/1979 00:00,-53.4296,49.2564,Canadian Wildlife Service - Atlantic Region (CWS - Atlantic),,NF000523_BLGU_1244_1979-01-01,urn:lsid:marinespecies.org:taxname:137130,,FALSE,,,,137130
ae7b4cd6-da7f-47d5-a056-92e99fe326a0,Cepphus grylle,,,-58.39,49.17,"Canadian Wildlife Service-Atlantic, Environment Canada",,1421648014_-1829300702_1931750555,urn:lsid:marinespecies.org:taxname:137130,,FALSE,,,,137130
ae824b40-86e4-482b-86af-b26ae43ddb4b,Cepphus grylle,,,-61.66,50.08,"Canadian Wildlife Service-Atlantic, Environment Canada",,-1636689528_-1055861835_-1039386320,urn:lsid:marinespecies.org:taxname:137130,,FALSE,,,,137130
ae84df8e-9b7a-4634-a229-6611eb18e18c,Cepphus grylle,,,-59.76,45.88,"Canadian Wildlife Service-Atlantic, Environment Canada",,1207827508_162753551_741051605,urn:lsid:marinespecies.org:taxname:137130,,FALSE,,,,137130
ae9b8f11-633c-4b1a-9079-f2d64b4586ea,Cepphus grylle,"(Linnaeus, 1758)",1978-06-27T15:40:00,-55.7833,52.8833,Canadian Wildlife Service,280,280_102048,urn:lsid:marinespecies.org:taxname:137130,,FALSE,,,,137130
ae9fca0e-44aa-413c-85a3-b69f68ef6d51,Cepphus grylle,"(Linnaeus, 1758)",1979-08-22T12:30:00,-62.5167,58.2333,Canadian Wildlife Service,280,280_120273,urn:lsid:marinespecies.org:taxname:137130,,FALSE,,,,137130
aeb41f47-1087-4ccc-830e-174ca80481f0,Cepphus grylle,"(Linnaeus, 1758)",1979-08-04T15:00:00,-57.1333,54.5667,Canadian Wildlife Service,280,280_117591,urn:lsid:marinespecies.org:taxname:137130,,FALSE,,,,137130
aeba6c16-f1af-45b4-8f4b-46ac7a9c729d,Cepphus grylle,,,-58.43,49.23,"Canadian Wildlife Service-Atlantic, Environment Canada",,896836590_1873331891_75706450,urn:lsid:marinespecies.org:taxname:137130,,FALSE,,,,137130
aec76dfb-026a-4891-adbe-a839ccf1ce87,Cepphus grylle,,,-64.46,49.78,"Canadian Wildlife Service-Atlantic, Environment Canada",,843543794_632059758_-217343397,urn:lsid:marinespecies.org:taxname:137130,,FALSE,,,,137130
af35c969-54f2-4273-95d0-8ea4a96bfdc2,Cepphus grylle,,,-58.43,49.23,"Canadian Wildlife Service-Atlantic, Environment Canada",,896836590_1873331891_-2059907787,urn:lsid:marinespecies.org:taxname:137130,,FALSE,,,,137130
af402a34-6bde-477d-98ed-e7abdb80e12b,Cepphus grylle,"(Linnaeus, 1758)",7/22/05 09:30,-68.234,44.1459,NA,,440927,137130,,FALSE,,,,137130
af52792f-a578-49ac-9ae3-74a1a38805e1,Cepphus grylle,,,-65.53,47.97,"Canadian Wildlife Service-Atlantic, Environment Canada",,-635145613_-79743528_1408471580,urn:lsid:marinespecies.org:taxname:137130,,FALSE,,,,137130
af8da658-bfa0-482d-9abf-f2e165d7af68,Cepphus grylle,"(Linnaeus, 1758)",8/13/78 00:00,-61.28225,56.28336,Canadian Wildlife Service - Atlantic Region (CWS - Atlantic),,NF000950_BLGU_2080_1978-08-13,urn:lsid:marinespecies.org:taxname:137130,,FALSE,,,,137130
af947148-065f-45fb-93ea-12b14c5cff2e,Cepphus grylle,"(Linnaeus, 1758)",01/01/1975 00:00,-54.56551,49.66823,Canadian Wildlife Service - Atlantic Region (CWS - Atlantic),,NF000585_BLGU_1371_1975-01-01,urn:lsid:marinespecies.org:taxname:137130,,FALSE,,,,137130
afa850a8-54ec-43cd-9a78-16a035f64b4f,Cepphus grylle,"(Linnaeus, 1758)",2001-07-02T12:00:00Z,-66.76983643,44.5809288,ACCD,EOR,31791,urn:lsid:marinespecies.org:taxname:137130,,FALSE,,,,137130
afd48202-64c8-4cb5-a404-bc372d540f93,Cepphus grylle,"(Linnaeus, 1758)",1973-02-28T13:20:00,-67.5667,49.2,Canadian Wildlife Service,280,280_62757,urn:lsid:marinespecies.org:taxname:137130,,FALSE,,,,137130
aff1bb5b-c019-43a6-93a7-c5f6f2443c82,Cepphus grylle,"(Linnaeus, 1758)",1973-03-09T13:35:00,-61.7333,44.7833,Canadian Wildlife Service,280,280_62907,urn:lsid:marinespecies.org:taxname:137130,,FALSE,,,,137130
afff292a-178c-43f4-85e5-9b37369262ed,Cepphus grylle,"(Linnaeus, 1758)",1971-02-26T11:00:00,-52.6167,47.3,Canadian Wildlife Service,280,280_34357,urn:lsid:marinespecies.org:taxname:137130,,FALSE,,,,137130
b000c88d-9a68-432e-a7ab-830a21885df3,Cepphus grylle,"(Linnaeus, 1758)",1978-08-02T10:15:00,-57.0333,53.8833,Canadian Wildlife Service,280,280_104983,urn:lsid:marinespecies.org:taxname:137130,,FALSE,,,,137130
b00d21dd-239c-4f81-bdb5-6465299e1c69,Cepphus grylle,"(Linnaeus, 1758)",01/01/1983 00:00,-56.22562,46.77825,Canadian Wildlife Service - Atlantic Region (CWS - Atlantic),,NF000184_BLGU_330_1983-01-01,urn:lsid:marinespecies.org:taxname:137130,,FALSE,,,,137130
b00e46d1-8f81-4660-828c-271874154d72,Cepphus grylle,,,-65.3,43.66,"Canadian Wildlife Service-Atlantic, Environment Canada",,1248786725_1814790227_-827318120,urn:lsid:marinespecies.org:taxname:137130,,FALSE,,,,137130
b03cde6f-1644-4669-90d8-df4af8dfa8b4,Cepphus grylle,"(Linnaeus, 1758)",01/01/1975 00:00,-53.08215,48.69988,Canadian Wildlife Service - Atlantic Region (CWS - Atlantic),,NF000576_BLGU_1172_1975-01-01,urn:lsid:marinespecies.org:taxname:137130,,FALSE,,,,137130
b0409320-8eb1-43b3-93c5-d69a843a739a,Cepphus grylle,"(Linnaeus, 1758)",06/12/1986 12:00,-65.2492981,47.7891655,ACCD,EOR,31652,urn:lsid:marinespecies.org:taxname:137130,,FALSE,,,,137130
b0653a1c-3ebe-453a-9b8d-7727077466d3,Cepphus grylle,,,-58.08,55.02,"Canadian Wildlife Service-Atlantic, Environment Canada",,1436357738_-1409304333_-1894009767,urn:lsid:marinespecies.org:taxname:137130,,FALSE,,,,137130
b096275e-af50-48e6-abeb-be5727b31c69,Cepphus grylle,"(Linnaeus, 1758)",7/18/86 00:00,-52.85718,47.16821,Canadian Wildlife Service - Atlantic Region (CWS - Atlantic),,NF000278_BLGU_735_1986-07-18_1130,urn:lsid:marinespecies.org:taxname:137130,,FALSE,,,,137130
b0b31ead-a921-4273-bbc3-a575bba70b1b,Cepphus grylle,"(Linnaeus, 1758)",NA,-55.43333,53.13334,NOAA,,68574,137130,,FALSE,,,,137130
b0b7e6d0-f150-4fbc-b042-d7863b7f1056,Cepphus grylle,,,-53.82,50.99,"Canadian Wildlife Service-Atlantic, Environment Canada",,1436357738_-1299716649_-1003832355,urn:lsid:marinespecies.org:taxname:137130,,FALSE,,,,137130
b0c6a5ba-4a3c-46b4-986e-277cd69e3b43,Cepphus grylle,,,-61.63,50.09,"Canadian Wildlife Service-Atlantic, Environment Canada",,-1636689528_401245694_1126227004,urn:lsid:marinespecies.org:taxname:137130,,FALSE,,,,137130
b0e9e5e9-cad2-4b29-96d4-0e022f259f95,Cepphus grylle,"(Linnaeus, 1758)",5/24/80 12:00,-59.95988083,45.8946991,ACCD,EOR,31756,urn:lsid:marinespecies.org:taxname:137130,,FALSE,,,,137130
b0f07467-8f25-4ea2-988d-a57da6d02546,Cepphus grylle,"(Linnaeus, 1758)",6/23/15 00:00,-53.94054,47.50656,Canadian Wildlife Service - Atlantic Region (CWS - Atlantic),,NF000346_BLGU_12759_2015-06-23,urn:lsid:marinespecies.org:taxname:137130,,FALSE,,,,137130
b109b1f1-496a-478e-bde0-88bde3abf244,Cepphus grylle,"(Linnaeus, 1758)",1979-08-27T13:50:00,-61.3833,57.15,Canadian Wildlife Service,280,280_120938,urn:lsid:marinespecies.org:taxname:137130,,FALSE,,,,137130
b12392a1-89ee-43c4-b991-1d4c57c4a585,Cepphus grylle,"(Linnaeus, 1758)",01/01/1945 00:00,-53.78219,47.76656,Canadian Wildlife Service - Atlantic Region (CWS - Atlantic),,NF000434_BLGU_1049_1945-01-01,urn:lsid:marinespecies.org:taxname:137130,,FALSE,,,,137130
b1776241-d5c8-40c5-8cf8-29617406f44d,Cepphus grylle,"(Linnaeus, 1758)",1987-07-15T12:00:00Z,-65.75216675,44.67573929,ACCD,EOR,31459,urn:lsid:marinespecies.org:taxname:137130,,FALSE,,,,137130
b19297e4-d05a-4a4b-bd0a-16ec95b84132,Cepphus grylle,"(Linnaeus, 1758)",07/02/1962 12:00,-61.04016876,46.61471176,ACCD,EOR,31730,urn:lsid:marinespecies.org:taxname:137130,,FALSE,,,,137130
b1a40721-1508-42c4-8be6-de2ed18f5ea5,Cepphus grylle,"(Linnaeus, 1758)",01/01/1987 00:00,-56.23729,46.84991,Canadian Wildlife Service - Atlantic Region (CWS - Atlantic),,NF000202_BLGU_478_1987-01-01,urn:lsid:marinespecies.org:taxname:137130,,FALSE,,,,137130
b1af5eba-2cf5-46c1-a0e1-21131788d0d3,Cepphus grylle,"(Linnaeus, 1758)",05/06/2000,-68.5,53,ICES,DOME-Biota,12135351,urn:lsid:marinespecies.org:taxname:137130,,FALSE,,,,137130
b1f7f518-2b1d-4335-abe3-874aaa75260b,Cepphus grylle,"(Linnaeus, 1758)",01/01/1974 00:00,-55.15601,46.99064,Canadian Wildlife Service - Atlantic Region (CWS - Atlantic),,NF000225_BLGU_575_1974-01-01,urn:lsid:marinespecies.org:taxname:137130,,FALSE,,,,137130
b22cc555-6f72-40c2-ae7a-c2a0f3c32704,Cepphus grylle,"(Linnaeus, 1758)",6/20/00,-68.5,53,ICES,DOME-Biota,12135379,urn:lsid:marinespecies.org:taxname:137130,,FALSE,,,,137130
b2574a3b-b29c-4123-96fc-2def91106f3a,Cepphus grylle,,,-52.91,47,"Canadian Wildlife Service-Atlantic, Environment Canada",,1201195787_1725118178_1489013168,urn:lsid:marinespecies.org:taxname:137130,,FALSE,,,,137130
b269a428-1d68-4058-b944-ace7e9819d54,Cepphus grylle,"(Linnaeus, 1758)",1979-06-21T12:00:00Z,-65.38295746,47.73332405,ACCD,EOR,31654,urn:lsid:marinespecies.org:taxname:137130,,FALSE,,,,137130
b2848c90-b4e8-4219-bfc7-9dc8ed68e833,Cepphus grylle,"(Linnaeus, 1758)",8/14/78 00:00,-60.06556,55.21667,Canadian Wildlife Service - Atlantic Region (CWS - Atlantic),,NF000812_BLGU_1907_1978-08-14,urn:lsid:marinespecies.org:taxname:137130,,FALSE,,,,137130
b2d9cabe-a3e8-4bb2-bcbb-b105607774b6,Cepphus grylle,,,-53.33,46.61,"Canadian Wildlife Service-Atlantic, Environment Canada",,1201195787_953810740_-1646925919,urn:lsid:marinespecies.org:taxname:137130,,FALSE,,,,137130
b2db384e-bab2-4676-8a9c-76ab1e8ec41c,Cepphus grylle,,,-65.4,47.95,"Canadian Wildlife Service-Atlantic, Environment Canada",,58439636_-1919238640_1896953924,urn:lsid:marinespecies.org:taxname:137130,,FALSE,,,,137130
b2e4cc1c-2520-45c0-bf49-0aba1ae199d0,Cepphus grylle,,,-63.83,48.8,"Canadian Wildlife Service-Atlantic, Environment Canada",,1421648014_1821620151_132807109,urn:lsid:marinespecies.org:taxname:137130,,FALSE,,,,137130
b2f68c3c-f194-4c7a-9fd3-6e96b4d1bc61,Cepphus grylle,"(Linnaeus, 1758)",01/01/1975 00:00,-54.19883,49.7999,Canadian Wildlife Service - Atlantic Region (CWS - Atlantic),,NF000596_BLGU_1541_1975-01-01,urn:lsid:marinespecies.org:taxname:137130,,FALSE,,,,137130
b31bbafe-d5b0-428e-b93a-a71c9a47e73e,Cepphus grylle,"(Linnaeus, 1758)",08/01/1986 12:00,-63.99726868,46.9745903,ACCD,EOR,31475,urn:lsid:marinespecies.org:taxname:137130,,FALSE,,,,137130
b32fc771-11e5-44d6-85d4-31d919d195e0,Cepphus grylle,"(Linnaeus, 1758)",1989-07-09T12:00:00Z,-66.28401184,45.17433167,ACCD,EOR,31449,urn:lsid:marinespecies.org:taxname:137130,,FALSE,,,,137130
b3559f59-6cb2-46b1-a8ad-f246abaaebcc,Cepphus grylle,"(Linnaeus, 1758)",8/13/78 00:00,-59.73222,55.18333,Canadian Wildlife Service - Atlantic Region (CWS - Atlantic),,NF000805_BLGU_1895_1978-08-13,urn:lsid:marinespecies.org:taxname:137130,,FALSE,,,,137130
b3633c73-04c8-4b66-9fba-d79e554c36ff,Cepphus grylle,"(Linnaeus, 1758)",NA,-69.0617,44.1079,USFWS,,670260,137130,,FALSE,,,,137130
b3a526ff-29df-4dfe-9661-2989c5a597c9,Cepphus grylle,"(Linnaeus, 1758)",1980-08-29T17:30:00,-61.2167,56.4,Canadian Wildlife Service,280,280_134449,urn:lsid:marinespecies.org:taxname:137130,,FALSE,,,,137130
b3bb59a4-7e8c-4d01-82f8-c151d309b904,Cepphus grylle,"(Linnaeus, 1758)",1980-05-24T12:00:00Z,-60.06045151,45.86557007,ACCD,EOR,31757,urn:lsid:marinespecies.org:taxname:137130,,FALSE,,,,137130
b3ca1e1a-5f5d-4930-b569-230810d07351,Cepphus grylle,"(Linnaeus, 1758)",1979-08-11T16:20:00,-62,57.5833,Canadian Wildlife Service,280,280_118409,urn:lsid:marinespecies.org:taxname:137130,,FALSE,,,,137130
b40da49c-e9b0-4ec6-9135-ef3e92878e7b,Cepphus grylle,"(Linnaeus, 1758)",7/24/05 08:56,-68.0333,44.3391,NA,,441029,137130,,FALSE,,,,137130
b42dfb12-5171-428e-8158-34cc0c4fe60f,Cepphus grylle,"(Linnaeus, 1758)",07/08/2005 09:25,-67.8582,44.3641,NA,,440580,137130,,FALSE,,,,137130
b46b65be-1352-4405-9a68-ab92d02bfdc3,Cepphus grylle,"(Linnaeus, 1758)",7/18/86 00:00,-52.86422,47.13228,Canadian Wildlife Service - Atlantic Region (CWS - Atlantic),,NF000269_BLGU_706_1986-07-18_1130,urn:lsid:marinespecies.org:taxname:137130,,FALSE,,,,137130
b53e93ae-0e3d-4376-b6d6-2fc478a4c885,Cepphus grylle,"(Linnaeus, 1758)",05/06/1999,-68.5,53,ICES,DOME-Biota,12135608,urn:lsid:marinespecies.org:taxname:137130,,FALSE,,,,137130
b5591fb8-d715-480a-b865-79cdcc077011,Cepphus grylle,,,-51.25,47.69,"Canadian Wildlife Service-Atlantic, Environment Canada",,1235054563_1749860950_-1972893580,urn:lsid:marinespecies.org:taxname:137130,,FALSE,,,,137130
b5a37228-691a-47f9-9a03-63a56d7397ce,Cepphus grylle,"(Linnaeus, 1758)",6/21/79 00:00,-65.25568,47.78931,Canadian Wildlife Service - Atlantic Region (CWS - Atlantic),,NB000067_BLGU_88_1979-06-21,urn:lsid:marinespecies.org:taxname:137130,,FALSE,,,,137130
b5c7b12c-e672-4d36-a56f-9bd58e4e5593,Cepphus grylle,"(Linnaeus, 1758)",1977-08-05T11:50:00,-67.5333,59.2833,Canadian Wildlife Service,280,280_85239,urn:lsid:marinespecies.org:taxname:137130,,FALSE,,,,137130
b5d578c6-7702-46a3-a041-6250cd33441f,Cepphus grylle,"(Linnaeus, 1758)",6/14/68 12:00,-65.98500824,47.92221832,ACCD,EOR,31413,urn:lsid:marinespecies.org:taxname:137130,,FALSE,,,,137130
b5f75f04-e077-4b1c-919f-b2dddc6d8bcc,Cepphus grylle,"(Linnaeus, 1758)",2000-08-12T12:00:00Z,-65.25669861,47.78926086,ACCD,EOR,31408,urn:lsid:marinespecies.org:taxname:137130,,FALSE,,,,137130
b60c18b1-d19c-4611-93fb-5f6f36018abd,Cepphus grylle,"(Linnaeus, 1758)",08/09/2006 11:36,-68.0788,44.2924,NA,,6685,137130,,FALSE,,,,137130
b64883d2-b1a9-44fb-a25e-3f4e2bbda936,Cepphus grylle,"(Linnaeus, 1758)",1977-07-30T07:56:00,-55.6667,55,Canadian Wildlife Service,280,280_84587,urn:lsid:marinespecies.org:taxname:137130,,FALSE,,,,137130
b661f551-f9d6-4585-9d0e-051d0f66c6a1,Cepphus grylle,,,-55.21,51.36,"Canadian Wildlife Service-Atlantic, Environment Canada",,1258482491_426765214_1474059975,urn:lsid:marinespecies.org:taxname:137130,,FALSE,,,,137130
b6735396-ee71-405c-a1d2-ac70984a6d5a,Cepphus grylle,,,-54.23,49.47,"Canadian Wildlife Service-Atlantic, Environment Canada",,1354126167_-1532108966_1352911839,urn:lsid:marinespecies.org:taxname:137130,,FALSE,,,,137130
b691773c-eecf-4150-97de-2ce885888116,Cepphus grylle,"(Linnaeus, 1758)",01/01/1983 00:00,-53.66554,47.04989,Canadian Wildlife Service - Atlantic Region (CWS - Atlantic),,NF000245_BLGU_638_1983-01-01,urn:lsid:marinespecies.org:taxname:137130,,FALSE,,,,137130
b6b2f681-937d-4f48-9c33-905d414552cc,Cepphus grylle,"(Linnaeus, 1758)",07/02/2005 15:14,-68.2275,44.1605,NA,,439868,137130,,FALSE,,,,137130
b6b71dca-7c79-4c9c-bd19-e1a50f961679,Cepphus grylle,"(Linnaeus, 1758)",01/01/1971 00:00,-61.59664,45.98013,Canadian Wildlife Service - Atlantic Region (CWS - Atlantic),,NS001137_BLGU_3114_1971-01-01,urn:lsid:marinespecies.org:taxname:137130,,FALSE,,,,137130
b6fb93bd-9b1f-40c5-bcd3-817e3e64724b,Cepphus grylle,"(Linnaeus, 1758)",06/10/1982 00:00,-64.69175,45.33006,Canadian Wildlife Service - Atlantic Region (CWS - Atlantic),,NS001131_BLGU_2912_1982-06-10,urn:lsid:marinespecies.org:taxname:137130,,FALSE,,,,137130
b701ee92-8396-4039-a5cd-4cc643fc43ba,Cepphus grylle,,,-63.37,49.92,"Canadian Wildlife Service-Atlantic, Environment Canada",,-635145613_-301838835_1035668757,urn:lsid:marinespecies.org:taxname:137130,,FALSE,,,,137130
b7257c42-69e0-4a68-9777-4194b1e190ec,Cepphus grylle,"(Linnaeus, 1758)",2000-07-02T00:00:00Z,-61.53245163,45.06666183,ACCD,EOR,31768,urn:lsid:marinespecies.org:taxname:137130,,FALSE,,,,137130
b760e6aa-4338-4595-a436-7679bde9109b,Cepphus grylle,"(Linnaeus, 1758)",1990-08-12T12:00:00Z,-60.39228821,47.02912903,ACCD,EOR,31499,urn:lsid:marinespecies.org:taxname:137130,,FALSE,,,,137130
b7632d95-a4f9-46f5-b1c8-e6de002e8a4b,Cepphus grylle,,,-55.56,52.04,"Canadian Wildlife Service-Atlantic, Environment Canada",,1367583303_-287171571_1056869110,urn:lsid:marinespecies.org:taxname:137130,,FALSE,,,,137130
b79cc133-a391-4d3a-855b-2d4ec9718928,Cepphus grylle,"(Linnaeus, 1758)",08/11/2006 13:27,-68.0827,44.2682,NA,,6755,137130,,FALSE,,,,137130
b7c2925d-379e-4885-9a68-45e553198091,Cepphus grylle,"(Linnaeus, 1758)",08/07/1978 00:00,-61.13223,56.55003,Canadian Wildlife Service - Atlantic Region (CWS - Atlantic),,NF000988_BLGU_2139_1978-08-07,urn:lsid:marinespecies.org:taxname:137130,,FALSE,,,,137130
b81ac10d-afec-4831-b459-8a61d938a6d9,Cepphus grylle,"(Linnaeus, 1758)",NA,-68.98333,44.01667,NA,,129330,137130,,FALSE,,,,137130
b870a990-6366-4124-9949-21a436c8b1ca,Cepphus grylle,"(Linnaeus, 1758)",05/06/2000,-68.5,53,ICES,DOME-Biota,12135350,urn:lsid:marinespecies.org:taxname:137130,,FALSE,,,,137130
b8d162f1-5edf-475b-b9a0-81c7ffbf6fb7,Cepphus grylle,"(Linnaeus, 1758)",01/01/1999 00:00,-61.5426,45.10182,Canadian Wildlife Service - Atlantic Region (CWS - Atlantic),,NS002232_BLGU_4691_1999-01-01,urn:lsid:marinespecies.org:taxname:137130,,FALSE,,,,137130
b8e53cd5-43a2-4f5e-bf3e-5d3d1344dbd0,Cepphus grylle,,,-61.71,47.31,"Canadian Wildlife Service-Atlantic, Environment Canada",,-1325055108_-1513944160_-579855169,urn:lsid:marinespecies.org:taxname:137130,,FALSE,,,,137130
b939f049-6c96-46b4-8b65-1913f3eb2856,Cepphus grylle,"(Linnaeus, 1758)",NA,-68.8476,44.1837,USFWS,,699373,137130,,FALSE,,,,137130
b973e054-75da-41c7-9b09-362ef30cc14c,Cepphus grylle,,,-61.72,47.31,"Canadian Wildlife Service-Atlantic, Environment Canada",,-749624382_1562597660_-1299170447,urn:lsid:marinespecies.org:taxname:137130,,FALSE,,,,137130
b99475cc-2c44-4b05-9e01-4b052fa22254,Cepphus grylle,"(Linnaeus, 1758)",07/08/2005 09:24,-67.8596,44.3602,NA,,440576,137130,,FALSE,,,,137130
b9e8d8e5-0899-4a01-a890-f789b4662cda,Cepphus grylle,,,-58.74,48.5,"Canadian Wildlife Service-Atlantic, Environment Canada",,896836590_-1715985443_-1336076857,urn:lsid:marinespecies.org:taxname:137130,,FALSE,,,,137130
ba080d74-d755-4329-9458-b9df9b76c39a,Cepphus grylle,"(Linnaeus, 1758)",1978-08-29T12:00:00,-57.6833,54.35,Canadian Wildlife Service,280,280_108843,urn:lsid:marinespecies.org:taxname:137130,,FALSE,,,,137130
ba0cc455-859f-47ac-8d50-889fde7acf3e,Cepphus grylle,"(Linnaeus, 1758)",01/01/1975 00:00,-53.592,48.68335,Canadian Wildlife Service - Atlantic Region (CWS - Atlantic),,NF000487_BLGU_1168_1975-01-01,urn:lsid:marinespecies.org:taxname:137130,,FALSE,,,,137130
ba207b71-275c-42bb-88af-1231147b8c00,Cepphus grylle,"(Linnaeus, 1758)",01/01/1986 00:00,-55.83218,51.24159,Canadian Wildlife Service - Atlantic Region (CWS - Atlantic),,NF000651_BLGU_1670_1986-01-01,urn:lsid:marinespecies.org:taxname:137130,,FALSE,,,,137130
ba278ec5-1dcc-4ff3-94b1-b8a86ee18e52,Cepphus grylle,"(Linnaeus, 1758)",1978-08-02T13:00:00,-57.0667,54.25,Canadian Wildlife Service,280,280_105035,urn:lsid:marinespecies.org:taxname:137130,,FALSE,,,,137130
ba2c274b-4c80-4295-9ad1-71ffb138c22e,Cepphus grylle,"(Linnaeus, 1758)",01/01/1985 00:00,-56.34896,46.78325,Canadian Wildlife Service - Atlantic Region (CWS - Atlantic),,NF000186_BLGU_360_1985-01-01,urn:lsid:marinespecies.org:taxname:137130,,FALSE,,,,137130
ba442f5f-c286-4dba-b402-b9d0d2837325,Cepphus grylle,,,-65.23,43.55,"Canadian Wildlife Service-Atlantic, Environment Canada",,1361835644_1528901942_-1769198977,urn:lsid:marinespecies.org:taxname:137130,,FALSE,,,,137130
ba455ee5-fa5b-4247-9388-26723fbad3b4,Cepphus grylle,,,-65.32,43.68,"Canadian Wildlife Service-Atlantic, Environment Canada",,1280325370_1100320259_-746737388,urn:lsid:marinespecies.org:taxname:137130,,FALSE,,,,137130
ba613cf2-6a08-4ad0-8015-fe6ad7c9b83f,Cepphus grylle,"(Linnaeus, 1758)",8/15/78 00:00,-58.18216,54.98332,Canadian Wildlife Service - Atlantic Region (CWS - Atlantic),,NF000780_BLGU_1869_1978-08-15,urn:lsid:marinespecies.org:taxname:137130,,FALSE,,,,137130
ba6fa7cf-27c6-43a6-8d39-c75a309a118f,Cepphus grylle,"(Linnaeus, 1758)",1979-08-25T15:45:00,-62.25,58.0333,Canadian Wildlife Service,280,280_120752,urn:lsid:marinespecies.org:taxname:137130,,FALSE,,,,137130
ba89fcf7-f2fe-41cc-b799-bd35cd704a01,Cepphus grylle,"(Linnaeus, 1758)",01/01/1975 00:00,-53.983,46.8437,Canadian Wildlife Service - Atlantic Region (CWS - Atlantic),,NF000199_BLGU_463_1975-01-01,urn:lsid:marinespecies.org:taxname:137130,,FALSE,,,,137130
ba9b622d-5ec5-4b88-9da2-ff3d115cf8c0,Cepphus grylle,"(Linnaeus, 1758)",08/12/2005 11:47,-68.0289,44.3403,NA,,442067,137130,,FALSE,,,,137130
bac0411a-af41-4548-9864-687283f9dda8,Cepphus grylle,,,-65.54,47.97,"Canadian Wildlife Service-Atlantic, Environment Canada",,1421648014_583394721_746177136,urn:lsid:marinespecies.org:taxname:137130,,FALSE,,,,137130
bacaa603-4500-419a-8010-6752be337347,Cepphus grylle,"(Linnaeus, 1758)",05/01/2012 00:00,-61.5426,45.10182,Canadian Wildlife Service - Atlantic Region (CWS - Atlantic),,NS002232_BLGU_9932_2012-05-01,urn:lsid:marinespecies.org:taxname:137130,,FALSE,,,,137130
bb14b93a-ea99-4de3-b4b3-0498857bed36,Cepphus grylle,"(Linnaeus, 1758)",6/21/86 12:00,-62.33567047,46.30559921,ACCD,EOR,31484,urn:lsid:marinespecies.org:taxname:137130,,FALSE,,,,137130
bb235cdd-5914-4e0a-8d55-5c22d03e8493,Cepphus grylle,,,-65.32,43.7,"Canadian Wildlife Service-Atlantic, Environment Canada",,1361835644_1399135981_924463843,urn:lsid:marinespecies.org:taxname:137130,,FALSE,,,,137130
bb602c82-a0e0-4e8a-a9ee-fb7202be1d00,Cepphus grylle,,,-61.81,47.35,"Canadian Wildlife Service-Atlantic, Environment Canada",,-1933920140_1475696060_-1132918935,urn:lsid:marinespecies.org:taxname:137130,,FALSE,,,,137130
bb882ed8-0857-41c0-9724-674e47d38701,Cepphus grylle,"(Linnaeus, 1758)",1980-08-29T17:50:00,-61.1333,56.4167,Canadian Wildlife Service,280,280_134471,urn:lsid:marinespecies.org:taxname:137130,,FALSE,,,,137130
bb98912c-f15a-4f5e-bc30-1b0de56f5f12,Cepphus grylle,"(Linnaeus, 1758)",1980-08-27T14:40:00,-61.3167,57,Canadian Wildlife Service,280,280_134163,urn:lsid:marinespecies.org:taxname:137130,,FALSE,,,,137130
bb9c4d09-c717-4400-8744-79bbc9da11e6,Cepphus grylle,"(Linnaeus, 1758)",1986-07-04T12:00:00Z,-64.04225159,47.00020981,ACCD,EOR,31698,urn:lsid:marinespecies.org:taxname:137130,,FALSE,,,,137130
bbb1791b-d626-4844-b7b9-5e9ce99bf82a,Cepphus grylle,,,-64.32,48.79,"Canadian Wildlife Service-Atlantic, Environment Canada",,58439636_508815507_541333515,urn:lsid:marinespecies.org:taxname:137130,,FALSE,,,,137130
bbed8620-0e92-40c5-8a10-c81dc8dc536a,Cepphus grylle,"(Linnaeus, 1758)",8/18/78 00:00,-58.79635,54.99371,Canadian Wildlife Service - Atlantic Region (CWS - Atlantic),,NF000781_BLGU_1876_1978-08-18,urn:lsid:marinespecies.org:taxname:137130,,FALSE,,,,137130
bc300c6e-493e-41fe-84d9-47e7ff8545c8,Cepphus grylle,,,-55.36,54.44,"Canadian Wildlife Service-Atlantic, Environment Canada",,1412337955_-1066156499_997514218,urn:lsid:marinespecies.org:taxname:137130,,FALSE,,,,137130
bc305a3d-76d7-4035-accb-be7cf9aec4c6,Cepphus grylle,"(Linnaeus, 1758)",1989-06-19T12:00:00Z,-65.80091095,43.63235855,ACCD,EOR,31458,urn:lsid:marinespecies.org:taxname:137130,,FALSE,,,,137130
bc6a5987-341b-4417-b2d8-dfce8f547867,Cepphus grylle,,,-64.97,48.06,"Canadian Wildlife Service-Atlantic, Environment Canada",,545832393_1490362650_2142487837,urn:lsid:marinespecies.org:taxname:137130,,FALSE,,,,137130
bc94619f-843a-44a0-8730-f3cc03eb08dd,Cepphus grylle,"(Linnaeus, 1758)",01/01/1986 00:00,-56.22562,46.77825,Canadian Wildlife Service - Atlantic Region (CWS - Atlantic),,NF000184_BLGU_332_1986-01-01,urn:lsid:marinespecies.org:taxname:137130,,FALSE,,,,137130
bcd37aa4-e433-443a-b378-dfa770f8c50c,Cepphus grylle,"(Linnaeus, 1758)",1979-08-10T12:10:00,-57.05,54.8167,Canadian Wildlife Service,280,280_118120,urn:lsid:marinespecies.org:taxname:137130,,FALSE,,,,137130
bcfdf0fc-a01f-42d6-a2f3-312f86755aeb,Cepphus grylle,"(Linnaeus, 1758)",8/13/78 00:00,-61.53226,56.2167,Canadian Wildlife Service - Atlantic Region (CWS - Atlantic),,NF000927_BLGU_2055_1978-08-13,urn:lsid:marinespecies.org:taxname:137130,,FALSE,,,,137130
bd381404-fa39-491f-9c5e-a174d55d6c49,Cepphus grylle,,,-64.58,47.2,"Canadian Wildlife Service-Atlantic, Environment Canada",,898051745_403867037_1774929702,urn:lsid:marinespecies.org:taxname:137130,,FALSE,,,,137130
bd6fe1e0-e20f-4490-a89e-e5acc5136e33,Cepphus grylle,"(Linnaeus, 1758)",1979-08-04T08:45:00,-57.8833,54.3167,Canadian Wildlife Service,280,280_117530,urn:lsid:marinespecies.org:taxname:137130,,FALSE,,,,137130
bda7fd6a-de9e-4958-a359-33c469231af1,Cepphus grylle,"(Linnaeus, 1758)",1981-02-15T10:00:00,-57.8333,47.5,Canadian Wildlife Service,280,280_138762,urn:lsid:marinespecies.org:taxname:137130,,FALSE,,,,137130
bdc3632b-12ef-453c-87ce-36545b7df2f7,Cepphus grylle,,,-61.76,49.86,"Canadian Wildlife Service-Atlantic, Environment Canada",,1421648014_-1834315120_1469732130,urn:lsid:marinespecies.org:taxname:137130,,FALSE,,,,137130
bdd777bb-072a-47ef-aa5e-37559f5590d2,Cepphus grylle,"(Linnaeus, 1758)",08/07/1978 00:00,-61.11557,56.58337,Canadian Wildlife Service - Atlantic Region (CWS - Atlantic),,NF000995_BLGU_2144_1978-08-07,urn:lsid:marinespecies.org:taxname:137130,,FALSE,,,,137130
bddd5bbc-7af7-4a4c-828c-fc3d7cfbcb75,Cepphus grylle,"(Linnaeus, 1758)",07/02/2001 12:00,-66.83262634,44.61669922,ACCD,EOR,31782,urn:lsid:marinespecies.org:taxname:137130,,FALSE,,,,137130
be369695-49ff-44cd-a1c7-ed32422d2b20,Cepphus grylle,"(Linnaeus, 1758)",1990-06-06T12:00:00Z,-61.26250076,46.35813141,ACCD,EOR,31490,urn:lsid:marinespecies.org:taxname:137130,,FALSE,,,,137130
be554c7a-da52-4516-9ee8-32155d78faa8,Cepphus grylle,"(Linnaeus, 1758)",1973-03-06T14:30:00,-59.1333,50,Canadian Wildlife Service,280,280_62817,urn:lsid:marinespecies.org:taxname:137130,,FALSE,,,,137130
be7cd9a0-f432-45f5-838c-8815572a8e25,Cepphus grylle,"(Linnaeus, 1758)",07/02/2001 12:00,-66.80682373,44.60234833,ACCD,EOR,31787,urn:lsid:marinespecies.org:taxname:137130,,FALSE,,,,137130
bef764fd-1906-4bda-a62f-fc689fc97bd5,Cepphus grylle,,,-53.2,46.59,"Canadian Wildlife Service-Atlantic, Environment Canada",,1427117146_1913276647_1074682524,urn:lsid:marinespecies.org:taxname:137130,,FALSE,,,,137130
befdd783-3510-492a-9fab-e0c0a21476cf,Cepphus grylle,,,-58.42,49.16,"Canadian Wildlife Service-Atlantic, Environment Canada",,896836590_-1781653092_-760223608,urn:lsid:marinespecies.org:taxname:137130,,FALSE,,,,137130
bf1fc4fd-6a69-461a-9368-973713ae0439,Cepphus grylle,"(Linnaeus, 1758)",1975-07-23T06:35:00,-56.7,51.4,Canadian Wildlife Service,280,280_68747,urn:lsid:marinespecies.org:taxname:137130,,FALSE,,,,137130
bf42ebf7-f6a5-416a-bdf1-dc673daeb4f7,Cepphus grylle,"(Linnaeus, 1758)",NA,-69.9499,41.3495,"BOEM, USFWS, NOAA, NAVY",,731929,137130,,FALSE,,,,137130
bf4f46c6-8c50-4edc-8656-708878e50ce8,Cepphus grylle,"(Linnaeus, 1758)",1971-05-10T09:50:00,-52.65,47.5333,Canadian Wildlife Service,280,280_35964,urn:lsid:marinespecies.org:taxname:137130,,FALSE,,,,137130
bf88868b-ee3f-4188-99df-68c7b557aa96,Cepphus grylle,"(Linnaeus, 1758)",NA,-69.9705,41.4425,USFWS,,680377,137130,,FALSE,,,,137130
bf951cb8-234f-4f7a-a516-fdef0a62aff4,Cepphus grylle,"(Linnaeus, 1758)",8/14/78 00:00,-60.2489,55.30001,Canadian Wildlife Service - Atlantic Region (CWS - Atlantic),,NF000840_BLGU_1939_1978-08-14,urn:lsid:marinespecies.org:taxname:137130,,FALSE,,,,137130
bf953564-a234-45c0-9173-a0f2c5750b9d,Cepphus grylle,"(Linnaeus, 1758)",5/24/80 00:00,-59.95988,45.8947,Canadian Wildlife Service - Atlantic Region (CWS - Atlantic),,NS001325_BLGU_3090_1980-05-24,urn:lsid:marinespecies.org:taxname:137130,,FALSE,,,,137130
bfab70dc-c4d1-4135-9bb1-8fcf894a9560,Cepphus grylle,"(Linnaeus, 1758)",01/01/1975 00:00,-55.6158,46.86926,Canadian Wildlife Service - Atlantic Region (CWS - Atlantic),,NF000212_BLGU_525_1975-01-01,urn:lsid:marinespecies.org:taxname:137130,,FALSE,,,,137130
bfb0b1ed-51f1-4c97-83af-a9e19a3a76e5,Cepphus grylle,"(Linnaeus, 1758)",01/01/1983 00:00,-56.16562,46.81991,Canadian Wildlife Service - Atlantic Region (CWS - Atlantic),,NF000195_BLGU_411_1983-01-01,urn:lsid:marinespecies.org:taxname:137130,,FALSE,,,,137130
bfc39751-4ffd-4585-8443-c70641812314,Cepphus grylle,"(Linnaeus, 1758)",1979-07-18T08:20:00,-55.7333,53.5833,Canadian Wildlife Service,280,280_116334,urn:lsid:marinespecies.org:taxname:137130,,FALSE,,,,137130
bfe1ea29-1ef7-45f5-9427-755a51d6e7d5,Cepphus grylle,,,-58.48,49.2,"Canadian Wildlife Service-Atlantic, Environment Canada",,896836590_2046568259_1951642676,urn:lsid:marinespecies.org:taxname:137130,,FALSE,,,,137130
c01c1d68-3239-4596-99a3-5550190f7c0a,Cepphus grylle,"(Linnaeus, 1758)",,-67.06667328,44.5,ACCD,EOR,31399,urn:lsid:marinespecies.org:taxname:137130,,FALSE,,,,137130
c029b08b-d10a-454e-8cb7-a3822cac4ac8,Cepphus grylle,"(Linnaeus, 1758)",6/25/05 09:55,-67.8581,44.3615,NA,,440009,137130,,FALSE,,,,137130
c0428f97-8454-4617-8857-2d7fdfe5898f,Cepphus grylle,"(Linnaeus, 1758)",8/18/78 00:00,-58.28217,54.98332,Canadian Wildlife Service - Atlantic Region (CWS - Atlantic),,NF000778_BLGU_1871_1978-08-18,urn:lsid:marinespecies.org:taxname:137130,,FALSE,,,,137130
c090e7d2-7c30-4a0a-83d3-f40b0495c626,Cepphus grylle,"(Linnaeus, 1758)",01/01/1984 00:00,-54.1809,49.8188,Canadian Wildlife Service - Atlantic Region (CWS - Atlantic),,NF003516_BLGU_1555_1984-01-01,urn:lsid:marinespecies.org:taxname:137130,,FALSE,,,,137130
c09fad55-6efd-487a-9de1-1927cba9ed3b,Cepphus grylle,"(Linnaeus, 1758)",01/01/1975 00:00,-54.57218,49.68323,Canadian Wildlife Service - Atlantic Region (CWS - Atlantic),,NF000586_BLGU_1374_1975-01-01,urn:lsid:marinespecies.org:taxname:137130,,FALSE,,,,137130
c0ebf7b9-6067-47cd-823a-f26cf523b9d1,Cepphus grylle,"(Linnaeus, 1758)",01/01/1974 00:00,-55.1197,47.04154,Canadian Wildlife Service - Atlantic Region (CWS - Atlantic),,NF000242_BLGU_633_1974-01-01,urn:lsid:marinespecies.org:taxname:137130,,FALSE,,,,137130
c0f375b1-4f83-4815-b5f5-caf42ce8f8f3,Cepphus grylle,,,-65.44,47.96,"Canadian Wildlife Service-Atlantic, Environment Canada",,-635145613_1421040941_-943389521,urn:lsid:marinespecies.org:taxname:137130,,FALSE,,,,137130
c1170edd-6fec-4c66-96bf-4422cefd6781,Cepphus grylle,"(Linnaeus, 1758)",NA,-70.567,42.1065,USFWS,,669397,137130,,FALSE,,,,137130
c17f68e1-9415-4bac-a535-088b962b2435,Cepphus grylle,,,-64.98,48.13,"Canadian Wildlife Service-Atlantic, Environment Canada",,-1636689528_-451746691_-1050258708,urn:lsid:marinespecies.org:taxname:137130,,FALSE,,,,137130
c187e438-965e-47af-bc3b-d6399d86a067,Cepphus grylle,"(Linnaeus, 1758)",1979-08-04T10:00:00,-57.5167,54.3667,Canadian Wildlife Service,280,280_117550,urn:lsid:marinespecies.org:taxname:137130,,FALSE,,,,137130
c194e548-db4e-4db2-a851-27ed97abeca2,Cepphus grylle,"(Linnaeus, 1758)",6/22/06 11:59,-68.0988,44.344,NA,,4451,137130,,FALSE,,,,137130
c1be08ff-5a57-467d-ab9f-ee3b545c7164,Cepphus grylle,"(Linnaeus, 1758)",NA,-68.06667,44.3,NA,,117157,137130,,FALSE,,,,137130
c1c67c1a-795a-401f-a637-b8dd7feb2560,Cepphus grylle,"(Linnaeus, 1758)",NA,-68.9142,43.8499,USFWS,,699139,137130,,FALSE,,,,137130
c1c80f98-fbf6-41d4-91e2-8597c15409c1,Cepphus grylle,"(Linnaeus, 1758)",1981-02-15T10:20:00,-57.5,47.5,Canadian Wildlife Service,280,280_138773,urn:lsid:marinespecies.org:taxname:137130,,FALSE,,,,137130
c22162c8-710c-4415-a149-ea44e5af5456,Cepphus grylle,"(Linnaeus, 1758)",01/01/2001 00:00,-66.77646,44.79926,Canadian Wildlife Service - Atlantic Region (CWS - Atlantic),,NB002613_BLGU_5392_2001-01-01,urn:lsid:marinespecies.org:taxname:137130,,FALSE,,,,137130
c27e9aa6-e0e3-499d-8ab5-6d251c2934bb,Cepphus grylle,"(Linnaeus, 1758)",07/10/2012 00:00,-54.0945,49.818,Canadian Wildlife Service - Atlantic Region (CWS - Atlantic),,NF003532_BLGU_10061_2012-07-10,urn:lsid:marinespecies.org:taxname:137130,,FALSE,,,,137130
c27fbd63-d835-40c5-8ef9-4f65bcd84d8c,Cepphus grylle,"(Linnaeus, 1758)",12/16/86 12:00,-64.407547,44.24314117,ACCD,EOR,31460,urn:lsid:marinespecies.org:taxname:137130,,FALSE,,,,137130
c290a9b0-3907-49a3-bbe1-dc3ed6370ab3,Cepphus grylle,"(Linnaeus, 1758)",1987-07-13T12:00:00Z,-61.30472946,46.23123169,ACCD,EOR,31487,urn:lsid:marinespecies.org:taxname:137130,,FALSE,,,,137130
c304f027-5cfe-4a7a-90de-109577210864,Cepphus grylle,,,-68.55,48.57,"Canadian Wildlife Service-Atlantic, Environment Canada",,545832393_692363394_-1477429761,urn:lsid:marinespecies.org:taxname:137130,,FALSE,,,,137130
c412c2e0-3a09-4ada-84a9-fc12eba533f4,Cepphus grylle,"(Linnaeus, 1758)",07/02/1971 12:00,-59.81575012,46.18328094,ACCD,EOR,31748,urn:lsid:marinespecies.org:taxname:137130,,FALSE,,,,137130
c41c4b6b-8397-40c6-a5c1-95e1fb4caa20,Cepphus grylle,,,-65.33,43.7,"Canadian Wildlife Service-Atlantic, Environment Canada",,1361835644_1884259954_-1660121913,urn:lsid:marinespecies.org:taxname:137130,,FALSE,,,,137130
c4851a27-cdb9-4298-9184-49f36a291961,Cepphus grylle,,,-65.33,43.7,"Canadian Wildlife Service-Atlantic, Environment Canada",,1361835644_1884259954_323292683,urn:lsid:marinespecies.org:taxname:137130,,FALSE,,,,137130
c4d601dc-3c6b-4c88-96e2-0685d7cf80e7,Cepphus grylle,"(Linnaeus, 1758)",7/13/16 00:00,-55.60508,46.89459,Canadian Wildlife Service - Atlantic Region (CWS - Atlantic),,NF000217_BLGU_13157_2016-07-13,urn:lsid:marinespecies.org:taxname:137130,,FALSE,,,,137130
c4ecd4ab-b032-43f5-b778-823fbb5f952f,Cepphus grylle,"(Linnaeus, 1758)",1979-08-14T07:15:00,-59.2333,55.25,Canadian Wildlife Service,280,280_118836,urn:lsid:marinespecies.org:taxname:137130,,FALSE,,,,137130
c4fcad79-06e7-432f-a11a-aa3268499f79,Cepphus grylle,,,-58.29,49.21,"Canadian Wildlife Service-Atlantic, Environment Canada",,896836590_1757863809_-1358285111,urn:lsid:marinespecies.org:taxname:137130,,FALSE,,,,137130
c5184970-0eaa-4936-8ae0-5cf3c27d7095,Cepphus grylle,,,-59.68,46.13,"Canadian Wildlife Service-Atlantic, Environment Canada",,-1666739583_982306580_626449467,urn:lsid:marinespecies.org:taxname:137130,,FALSE,,,,137130
c53184ee-fb11-444a-9a08-b25f9f83feda,Cepphus grylle,"(Linnaeus, 1758)",08/08/2005 09:05,-67.9981,44.3241,NA,,441918,137130,,FALSE,,,,137130
c54b1bfd-ebdb-40b3-ac50-361597a49323,Cepphus grylle,"(Linnaeus, 1758)",8/15/78 00:00,-58.2155,54.98332,Canadian Wildlife Service - Atlantic Region (CWS - Atlantic),,NF000779_BLGU_1870_1978-08-15,urn:lsid:marinespecies.org:taxname:137130,,FALSE,,,,137130
c57fe347-320a-4f49-8c60-21f3d48df10a,Cepphus grylle,,,-65.33,43.7,"Canadian Wildlife Service-Atlantic, Environment Canada",,1361835644_1884259954_1886357756,urn:lsid:marinespecies.org:taxname:137130,,FALSE,,,,137130
c5831a1b-0a4f-4065-b1fa-48dd54dda0f2,Cepphus grylle,,,-56.69,53.78,"Canadian Wildlife Service-Atlantic, Environment Canada",,1278617075_-1448126524_2041349493,urn:lsid:marinespecies.org:taxname:137130,,FALSE,,,,137130
c5a568e7-63e3-4a2b-8134-4bb31c33c542,Cepphus grylle,,,-59.41,50.12,"Canadian Wildlife Service-Atlantic, Environment Canada",,792082018_999503206_2063458814,urn:lsid:marinespecies.org:taxname:137130,,FALSE,,,,137130
c5b04588-114e-4105-b606-ce4613b26c8c,Cepphus grylle,"(Linnaeus, 1758)",6/25/13 00:00,-52.7804,47.23832,Canadian Wildlife Service - Atlantic Region (CWS - Atlantic),,NF000298_BLGU_10946_2013-06-25,urn:lsid:marinespecies.org:taxname:137130,,FALSE,,,,137130
c6004e40-bca4-4816-b2d2-43e945c7aae4,Cepphus grylle,,,-63.3,59.24,"Canadian Wildlife Service-Atlantic, Environment Canada",,1409356886_-785990664_-2071010586,urn:lsid:marinespecies.org:taxname:137130,,FALSE,,,,137130
c610f966-94b2-4993-8206-329258848eac,Cepphus grylle,"(Linnaeus, 1758)",NA,-69.0925,44.1078,USFWS,,682384,137130,,FALSE,,,,137130
c64bcd82-a397-42a4-b84c-3c10eded5184,Cepphus grylle,"(Linnaeus, 1758)",7/13/06 00:00,-59.87222,46.14994,Canadian Wildlife Service - Atlantic Region (CWS - Atlantic),,NS003495_BLGU_12086_2006-07-13,urn:lsid:marinespecies.org:taxname:137130,,FALSE,,,,137130
c64c1ca8-8c4a-491f-a2de-cc2c96a89993,Cepphus grylle,"(Linnaeus, 1758)",6/20/00,-68.5,53,ICES,DOME-Biota,12135377,urn:lsid:marinespecies.org:taxname:137130,,FALSE,,,,137130
c6c78fde-7c14-4f9c-baf2-240645c91b72,Cepphus grylle,,,-64.56,48.33,"Canadian Wildlife Service-Atlantic, Environment Canada",,689065724_2012113659_-210113439,urn:lsid:marinespecies.org:taxname:137130,,FALSE,,,,137130
c6cfb59e-be03-46b2-a1f5-f0ef52d7c52e,Cepphus grylle,"(Linnaeus, 1758)",1973-03-02T13:50:00,-62,49.8,Canadian Wildlife Service,280,280_62774,urn:lsid:marinespecies.org:taxname:137130,,FALSE,,,,137130
c6ff800b-2514-459a-a2e5-65974b0789ef,Cepphus grylle,"(Linnaeus, 1758)",01/01/2001 00:00,-66.84205,44.60393,Canadian Wildlife Service - Atlantic Region (CWS - Atlantic),,NB000093_BLGU_5399_2001-01-01,urn:lsid:marinespecies.org:taxname:137130,,FALSE,,,,137130
c707351f-ec5d-490b-a837-56b4b1de1f0d,Cepphus grylle,"(Linnaeus, 1758)",1988-07-17T12:00:00Z,-66.95944214,45.00941086,ACCD,EOR,31432,urn:lsid:marinespecies.org:taxname:137130,,FALSE,,,,137130
c7a87076-1663-4799-aa89-dfecc45c576b,Cepphus grylle,"(Linnaeus, 1758)",01/01/1984 00:00,-52.79882,48.11655,Canadian Wildlife Service - Atlantic Region (CWS - Atlantic),,NF000456_BLGU_1081_1984-01-01,urn:lsid:marinespecies.org:taxname:137130,,FALSE,,,,137130
c7db61d0-4757-4413-aa99-a9c2ea762397,Cepphus grylle,"(Linnaeus, 1758)",2001-07-02T12:00:00Z,-66.81907654,44.61159134,ACCD,EOR,31783,urn:lsid:marinespecies.org:taxname:137130,,FALSE,,,,137130
c7e6c527-d902-4b3e-9031-7fbb398e075a,Cepphus grylle,"(Linnaeus, 1758)",6/19/05 09:31,-68.022,44.32,NA,,439461,137130,,FALSE,,,,137130
c81bcfa9-14be-4e6d-96a5-ca69a5d2ee64,Cepphus grylle,"(Linnaeus, 1758)",01/01/1981 00:00,-66.01256,43.41084,Canadian Wildlife Service - Atlantic Region (CWS - Atlantic),,NS001144_BLGU_2253_1981-01-01,urn:lsid:marinespecies.org:taxname:137130,,FALSE,,,,137130
c882a575-87c2-4f70-9b17-26668a90abc8,Cepphus grylle,"(Linnaeus, 1758)",6/18/02 00:00,-57.00999,47.5687,Canadian Wildlife Service - Atlantic Region (CWS - Atlantic),,NF002999_BLGU_6388_2002-06-18,urn:lsid:marinespecies.org:taxname:137130,,FALSE,,,,137130
c8c9fd67-7868-4f86-a922-4820534ddf96,Cepphus grylle,,,-51.58,47.67,"Canadian Wildlife Service-Atlantic, Environment Canada",,1235054563_-1266403924_-2122447949,urn:lsid:marinespecies.org:taxname:137130,,FALSE,,,,137130
c91a5221-c801-4384-b9a0-fbbd385f35e2,Cepphus grylle,"(Linnaeus, 1758)",06/01/1992 00:00,-64.04913,44.38377,Canadian Wildlife Service - Atlantic Region (CWS - Atlantic),,NS001336_BLGU_5338_1992-06-01,urn:lsid:marinespecies.org:taxname:137130,,FALSE,,,,137130
c93079c8-e155-40bf-a11e-28c2efac260d,Cepphus grylle,"(Linnaeus, 1758)",6/13/06 00:00,-59.93094,45.9159,Canadian Wildlife Service - Atlantic Region (CWS - Atlantic),,NS003492_BLGU_12081_2006-06-13,urn:lsid:marinespecies.org:taxname:137130,,FALSE,,,,137130
c9503194-da64-46fd-b277-e8f1815ca6a1,Cepphus grylle,"(Linnaeus, 1758)",01/01/1974 00:00,-55.20951,46.9649,Canadian Wildlife Service - Atlantic Region (CWS - Atlantic),,NF000220_BLGU_579_1974-01-01,urn:lsid:marinespecies.org:taxname:137130,,FALSE,,,,137130
c96fdb14-8585-4d2d-b44a-6403677d3c3e,Cepphus grylle,,,-53.03,48.72,"Canadian Wildlife Service-Atlantic, Environment Canada",,1373407025_-2060016965_1873301006,urn:lsid:marinespecies.org:taxname:137130,,FALSE,,,,137130
c98931a6-0701-4078-b426-126054ebf978,Cepphus grylle,"(Linnaeus, 1758)",8/14/78 00:00,-59.31553,55.28333,Canadian Wildlife Service - Atlantic Region (CWS - Atlantic),,NF000838_BLGU_1928_1978-08-14,urn:lsid:marinespecies.org:taxname:137130,,FALSE,,,,137130
c98ee699-871f-4bcf-95d9-c8ec0b95f9e1,Cepphus grylle,,,-62.17,47.15,"Canadian Wildlife Service-Atlantic, Environment Canada",,1421648014_-543188357_1655971346,urn:lsid:marinespecies.org:taxname:137130,,FALSE,,,,137130
c98ff4a0-a31c-4f12-b064-61cefcf0324a,Cepphus grylle,"(Linnaeus, 1758)",08/05/2010 00:00,-57.53216,54.3833,Canadian Wildlife Service - Atlantic Region (CWS - Atlantic),,NF000737_BLGU_12553_2010-08-05,urn:lsid:marinespecies.org:taxname:137130,,FALSE,,,,137130
c9aea7d4-6969-496a-967a-a8ba4e31fb1b,Cepphus grylle,"(Linnaeus, 1758)",1979-08-27T16:10:00,-61.5333,56.95,Canadian Wildlife Service,280,280_120975,urn:lsid:marinespecies.org:taxname:137130,,FALSE,,,,137130
c9c7c661-f1b8-4cde-b9b4-82d8c53233cc,Cepphus grylle,"(Linnaeus, 1758)",7/19/06 12:48,-68.0411,44.3343,NA,,5599,137130,,FALSE,,,,137130
c9e92756-32da-46ae-b6fd-28bcb52f1c68,Cepphus grylle,,,-52.96,49.58,"Canadian Wildlife Service-Atlantic, Environment Canada",,1353408495_471065868_1513099001,urn:lsid:marinespecies.org:taxname:137130,,FALSE,,,,137130
c9f8a43a-6a31-48aa-aad6-24cde4cb2cef,Cepphus grylle,,,-65.51,49.34,"Canadian Wildlife Service-Atlantic, Environment Canada",,-801551520_-1143907458_412101047,urn:lsid:marinespecies.org:taxname:137130,,FALSE,,,,137130
c9f8ffff-6112-45c5-8640-cbed4287b814,Cepphus grylle,,,-65.46,47.95,"Canadian Wildlife Service-Atlantic, Environment Canada",,1421648014_-187210835_1413080661,urn:lsid:marinespecies.org:taxname:137130,,FALSE,,,,137130
ca33d81b-f824-4624-879f-4802ac9b515d,Cepphus grylle,,,-59.56,46.3,"Canadian Wildlife Service-Atlantic, Environment Canada",,-1265397639_471784821_-724338991,urn:lsid:marinespecies.org:taxname:137130,,FALSE,,,,137130
ca451ad7-272d-4fd8-8296-f81b6417fb17,Cepphus grylle,,,-58.2,49.5,"Canadian Wildlife Service-Atlantic, Environment Canada",,896836590_410645184_-20483755,urn:lsid:marinespecies.org:taxname:137130,,FALSE,,,,137130
ca7b3401-a15b-48fa-8e25-3e5210316c36,Cepphus grylle,"(Linnaeus, 1758)",07/08/1992 12:00,-66.75013733,44.6669693,ACCD,EOR,31397,urn:lsid:marinespecies.org:taxname:137130,,FALSE,,,,137130
caa7704e-dbe8-43a5-b4e4-5d7d76324566,Cepphus grylle,,,-55.59,52.34,"Canadian Wildlife Service-Atlantic, Environment Canada",,1351610123_-823004762_1338533008,urn:lsid:marinespecies.org:taxname:137130,,FALSE,,,,137130
caf49c93-0abb-4ddf-8367-befe96e597c5,Cepphus grylle,"(Linnaeus, 1758)",7/27/16 00:00,-65.98543,43.50578,Canadian Wildlife Service - Atlantic Region (CWS - Atlantic),,NS001411_BLGU_13363_2016-07-27,urn:lsid:marinespecies.org:taxname:137130,,FALSE,,,,137130
cb1601c3-28ac-4de6-bb46-4ec4acf8558b,Cepphus grylle,"(Linnaeus, 1758)",1978-06-26T10:00:00,-55.55,52.1667,Canadian Wildlife Service,280,280_101929,urn:lsid:marinespecies.org:taxname:137130,,FALSE,,,,137130
cc161ca6-efb8-4036-a246-bb5fb274d0fc,Cepphus grylle,"(Linnaeus, 1758)",01/01/1981 00:00,-55.6158,46.86926,Canadian Wildlife Service - Atlantic Region (CWS - Atlantic),,NF000212_BLGU_527_1981-01-01,urn:lsid:marinespecies.org:taxname:137130,,FALSE,,,,137130
cc1e7e59-24af-4cc6-acf0-0edd16e6f107,Cepphus grylle,,,-53.18,47.73,"Canadian Wildlife Service-Atlantic, Environment Canada",,1355323011_1701287967_-1921394843,urn:lsid:marinespecies.org:taxname:137130,,FALSE,,,,137130
cc3f760a-fb3f-4bf2-a637-df1b47050cab,Cepphus grylle,"(Linnaeus, 1758)",1979-09-01T09:00:00,-61.25,56.1,Canadian Wildlife Service,280,280_121161,urn:lsid:marinespecies.org:taxname:137130,,FALSE,,,,137130
cc93378c-a712-4c15-ba79-20ccc644d37a,Cepphus grylle,"(Linnaeus, 1758)",01/01/1989 00:00,-53.7155,48.71656,Canadian Wildlife Service - Atlantic Region (CWS - Atlantic),,NF000493_BLGU_1182_1989-01-01,urn:lsid:marinespecies.org:taxname:137130,,FALSE,,,,137130
cca21896-d9b1-4630-abfb-24a751c6b0a0,Cepphus grylle,"(Linnaeus, 1758)",NA,-68.3052,44.2738,USFWS,,670436,137130,,FALSE,,,,137130
cca5462d-7bf9-4b6e-982a-59118277fed8,Cepphus grylle,"(Linnaeus, 1758)",7/26/05 15:45,-68.1661,44.2285,NA,,441271,137130,,FALSE,,,,137130
ccdff32c-31c8-4f75-94ee-72f6869eedc3,Cepphus grylle,"(Linnaeus, 1758)",7/26/06 10:19,-68.2268,44.1793,NA,,6005,137130,,FALSE,,,,137130
ccf80a48-1c8a-42f3-8f3d-3fea86c1e10b,Cepphus grylle,"(Linnaeus, 1758)",01/01/1975 00:00,-54.08154,47.4656,Canadian Wildlife Service - Atlantic Region (CWS - Atlantic),,NF000338_BLGU_923_1975-01-01,urn:lsid:marinespecies.org:taxname:137130,,FALSE,,,,137130
cd08eb4e-550d-4412-94a1-cd1a9dc41867,Cepphus grylle,"(Linnaeus, 1758)",7/18/86 00:00,-52.85551,47.15488,Canadian Wildlife Service - Atlantic Region (CWS - Atlantic),,NF000276_BLGU_732_1986-07-18_1130,urn:lsid:marinespecies.org:taxname:137130,,FALSE,,,,137130
cd315c47-b005-4ff3-b162-c6eccd1290b8,Cepphus grylle,"(Linnaeus, 1758)",01/01/1984 00:00,-56.34896,46.78325,Canadian Wildlife Service - Atlantic Region (CWS - Atlantic),,NF000186_BLGU_359_1984-01-01,urn:lsid:marinespecies.org:taxname:137130,,FALSE,,,,137130
cd3e40e9-23b2-4b2f-941d-b2dd7cf65cfd,Cepphus grylle,"(Linnaeus, 1758)",7/26/05 13:38,-68.195,44.2102,NA,,441249,137130,,FALSE,,,,137130
cd55e2ef-9836-46b1-a8f7-10d0f39026da,Cepphus grylle,"(Linnaeus, 1758)",01/01/1956 00:00,-66.02926,43.62252,Canadian Wildlife Service - Atlantic Region (CWS - Atlantic),,NS001169_BLGU_2301_1956-01-01,urn:lsid:marinespecies.org:taxname:137130,,FALSE,,,,137130
cd690ae9-5aee-4d52-b676-9ad11e14076b,Cepphus grylle,,,-58.56,48.87,"Canadian Wildlife Service-Atlantic, Environment Canada",,896836590_380738895_417822808,urn:lsid:marinespecies.org:taxname:137130,,FALSE,,,,137130
cd6ac3f6-3d4d-4a85-af68-ce645a6e3a43,Cepphus grylle,,,-62.25,47.28,"Canadian Wildlife Service-Atlantic, Environment Canada",,58439636_153766390_519104468,urn:lsid:marinespecies.org:taxname:137130,,FALSE,,,,137130
cd6c5c0c-0d86-4112-b303-4840b7358337,Cepphus grylle,"(Linnaeus, 1758)",1970-05-21T19:22:00,-52.8333,46.5833,Canadian Wildlife Service,280,280_21505,urn:lsid:marinespecies.org:taxname:137130,,FALSE,,,,137130
cd74a9c0-2ddb-4c59-a62f-52b8134cd5f5,Cepphus grylle,,,-65.11,48.08,"Canadian Wildlife Service-Atlantic, Environment Canada",,-1636689528_932025829_-1751231525,urn:lsid:marinespecies.org:taxname:137130,,FALSE,,,,137130
cd797d63-25f2-4efc-8c6e-f947a04d970e,Cepphus grylle,"(Linnaeus, 1758)",6/25/05 09:39,-68.014,44.3206,NA,,439984,137130,,FALSE,,,,137130
cdc098ba-924d-4676-b979-51faa540b3a1,Cepphus grylle,"(Linnaeus, 1758)",07/02/1973 12:00,-66.69255447,44.63250542,ACCD,EOR,31777,urn:lsid:marinespecies.org:taxname:137130,,FALSE,,,,137130
cdcb5d19-dcbc-4b24-b556-a78e2120e1fa,Cepphus grylle,"(Linnaeus, 1758)",01/01/1974 00:00,-53.62497,48.70481,Canadian Wildlife Service - Atlantic Region (CWS - Atlantic),,NF000492_BLGU_1174_1974-01-01,urn:lsid:marinespecies.org:taxname:137130,,FALSE,,,,137130
cdd91610-5b49-49cb-8a74-382398cb5ee8,Cepphus grylle,"(Linnaeus, 1758)",01/01/1945 00:00,-53.81549,49.54989,Canadian Wildlife Service - Atlantic Region (CWS - Atlantic),,NF000563_BLGU_1331_1945-01-01,urn:lsid:marinespecies.org:taxname:137130,,FALSE,,,,137130
cde1f345-f79b-4104-b6f5-ff24c938f0de,Cepphus grylle,"(Linnaeus, 1758)",05/01/2016 00:00,-66.14406,43.68891,Canadian Wildlife Service - Atlantic Region (CWS - Atlantic),,NS001172_BLGU_13376_2016-05-01,urn:lsid:marinespecies.org:taxname:137130,,FALSE,,,,137130
cde700b4-7704-4177-9a67-72a10a31aef7,Cepphus grylle,,,-64.42,48.84,"Canadian Wildlife Service-Atlantic, Environment Canada",,-487837150_-1015122166_-1293662455,urn:lsid:marinespecies.org:taxname:137130,,FALSE,,,,137130
cde817b4-7464-4656-9cfe-714134a74899,Cepphus grylle,"(Linnaeus, 1758)",6/21/05 13:53,-68.2395,44.1413,NA,,439642,137130,,FALSE,,,,137130
ce2c25f6-5d5b-42ac-9b7c-df2d18eb133b,Cepphus grylle,"(Linnaeus, 1758)",8/13/78 00:00,-60.7327,55.92646,Canadian Wildlife Service - Atlantic Region (CWS - Atlantic),,NF000906_BLGU_2015_1978-08-13,urn:lsid:marinespecies.org:taxname:137130,,FALSE,,,,137130
ce636436-8bf7-497d-8b8a-1107a4b05482,Cepphus grylle,"(Linnaeus, 1758)",08/08/2005 13:57,-68.0514,44.3005,NA,,441982,137130,,FALSE,,,,137130
ce7abfac-3086-45d8-be52-357cfd9daf91,Cepphus grylle,"(Linnaeus, 1758)",6/23/90 12:00,-59.79985809,46.12871933,ACCD,EOR,31511,urn:lsid:marinespecies.org:taxname:137130,,FALSE,,,,137130
ce8d1d91-c7b6-4def-8757-7e7e23b8a1be,Cepphus grylle,"(Linnaeus, 1758)",1977-07-29T14:45:00,-52.3,47.3167,Canadian Wildlife Service,280,280_84409,urn:lsid:marinespecies.org:taxname:137130,,FALSE,,,,137130
ce8f263b-ad09-4c47-aeb1-b205fe122d47,Cepphus grylle,"(Linnaeus, 1758)",NA,-68.534,44.1082,USFWS,,670222,137130,,FALSE,,,,137130
ce9351c3-b268-4f7f-9e0f-9c21b6522f3e,Cepphus grylle,,,-66.14,50.05,"Canadian Wildlife Service-Atlantic, Environment Canada",,689065724_805961631_531921173,urn:lsid:marinespecies.org:taxname:137130,,FALSE,,,,137130
cf2a51c1-291e-4b27-abfd-e30a2a9c8fd1,Cepphus grylle,,,-55.98,50.34,"Canadian Wildlife Service-Atlantic, Environment Canada",,1215446144_1974088747_338931262,urn:lsid:marinespecies.org:taxname:137130,,FALSE,,,,137130
cf31564f-4543-47e4-926d-c9e7f2cb5a43,Cepphus grylle,"(Linnaeus, 1758)",NA,-67.569,44.5172,"BOEM, USFWS, NOAA, NAVY",,728403,137130,,FALSE,,,,137130
cfb87489-516c-4ce0-b967-341891c950e8,Cepphus grylle,"(Linnaeus, 1758)",06/06/1998 00:00,-64.04913,44.38377,Canadian Wildlife Service - Atlantic Region (CWS - Atlantic),,NS001336_BLGU_4904_1998-06-06_1215,urn:lsid:marinespecies.org:taxname:137130,,FALSE,,,,137130
cfd6da50-cde1-4314-ab4d-64b5a986681a,Cepphus grylle,,,-52.61,47.56,"Canadian Wildlife Service-Atlantic, Environment Canada",,1212755974_-2095286695_956270069,urn:lsid:marinespecies.org:taxname:137130,,FALSE,,,,137130
d08812e6-14e0-4013-b81a-a27fd2df815d,Cepphus grylle,"(Linnaeus, 1758)",1973-03-05T10:40:00,-57.5833,51.1,Canadian Wildlife Service,280,280_62804,urn:lsid:marinespecies.org:taxname:137130,,FALSE,,,,137130
d09215f4-5e9e-4a69-b1d8-83792ac288fc,Cepphus grylle,"(Linnaeus, 1758)",01/01/2001 00:00,-66.76968,44.58236,Canadian Wildlife Service - Atlantic Region (CWS - Atlantic),,NB000087_BLGU_5402_2001-01-01,urn:lsid:marinespecies.org:taxname:137130,,FALSE,,,,137130
d0a634e4-269c-4937-8fe0-3eb8c3e50540,Cepphus grylle,,,-53.34,46.56,"Canadian Wildlife Service-Atlantic, Environment Canada",,1427117146_-560095079_-161228412,urn:lsid:marinespecies.org:taxname:137130,,FALSE,,,,137130
d106e171-c89e-430a-af47-2dc629e24b26,Cepphus grylle,"(Linnaeus, 1758)",NA,-67.5986,44.5172,"BOEM, USFWS, NOAA, NAVY",,728408,137130,,FALSE,,,,137130
d1503915-e9ef-4778-8828-95d75f8cae0c,Cepphus grylle,,,-59.28,48.47,"Canadian Wildlife Service-Atlantic, Environment Canada",,896836590_1253764870_578083681,urn:lsid:marinespecies.org:taxname:137130,,FALSE,,,,137130
d1ce20ed-ba1f-42d0-b136-3e0aea5a4ee4,Cepphus grylle,"(Linnaeus, 1758)",8/21/78 00:00,-57.49881,54.66664,Canadian Wildlife Service - Atlantic Region (CWS - Atlantic),,NF000757_BLGU_1843_1978-08-21,urn:lsid:marinespecies.org:taxname:137130,,FALSE,,,,137130
d1e46f24-cb80-4bb8-bb6e-0480d351405d,Cepphus grylle,"(Linnaeus, 1758)",1979-07-15T18:00:00,-55.5833,50.3333,Canadian Wildlife Service,280,280_116101,urn:lsid:marinespecies.org:taxname:137130,,FALSE,,,,137130
d2042b2f-cbd8-45bb-aaa7-83ca4450dfcd,Cepphus grylle,"(Linnaeus, 1758)",1979-08-13T09:00:00,-62.5333,58.4833,Canadian Wildlife Service,280,280_118687,urn:lsid:marinespecies.org:taxname:137130,,FALSE,,,,137130
d2188125-98e5-471d-b95e-10d49281fb7a,Cepphus grylle,"(Linnaeus, 1758)",05/06/2000,-68.5,53,ICES,DOME-Biota,12135335,urn:lsid:marinespecies.org:taxname:137130,,FALSE,,,,137130
d21fd38d-d0da-428d-ae66-9fb6eda91f93,Cepphus grylle,"(Linnaeus, 1758)",1973-06-18T10:45:00,-66.7333,44.9667,Canadian Wildlife Service,280,280_63056,urn:lsid:marinespecies.org:taxname:137130,,FALSE,,,,137130
d231533f-f94f-46b5-a266-2bda5011ca33,Cepphus grylle,"(Linnaeus, 1758)",01/01/1986 00:00,-57.82865,49.93652,Canadian Wildlife Service - Atlantic Region (CWS - Atlantic),,NF000606_BLGU_1570_1986-01-01,urn:lsid:marinespecies.org:taxname:137130,,FALSE,,,,137130
d26a6829-06e9-49f3-a015-84860953f624,Cepphus grylle,"(Linnaeus, 1758)",01/01/2001 00:00,-66.84181,44.61022,Canadian Wildlife Service - Atlantic Region (CWS - Atlantic),,NB000094_BLGU_5400_2001-01-01,urn:lsid:marinespecies.org:taxname:137130,,FALSE,,,,137130
d281be7c-a3ae-4ecb-a4a8-e215720ebaf5,Cepphus grylle,"(Linnaeus, 1758)",01/01/1945 00:00,-52.79882,48.11655,Canadian Wildlife Service - Atlantic Region (CWS - Atlantic),,NF000456_BLGU_1079_1945-01-01,urn:lsid:marinespecies.org:taxname:137130,,FALSE,,,,137130
d294422b-9f5b-438d-a1a4-1862129d9edd,Cepphus grylle,,,-61.72,47.02,"Canadian Wildlife Service-Atlantic, Environment Canada",,-1933920140_1438942879_-256796067,urn:lsid:marinespecies.org:taxname:137130,,FALSE,,,,137130
d2aeaccf-2f88-49c0-bacf-0383f296af98,Cepphus grylle,"(Linnaeus, 1758)",1980-05-19T10:55:00,-55.2167,46.95,Canadian Wildlife Service,280,280_126049,urn:lsid:marinespecies.org:taxname:137130,,FALSE,,,,137130
d2af6682-9d02-40c7-ad65-33c064fba317,Cepphus grylle,"(Linnaeus, 1758)",07/09/2007 00:00,-61.26128,46.35939,Canadian Wildlife Service - Atlantic Region (CWS - Atlantic),,NS001348_BLGU_12612_2007-07-09,urn:lsid:marinespecies.org:taxname:137130,,FALSE,,,,137130
d2b00028-8424-49f3-8269-f5f037864a2c,Cepphus grylle,"(Linnaeus, 1758)",8/21/78 00:00,-57.47658,54.66995,Canadian Wildlife Service - Atlantic Region (CWS - Atlantic),,NF000758_BLGU_1842_1978-08-21,urn:lsid:marinespecies.org:taxname:137130,,FALSE,,,,137130
d2ded798-e28f-481b-8167-b4829a6f2767,Cepphus grylle,"(Linnaeus, 1758)",1989-07-25T12:00:00Z,-66.70659637,44.62926865,ACCD,EOR,31446,urn:lsid:marinespecies.org:taxname:137130,,FALSE,,,,137130
d30c160b-46f1-47fb-bc68-1fedd2ccc75b,Cepphus grylle,"(Linnaeus, 1758)",08/06/1989 12:00,-67.10142517,44.50217056,ACCD,EOR,31425,urn:lsid:marinespecies.org:taxname:137130,,FALSE,,,,137130
d326e431-2ccd-4b83-9a2b-4a08c4b3b2d0,Cepphus grylle,"(Linnaeus, 1758)",6/21/01 00:00,-55.70397,50.22051,Canadian Wildlife Service - Atlantic Region (CWS - Atlantic),,NF002701_BLGU_5813_2001-06-21,urn:lsid:marinespecies.org:taxname:137130,,FALSE,,,,137130
d356b643-a86e-4ece-ade8-b681512e61be,Cepphus grylle,"(Linnaeus, 1758)",01/01/1988 00:00,-53.17636,49.75877,Canadian Wildlife Service - Atlantic Region (CWS - Atlantic),,NF001089_BLGU_1400_1988-01-01,urn:lsid:marinespecies.org:taxname:137130,,FALSE,,,,137130
d373e0fe-bf74-4dc4-a4f0-fe12dcf31d15,Cepphus grylle,"(Linnaeus, 1758)",1973-03-06T14:10:00,-59.0833,50.0167,Canadian Wildlife Service,280,280_62814,urn:lsid:marinespecies.org:taxname:137130,,FALSE,,,,137130
d3bd639c-cb1f-4d7f-ab94-e68d33bc1074,Cepphus grylle,"(Linnaeus, 1758)",7/30/06 09:50,-68.1636,44.3359,NA,,5303,137130,,FALSE,,,,137130
d3ef0a44-3a2a-4f2b-a58d-0eafcaf7448d,Cepphus grylle,"(Linnaeus, 1758)",07/05/2005 00:00,-52.671,47.534,Canadian Wildlife Service - Atlantic Region (CWS - Atlantic),,NF000351_BLGU_12524_2005-07-05,urn:lsid:marinespecies.org:taxname:137130,,FALSE,,,,137130
d41dd471-2c47-49a9-8bee-51bda0022279,Cepphus grylle,"(Linnaeus, 1758)",06/06/1990 12:00,-61.26250076,46.35813141,ACCD,EOR,31490,urn:lsid:marinespecies.org:taxname:137130,,FALSE,,,,137130
d440cc67-fe75-4a3b-8ab6-922aa8071e82,Cepphus grylle,"(Linnaeus, 1758)",1980-11-12T13:15:00,-52.5667,47.4667,Canadian Wildlife Service,280,280_136602,urn:lsid:marinespecies.org:taxname:137130,,FALSE,,,,137130
d4735872-c9aa-4a21-81fa-af298777bf93,Cepphus grylle,"(Linnaeus, 1758)",01/01/1975 00:00,-54.81298,47.24344,Canadian Wildlife Service - Atlantic Region (CWS - Atlantic),,NF000293_BLGU_814_1975-01-01,urn:lsid:marinespecies.org:taxname:137130,,FALSE,,,,137130
d4b10631-fce7-4eae-90d4-f18904632da0,Cepphus grylle,"(Linnaeus, 1758)",07/07/2015 00:00,-52.81397,47.18734,Canadian Wildlife Service - Atlantic Region (CWS - Atlantic),,NF000279_BLGU_12565_2015-07-07,urn:lsid:marinespecies.org:taxname:137130,,FALSE,,,,137130
d4e6c228-3cf7-4cf5-a12b-63755858dbd3,Cepphus grylle,"(Linnaeus, 1758)",6/20/00,-68.5,53,ICES,DOME-Biota,12135376,urn:lsid:marinespecies.org:taxname:137130,,FALSE,,,,137130
d5025148-d699-43f5-84b0-b6699fe78345,Cepphus grylle,,,-58.53,48.92,"Canadian Wildlife Service-Atlantic, Environment Canada",,896836590_577730056_-1995260009,urn:lsid:marinespecies.org:taxname:137130,,FALSE,,,,137130
d518bfd7-7419-416e-ae03-437d0574761d,Cepphus grylle,"(Linnaeus, 1758)",6/18/16 00:00,-65.32009,43.57018,Canadian Wildlife Service - Atlantic Region (CWS - Atlantic),,NS002198_BLGU_13279_2016-06-18,urn:lsid:marinespecies.org:taxname:137130,,FALSE,,,,137130
d5196396-1891-4dc6-abc9-876a03e3acfe,Cepphus grylle,"(Linnaeus, 1758)",1980-08-27T14:20:00,-61.35,56.9333,Canadian Wildlife Service,280,280_134175,urn:lsid:marinespecies.org:taxname:137130,,FALSE,,,,137130
d52c856e-be8d-49e0-ab64-1a6761268fb7,Cepphus grylle,"(Linnaeus, 1758)",8/13/78 00:00,-61.13224,56.25003,Canadian Wildlife Service - Atlantic Region (CWS - Atlantic),,NF000937_BLGU_2073_1978-08-13,urn:lsid:marinespecies.org:taxname:137130,,FALSE,,,,137130
d5534865-11ec-4f67-92ac-9caa831cd2e9,Cepphus grylle,"(Linnaeus, 1758)",8/13/78 00:00,-61.44892,56.38337,Canadian Wildlife Service - Atlantic Region (CWS - Atlantic),,NF000975_BLGU_2120_1978-08-13,urn:lsid:marinespecies.org:taxname:137130,,FALSE,,,,137130
d55d123b-dc8a-4c8b-9696-659e1e19e4c2,Cepphus grylle,"(Linnaeus, 1758)",01/01/1975 00:00,-54.50384,49.64323,Canadian Wildlife Service - Atlantic Region (CWS - Atlantic),,NF000578_BLGU_1363_1975-01-01,urn:lsid:marinespecies.org:taxname:137130,,FALSE,,,,137130
d59a9269-deac-4efd-867f-c31abb1b68b5,Cepphus grylle,"(Linnaeus, 1758)",7/27/07 00:00,-59.8132,46.17216,Canadian Wildlife Service - Atlantic Region (CWS - Atlantic),,NS003222_BLGU_12176_2007-07-27,urn:lsid:marinespecies.org:taxname:137130,,FALSE,,,,137130
d5ac3e28-c5b8-4ec8-abdc-1dd9e8e30916,Cepphus grylle,"(Linnaeus, 1758)",07/01/2006 13:28,-68.0742,44.3289,NA,,4530,137130,,FALSE,,,,137130
d5e31a4d-0f28-4690-870f-ad5f77f92927,Cepphus grylle,"(Linnaeus, 1758)",1979-08-29T08:30:00,-61.4,56.2667,Canadian Wildlife Service,280,280_121060,urn:lsid:marinespecies.org:taxname:137130,,FALSE,,,,137130
d5f7fcfa-56d2-4b23-9060-8a38b76442c4,Cepphus grylle,"(Linnaeus, 1758)",07/02/1971 12:00,-59.96403885,45.90000153,ACCD,EOR,31754,urn:lsid:marinespecies.org:taxname:137130,,FALSE,,,,137130
d621484b-9d8b-46c2-b1eb-f07976400790,Cepphus grylle,"(Linnaeus, 1758)",7/29/07 00:00,-56.53213,53.93329,Canadian Wildlife Service - Atlantic Region (CWS - Atlantic),,NF000706_BLGU_12578_2007-07-29,urn:lsid:marinespecies.org:taxname:137130,,FALSE,,,,137130
d6470cdf-bdd1-4e2d-913c-c0a3dbdc3f02,Cepphus grylle,,,-65.87,48.01,"Canadian Wildlife Service-Atlantic, Environment Canada",,-635145613_-1407643040_312980930,urn:lsid:marinespecies.org:taxname:137130,,FALSE,,,,137130
d6c2be96-f6ac-4336-9d2b-39b0dd413982,Cepphus grylle,"(Linnaeus, 1758)",05/06/2000,-68.5,53,ICES,DOME-Biota,12135343,urn:lsid:marinespecies.org:taxname:137130,,FALSE,,,,137130
d6d434cc-ecad-45c8-b00c-ac991a770698,Cepphus grylle,"(Linnaeus, 1758)",7/31/05 15:43,-68.0105,44.1989,NA,,441520,137130,,FALSE,,,,137130
d6ea84ab-518e-4211-a8f5-8078ffc18f46,Cepphus grylle,"(Linnaeus, 1758)",1981-02-18T04:50:00,-54.5,47.3333,Canadian Wildlife Service,280,280_139045,urn:lsid:marinespecies.org:taxname:137130,,FALSE,,,,137130
d6eb6fbd-35c6-4cd6-a812-c489d23334bd,Cepphus grylle,"(Linnaeus, 1758)",01/01/1975 00:00,-54.11604,49.82013,Canadian Wildlife Service - Atlantic Region (CWS - Atlantic),,NF000597_BLGU_1535_1975-01-01,urn:lsid:marinespecies.org:taxname:137130,,FALSE,,,,137130
d6eec916-1326-407e-a1b7-021091520056,Cepphus grylle,"(Linnaeus, 1758)",1973-07-02T12:00:00Z,-66.69255447,44.63250542,ACCD,EOR,31777,urn:lsid:marinespecies.org:taxname:137130,,FALSE,,,,137130
d7286603-7eb5-44e5-8e4d-197ec065c02a,Cepphus grylle,"(Linnaeus, 1758)",NA,-70.27,41.6005,USFWS,,698138,137130,,FALSE,,,,137130
d73b231c-093b-456d-8c77-3281711b06c8,Cepphus grylle,"(Linnaeus, 1758)",06/02/2014 00:00,-65.98543,43.50578,Canadian Wildlife Service - Atlantic Region (CWS - Atlantic),,NS001411_BLGU_12485_2014-06-02,urn:lsid:marinespecies.org:taxname:137130,,FALSE,,,,137130
d7985036-225c-46fa-87f6-a9d201ab18c1,Cepphus grylle,"(Linnaeus, 1758)",1979-08-27T13:40:00,-61.45,57.1667,Canadian Wildlife Service,280,280_120930,urn:lsid:marinespecies.org:taxname:137130,,FALSE,,,,137130
d80319ec-33d0-4353-b890-5a6dd71b8825,Cepphus grylle,"(Linnaeus, 1758)",07/04/1986 00:00,-64.04225,47.00021,Canadian Wildlife Service - Atlantic Region (CWS - Atlantic),,PE002191_BLGU_3438_1986-07-04,urn:lsid:marinespecies.org:taxname:137130,,FALSE,,,,137130
d80ee6c7-1a44-4dbd-b557-dfeac6f0fba1,Cepphus grylle,"(Linnaeus, 1758)",6/21/79 12:00,-65.34829712,47.75526047,ACCD,EOR,31415,urn:lsid:marinespecies.org:taxname:137130,,FALSE,,,,137130
d81435b3-b8f5-406b-8bc6-f6a87843e33f,Cepphus grylle,"(Linnaeus, 1758)",08/06/1978 00:00,-62.31945,57.95736,Canadian Wildlife Service - Atlantic Region (CWS - Atlantic),,NF001049_BLGU_2206_1978-08-06,urn:lsid:marinespecies.org:taxname:137130,,FALSE,,,,137130
d831816b-0437-48cc-928b-6c2855f464b5,Cepphus grylle,,,-65.23,49.32,"Canadian Wildlife Service-Atlantic, Environment Canada",,-801551520_-1939936270_-667087698,urn:lsid:marinespecies.org:taxname:137130,,FALSE,,,,137130
d839b3c2-304f-4321-aa59-6827fecc61ff,Cepphus grylle,,,-65.32,43.72,"Canadian Wildlife Service-Atlantic, Environment Canada",,1361835644_-1475097759_-1305052291,urn:lsid:marinespecies.org:taxname:137130,,FALSE,,,,137130
d843defb-30d3-4ac6-a035-f34c70842435,Cepphus grylle,"(Linnaeus, 1758)",01/01/1971 00:00,-60.11323,45.76701,Canadian Wildlife Service - Atlantic Region (CWS - Atlantic),,NS001355_BLGU_3036_1971-01-01,urn:lsid:marinespecies.org:taxname:137130,,FALSE,,,,137130
d847fd56-d962-4fea-b6c7-d70910e3cdb5,Cepphus grylle,"(Linnaeus, 1758)",1980-11-12T14:50:00,-52.4833,47.4333,Canadian Wildlife Service,280,280_136611,urn:lsid:marinespecies.org:taxname:137130,,FALSE,,,,137130
d888b463-79a0-4d2a-aa2c-6663b2adff4d,Cepphus grylle,"(Linnaeus, 1758)",01/01/1971 00:00,-60.06687,45.81714,Canadian Wildlife Service - Atlantic Region (CWS - Atlantic),,NS001357_BLGU_3051_1971-01-01,urn:lsid:marinespecies.org:taxname:137130,,FALSE,,,,137130
d88cf8c4-5ff8-4641-9b76-b69935f6f826,Cepphus grylle,"(Linnaeus, 1758)",1972-09-02T12:00:00,-67.05,44.0833,Canadian Wildlife Service,280,280_60197,urn:lsid:marinespecies.org:taxname:137130,,FALSE,,,,137130
d8c296f2-6f8c-4c56-83b3-f872ca5e7ab8,Cepphus grylle,"(Linnaeus, 1758)",1987-08-16T12:00:00Z,-66.90989685,44.90929031,ACCD,EOR,31431,urn:lsid:marinespecies.org:taxname:137130,,FALSE,,,,137130
d8dbb8f6-ab78-4637-958d-e47455bc70c6,Cepphus grylle,,,-58.41,49.24,"Canadian Wildlife Service-Atlantic, Environment Canada",,896836590_-1824578635_681594426,urn:lsid:marinespecies.org:taxname:137130,,FALSE,,,,137130
d8e88731-760d-4d45-b448-581b4447413c,Cepphus grylle,"(Linnaeus, 1758)",01/01/1997 00:00,-54.04883,49.48989,Canadian Wildlife Service - Atlantic Region (CWS - Atlantic),,NF000535_BLGU_5330_1997-01-01,urn:lsid:marinespecies.org:taxname:137130,,FALSE,,,,137130
d8fccb7e-dfca-40dd-86f5-84914e77e432,Cepphus grylle,,,-64.66,49.98,"Canadian Wildlife Service-Atlantic, Environment Canada",,-1636689528_-1546033855_1688934491,urn:lsid:marinespecies.org:taxname:137130,,FALSE,,,,137130
d922460f-f3a3-42a3-b4aa-b609d7514331,Cepphus grylle,,,-58.4,49.26,"Canadian Wildlife Service-Atlantic, Environment Canada",,896836590_-445160925_-1903371220,urn:lsid:marinespecies.org:taxname:137130,,FALSE,,,,137130
d94cd8a0-f610-45c5-bd39-ab5a1a745188,Cepphus grylle,"(Linnaeus, 1758)",7/21/90 12:00,-60.58391953,46.95695114,ACCD,EOR,31496,urn:lsid:marinespecies.org:taxname:137130,,FALSE,,,,137130
d96c88f2-abcf-4354-884d-9922e2c88dfb,Cepphus grylle,"(Linnaeus, 1758)",1979-08-11T16:10:00,-62.0333,57.5667,Canadian Wildlife Service,280,280_118407,urn:lsid:marinespecies.org:taxname:137130,,FALSE,,,,137130
d97e26f7-aee2-4cf6-b8c8-917fb3d27855,Cepphus grylle,"(Linnaeus, 1758)",1973-03-02T15:50:00,-61.5833,49.9,Canadian Wildlife Service,280,280_62778,urn:lsid:marinespecies.org:taxname:137130,,FALSE,,,,137130
d99bf9d3-49da-44d7-ad02-8257e2cc4cda,Cepphus grylle,"(Linnaeus, 1758)",5/24/80 12:00,-60.06687164,45.81713867,ACCD,EOR,31759,urn:lsid:marinespecies.org:taxname:137130,,FALSE,,,,137130
d9a649c8-1661-46b3-8a06-b98c336ca714,Cepphus grylle,,,-63.8,48.81,"Canadian Wildlife Service-Atlantic, Environment Canada",,1421648014_-1760694280_-1946831306,urn:lsid:marinespecies.org:taxname:137130,,FALSE,,,,137130
d9b0ad7a-7c18-4998-a189-4e89a72a5510,Cepphus grylle,"(Linnaeus, 1758)",6/21/06 14:12,-68.0416,44.2273,NA,,4402,137130,,FALSE,,,,137130
d9dafbf1-ae8b-4fe4-a436-3b05d47a01b6,Cepphus grylle,"(Linnaeus, 1758)",1973-02-20T09:45:00,-61.05,45.4,Canadian Wildlife Service,280,280_62597,urn:lsid:marinespecies.org:taxname:137130,,FALSE,,,,137130
d9df392d-f228-432f-964c-408fd136d2c2,Cepphus grylle,"(Linnaeus, 1758)",1974-07-23T13:55:00,-58,58.7833,Canadian Wildlife Service,280,280_65118,urn:lsid:marinespecies.org:taxname:137130,,FALSE,,,,137130
da0b7ae3-ebca-4889-b997-f2fe7d5b02a3,Cepphus grylle,"(Linnaeus, 1758)",08/06/2006 11:49,-68.1033,44.3353,NA,,6599,137130,,FALSE,,,,137130
da105610-28c9-473f-8d03-7db1a459dbbf,Cepphus grylle,"(Linnaeus, 1758)",1979-08-14T06:45:00,-59.1333,55.2833,Canadian Wildlife Service,280,280_118830,urn:lsid:marinespecies.org:taxname:137130,,FALSE,,,,137130
da7c3545-fc45-45f9-be97-c072ff4ca05c,Cepphus grylle,,,-61.72,47.31,"Canadian Wildlife Service-Atlantic, Environment Canada",,-1933920140_-710018418_842719102,urn:lsid:marinespecies.org:taxname:137130,,FALSE,,,,137130
da7d702c-62f2-4457-9162-067c61cfbf6b,Cepphus grylle,"(Linnaeus, 1758)",1973-02-15T15:20:00,-61.1833,45.4667,Canadian Wildlife Service,280,280_62301,urn:lsid:marinespecies.org:taxname:137130,,FALSE,,,,137130
da993485-180e-42ca-8617-5294ebf6028f,Cepphus grylle,"(Linnaeus, 1758)",07/02/1971 12:00,-59.77175903,46.18024826,ACCD,EOR,31749,urn:lsid:marinespecies.org:taxname:137130,,FALSE,,,,137130
daa06748-72ed-4ffa-bc56-85712b3dab8b,Cepphus grylle,"(Linnaeus, 1758)",07/02/2010 00:00,-62.66122,45.95926,Canadian Wildlife Service - Atlantic Region (CWS - Atlantic),,PE002620_BLGU_11912_2010-07-02,urn:lsid:marinespecies.org:taxname:137130,,FALSE,,,,137130
daaa2abb-bdaf-4fe8-bab1-1e726688007c,Cepphus grylle,"(Linnaeus, 1758)",1981-02-15T12:10:00,-57.3333,47.5,Canadian Wildlife Service,280,280_138797,urn:lsid:marinespecies.org:taxname:137130,,FALSE,,,,137130
dac0e7b6-4933-4eca-9c8d-a05574a13829,Cepphus grylle,,,-58.45,49.22,"Canadian Wildlife Service-Atlantic, Environment Canada",,896836590_1989142049_-1323545238,urn:lsid:marinespecies.org:taxname:137130,,FALSE,,,,137130
dae52b24-d735-40f7-9f40-3a1553dc8934,Cepphus grylle,"(Linnaeus, 1758)",1980-08-29T16:20:00,-61.4,56.2667,Canadian Wildlife Service,280,280_134434,urn:lsid:marinespecies.org:taxname:137130,,FALSE,,,,137130
db21cc40-554b-410e-a0d4-6c19b9568b11,Cepphus grylle,"(Linnaeus, 1758)",1977-08-05T11:50:00,-67.5333,59.2833,Canadian Wildlife Service,280,280_85238,urn:lsid:marinespecies.org:taxname:137130,,FALSE,,,,137130
db3492b0-f48e-4222-bb3b-1ccfdbd8d0d9,Cepphus grylle,"(Linnaeus, 1758)",1971-07-02T12:00:00Z,-59.66574097,46.03327942,ACCD,EOR,31750,urn:lsid:marinespecies.org:taxname:137130,,FALSE,,,,137130
db5d048c-81c0-4622-9334-6cece5ee1e36,Cepphus grylle,"(Linnaeus, 1758)",01/01/1984 00:00,-53.01551,47.54488,Canadian Wildlife Service - Atlantic Region (CWS - Atlantic),,NF000357_BLGU_960_1984-01-01,urn:lsid:marinespecies.org:taxname:137130,,FALSE,,,,137130
db6eb7fd-c753-4d34-ab5a-7239e9ea6bf2,Cepphus grylle,,,-65.47,47.96,"Canadian Wildlife Service-Atlantic, Environment Canada",,1421648014_-1994679938_-133436325,urn:lsid:marinespecies.org:taxname:137130,,FALSE,,,,137130
db78fcc6-fb85-439a-8b21-ea8ccbb918c9,Cepphus grylle,"(Linnaeus, 1758)",01/01/1984 00:00,-54.04883,49.48989,Canadian Wildlife Service - Atlantic Region (CWS - Atlantic),,NF000535_BLGU_1294_1984-01-01,urn:lsid:marinespecies.org:taxname:137130,,FALSE,,,,137130
db8aee81-fed3-4438-b27c-bd9cdcc69414,Cepphus grylle,"(Linnaeus, 1758)",1979-08-17T16:00:00,-63.2,59.1333,Canadian Wildlife Service,280,280_119578,urn:lsid:marinespecies.org:taxname:137130,,FALSE,,,,137130
dba04abe-6b91-4d0a-9f6b-4faf5e2b2ffd,Cepphus grylle,"(Linnaeus, 1758)",8/15/78 00:00,-58.18216,54.96665,Canadian Wildlife Service - Atlantic Region (CWS - Atlantic),,NF000776_BLGU_1865_1978-08-15,urn:lsid:marinespecies.org:taxname:137130,,FALSE,,,,137130
dbabf627-47df-438a-b851-41836041f4c7,Cepphus grylle,"(Linnaeus, 1758)",8/21/78 00:00,-57.19881,54.54997,Canadian Wildlife Service - Atlantic Region (CWS - Atlantic),,NF000754_BLGU_1838_1978-08-21,urn:lsid:marinespecies.org:taxname:137130,,FALSE,,,,137130
dbb3288e-f8a8-4881-88a0-b73fdea9ff6f,Cepphus grylle,"(Linnaeus, 1758)",7/30/06 13:42,-68.0184,44.3397,NA,,5304,137130,,FALSE,,,,137130
dbce012b-4460-4f66-aa9a-672025920896,Cepphus grylle,"(Linnaeus, 1758)",07/02/2010 00:00,-66.87169,44.99206,Canadian Wildlife Service - Atlantic Region (CWS - Atlantic),,NB002496_BLGU_11926_2010-07-02,urn:lsid:marinespecies.org:taxname:137130,,FALSE,,,,137130
dbfec671-47a5-4ac9-9e8c-5d5cb0346cbb,Cepphus grylle,"(Linnaeus, 1758)",1979-08-11T12:25:00,-61.45,57.1667,Canadian Wildlife Service,280,280_118350,urn:lsid:marinespecies.org:taxname:137130,,FALSE,,,,137130
dc7d834b-b87e-4577-95fc-cba23cb49b88,Cepphus grylle,,,-61.74,44.71,"Canadian Wildlife Service-Atlantic, Environment Canada",,1239289189_-1128183542_1635270216,urn:lsid:marinespecies.org:taxname:137130,,FALSE,,,,137130
dd0970a1-5cfd-4aa0-9c49-d43d64a7ba57,Cepphus grylle,"(Linnaeus, 1758)",1979-08-14T15:45:00,-62.9833,58.4667,Canadian Wildlife Service,280,280_118887,urn:lsid:marinespecies.org:taxname:137130,,FALSE,,,,137130
dd4773d1-1766-4753-886e-3aba1e8afffe,Cepphus grylle,"(Linnaeus, 1758)",1992-07-08T12:00:00Z,-66.90527344,44.59878922,ACCD,EOR,31407,urn:lsid:marinespecies.org:taxname:137130,,FALSE,,,,137130
dd7e11f4-955c-4ea4-a04f-2af87fa64b41,Cepphus grylle,,,-65.32,43.73,"Canadian Wildlife Service-Atlantic, Environment Canada",,1361835644_-1428486039_-1346997024,urn:lsid:marinespecies.org:taxname:137130,,FALSE,,,,137130
dda47577-2e7d-46f6-a048-2ff3b8b9c558,Cepphus grylle,"(Linnaeus, 1758)",01/01/1975 00:00,-54.1655,49.5399,Canadian Wildlife Service - Atlantic Region (CWS - Atlantic),,NF000551_BLGU_1321_1975-01-01,urn:lsid:marinespecies.org:taxname:137130,,FALSE,,,,137130
de06f562-515d-4f1b-a3ea-e627952f260d,Cepphus grylle,"(Linnaeus, 1758)",05/06/2000,-68.5,53,ICES,DOME-Biota,12135347,urn:lsid:marinespecies.org:taxname:137130,,FALSE,,,,137130
de0b7cb6-9163-44d8-a575-98e218f34cf2,Cepphus grylle,"(Linnaeus, 1758)",1979-08-18T13:40:00,-63.6833,59.3667,Canadian Wildlife Service,280,280_119763,urn:lsid:marinespecies.org:taxname:137130,,FALSE,,,,137130
de81dcd3-4f22-4c31-b393-143ecc0abdd9,Cepphus grylle,"(Linnaeus, 1758)",1981-02-18T07:10:00,-54,47.1667,Canadian Wildlife Service,280,280_139090,urn:lsid:marinespecies.org:taxname:137130,,FALSE,,,,137130
deb8adbe-c73e-49b6-bff9-b63fed35463b,Cepphus grylle,"(Linnaeus, 1758)",01/01/1944 00:00,-57.28224,50.89163,Canadian Wildlife Service - Atlantic Region (CWS - Atlantic),,NF000631_BLGU_1619_1944-01-01,urn:lsid:marinespecies.org:taxname:137130,,FALSE,,,,137130
def48b45-6ffa-4b3b-9928-5fe5c4be051c,Cepphus grylle,"(Linnaeus, 1758)",1973-02-20T08:40:00,-61.0833,45.4167,Canadian Wildlife Service,280,280_62581,urn:lsid:marinespecies.org:taxname:137130,,FALSE,,,,137130
df23f867-9031-42ca-9f68-efe222e94936,Cepphus grylle,"(Linnaeus, 1758)",05/06/1999,-68.5,53,ICES,DOME-Biota,12135595,urn:lsid:marinespecies.org:taxname:137130,,FALSE,,,,137130
df32dddd-f3c3-4e8a-80bd-bba635431ac9,Cepphus grylle,,,-65.31,43.67,"Canadian Wildlife Service-Atlantic, Environment Canada",,1280325370_-1867204000_617875447,urn:lsid:marinespecies.org:taxname:137130,,FALSE,,,,137130
df33cfef-c5b7-4c23-bc7e-ce399f5d7c4c,Cepphus grylle,"(Linnaeus, 1758)",1980-08-29T17:20:00,-61.3,56.3833,Canadian Wildlife Service,280,280_134444,urn:lsid:marinespecies.org:taxname:137130,,FALSE,,,,137130
dfc6ea24-3cab-499d-9776-55f533d4ada2,Cepphus grylle,"(Linnaeus, 1758)",7/26/06 10:17,-68.2191,44.1897,NA,,6003,137130,,FALSE,,,,137130
dff60cd3-028d-49f4-a3e9-eeefd31e0c4d,Cepphus grylle,"(Linnaeus, 1758)",,-70.68000031,41.50999832,Smithsonian Environmental Research Center,A Biological Survey of the Waters of Woods Hole and Vacinity,581,urn:lsid:marinespecies.org:taxname:137130,,FALSE,,,,137130
e01ecfa9-a001-4196-9bef-2144a426f02e,Cepphus grylle,"(Linnaeus, 1758)",2017-03-21T09:37:53,-71.0659,40.3447,NORMANDEAU,1817,1817_45620,urn:lsid:marinespecies.org:taxname:137130,,FALSE,,,,137130
e031e78f-9ee9-4109-a1f6-a8e298235078,Cepphus grylle,"(Linnaeus, 1758)",1971-02-26T08:50:00,-52.5833,47.55,Canadian Wildlife Service,280,280_34343,urn:lsid:marinespecies.org:taxname:137130,,FALSE,,,,137130
e03edc38-3712-4a4b-88d9-b8925e027c6e,Cepphus grylle,"(Linnaeus, 1758)",1976-05-28T12:00:00Z,-65.03027344,43.68431091,ACCD,EOR,31805,urn:lsid:marinespecies.org:taxname:137130,,FALSE,,,,137130
e0760aa2-e1da-440c-a858-cc077065020b,Cepphus grylle,"(Linnaeus, 1758)",7/25/06 00:00,-66.9969,45.14016,Canadian Wildlife Service - Atlantic Region (CWS - Atlantic),,NB002417_BLGU_11946_2006-07-25,urn:lsid:marinespecies.org:taxname:137130,,FALSE,,,,137130
e0a46860-001b-4110-8079-4e8337d192dc,Cepphus grylle,"(Linnaeus, 1758)",1979-08-27T10:45:00,-61.7333,57.6,Canadian Wildlife Service,280,280_120893,urn:lsid:marinespecies.org:taxname:137130,,FALSE,,,,137130
e0aee6e9-4b2b-4e7e-a588-1ff470ce6d71,Cepphus grylle,"(Linnaeus, 1758)",01/01/1986 00:00,-52.96551,47.63321,Canadian Wildlife Service - Atlantic Region (CWS - Atlantic),,NF000396_BLGU_1008_1986-01-01,urn:lsid:marinespecies.org:taxname:137130,,FALSE,,,,137130
e0c119f7-e6a2-4797-9321-cb688ea9b337,Cepphus grylle,"(Linnaeus, 1758)",01/01/1984 00:00,-52.86218,47.02655,Canadian Wildlife Service - Atlantic Region (CWS - Atlantic),,NF000237_BLGU_621_1984-01-01,urn:lsid:marinespecies.org:taxname:137130,,FALSE,,,,137130
e0c20e23-2700-4c04-ae5e-4189ae41c890,Cepphus grylle,"(Linnaeus, 1758)",1978-06-26T15:40:00,-55.7167,52.5167,Canadian Wildlife Service,280,280_101995,urn:lsid:marinespecies.org:taxname:137130,,FALSE,,,,137130
e0fd6b60-d4ba-49af-8177-ba8b812bc2e9,Cepphus grylle,"(Linnaeus, 1758)",8/13/78 00:00,-59.79889,55.18333,Canadian Wildlife Service - Atlantic Region (CWS - Atlantic),,NF000802_BLGU_1899_1978-08-13,urn:lsid:marinespecies.org:taxname:137130,,FALSE,,,,137130
e108dad2-4413-4208-aee5-e87e97e91c4d,Cepphus grylle,"(Linnaeus, 1758)",1986-12-16T12:00:00Z,-64.407547,44.24314117,ACCD,EOR,31460,urn:lsid:marinespecies.org:taxname:137130,,FALSE,,,,137130
e11c2c74-29fa-4be2-8b25-2309aa294164,Cepphus grylle,"(Linnaeus, 1758)",6/21/06 13:54,-68.1387,44.3109,NA,,4400,137130,,FALSE,,,,137130
e19d1952-0e35-4ee0-b357-f6f198cb544b,Cepphus grylle,"(Linnaeus, 1758)",08/07/1978 00:00,-60.99889,56.75004,Canadian Wildlife Service - Atlantic Region (CWS - Atlantic),,NF001015_BLGU_2165_1978-08-07,urn:lsid:marinespecies.org:taxname:137130,,FALSE,,,,137130
e1e7d764-ccf2-4715-9b44-a86fb6d1487e,Cepphus grylle,,,-61.56,50.1,"Canadian Wildlife Service-Atlantic, Environment Canada",,-1636689528_1716046338_-1047386104,urn:lsid:marinespecies.org:taxname:137130,,FALSE,,,,137130
e1ff75b7-c82d-48c1-88af-e8cd54290c85,Cepphus grylle,,,-64.81,49.76,"Canadian Wildlife Service-Atlantic, Environment Canada",,689065724_-1339955327_-898700788,urn:lsid:marinespecies.org:taxname:137130,,FALSE,,,,137130
e20f5a6f-3d1b-4d89-b08a-a8ead638d4c5,Cepphus grylle,,,-61.49,50.11,"Canadian Wildlife Service-Atlantic, Environment Canada",,-1636689528_1186902223_-1795020652,urn:lsid:marinespecies.org:taxname:137130,,FALSE,,,,137130
e228044d-3e5c-415d-b5f6-bf403bc1995f,Cepphus grylle,,,-64.59,49.72,"Canadian Wildlife Service-Atlantic, Environment Canada",,689065724_-1039950974_-754820343,urn:lsid:marinespecies.org:taxname:137130,,FALSE,,,,137130
e2291602-38b9-4cb2-85e8-eff444120eb9,Cepphus grylle,"(Linnaeus, 1758)",7/14/08 00:00,-56.16562,46.81991,Canadian Wildlife Service - Atlantic Region (CWS - Atlantic),,NF000195_BLGU_12505_2008-07-14,urn:lsid:marinespecies.org:taxname:137130,,FALSE,,,,137130
e248f767-0bfb-42bc-826f-7d7ff5107150,Cepphus grylle,"(Linnaeus, 1758)",7/14/10 00:00,-62.4535,46.01162,Canadian Wildlife Service - Atlantic Region (CWS - Atlantic),,PE002622_BLGU_11914_2010-07-14,urn:lsid:marinespecies.org:taxname:137130,,FALSE,,,,137130
e25a8518-2f4e-4d0f-ad66-0acb422c3a48,Cepphus grylle,"(Linnaeus, 1758)",07/04/2005 15:40,-68.103,44.3436,NA,,440339,137130,,FALSE,,,,137130
e25ae404-4912-4ce3-9ab4-82a13f740543,Cepphus grylle,,,-65.54,47.97,"Canadian Wildlife Service-Atlantic, Environment Canada",,-635145613_847021817_-1844062483,urn:lsid:marinespecies.org:taxname:137130,,FALSE,,,,137130
e28dd3fc-5c40-4c24-ab77-4df1cdb390d3,Cepphus grylle,,,-65.48,47.96,"Canadian Wildlife Service-Atlantic, Environment Canada",,-635145613_-623167742_-371371886,urn:lsid:marinespecies.org:taxname:137130,,FALSE,,,,137130
e2be3075-f9b6-4434-8244-a2daa20d9418,Cepphus grylle,,,-61.71,47.31,"Canadian Wildlife Service-Atlantic, Environment Canada",,202524170_-1175891983_1152797784,urn:lsid:marinespecies.org:taxname:137130,,FALSE,,,,137130
e2d5368a-2674-4b83-b549-98a20ca33f73,Cepphus grylle,"(Linnaeus, 1758)",1973-03-06T08:50:00,-58.5667,50.2333,Canadian Wildlife Service,280,280_62811,urn:lsid:marinespecies.org:taxname:137130,,FALSE,,,,137130
e3091439-896e-4479-ae04-8df0f490ea78,Cepphus grylle,"(Linnaeus, 1758)",07/12/2005 09:09,-67.9227,44.3385,NA,,440820,137130,,FALSE,,,,137130
e3154c55-553d-4ff3-9f7c-755481a33835,Cepphus grylle,"(Linnaeus, 1758)",7/31/05 19:22,-68.0504,44.2887,NA,,441118,137130,,FALSE,,,,137130
e3176f73-d602-4bb5-a440-4ebff4fb471a,Cepphus grylle,"(Linnaeus, 1758)",05/06/1999,-68.5,53,ICES,DOME-Biota,12135604,urn:lsid:marinespecies.org:taxname:137130,,FALSE,,,,137130
e32eb134-75aa-435c-a758-42b874f3b50b,Cepphus grylle,,,-58.76,48.88,"Canadian Wildlife Service-Atlantic, Environment Canada",,896836590_-559121376_645680889,urn:lsid:marinespecies.org:taxname:137130,,FALSE,,,,137130
e330506d-10e2-4c54-b634-33f7ca763300,Cepphus grylle,"(Linnaeus, 1758)",8/16/90 12:00,-60.31938934,46.81330872,ACCD,EOR,31505,urn:lsid:marinespecies.org:taxname:137130,,FALSE,,,,137130
e351437b-e5d8-491a-828c-976cb5fac902,Cepphus grylle,"(Linnaeus, 1758)",01/01/2001 00:00,-66.89897,44.59779,Canadian Wildlife Service - Atlantic Region (CWS - Atlantic),,NB000090_BLGU_5404_2001-01-01,urn:lsid:marinespecies.org:taxname:137130,,FALSE,,,,137130
e36c1587-2fa7-4c98-9e11-24697aa96274,Cepphus grylle,"(Linnaeus, 1758)",1979-08-25T12:05:00,-58.8833,55.2833,Canadian Wildlife Service,280,280_120671,urn:lsid:marinespecies.org:taxname:137130,,FALSE,,,,137130
e378026b-6b51-404c-9710-70e4db84451f,Cepphus grylle,"(Linnaeus, 1758)",01/01/1979 00:00,-54.19889,46.83323,Canadian Wildlife Service - Atlantic Region (CWS - Atlantic),,NF000198_BLGU_436_1979-01-01,urn:lsid:marinespecies.org:taxname:137130,,FALSE,,,,137130
e3c4ff17-2f52-48c2-a263-5f953c5845c4,Cepphus grylle,"(Linnaeus, 1758)",2001-07-02T12:00:00Z,-66.78392792,44.79959869,ACCD,EOR,31771,urn:lsid:marinespecies.org:taxname:137130,,FALSE,,,,137130
e3f5e656-f34b-4782-a5f2-ca6105c82354,Cepphus grylle,"(Linnaeus, 1758)",07/03/1986 00:00,-63.9756,46.87932,Canadian Wildlife Service - Atlantic Region (CWS - Atlantic),,PE002189_BLGU_3437_1986-07-03,urn:lsid:marinespecies.org:taxname:137130,,FALSE,,,,137130
e404105f-7ab6-4a73-adf6-42a4f15ab017,Cepphus grylle,"(Linnaeus, 1758)",07/08/2005 09:24,-67.8655,44.3563,NA,,440573,137130,,FALSE,,,,137130
e4307945-485c-4c73-8cfd-e4f6b3740e63,Cepphus grylle,"(Linnaeus, 1758)",07/08/2005 09:24,-67.859,44.3612,NA,,440578,137130,,FALSE,,,,137130
e44a8382-ec6e-4ae4-b814-92145e023d2b,Cepphus grylle,"(Linnaeus, 1758)",1986-06-21T12:00:00Z,-62.33567047,46.30559921,ACCD,EOR,31484,urn:lsid:marinespecies.org:taxname:137130,,FALSE,,,,137130
e44bcf1c-25ce-4aef-acae-1b2c57cec0e5,Cepphus grylle,"(Linnaeus, 1758)",08/07/1978 00:00,-61.31557,56.5667,Canadian Wildlife Service - Atlantic Region (CWS - Atlantic),,NF000993_BLGU_2142_1978-08-07,urn:lsid:marinespecies.org:taxname:137130,,FALSE,,,,137130
e48d2c5a-c28b-4e75-88e4-1510efa6c9e3,Cepphus grylle,"(Linnaeus, 1758)",7/26/06 10:12,-68.195,44.2196,NA,,6001,137130,,FALSE,,,,137130
e4b14874-a379-4bab-b54f-6a8d54ab93cc,Cepphus grylle,"(Linnaeus, 1758)",7/15/06 18:14,-68.0516,44.3269,NA,,5437,137130,,FALSE,,,,137130
e4e90f3a-a3b7-44ae-9a96-c2106e56d5ad,Cepphus grylle,,,-59.77,50.1,"Canadian Wildlife Service-Atlantic, Environment Canada",,792082018_1121705007_362655845,urn:lsid:marinespecies.org:taxname:137130,,FALSE,,,,137130
e500cd14-895c-40c3-9075-47ee5369cfb9,Cepphus grylle,"(Linnaeus, 1758)",1973-03-03T14:25:00,-60.8667,49.9,Canadian Wildlife Service,280,280_62787,urn:lsid:marinespecies.org:taxname:137130,,FALSE,,,,137130
e51fc47a-f1ad-444e-a246-7b2375d01963,Cepphus grylle,"(Linnaeus, 1758)",6/23/14 00:00,-55.57673,46.88861,Canadian Wildlife Service - Atlantic Region (CWS - Atlantic),,NF002899_BLGU_12491_2014-06-23,urn:lsid:marinespecies.org:taxname:137130,,FALSE,,,,137130
e54ada7a-4057-445c-a67b-b07ce9968ec0,Cepphus grylle,"(Linnaeus, 1758)",NA,-69.966,41.4425,USFWS,,680378,137130,,FALSE,,,,137130
e56a8a59-d6a5-4737-998d-fd3603f3dade,Cepphus grylle,,,-64.59,48.22,"Canadian Wildlife Service-Atlantic, Environment Canada",,689065724_-1435385300_1178423895,urn:lsid:marinespecies.org:taxname:137130,,FALSE,,,,137130
e5757d8d-52ee-4878-b14b-d0ab69fc49f5,Cepphus grylle,"(Linnaeus, 1758)",08/07/1978 00:00,-60.78221,56.68337,Canadian Wildlife Service - Atlantic Region (CWS - Atlantic),,NF001007_BLGU_2153_1978-08-07,urn:lsid:marinespecies.org:taxname:137130,,FALSE,,,,137130
e5820578-912a-4eda-907a-fc619f4e4add,Cepphus grylle,"(Linnaeus, 1758)",7/14/15 00:00,-55.6158,46.86926,Canadian Wildlife Service - Atlantic Region (CWS - Atlantic),,NF000212_BLGU_13153_2015-07-14,urn:lsid:marinespecies.org:taxname:137130,,FALSE,,,,137130
e5946b67-ff58-4119-bb10-e96bbcf7a95f,Cepphus grylle,"(Linnaeus, 1758)",1979-08-18T13:50:00,-63.7167,59.3667,Canadian Wildlife Service,280,280_119764,urn:lsid:marinespecies.org:taxname:137130,,FALSE,,,,137130
e5b2c0ef-d2bd-4e64-8080-c919465f16b1,Cepphus grylle,"(Linnaeus, 1758)",07/07/2006 00:00,-59.99478,45.87219,Canadian Wildlife Service - Atlantic Region (CWS - Atlantic),,NS001324_BLGU_12078_2006-07-07,urn:lsid:marinespecies.org:taxname:137130,,FALSE,,,,137130
e5cde4f0-955a-4b24-af1a-251dedbb1953,Cepphus grylle,,,-64.9,49.3,"Canadian Wildlife Service-Atlantic, Environment Canada",,-801551520_134390991_2125580245,urn:lsid:marinespecies.org:taxname:137130,,FALSE,,,,137130
e61c4e61-3188-4133-b0b7-5b60983352f5,Cepphus grylle,,,-61.57,50.1,"Canadian Wildlife Service-Atlantic, Environment Canada",,-1636689528_279088037_630209411,urn:lsid:marinespecies.org:taxname:137130,,FALSE,,,,137130
e6341f7e-19b4-4ac3-ad36-924d0532063c,Cepphus grylle,"(Linnaeus, 1758)",,-66.8666687,44.98332977,ACCD,EOR,31400,urn:lsid:marinespecies.org:taxname:137130,,FALSE,,,,137130
e65e5db5-e1fc-4c8f-a2a2-53205f184237,Cepphus grylle,,,-63.51,59.34,"Canadian Wildlife Service-Atlantic, Environment Canada",,1409356886_1862319639_854085149,urn:lsid:marinespecies.org:taxname:137130,,FALSE,,,,137130
e65f328a-dd97-44d4-a798-0a9e843f99c7,Cepphus grylle,"(Linnaeus, 1758)",09/07/2005 12:03,-68.1582,44.331,NA,,443164,137130,,FALSE,,,,137130
e6ddf818-2663-4034-904a-053614dbc1f5,Cepphus grylle,"(Linnaeus, 1758)",NA,-67.8224,44.4422,USFWS,,670615,137130,,FALSE,,,,137130
e700fe1e-8311-49f1-821f-7f2892cf630d,Cepphus grylle,"(Linnaeus, 1758)",1980-07-17T05:55:00,-52.5833,47.4667,Canadian Wildlife Service,280,280_129120,urn:lsid:marinespecies.org:taxname:137130,,FALSE,,,,137130
e76401df-b7b2-42a9-a2b7-0e1d1327be47,Cepphus grylle,"(Linnaeus, 1758)",1979-08-04T16:15:00,-57.3167,54.7,Canadian Wildlife Service,280,280_117628,urn:lsid:marinespecies.org:taxname:137130,,FALSE,,,,137130
e7c9c20e-ddb0-473b-b915-395eab63986e,Cepphus grylle,"(Linnaeus, 1758)",05/01/2002 00:00,-61.5426,45.10182,Canadian Wildlife Service - Atlantic Region (CWS - Atlantic),,NS002232_BLGU_9902_2002-05-01,urn:lsid:marinespecies.org:taxname:137130,,FALSE,,,,137130
e7cae8a2-b628-4701-872b-118d367d0bd2,Cepphus grylle,,,-65.5,43.27,"Canadian Wildlife Service-Atlantic, Environment Canada",,1361835644_-609311442_1805278487,urn:lsid:marinespecies.org:taxname:137130,,FALSE,,,,137130
e7d38614-eee8-4836-b163-314c7542b03d,Cepphus grylle,"(Linnaeus, 1758)",1990-08-12T12:00:00Z,-60.45996094,46.99935913,ACCD,EOR,31498,urn:lsid:marinespecies.org:taxname:137130,,FALSE,,,,137130
e807823a-c0c0-4721-b534-17b16194addd,Cepphus grylle,"(Linnaeus, 1758)",5/28/76 00:00,-65.03027,43.68431,Canadian Wildlife Service - Atlantic Region (CWS - Atlantic),,NS001323_BLGU_2320_1976-05-28,urn:lsid:marinespecies.org:taxname:137130,,FALSE,,,,137130
e8114a15-b8f7-47da-9aa5-b4864343263c,Cepphus grylle,"(Linnaeus, 1758)",1987-09-02T12:00:00Z,-60.40792847,46.67055893,ACCD,EOR,31494,urn:lsid:marinespecies.org:taxname:137130,,FALSE,,,,137130
e8258b09-e07c-4fa2-9483-d7087fd690ec,Cepphus grylle,"(Linnaeus, 1758)",NA,-68.3555,44.1838,USFWS,,699442,137130,,FALSE,,,,137130
e829d764-6fad-432f-bd69-ecc929505f7f,Cepphus grylle,"(Linnaeus, 1758)",01/01/1980 00:00,-53.62555,46.64322,Canadian Wildlife Service - Atlantic Region (CWS - Atlantic),,NF000178_BLGU_298_1980-01-01,urn:lsid:marinespecies.org:taxname:137130,,FALSE,,,,137130
e881fd0f-9955-4013-b95a-5f3193fa3c1b,Cepphus grylle,"(Linnaeus, 1758)",8/13/06 17:09,-68.127,44.3487,NA,,6938,137130,,FALSE,,,,137130
e8baf89e-f341-4575-b5f0-7d62696c251d,Cepphus grylle,"(Linnaeus, 1758)",07/05/1988 00:00,-60.37579,46.38324,Canadian Wildlife Service - Atlantic Region (CWS - Atlantic),,NS001109_BLGU_3193_1988-07-05,urn:lsid:marinespecies.org:taxname:137130,,FALSE,,,,137130
e8c7e64a-67f9-46fc-b2e3-e8fe758c218c,Cepphus grylle,"(Linnaeus, 1758)",NA,-68.5948,44.1083,USFWS,,670229,137130,,FALSE,,,,137130
e8e84734-74dc-4ec3-aeb9-54f7068c97d9,Cepphus grylle,"(Linnaeus, 1758)",1979-08-27T10:15:00,-61.8333,57.6667,Canadian Wildlife Service,280,280_120888,urn:lsid:marinespecies.org:taxname:137130,,FALSE,,,,137130
e8eba166-7e88-4680-b754-69ba9372a971,Cepphus grylle,"(Linnaeus, 1758)",01/01/1971 00:00,-59.66196,46.03854,Canadian Wildlife Service - Atlantic Region (CWS - Atlantic),,NS001251_BLGU_3120_1971-01-01,urn:lsid:marinespecies.org:taxname:137130,,FALSE,,,,137130
e8ebd61d-89d9-43b1-9876-abce55488026,Cepphus grylle,,,-64.4,48.84,"Canadian Wildlife Service-Atlantic, Environment Canada",,58439636_-1036002882_1076393656,urn:lsid:marinespecies.org:taxname:137130,,FALSE,,,,137130
e8eeb219-efea-4e0f-872e-256e6d0e9aef,Cepphus grylle,,,-55.89,50.27,"Canadian Wildlife Service-Atlantic, Environment Canada",,1278617075_-239155459_771381619,urn:lsid:marinespecies.org:taxname:137130,,FALSE,,,,137130
e920f639-e936-4ef1-85ed-0563a21f2eb3,Cepphus grylle,"(Linnaeus, 1758)",07/08/2008 00:00,-62.55621,45.81521,Canadian Wildlife Service - Atlantic Region (CWS - Atlantic),,NS001389_BLGU_11791_2008-07-08,urn:lsid:marinespecies.org:taxname:137130,,FALSE,,,,137130
e934c728-bc8a-4736-a593-2a22d4214039,Cepphus grylle,,,-58.56,48.87,"Canadian Wildlife Service-Atlantic, Environment Canada",,896836590_-896630458_-1261488263,urn:lsid:marinespecies.org:taxname:137130,,FALSE,,,,137130
e939f65a-3da4-4f2b-9e53-fbea64efee71,Cepphus grylle,"(Linnaeus, 1758)",1988-07-05T12:00:00Z,-60.3768692,46.36740875,ACCD,EOR,31733,urn:lsid:marinespecies.org:taxname:137130,,FALSE,,,,137130
e9444e3b-b75c-4a44-8e87-3189d15fac16,Cepphus grylle,"(Linnaeus, 1758)",1979-08-18T12:20:00,-63.6,59.35,Canadian Wildlife Service,280,280_119752,urn:lsid:marinespecies.org:taxname:137130,,FALSE,,,,137130
e94e2ec4-0f81-461c-a244-88176b795997,Cepphus grylle,,,-66.39,50.01,"Canadian Wildlife Service-Atlantic, Environment Canada",,58439636_1290952587_-1036803017,urn:lsid:marinespecies.org:taxname:137130,,FALSE,,,,137130
e9574763-369b-4d5f-9226-5773d5d76e0d,Cepphus grylle,"(Linnaeus, 1758)",7/31/05 13:16,-68.1268,44.3509,NA,,441483,137130,,FALSE,,,,137130
e966c303-4cc4-41ac-9cad-c56b4657d76e,Cepphus grylle,"(Linnaeus, 1758)",NA,-69.4461,43.8598,USFWS,,670044,137130,,FALSE,,,,137130
e969050c-fcdd-41b0-852e-96b2920c9a34,Cepphus grylle,"(Linnaeus, 1758)",08/07/1978 00:00,-61.16556,56.81671,Canadian Wildlife Service - Atlantic Region (CWS - Atlantic),,NF001019_BLGU_2171_1978-08-07,urn:lsid:marinespecies.org:taxname:137130,,FALSE,,,,137130
e9a1e7c6-f2cf-4c24-9b0c-3f863efce871,Cepphus grylle,"(Linnaeus, 1758)",1989-08-13T12:00:00Z,-60.31864929,46.6970787,ACCD,EOR,31504,urn:lsid:marinespecies.org:taxname:137130,,FALSE,,,,137130
e9a5b471-3c60-4631-911b-c2e539c4df3b,Cepphus grylle,,,-55.9,53.74,"Canadian Wildlife Service-Atlantic, Environment Canada",,1436357738_-1595237412_-1432436829,urn:lsid:marinespecies.org:taxname:137130,,FALSE,,,,137130
e9b39154-7788-4fb5-be20-b6e7ec1d4e57,Cepphus grylle,"(Linnaeus, 1758)",1975-08-10T12:00:00Z,-61.98831177,45.62620163,ACCD,EOR,31761,urn:lsid:marinespecies.org:taxname:137130,,FALSE,,,,137130
e9b48ecc-a789-4b37-a164-f9f7506d7578,Cepphus grylle,"(Linnaeus, 1758)",NA,-68.9499,43.8587,USFWS,,682146,137130,,FALSE,,,,137130
e9cde7aa-9364-48c4-a1f9-1fc5b4ee4892,Cepphus grylle,"(Linnaeus, 1758)",01/01/1987 00:00,-56.38896,47.12491,Canadian Wildlife Service - Atlantic Region (CWS - Atlantic),,NF000266_BLGU_689_1987-01-01,urn:lsid:marinespecies.org:taxname:137130,,FALSE,,,,137130
e9cf85ca-296e-4954-b6ca-84350cd0761f,Cepphus grylle,"(Linnaeus, 1758)",1979-08-11T16:00:00,-62.0667,57.5333,Canadian Wildlife Service,280,280_118403,urn:lsid:marinespecies.org:taxname:137130,,FALSE,,,,137130
e9d87d2e-4ebc-4ad4-a37b-67fbc14508d4,Cepphus grylle,,,-60.95,48.3,"Canadian Wildlife Service-Atlantic, Environment Canada",,792082018_2088072554_-631316486,urn:lsid:marinespecies.org:taxname:137130,,FALSE,,,,137130
e9f96e6d-f7cc-4742-a1e1-6631efb30471,Cepphus grylle,,,-58.11,51.23,"Canadian Wildlife Service-Atlantic, Environment Canada",,-1636689528_-1335631587_1433905742,urn:lsid:marinespecies.org:taxname:137130,,FALSE,,,,137130
ea2c7592-930b-40cd-8b17-24f3e43aeb66,Cepphus grylle,"(Linnaeus, 1758)",07/09/1990 12:00,-62.50167847,46.02827072,ACCD,EOR,31479,urn:lsid:marinespecies.org:taxname:137130,,FALSE,,,,137130
ea378724-ecea-4d4a-8378-89c05e171176,Cepphus grylle,"(Linnaeus, 1758)",1979-08-04T10:45:00,-57.3,54.4167,Canadian Wildlife Service,280,280_117568,urn:lsid:marinespecies.org:taxname:137130,,FALSE,,,,137130
ea3cb2ea-1c08-4a87-bfb0-7d66abbe25f1,Cepphus grylle,"(Linnaeus, 1758)",8/16/90 12:00,-60.46910858,46.89649963,ACCD,EOR,31495,urn:lsid:marinespecies.org:taxname:137130,,FALSE,,,,137130
eacb7758-cdda-421c-8f82-35dbdc275be3,Cepphus grylle,"(Linnaeus, 1758)",1973-07-02T12:00:00Z,-66.76239777,44.61949158,ACCD,EOR,31419,urn:lsid:marinespecies.org:taxname:137130,,FALSE,,,,137130
eb38e19e-9096-4aa9-8b79-41fa92cc7504,Cepphus grylle,,,-64.12,48.73,"Canadian Wildlife Service-Atlantic, Environment Canada",,689065724_1073752314_47063440,urn:lsid:marinespecies.org:taxname:137130,,FALSE,,,,137130
eb4c8ece-b13a-42ae-9d9b-cb0069fac746,Cepphus grylle,"(Linnaeus, 1758)",05/06/1999,-68.5,53,ICES,DOME-Biota,12135594,urn:lsid:marinespecies.org:taxname:137130,,FALSE,,,,137130
eb89324e-55e0-4aae-bfb2-9ac80d0c9da1,Cepphus grylle,"(Linnaeus, 1758)",01/01/1975 00:00,-53.89549,49.56156,Canadian Wildlife Service - Atlantic Region (CWS - Atlantic),,NF000564_BLGU_1344_1975-01-01,urn:lsid:marinespecies.org:taxname:137130,,FALSE,,,,137130
eb92dbfc-24f0-4360-a669-f29d71a3f1bc,Cepphus grylle,,,-65.32,43.69,"Canadian Wildlife Service-Atlantic, Environment Canada",,1425516209_481733299_-951998864,urn:lsid:marinespecies.org:taxname:137130,,FALSE,,,,137130
eba007d1-fb88-4fa2-90fc-3bbdd30ba8fb,Cepphus grylle,"(Linnaeus, 1758)",07/02/2005 15:15,-68.2257,44.1635,NA,,439870,137130,,FALSE,,,,137130
eba94b31-f883-4404-ad22-02a8b4c27501,Cepphus grylle,"(Linnaeus, 1758)",1971-07-02T12:00:00Z,-59.96403885,45.90000153,ACCD,EOR,31754,urn:lsid:marinespecies.org:taxname:137130,,FALSE,,,,137130
ebc0c888-5fb5-4be2-a134-8726ab939bfb,Cepphus grylle,,,-63.91,50.29,"Canadian Wildlife Service-Atlantic, Environment Canada",,-1636689528_-1147544581_1186136663,urn:lsid:marinespecies.org:taxname:137130,,FALSE,,,,137130
ebc3582e-9f42-493d-ae2c-e819581a39ba,Cepphus grylle,"(Linnaeus, 1758)",01/01/1987 00:00,-56.09728,46.86158,Canadian Wildlife Service - Atlantic Region (CWS - Atlantic),,NF000210_BLGU_519_1987-01-01,urn:lsid:marinespecies.org:taxname:137130,,FALSE,,,,137130
ec1abd4a-82f6-43ca-b537-b1a5893d9cb0,Cepphus grylle,"(Linnaeus, 1758)",6/21/01 00:00,-55.80211,50.23467,Canadian Wildlife Service - Atlantic Region (CWS - Atlantic),,NF002700_BLGU_5812_2001-06-21,urn:lsid:marinespecies.org:taxname:137130,,FALSE,,,,137130
ec6d7657-7841-40ef-8156-33f075755684,Cepphus grylle,,,-64.42,48.84,"Canadian Wildlife Service-Atlantic, Environment Canada",,-487837150_460397640_-1435222038,urn:lsid:marinespecies.org:taxname:137130,,FALSE,,,,137130
ecabb437-036d-45ca-9476-258160fe5e03,Cepphus grylle,"(Linnaeus, 1758)",1979-07-16T07:45:00,-55.5167,52.35,Canadian Wildlife Service,280,280_116143,urn:lsid:marinespecies.org:taxname:137130,,FALSE,,,,137130
ecaf88a7-236b-4b33-9374-f799525d3cb8,Cepphus grylle,"(Linnaeus, 1758)",08/07/1978 00:00,-61.68222,57.65006,Canadian Wildlife Service - Atlantic Region (CWS - Atlantic),,NF001043_BLGU_2199_1978-08-07,urn:lsid:marinespecies.org:taxname:137130,,FALSE,,,,137130
ecc27dd9-8fdf-4df2-932a-81879b169c30,Cepphus grylle,"(Linnaeus, 1758)",1977-07-30T18:00:00,-58,55.85,Canadian Wildlife Service,280,280_84687,urn:lsid:marinespecies.org:taxname:137130,,FALSE,,,,137130
ecd05037-db3a-4150-acab-59512e8f0c55,Cepphus grylle,"(Linnaeus, 1758)",1978-08-05T14:00:00,-59.8333,55.45,Canadian Wildlife Service,280,280_105374,urn:lsid:marinespecies.org:taxname:137130,,FALSE,,,,137130
ecd7c882-6429-4695-b015-b4ffe529eaeb,Cepphus grylle,"(Linnaeus, 1758)",1979-08-18T11:30:00,-63.4,59.25,Canadian Wildlife Service,280,280_119735,urn:lsid:marinespecies.org:taxname:137130,,FALSE,,,,137130
ecee9592-0a9e-42be-a7ad-edf94b55ebd5,Cepphus grylle,,,-69.25,48.41,"Canadian Wildlife Service-Atlantic, Environment Canada",,1331997355_84282284_1970326632,urn:lsid:marinespecies.org:taxname:137130,,FALSE,,,,137130
ed0bfecd-8de2-4815-8c5d-86949bffcf22,Cepphus grylle,,,-61.7,47.31,"Canadian Wildlife Service-Atlantic, Environment Canada",,-749624382_643177955_1824538416,urn:lsid:marinespecies.org:taxname:137130,,FALSE,,,,137130
ed2817f7-6b0a-40e5-984f-849aab9d1eb3,Cepphus grylle,"(Linnaeus, 1758)",1975-07-29T17:15:00,-81.5,58.5833,Canadian Wildlife Service,280,280_69677,urn:lsid:marinespecies.org:taxname:137130,,FALSE,,,,137130
ed332cd8-e672-4a31-a14d-34fbccab0955,Cepphus grylle,"(Linnaeus, 1758)",1990-07-06T12:00:00Z,-65.18267822,47.81335068,ACCD,EOR,31464,urn:lsid:marinespecies.org:taxname:137130,,FALSE,,,,137130
ed6607c1-55c8-477e-9f57-2b52e793eae4,Cepphus grylle,"(Linnaeus, 1758)",1972-02-04T11:35:00,-53.3333,46.5833,Canadian Wildlife Service,280,280_55396,urn:lsid:marinespecies.org:taxname:137130,,FALSE,,,,137130
ed77f765-ad8a-4dad-857a-8c91de5ed7cf,Cepphus grylle,,,-69.3,43.83,"Canadian Wildlife Service-Atlantic, Environment Canada",,1272746530_1966666532_-629861035,urn:lsid:marinespecies.org:taxname:137130,,FALSE,,,,137130
ed8e1ce3-8ff2-449b-a992-306bd4fc0d03,Cepphus grylle,"(Linnaeus, 1758)",05/01/2006 00:00,-61.5426,45.10182,Canadian Wildlife Service - Atlantic Region (CWS - Atlantic),,NS002232_BLGU_9914_2006-05-01,urn:lsid:marinespecies.org:taxname:137130,,FALSE,,,,137130
edeb3f9a-77c2-4bd6-b383-f53c30808b14,Cepphus grylle,"(Linnaeus, 1758)",8/16/87 12:00,-66.90989685,44.90929031,ACCD,EOR,31431,urn:lsid:marinespecies.org:taxname:137130,,FALSE,,,,137130
edfd0053-4eca-4ed1-ae0d-f348cc2365c4,Cepphus grylle,"(Linnaeus, 1758)",1980-07-15T05:21:00,-51.9333,48.5,Canadian Wildlife Service,280,280_129019,urn:lsid:marinespecies.org:taxname:137130,,FALSE,,,,137130
ee108a2f-06a9-4f73-8347-3bda43db8d42,Cepphus grylle,"(Linnaeus, 1758)",07/06/2006 17:41,-68.0338,44.3394,NA,,4897,137130,,FALSE,,,,137130
ee2dcc29-643b-4f02-8c42-9844095c754e,Cepphus grylle,"(Linnaeus, 1758)",07/02/2005 15:15,-68.2266,44.1618,NA,,439869,137130,,FALSE,,,,137130
ee44226c-cd49-4b49-b84d-ca4c6bc1136d,Cepphus grylle,"(Linnaeus, 1758)",06/09/1976 00:00,-66.50797,45.10574,Canadian Wildlife Service - Atlantic Region (CWS - Atlantic),,NB000153_BLGU_229_1976-06-09,urn:lsid:marinespecies.org:taxname:137130,,FALSE,,,,137130
ee7da9bd-685c-4598-baf1-479cfae8bd44,Cepphus grylle,"(Linnaeus, 1758)",1978-01-24T10:30:00,-54.25,54.6667,Canadian Wildlife Service,280,280_94230,urn:lsid:marinespecies.org:taxname:137130,,FALSE,,,,137130
ee9082ee-e109-4279-a092-1917b6dde4be,Cepphus grylle,"(Linnaeus, 1758)",05/06/1999,-68.5,53,ICES,DOME-Biota,12135606,urn:lsid:marinespecies.org:taxname:137130,,FALSE,,,,137130
eeb5bd16-0802-4a06-be31-5f573937396c,Cepphus grylle,"(Linnaeus, 1758)",6/19/02 00:00,-58.59223,48.87078,Canadian Wildlife Service - Atlantic Region (CWS - Atlantic),,NF003056_BLGU_6491_2002-06-19,urn:lsid:marinespecies.org:taxname:137130,,FALSE,,,,137130
ef1b6d4f-6478-4764-a179-b359d21b67d6,Cepphus grylle,"(Linnaeus, 1758)",1986-06-21T12:00:00Z,-63.81055641,46.31604958,ACCD,EOR,31469,urn:lsid:marinespecies.org:taxname:137130,,FALSE,,,,137130
ef2b3044-71ef-4be9-879f-a53c99fa2b85,Cepphus grylle,"(Linnaeus, 1758)",7/31/16 00:00,-66.14861,43.63744,Canadian Wildlife Service - Atlantic Region (CWS - Atlantic),,NS001170_BLGU_13373_2016-07-31,urn:lsid:marinespecies.org:taxname:137130,,FALSE,,,,137130
ef6a6aec-fa8c-4a49-ae2d-23c3b40ed85e,Cepphus grylle,,,-62.38,44.66,"Canadian Wildlife Service-Atlantic, Environment Canada",,1404141821_1658568508_868515761,urn:lsid:marinespecies.org:taxname:137130,,FALSE,,,,137130
ef8b3e30-598d-4310-9fe5-5bffbb782032,Cepphus grylle,"(Linnaeus, 1758)",1975-07-29T16:17:00,-81.5,58.8333,Canadian Wildlife Service,280,280_69675,urn:lsid:marinespecies.org:taxname:137130,,FALSE,,,,137130
f04a38ac-de11-4bd6-95cb-fb3d5ab64ff7,Cepphus grylle,"(Linnaeus, 1758)",01/01/2001 00:00,-66.69499,44.68769,Canadian Wildlife Service - Atlantic Region (CWS - Atlantic),,NB002614_BLGU_5393_2001-01-01,urn:lsid:marinespecies.org:taxname:137130,,FALSE,,,,137130
f0766381-7206-4779-8064-9abd40c26e37,Cepphus grylle,"(Linnaeus, 1758)",5/29/84 00:00,-61.26128,46.35939,Canadian Wildlife Service - Atlantic Region (CWS - Atlantic),,NS001348_BLGU_3141_1984-05-29,urn:lsid:marinespecies.org:taxname:137130,,FALSE,,,,137130
f0880d88-fb2e-4adf-82a3-33c53d2a07dd,Cepphus grylle,"(Linnaeus, 1758)",07/02/2001 12:00,-66.84181213,44.61022186,ACCD,EOR,31784,urn:lsid:marinespecies.org:taxname:137130,,FALSE,,,,137130
f0f3cc87-d193-4560-be23-e663d9eefae7,Cepphus grylle,"(Linnaeus, 1758)",,-70.68000031,41.50999832,WoodsHoleBioSurvey,A Biological Survey of the Waters of Woods Hole and Vacinity,581,urn:lsid:marinespecies.org:taxname:137130,,FALSE,,,,137130
f121657b-b61e-48c5-94c7-a9158e43dcbd,Cepphus grylle,"(Linnaeus, 1758)",07/12/2006 18:15,-68.0466,44.3289,NA,,5252,137130,,FALSE,,,,137130
f1268986-e957-4272-854e-3476d3d80389,Cepphus grylle,,,-65.32,43.71,"Canadian Wildlife Service-Atlantic, Environment Canada",,1425516209_155418246_-1449664476,urn:lsid:marinespecies.org:taxname:137130,,FALSE,,,,137130
f14541c5-2e9f-4e66-a355-3f154b8913ab,Cepphus grylle,"(Linnaeus, 1758)",NA,-68.8814,43.8497,"BOEM, USFWS, NOAA, NAVY",,727800,137130,,FALSE,,,,137130
f1590ffe-1c40-44a9-8a02-b57ea98d06cf,Cepphus grylle,"(Linnaeus, 1758)",06/06/1990 00:00,-61.26128,46.35939,Canadian Wildlife Service - Atlantic Region (CWS - Atlantic),,NS001348_BLGU_3143_1990-06-06,urn:lsid:marinespecies.org:taxname:137130,,FALSE,,,,137130
f166ef3d-d0af-4780-a1f9-d3858b0fea69,Cepphus grylle,"(Linnaeus, 1758)",1979-07-18T08:35:00,-55.6833,53.6167,Canadian Wildlife Service,280,280_116347,urn:lsid:marinespecies.org:taxname:137130,,FALSE,,,,137130
f1695ac2-1e86-4ca9-ae5e-4f10a50de8e3,Cepphus grylle,"(Linnaeus, 1758)",6/25/05 09:33,-68.0789,44.3255,NA,,439980,137130,,FALSE,,,,137130
f179670e-3dd0-449c-84ac-b02f52c98cf9,Cepphus grylle,"(Linnaeus, 1758)",1987-07-22T06:20:00,-56.55,51.2833,Canadian Wildlife Service,280,280_200955,urn:lsid:marinespecies.org:taxname:137130,,FALSE,,,,137130
f17c9a86-e6a4-4abe-80f5-677d1846dbff,Cepphus grylle,,,-55.6,53.26,"Canadian Wildlife Service-Atlantic, Environment Canada",,1373407025_1810189065_-74503073,urn:lsid:marinespecies.org:taxname:137130,,FALSE,,,,137130
f1848abd-cc8d-47de-8d9e-0f92bf948e5f,Cepphus grylle,,,-65.23,43.61,"Canadian Wildlife Service-Atlantic, Environment Canada",,1361835644_-1923756304_1149863367,urn:lsid:marinespecies.org:taxname:137130,,FALSE,,,,137130
f1870f07-e260-43df-a6f2-569b0b0fbbb2,Cepphus grylle,"(Linnaeus, 1758)",1979-07-15T15:45:00,-55.45,50.05,Canadian Wildlife Service,280,280_116083,urn:lsid:marinespecies.org:taxname:137130,,FALSE,,,,137130
f1b011e5-2480-4a21-89ac-1841e3fed1c2,Cepphus grylle,"(Linnaeus, 1758)",6/20/01 00:00,-55.76552,50.89992,Canadian Wildlife Service - Atlantic Region (CWS - Atlantic),,NF000630_BLGU_5782_2001-06-20,urn:lsid:marinespecies.org:taxname:137130,,FALSE,,,,137130
f1f009b3-2792-4a6d-a6d4-f3ab080c76b4,Cepphus grylle,"(Linnaeus, 1758)",7/13/87 12:00,-61.30472946,46.23123169,ACCD,EOR,31487,urn:lsid:marinespecies.org:taxname:137130,,FALSE,,,,137130
f23071f0-b033-406b-a7c3-91d3c4df596e,Cepphus grylle,"(Linnaeus, 1758)",01/01/1971 00:00,-64.04913,44.38377,Canadian Wildlife Service - Atlantic Region (CWS - Atlantic),,NS001336_BLGU_2410_1971-01-01,urn:lsid:marinespecies.org:taxname:137130,,FALSE,,,,137130
f259fe2b-8637-4053-95f5-749a174eeed8,Cepphus grylle,"(Linnaeus, 1758)",NA,-67.6291,44.5163,"BOEM, USFWS, NOAA, NAVY",,728413,137130,,FALSE,,,,137130
f25fb7f3-497e-4f18-b442-c0553fdceb0e,Cepphus grylle,"(Linnaeus, 1758)",NA,-70.28333,42.06667,NA,,97269,137130,,FALSE,,,,137130
f27d4ce7-e15c-4c53-8bd0-4601ad83d056,Cepphus grylle,"(Linnaeus, 1758)",08/09/1978 00:00,-61.23225,56.2167,Canadian Wildlife Service - Atlantic Region (CWS - Atlantic),,NF000928_BLGU_2053_1978-08-09,urn:lsid:marinespecies.org:taxname:137130,,FALSE,,,,137130
f2a3e1b3-7669-4e8d-b65f-7b108d897dcf,Cepphus grylle,"(Linnaeus, 1758)",1986-08-29T12:00:00Z,-66.70130157,44.97756958,ACCD,EOR,31448,urn:lsid:marinespecies.org:taxname:137130,,FALSE,,,,137130
f2b6ed15-5483-43e6-aa37-f8372ffa96b1,Cepphus grylle,,,-58.05,51.24,"Canadian Wildlife Service-Atlantic, Environment Canada",,-1636689528_-1877656885_378209207,urn:lsid:marinespecies.org:taxname:137130,,FALSE,,,,137130
f2e923c7-385d-468a-a138-d9b342a8e903,Cepphus grylle,"(Linnaeus, 1758)",1971-05-18T12:40:00,-63.4833,48.45,Canadian Wildlife Service,280,280_37277,urn:lsid:marinespecies.org:taxname:137130,,FALSE,,,,137130
f357fd02-d7f5-47ce-b4b8-c67b94c098a9,Cepphus grylle,"(Linnaeus, 1758)",1979-08-22T13:30:00,-62.6,58.1833,Canadian Wildlife Service,280,280_120278,urn:lsid:marinespecies.org:taxname:137130,,FALSE,,,,137130
f3c0679a-3740-41db-b217-178dc51c4498,Cepphus grylle,"(Linnaeus, 1758)",1969-04-26T09:00:00,-66.7667,44.9167,Canadian Wildlife Service,280,280_2029,urn:lsid:marinespecies.org:taxname:137130,,FALSE,,,,137130
f3cd427b-9827-4c33-ba74-88ccb2b16faf,Cepphus grylle,,,-64.12,48.06,"Canadian Wildlife Service-Atlantic, Environment Canada",,-1636689528_872533413_282533434,urn:lsid:marinespecies.org:taxname:137130,,FALSE,,,,137130
f3e1510c-4c5c-4444-80f7-f4e0d57fa455,Cepphus grylle,"(Linnaeus, 1758)",,-66.8666687,44.98332977,ACCD,EOR,31400,urn:lsid:marinespecies.org:taxname:137130,,FALSE,,,,137130
f4359ed2-d2f5-4b89-b553-94100add03f8,Cepphus grylle,"(Linnaeus, 1758)",1979-08-29T16:00:00,-61.4333,56.25,Canadian Wildlife Service,280,280_121094,urn:lsid:marinespecies.org:taxname:137130,,FALSE,,,,137130
f46264d6-50de-473d-812a-ee90dd6748b2,Cepphus grylle,"(Linnaeus, 1758)",08/10/1978 00:00,-60.29889,55.78335,Canadian Wildlife Service - Atlantic Region (CWS - Atlantic),,NF000894_BLGU_1994_1978-08-10,urn:lsid:marinespecies.org:taxname:137130,,FALSE,,,,137130
f480fbf5-50bd-41b7-80e6-ac31b145e867,Cepphus grylle,,,-64.78,49.34,"Canadian Wildlife Service-Atlantic, Environment Canada",,-801551520_1347151546_1529487907,urn:lsid:marinespecies.org:taxname:137130,,FALSE,,,,137130
f49eff4d-ff13-4bef-bb1a-afae806e5f35,Cepphus grylle,"(Linnaeus, 1758)",7/14/10 00:00,-66.13016,47.98963,Canadian Wildlife Service - Atlantic Region (CWS - Atlantic),,NB003378_BLGU_11977_2010-07-14,urn:lsid:marinespecies.org:taxname:137130,,FALSE,,,,137130
f4db2ba7-ad73-43cb-a0f5-bbf25723ca00,Cepphus grylle,,,-63.43,44.44,"Canadian Wildlife Service-Atlantic, Environment Canada",,-1339166790_-1612615465_1861942960,urn:lsid:marinespecies.org:taxname:137130,,FALSE,,,,137130
f4e2c0fc-e02c-4437-8236-b716ec11c458,Cepphus grylle,"(Linnaeus, 1758)",5/27/03 00:00,-53.16533,47.73679,Canadian Wildlife Service - Atlantic Region (CWS - Atlantic),,NF002930_BLGU_9610_2003-05-27,urn:lsid:marinespecies.org:taxname:137130,,FALSE,,,,137130
f508b5ce-6d7c-49af-92c2-0f18359b70ee,Cepphus grylle,"(Linnaeus, 1758)",01/01/1982 00:00,-52.79882,48.11655,Canadian Wildlife Service - Atlantic Region (CWS - Atlantic),,NF000456_BLGU_1080_1982-01-01,urn:lsid:marinespecies.org:taxname:137130,,FALSE,,,,137130
f511b59a-1d61-4a5f-a24a-441e59e67fd5,Cepphus grylle,"(Linnaeus, 1758)",NA,-68.9304,43.8495,USFWS,,699141,137130,,FALSE,,,,137130
f52d526e-d975-4b29-ac8f-d241aedb470c,Cepphus grylle,"(Linnaeus, 1758)",1981-02-18T05:10:00,-54.5,47.3333,Canadian Wildlife Service,280,280_139049,urn:lsid:marinespecies.org:taxname:137130,,FALSE,,,,137130
f53711fc-449c-4898-a64b-3bc3e02882c8,Cepphus grylle,"(Linnaeus, 1758)",01/01/1944 00:00,-57.1036,50.92273,Canadian Wildlife Service - Atlantic Region (CWS - Atlantic),,NF002632_BLGU_1622_1944-01-01,urn:lsid:marinespecies.org:taxname:137130,,FALSE,,,,137130
f574f8f1-3765-4387-990a-49872c3e503b,Cepphus grylle,"(Linnaeus, 1758)",NA,-68.359,44.1082,USFWS,,670347,137130,,FALSE,,,,137130
f5b866d4-1b3b-4386-8d71-1e59486abade,Cepphus grylle,"(Linnaeus, 1758)",6/19/05 09:47,-67.8606,44.3578,NA,,439476,137130,,FALSE,,,,137130
f6524069-bc61-4dc2-acc7-f416bda81efa,Cepphus grylle,"(Linnaeus, 1758)",1977-09-17T18:00:00,-66.7667,44.9167,Canadian Wildlife Service,280,280_90300,urn:lsid:marinespecies.org:taxname:137130,,FALSE,,,,137130
f683e1eb-c8c5-44cf-98b9-693c8996552c,Cepphus grylle,,,-58.74,48.49,"Canadian Wildlife Service-Atlantic, Environment Canada",,896836590_-490045101_-167453026,urn:lsid:marinespecies.org:taxname:137130,,FALSE,,,,137130
f6970f0b-0d73-4b6e-8e06-0cff77a375f4,Cepphus grylle,"(Linnaeus, 1758)",1983-07-05T17:55:00,-54.1167,53.1333,Canadian Wildlife Service,280,280_164593,urn:lsid:marinespecies.org:taxname:137130,,FALSE,,,,137130
f6a7688a-1295-495d-be6c-a3eab57a3c0e,Cepphus grylle,,,-58.43,49.23,"Canadian Wildlife Service-Atlantic, Environment Canada",,896836590_-1326465160_-1011296636,urn:lsid:marinespecies.org:taxname:137130,,FALSE,,,,137130
f6cbd967-e96c-4932-bcf8-b199e34adf2a,Cepphus grylle,"(Linnaeus, 1758)",8/19/05 11:42,-68.0193,44.2551,NA,,442285,137130,,FALSE,,,,137130
f70710bd-3c8c-4a90-9784-837d8d6f6e66,Cepphus grylle,"(Linnaeus, 1758)",1987-06-05T12:00:00Z,-66.73302841,44.95199394,ACCD,EOR,31769,urn:lsid:marinespecies.org:taxname:137130,,FALSE,,,,137130
f7166c4f-66cb-49f3-a7d2-a4c2ee4e8c36,Cepphus grylle,"(Linnaeus, 1758)",1983-07-06T08:50:00,-56.0833,55.7167,Canadian Wildlife Service,280,280_164706,urn:lsid:marinespecies.org:taxname:137130,,FALSE,,,,137130
f71d8b9a-7dd0-4d89-91f5-44708832ae6e,Cepphus grylle,"(Linnaeus, 1758)",1981-02-15T13:40:00,-57.3333,47.5,Canadian Wildlife Service,280,280_138818,urn:lsid:marinespecies.org:taxname:137130,,FALSE,,,,137130
f7270c0a-249c-4170-86fb-f2be930035ef,Cepphus grylle,"(Linnaeus, 1758)",08/06/2006 08:55,-68.0338,44.3393,NA,,6593,137130,,FALSE,,,,137130
f72c763b-4616-4ac6-bf66-631dcbb4c92b,Cepphus grylle,,,-53.53,46.55,"Canadian Wildlife Service-Atlantic, Environment Canada",,1427117146_740371451_-417841888,urn:lsid:marinespecies.org:taxname:137130,,FALSE,,,,137130
f75d0adc-43bb-4ca7-b6b4-04ca7d6a460a,Cepphus grylle,"(Linnaeus, 1758)",07/02/2001 12:00,-66.78392792,44.79959869,ACCD,EOR,31771,urn:lsid:marinespecies.org:taxname:137130,,FALSE,,,,137130
f7d12dc9-c7a6-470d-9e79-85b7b6c1a9d4,Cepphus grylle,"(Linnaeus, 1758)",08/07/1978 00:00,-61.29889,57.20005,Canadian Wildlife Service - Atlantic Region (CWS - Atlantic),,NF001029_BLGU_2182_1978-08-07,urn:lsid:marinespecies.org:taxname:137130,,FALSE,,,,137130
f7fc232b-e5de-4b96-839c-fc6bd7dd3171,Cepphus grylle,"(Linnaeus, 1758)",07/05/1988 12:00,-66.02554321,43.65013885,ACCD,EOR,31456,urn:lsid:marinespecies.org:taxname:137130,,FALSE,,,,137130
f8077d7f-4a62-4a0f-a00f-8d6d33ac9c4f,Cepphus grylle,"(Linnaeus, 1758)",01/01/1986 00:00,-52.83718,47.19155,Canadian Wildlife Service - Atlantic Region (CWS - Atlantic),,NF000282_BLGU_765_1986-01-01,urn:lsid:marinespecies.org:taxname:137130,,FALSE,,,,137130
f80ed1c7-5e14-45aa-94e2-629352a2d8c7,Cepphus grylle,"(Linnaeus, 1758)",1978-06-25T11:20:00,-55.75,51.05,Canadian Wildlife Service,280,280_101820,urn:lsid:marinespecies.org:taxname:137130,,FALSE,,,,137130
f81f8a09-7250-41e6-a064-708a5fa06143,Cepphus grylle,,,-64.1,47.97,"Canadian Wildlife Service-Atlantic, Environment Canada",,-1636689528_-2077277234_223067943,urn:lsid:marinespecies.org:taxname:137130,,FALSE,,,,137130
f83f2dd6-a451-4062-91b2-28e2efa0a8de,Cepphus grylle,"(Linnaeus, 1758)",1973-02-20T12:25:00,-60.9833,45.45,Canadian Wildlife Service,280,280_62620,urn:lsid:marinespecies.org:taxname:137130,,FALSE,,,,137130
f8b5d6b9-3c9b-4243-874c-e22d8a6f33e4,Cepphus grylle,"(Linnaeus, 1758)",NA,-68.1456,44.4445,USFWS,,670576,137130,,FALSE,,,,137130
f8fbce1e-46ef-47dd-8b6c-b86e9aa578c1,Cepphus grylle,"(Linnaeus, 1758)",1979-08-27T11:00:00,-61.6833,57.5833,Canadian Wildlife Service,280,280_120895,urn:lsid:marinespecies.org:taxname:137130,,FALSE,,,,137130
f90d50bc-ca7a-4fc9-9d00-917cee54f1c4,Cepphus grylle,"(Linnaeus, 1758)",1979-08-25T11:15:00,-59.0667,55.15,Canadian Wildlife Service,280,280_120661,urn:lsid:marinespecies.org:taxname:137130,,FALSE,,,,137130
f911190f-7e27-477d-9057-37b922d35346,Cepphus grylle,"(Linnaeus, 1758)",01/01/1983 00:00,-56.53213,53.99995,Canadian Wildlife Service - Atlantic Region (CWS - Atlantic),,NF000710_BLGU_1773_1983-01-01,urn:lsid:marinespecies.org:taxname:137130,,FALSE,,,,137130
f9111a36-fc40-4d28-afad-bb09f0566aa4,Cepphus grylle,"(Linnaeus, 1758)",05/06/1999,-68.5,53,ICES,DOME-Biota,12135602,urn:lsid:marinespecies.org:taxname:137130,,FALSE,,,,137130
f92096ad-410e-4db6-86e4-3a3beae5613e,Cepphus grylle,,,-52.6,47.55,"Canadian Wildlife Service-Atlantic, Environment Canada",,1201195787_-346424835_-58038228,urn:lsid:marinespecies.org:taxname:137130,,FALSE,,,,137130
f9297637-cebe-496c-bb48-3fb9a08c43e8,Cepphus grylle,"(Linnaeus, 1758)",6/23/10 00:00,-62.27892,44.86835,Canadian Wildlife Service - Atlantic Region (CWS - Atlantic),,NS001200_BLGU_12144_2010-06-23,urn:lsid:marinespecies.org:taxname:137130,,FALSE,,,,137130
f9784fe4-c132-4c56-b3ff-cd9211488035,Cepphus grylle,"(Linnaeus, 1758)",1990-08-21T12:00:00Z,-66.79517365,44.65367126,ACCD,EOR,31442,urn:lsid:marinespecies.org:taxname:137130,,FALSE,,,,137130
f9a64dc8-f81b-4819-a273-8ba865015094,Cepphus grylle,,,-58.83,51,"Canadian Wildlife Service-Atlantic, Environment Canada",,-1636689528_-870438984_2069763695,urn:lsid:marinespecies.org:taxname:137130,,FALSE,,,,137130
f9b1d0a9-fec3-4854-8bde-2cb1555cd6c4,Cepphus grylle,"(Linnaeus, 1758)",01/01/2001 00:00,-66.83263,44.6167,Canadian Wildlife Service - Atlantic Region (CWS - Atlantic),,NB002442_BLGU_5397_2001-01-01,urn:lsid:marinespecies.org:taxname:137130,,FALSE,,,,137130
fa29a614-e4f4-41a2-ba2a-e1a9aa69fca2,Cepphus grylle,"(Linnaeus, 1758)",1987-07-02T12:00:00Z,-66.75833511,44.58510399,ACCD,EOR,31424,urn:lsid:marinespecies.org:taxname:137130,,FALSE,,,,137130
fa31aa8d-fcab-4486-8b08-d258eaca12bd,Cepphus grylle,"(Linnaeus, 1758)",8/14/78 00:00,-58.89885,55.06666,Canadian Wildlife Service - Atlantic Region (CWS - Atlantic),,NF000791_BLGU_1885_1978-08-14,urn:lsid:marinespecies.org:taxname:137130,,FALSE,,,,137130
fa482f8f-4bc9-4386-8c76-ab7185468975,Cepphus grylle,"(Linnaeus, 1758)",6/21/00 12:00,-61.25893021,46.36706161,ACCD,EOR,31744,urn:lsid:marinespecies.org:taxname:137130,,FALSE,,,,137130
fa50ec6a-88e5-4629-a4ad-1bb096df7416,Cepphus grylle,"(Linnaeus, 1758)",2001-07-02T12:00:00Z,-64.04988861,44.3838501,ACCD,EOR,31803,urn:lsid:marinespecies.org:taxname:137130,,FALSE,,,,137130
fa5f6104-8d03-43df-a11e-947dbee8f055,Cepphus grylle,"(Linnaeus, 1758)",6/20/00,-68.5,53,ICES,DOME-Biota,12135381,urn:lsid:marinespecies.org:taxname:137130,,FALSE,,,,137130
fa8e19a0-7941-4ee6-af54-1c5f701f6284,Cepphus grylle,"(Linnaeus, 1758)",7/13/15 00:00,-55.62205,46.85772,Canadian Wildlife Service - Atlantic Region (CWS - Atlantic),,NF000208_BLGU_13161_2015-07-13,urn:lsid:marinespecies.org:taxname:137130,,FALSE,,,,137130
faa0a9ec-a4b8-4d05-968c-10479d8a7168,Cepphus grylle,"(Linnaeus, 1758)",1969-05-31T10:30:00,-59.2,48.4,Canadian Wildlife Service,280,280_6846,urn:lsid:marinespecies.org:taxname:137130,,FALSE,,,,137130
fac2f835-c94e-4cd9-8353-a04019e86fec,Cepphus grylle,"(Linnaeus, 1758)",6/21/01 00:00,-55.8452,50.2168,Canadian Wildlife Service - Atlantic Region (CWS - Atlantic),,NF002699_BLGU_5810_2001-06-21,urn:lsid:marinespecies.org:taxname:137130,,FALSE,,,,137130
face0881-242d-4ba9-9cf8-d9c5caf8ee69,Cepphus grylle,,,-61.74,49.86,"Canadian Wildlife Service-Atlantic, Environment Canada",,1421648014_-1801436776_-341621931,urn:lsid:marinespecies.org:taxname:137130,,FALSE,,,,137130
faedc820-9e59-4166-91fa-6ce5b64c3431,Cepphus grylle,"(Linnaeus, 1758)",,-65.80601556,44.97985204,Huntsman Marine Science Centre - Atlantic Reference Centre (ARC),BOFSL,Cepphus grylle,urn:lsid:marinespecies.org:taxname:137130,,FALSE,,,,137130
fb78f8a7-6908-4f81-96ce-8fcd83692c49,Cepphus grylle,"(Linnaeus, 1758)",8/13/06 17:14,-68.104,44.3119,NA,,6939,137130,,FALSE,,,,137130
fb7dfa7b-ece8-47b7-a1c6-624ef465fe4c,Cepphus grylle,"(Linnaeus, 1758)",NA,-67.5403,44.5167,"BOEM, USFWS, NOAA, NAVY",,728438,137130,,FALSE,,,,137130
fbe25dad-e35b-4af6-ad23-227691e9cfdf,Cepphus grylle,,,-53.62,48.17,"Canadian Wildlife Service-Atlantic, Environment Canada",,1427117146_-1538086341_-818352544,urn:lsid:marinespecies.org:taxname:137130,,FALSE,,,,137130
fc0ab09c-72d0-4f85-96a1-e5af4acf4d2c,Cepphus grylle,,,-66.16,49.23,"Canadian Wildlife Service-Atlantic, Environment Canada",,792082018_-714694472_-43835905,urn:lsid:marinespecies.org:taxname:137130,,FALSE,,,,137130
fc62dd1a-d3b0-479b-aa73-6b1a96d82420,Cepphus grylle,"(Linnaeus, 1758)",07/02/1973 12:00,-66.76629639,44.58356094,ACCD,EOR,31418,urn:lsid:marinespecies.org:taxname:137130,,FALSE,,,,137130
fc63ac1c-03a0-4947-8381-14de7babc19b,Cepphus grylle,"(Linnaeus, 1758)",1977-04-24T20:15:00,-52.6,49.9667,Canadian Wildlife Service,280,280_81110,urn:lsid:marinespecies.org:taxname:137130,,FALSE,,,,137130
fc6964ae-6563-4b83-846d-8750b088faf4,Cepphus grylle,"(Linnaeus, 1758)",1969-07-23T10:10:00,-55.2167,50.95,Canadian Wildlife Service,280,280_14991,urn:lsid:marinespecies.org:taxname:137130,,FALSE,,,,137130
fc84d20f-314a-435b-be3b-28477b4690c8,Cepphus grylle,"(Linnaeus, 1758)",7/23/07 00:00,-66.02681,43.66829,Canadian Wildlife Service - Atlantic Region (CWS - Atlantic),,NS003487_BLGU_12050_2007-07-23,urn:lsid:marinespecies.org:taxname:137130,,FALSE,,,,137130
fca07a9e-5333-4134-9705-81eb1f4cb702,Cepphus grylle,,,-61.65,50.08,"Canadian Wildlife Service-Atlantic, Environment Canada",,-1636689528_-1940974357_1221096711,urn:lsid:marinespecies.org:taxname:137130,,FALSE,,,,137130
fce0425c-ca66-41f6-9630-ceb427feb176,Cepphus grylle,"(Linnaeus, 1758)",1979-08-14T07:15:00,-59.2333,55.25,Canadian Wildlife Service,280,280_118839,urn:lsid:marinespecies.org:taxname:137130,,FALSE,,,,137130
fd119771-b89f-4bbe-acf6-116cf5d48c23,Cepphus grylle,"(Linnaeus, 1758)",6/21/05 13:41,-68.1887,44.2199,NA,,439637,137130,,FALSE,,,,137130
fd234f9c-8710-4842-a888-281ac518f88b,Cepphus grylle,"(Linnaeus, 1758)",8/21/90 12:00,-66.79517365,44.65367126,ACCD,EOR,31442,urn:lsid:marinespecies.org:taxname:137130,,FALSE,,,,137130
fd3767ad-3b7d-4f04-9bf7-4062c32b1d6b,Cepphus grylle,"(Linnaeus, 1758)",6/23/14 00:00,-55.6158,46.86926,Canadian Wildlife Service - Atlantic Region (CWS - Atlantic),,NF000212_BLGU_12497_2014-06-23,urn:lsid:marinespecies.org:taxname:137130,,FALSE,,,,137130
fd5d13fb-246a-4699-b2b7-435fab9e1d43,Cepphus grylle,"(Linnaeus, 1758)",1974-08-08T13:00:00,-55.0333,52.7667,Canadian Wildlife Service,280,280_66422,urn:lsid:marinespecies.org:taxname:137130,,FALSE,,,,137130
fd7ffe06-c9da-4eb3-b93a-ae4048d1b0fc,Cepphus grylle,"(Linnaeus, 1758)",07/02/2000 00:00,-61.53245163,45.06666183,ACCD,EOR,31768,urn:lsid:marinespecies.org:taxname:137130,,FALSE,,,,137130
fd92e875-8000-48d4-bda8-73ce8ac534a6,Cepphus grylle,"(Linnaeus, 1758)",07/02/1971 12:00,-59.79444885,45.96278,ACCD,EOR,31752,urn:lsid:marinespecies.org:taxname:137130,,FALSE,,,,137130
fd9b1f79-dcbf-4e91-935d-324a2221d0a8,Cepphus grylle,,,-65.51,47.97,"Canadian Wildlife Service-Atlantic, Environment Canada",,-635145613_-453006569_1279832336,urn:lsid:marinespecies.org:taxname:137130,,FALSE,,,,137130
fda6e600-05af-4ca9-99db-60fae2a2e4d4,Cepphus grylle,,,-61.84,47.36,"Canadian Wildlife Service-Atlantic, Environment Canada",,-1933920140_-77378327_-1848996723,urn:lsid:marinespecies.org:taxname:137130,,FALSE,,,,137130
fdc4d1f4-ca64-4f58-820b-630ecfa6e405,Cepphus grylle,"(Linnaeus, 1758)",06/11/2008 00:00,-62.49221,44.83054,Canadian Wildlife Service - Atlantic Region (CWS - Atlantic),,NS003155_BLGU_11774_2008-06-11,urn:lsid:marinespecies.org:taxname:137130,,FALSE,,,,137130
fddf3b51-7eff-46c5-950d-ebd2c9dfe341,Cepphus grylle,,,-61.8,47.35,"Canadian Wildlife Service-Atlantic, Environment Canada",,-1933920140_-520600441_-846282817,urn:lsid:marinespecies.org:taxname:137130,,FALSE,,,,137130
fdf8a699-c392-45aa-8141-199f05bc3575,Cepphus grylle,"(Linnaeus, 1758)",7/22/05 09:30,-68.2345,44.1475,NA,,440925,137130,,FALSE,,,,137130
fe33865f-ddc0-4276-913c-a8fd9ad2f2a0,Cepphus grylle,"(Linnaeus, 1758)",01/01/1979 00:00,-52.81397,47.18734,Canadian Wildlife Service - Atlantic Region (CWS - Atlantic),,NF000279_BLGU_740_1979-01-01,urn:lsid:marinespecies.org:taxname:137130,,FALSE,,,,137130
fe6797b0-8dbd-401e-97ec-a4566bf7ab13,Cepphus grylle,"(Linnaeus, 1758)",1987-06-11T12:00:00Z,-59.82984924,45.95544815,ACCD,EOR,31509,urn:lsid:marinespecies.org:taxname:137130,,FALSE,,,,137130
fe76dcac-650c-4c05-b7b2-3ab580b297ca,Cepphus grylle,"(Linnaeus, 1758)",1969-08-13T10:40:00,-55.5,51.9333,Canadian Wildlife Service,280,280_18290,urn:lsid:marinespecies.org:taxname:137130,,FALSE,,,,137130
fe7a2dff-8cd6-4f15-8a14-7bade5db814c,Cepphus grylle,"(Linnaeus, 1758)",1979-08-11T13:15:00,-61.5667,57.2667,Canadian Wildlife Service,280,280_118352,urn:lsid:marinespecies.org:taxname:137130,,FALSE,,,,137130
ff21a6bf-3346-41fb-8b51-ac58a4d801b5,Cepphus grylle,"(Linnaeus, 1758)",1973-03-06T08:30:00,-58.5333,50.25,Canadian Wildlife Service,280,280_62809,urn:lsid:marinespecies.org:taxname:137130,,FALSE,,,,137130
ff3ec3c6-325b-4b6a-96c7-f31d4a5c7070,Cepphus grylle,,,-59.03,48.36,"Canadian Wildlife Service-Atlantic, Environment Canada",,896836590_-309468170_-613438722,urn:lsid:marinespecies.org:taxname:137130,,FALSE,,,,137130
ff7b8476-6078-42f8-83c9-d194f07ccd70,Cepphus grylle,"(Linnaeus, 1758)",6/20/12 00:00,-52.7804,47.23832,Canadian Wildlife Service - Atlantic Region (CWS - Atlantic),,NF000298_BLGU_10020_2012-06-20,urn:lsid:marinespecies.org:taxname:137130,,FALSE,,,,137130
ff7ff81b-2335-4720-80b2-c7c87535c5f1,Cepphus grylle,,,-58.38,49.16,"Canadian Wildlife Service-Atlantic, Environment Canada",,1421648014_1143746848_1521482911,urn:lsid:marinespecies.org:taxname:137130,,FALSE,,,,137130
ff806c74-1e62-42a2-9bc7-b523d86fa185,Cepphus grylle,"(Linnaeus, 1758)",1987-07-22T07:55:00,-56.7167,51.3667,Canadian Wildlife Service,280,280_200966,urn:lsid:marinespecies.org:taxname:137130,,FALSE,,,,137130
ff8713df-df93-4064-9ab2-60302baaff79,Cepphus grylle,,,-64.1,47.98,"Canadian Wildlife Service-Atlantic, Environment Canada",,-1636689528_465826877_-19190740,urn:lsid:marinespecies.org:taxname:137130,,FALSE,,,,137130
ffb58087-765a-46f4-adc4-e6aad310c19f,Cepphus grylle,"(Linnaeus, 1758)",08/11/2006 13:16,-68.1433,44.3452,NA,,6754,137130,,FALSE,,,,137130
fff1c4c9-551b-40a1-9253-642940c2c52b,Cepphus grylle,"(Linnaeus, 1758)",8/13/78 00:00,-60.96557,56.23336,Canadian Wildlife Service - Atlantic Region (CWS - Atlantic),,NF000935_BLGU_2063_1978-08-13,urn:lsid:marinespecies.org:taxname:137130,,FALSE,,,,137130
